\set ECHO none
\i sql/14.5/ported_postgres_fdw.sql
-- SET consistant time zones;
--Testcase 1:
SET timezone = 'PST8PDT';
-- ===================================================================
-- create FDW objects
-- ===================================================================
--Testcase 2:
CREATE EXTENSION :DB_EXTENSIONNAME;
--Testcase 3:
CREATE SERVER :DB_SERVERNAME FOREIGN DATA WRAPPER :DB_EXTENSIONNAME
            OPTIONS (odbc_DRIVER :DB_DRIVERNAME,
                    odbc_SERVER :DB_SERVER,
					odbc_PORT :DB_PORT,
					odbc_DATABASE :DB_DATABASE_PORT_TEST
			);
--Testcase 4:
CREATE SERVER :DB_SERVERNAME2 FOREIGN DATA WRAPPER :DB_EXTENSIONNAME
            OPTIONS (odbc_DRIVER :DB_DRIVERNAME,
                    odbc_SERVER :DB_SERVER,
					odbc_PORT :DB_PORT,
					odbc_DATABASE :DB_DATABASE_PORT_TEST
			);
--Testcase 5:
CREATE USER MAPPING FOR public SERVER :DB_SERVERNAME OPTIONS(odbc_UID :DB_USER, odbc_PWD :DB_PASS);
--Testcase 6:
CREATE USER MAPPING FOR public SERVER :DB_SERVERNAME2 OPTIONS(odbc_UID :DB_USER, odbc_PWD :DB_PASS);
-- ===================================================================
-- create objects used through FDW postgres_svr server
-- ===================================================================
--Testcase 7:
CREATE TYPE user_enum AS ENUM ('foo', 'bar', 'buz');
--Testcase 8:
CREATE SCHEMA "S 1";
IMPORT FOREIGN SCHEMA :DB_SCHEMA_PORT_TEST2 FROM SERVER :DB_SERVERNAME INTO "S 1";
--Testcase 9:
INSERT INTO "S 1"."T1"
	SELECT id,
	       id % 10,
	       to_char(id, 'FM00000'),
	       '1970-01-01'::timestamptz + ((id % 100) || ' days')::interval,
	       '1970-01-01'::timestamp + ((id % 100) || ' days')::interval,
	       id % 10,
	       id % 10,
	       'foo'
	FROM generate_series(1, 1000) id;
--Testcase 10:
INSERT INTO "S 1"."T2"
	SELECT id,
	       'AAA' || to_char(id, 'FM000')
	FROM generate_series(1, 100) id;
--Testcase 11:
INSERT INTO "S 1"."T3"
	SELECT id,
	       id + 1,
	       'AAA' || to_char(id, 'FM000')
	FROM generate_series(1, 100) id;
--Testcase 12:
DELETE FROM "S 1"."T3" WHERE c1 % 2 != 0;	-- delete for outer join tests
--Testcase 13:
INSERT INTO "S 1"."T4"
	SELECT id,
	       id + 1,
	       'AAA' || to_char(id, 'FM000')
	FROM generate_series(1, 100) id;
--Testcase 14:
DELETE FROM "S 1"."T4" WHERE c1 % 3 != 0;	-- delete for outer join tests
-- ===================================================================
-- create foreign tables
-- ===================================================================
--Testcase 15:
CREATE FOREIGN TABLE ft1 (
	-- c0 int,
	c1 int OPTIONS (key 'true'),
	c2 int NOT NULL,
	c3 text,
	c4 timestamp,
	c5 timestamp,
	c6 varchar(10),
	c7 char(10) default 'ft1',
	c8 text
) SERVER :DB_SERVERNAME;
-- ALTER FOREIGN TABLE ft1 DROP COLUMN c0;  --ODBC can not work with it
-- BUG
--Testcase 16:
CREATE FOREIGN TABLE ft2 (
	c1 int OPTIONS (key 'true'),
	c2 int NOT NULL,
	-- cx int,
	c3 text,
	c4 timestamp,
	c5 timestamp,
	c6 varchar(10),
	c7 char(10) default 'ft2',
	c8 text
) SERVER :DB_SERVERNAME;
-- ALTER FOREIGN TABLE ft2 DROP COLUMN cx; --ODBC can not work with it
--Testcase 17:
CREATE FOREIGN TABLE ft4 (
	c1 int OPTIONS (key 'true'),
	c2 int NOT NULL,
	c3 text
) SERVER :DB_SERVERNAME OPTIONS (schema :DB_SCHEMA_PORT_TEST, table 'T3');
--Testcase 18:
CREATE FOREIGN TABLE ft5 (
	c1 int OPTIONS (key 'true'),
	c2 int NOT NULL,
	c3 text
) SERVER :DB_SERVERNAME OPTIONS (schema :DB_SCHEMA_PORT_TEST, table 'T4');
--Testcase 19:
CREATE FOREIGN TABLE ft6 (
	c1 int OPTIONS (key 'true'),
	c2 int NOT NULL,
	c3 text
) SERVER :DB_SERVERNAME2 OPTIONS (schema :DB_SCHEMA_PORT_TEST, table 'T4');
-- ===================================================================
-- tests for validator
-- ===================================================================
-- requiressl and some other parameters are omitted because
-- valid values for them depend on configure options
-- ALTER SERVER :DB_SERVERNAME OPTIONS (
-- 	use_remote_estimate 'false',
-- 	updatable 'true',
-- 	fdw_startup_cost '123.456',
-- 	fdw_tuple_cost '0.123',
-- 	service 'value',
-- 	connect_timeout 'value',
-- 	dbname 'value',
-- 	host 'value',
-- 	hostaddr 'value',
-- 	port 'value',
-- 	--client_encoding 'value',
-- 	application_name 'value',
-- 	--fallback_application_name 'value',
-- 	keepalives 'value',
-- 	keepalives_idle 'value',
-- 	keepalives_interval 'value',
-- 	tcp_user_timeout 'value',
-- 	-- requiressl 'value',
-- 	sslcompression 'value',
-- 	sslmode 'value',
-- 	sslcert 'value',
-- 	sslkey 'value',
-- 	sslrootcert 'value',
-- 	sslcrl 'value',
-- 	--requirepeer 'value',
-- 	krbsrvname 'value',
-- 	gsslib 'value'
-- 	--replication 'value'
-- );
-- Error, invalid list syntax
--Testcase 20:
ALTER SERVER :DB_SERVERNAME OPTIONS (ADD extensions 'foo; bar');
psql:sql/14.5/ported_postgres_fdw.sql:165: ERROR:  invalid option "extensions"
HINT:  Valid options in this context are: odbc_driver, odbc_server, odbc_port, odbc_database, updatable
-- OK but gets a warning
--Testcase 21:
ALTER SERVER :DB_SERVERNAME OPTIONS (ADD extensions 'foo, bar');
psql:sql/14.5/ported_postgres_fdw.sql:169: ERROR:  invalid option "extensions"
HINT:  Valid options in this context are: odbc_driver, odbc_server, odbc_port, odbc_database, updatable
-- ALTER SERVER :DB_SERVERNAME OPTIONS (DROP extensions);
-- Option user, password is not supported
-- ALTER USER MAPPING FOR public SERVER :DB_SERVERNAME
-- 	OPTIONS (DROP user, DROP password);
-- Attempt to add a valid option that's not allowed in a user mapping
-- Option sslmode is not supported
-- ALTER USER MAPPING FOR public SERVER :DB_SERVERNAME
-- 	OPTIONS (ADD sslmode 'require');
-- But we can add valid ones fine
-- Option sslpassword is not supported
-- ALTER USER MAPPING FOR public SERVER :DB_SERVERNAME
-- 	OPTIONS (ADD sslpassword 'dummy');
-- Ensure valid options we haven't used in a user mapping yet are
-- permitted to check validation.
-- Option sslkey, sslcert are not supported
-- ALTER USER MAPPING FOR public SERVER :DB_SERVERNAME
-- 	OPTIONS (ADD sslkey 'value', ADD sslcert 'value');
--Testcase 22:
ALTER FOREIGN TABLE ft1 OPTIONS (schema :DB_SCHEMA_PORT_TEST, table 'T1');
--Testcase 23:
ALTER FOREIGN TABLE ft2 OPTIONS (schema :DB_SCHEMA_PORT_TEST, table 'T1');
--Testcase 24:
ALTER FOREIGN TABLE ft1 ALTER COLUMN c1 OPTIONS (column 'C_1');
--Testcase 25:
ALTER FOREIGN TABLE ft2 ALTER COLUMN c1 OPTIONS (column 'C_1');
--Testcase 26:
\det+
                                List of foreign tables
 Schema | Table |    Server     |              FDW options               | Description 
--------+-------+---------------+----------------------------------------+-------------
 public | ft1   | mysql_server  | (schema 'odbc_fdw_post', "table" 'T1') | 
 public | ft2   | mysql_server  | (schema 'odbc_fdw_post', "table" 'T1') | 
 public | ft4   | mysql_server  | (schema 'odbc_fdw_post', "table" 'T3') | 
 public | ft5   | mysql_server  | (schema 'odbc_fdw_post', "table" 'T4') | 
 public | ft6   | mysql_server2 | (schema 'odbc_fdw_post', "table" 'T4') | 
(5 rows)

-- Test that alteration of server options causes reconnection
-- Remote's errors might be non-English, so hide them to ensure stable results
\set VERBOSITY terse
--Testcase 27:
SELECT c3, c4 FROM ft1 ORDER BY c3, c1 LIMIT 1;  -- should work
  c3   |            c4            
-------+--------------------------
 00001 | Fri Jan 02 00:00:00 1970
(1 row)

--Testcase 28:
ALTER SERVER :DB_SERVERNAME OPTIONS (SET odbc_DATABASE 'no such database');
--Testcase 29:
SELECT c3, c4 FROM ft1 ORDER BY c3, c1 LIMIT 1;  -- should fail
psql:sql/14.5/ported_postgres_fdw.sql:211: ERROR:  Connecting to driver
--Testcase 30:
ALTER SERVER :DB_SERVERNAME OPTIONS (SET odbc_DATABASE :DB_DATABASE_PORT_TEST);
--Testcase 31:
SELECT c3, c4 FROM ft1 ORDER BY c3, c1 LIMIT 1;  -- should work again
  c3   |            c4            
-------+--------------------------
 00001 | Fri Jan 02 00:00:00 1970
(1 row)

-- Test that alteration of user mapping options causes reconnection
-- Option 'user' is not supported
-- ALTER USER MAPPING FOR CURRENT_USER SERVER :DB_SERVERNAME
--    OPTIONS (ADD user 'no such user');
-- SELECT c3, c4 FROM ft1 ORDER BY c3, c1 LIMIT 1;  -- should fail
-- ALTER USER MAPPING FOR CURRENT_USER SERVER :DB_SERVERNAME
--    OPTIONS (DROP user);
-- SELECT c3, c4 FROM ft1 ORDER BY c3, c1 LIMIT 1;  -- should work again
\set VERBOSITY default
-- Now we should be able to run ANALYZE.
-- To exercise multiple code paths, we use local stats on ft1
-- and remote-estimate mode on ft2.
--Testcase 32:
ALTER FOREIGN TABLE ft2 OPTIONS (use_remote_estimate 'true');
psql:sql/14.5/ported_postgres_fdw.sql:231: ERROR:  invalid option "use_remote_estimate"
HINT:  Valid options in this context are: schema, table, prefix, sql_query, sql_count, updatable
-- ===================================================================
-- simple queries
-- ===================================================================
-- single table without alias
--Testcase 33:
EXPLAIN (COSTS OFF) SELECT * FROM ft1 ORDER BY c3, c1 OFFSET 100 LIMIT 10;
           QUERY PLAN            
---------------------------------
 Limit
   ->  Sort
         Sort Key: c3, c1
         ->  Foreign Scan on ft1
(4 rows)

--Testcase 34:
SELECT * FROM ft1 ORDER BY c3, c1 OFFSET 100 LIMIT 10;
 c1  | c2 |  c3   |            c4            |            c5            | c6 |     c7     | c8  
-----+----+-------+--------------------------+--------------------------+----+------------+-----
 101 |  1 | 00101 | Fri Jan 02 00:00:00 1970 | Fri Jan 02 00:00:00 1970 | 1  | 1          | foo
 102 |  2 | 00102 | Sat Jan 03 00:00:00 1970 | Sat Jan 03 00:00:00 1970 | 2  | 2          | foo
 103 |  3 | 00103 | Sun Jan 04 00:00:00 1970 | Sun Jan 04 00:00:00 1970 | 3  | 3          | foo
 104 |  4 | 00104 | Mon Jan 05 00:00:00 1970 | Mon Jan 05 00:00:00 1970 | 4  | 4          | foo
 105 |  5 | 00105 | Tue Jan 06 00:00:00 1970 | Tue Jan 06 00:00:00 1970 | 5  | 5          | foo
 106 |  6 | 00106 | Wed Jan 07 00:00:00 1970 | Wed Jan 07 00:00:00 1970 | 6  | 6          | foo
 107 |  7 | 00107 | Thu Jan 08 00:00:00 1970 | Thu Jan 08 00:00:00 1970 | 7  | 7          | foo
 108 |  8 | 00108 | Fri Jan 09 00:00:00 1970 | Fri Jan 09 00:00:00 1970 | 8  | 8          | foo
 109 |  9 | 00109 | Sat Jan 10 00:00:00 1970 | Sat Jan 10 00:00:00 1970 | 9  | 9          | foo
 110 |  0 | 00110 | Sun Jan 11 00:00:00 1970 | Sun Jan 11 00:00:00 1970 | 0  | 0          | foo
(10 rows)

-- single table with alias - also test that tableoid sort is not pushed to remote side
--Testcase 35:
EXPLAIN (VERBOSE, COSTS OFF) SELECT * FROM ft1 t1 ORDER BY t1.c3, t1.c1, t1.tableoid OFFSET 100 LIMIT 10;
                                         QUERY PLAN                                         
--------------------------------------------------------------------------------------------
 Limit
   Output: c1, c2, c3, c4, c5, c6, c7, c8, tableoid
   ->  Sort
         Output: c1, c2, c3, c4, c5, c6, c7, c8, tableoid
         Sort Key: t1.c3, t1.c1, t1.tableoid
         ->  Foreign Scan on public.ft1 t1
               Output: c1, c2, c3, c4, c5, c6, c7, c8, tableoid
               Remote SQL: SELECT `C_1`, c2, c3, c4, c5, c6, c7, c8 FROM odbc_fdw_post.`T1`
(8 rows)

--Testcase 36:
SELECT * FROM ft1 t1 ORDER BY t1.c3, t1.c1, t1.tableoid OFFSET 100 LIMIT 10;
 c1  | c2 |  c3   |            c4            |            c5            | c6 |     c7     | c8  
-----+----+-------+--------------------------+--------------------------+----+------------+-----
 101 |  1 | 00101 | Fri Jan 02 00:00:00 1970 | Fri Jan 02 00:00:00 1970 | 1  | 1          | foo
 102 |  2 | 00102 | Sat Jan 03 00:00:00 1970 | Sat Jan 03 00:00:00 1970 | 2  | 2          | foo
 103 |  3 | 00103 | Sun Jan 04 00:00:00 1970 | Sun Jan 04 00:00:00 1970 | 3  | 3          | foo
 104 |  4 | 00104 | Mon Jan 05 00:00:00 1970 | Mon Jan 05 00:00:00 1970 | 4  | 4          | foo
 105 |  5 | 00105 | Tue Jan 06 00:00:00 1970 | Tue Jan 06 00:00:00 1970 | 5  | 5          | foo
 106 |  6 | 00106 | Wed Jan 07 00:00:00 1970 | Wed Jan 07 00:00:00 1970 | 6  | 6          | foo
 107 |  7 | 00107 | Thu Jan 08 00:00:00 1970 | Thu Jan 08 00:00:00 1970 | 7  | 7          | foo
 108 |  8 | 00108 | Fri Jan 09 00:00:00 1970 | Fri Jan 09 00:00:00 1970 | 8  | 8          | foo
 109 |  9 | 00109 | Sat Jan 10 00:00:00 1970 | Sat Jan 10 00:00:00 1970 | 9  | 9          | foo
 110 |  0 | 00110 | Sun Jan 11 00:00:00 1970 | Sun Jan 11 00:00:00 1970 | 0  | 0          | foo
(10 rows)

-- whole-row reference
--Testcase 37:
EXPLAIN (VERBOSE, COSTS OFF) SELECT t1 FROM ft1 t1 ORDER BY t1.c3, t1.c1 OFFSET 100 LIMIT 10;
                                         QUERY PLAN                                         
--------------------------------------------------------------------------------------------
 Limit
   Output: t1.*, c3, c1
   ->  Sort
         Output: t1.*, c3, c1
         Sort Key: t1.c3, t1.c1
         ->  Foreign Scan on public.ft1 t1
               Output: t1.*, c3, c1
               Remote SQL: SELECT `C_1`, c2, c3, c4, c5, c6, c7, c8 FROM odbc_fdw_post.`T1`
(8 rows)

--Testcase 38:
SELECT t1 FROM ft1 t1 ORDER BY t1.c3, t1.c1 OFFSET 100 LIMIT 10;
                                           t1                                           
----------------------------------------------------------------------------------------
 (101,1,00101,"Fri Jan 02 00:00:00 1970","Fri Jan 02 00:00:00 1970",1,"1         ",foo)
 (102,2,00102,"Sat Jan 03 00:00:00 1970","Sat Jan 03 00:00:00 1970",2,"2         ",foo)
 (103,3,00103,"Sun Jan 04 00:00:00 1970","Sun Jan 04 00:00:00 1970",3,"3         ",foo)
 (104,4,00104,"Mon Jan 05 00:00:00 1970","Mon Jan 05 00:00:00 1970",4,"4         ",foo)
 (105,5,00105,"Tue Jan 06 00:00:00 1970","Tue Jan 06 00:00:00 1970",5,"5         ",foo)
 (106,6,00106,"Wed Jan 07 00:00:00 1970","Wed Jan 07 00:00:00 1970",6,"6         ",foo)
 (107,7,00107,"Thu Jan 08 00:00:00 1970","Thu Jan 08 00:00:00 1970",7,"7         ",foo)
 (108,8,00108,"Fri Jan 09 00:00:00 1970","Fri Jan 09 00:00:00 1970",8,"8         ",foo)
 (109,9,00109,"Sat Jan 10 00:00:00 1970","Sat Jan 10 00:00:00 1970",9,"9         ",foo)
 (110,0,00110,"Sun Jan 11 00:00:00 1970","Sun Jan 11 00:00:00 1970",0,"0         ",foo)
(10 rows)

-- empty result
--Testcase 39:
SELECT * FROM ft1 WHERE false;
 c1 | c2 | c3 | c4 | c5 | c6 | c7 | c8 
----+----+----+----+----+----+----+----
(0 rows)

-- with WHERE clause
--Testcase 40:
EXPLAIN (VERBOSE, COSTS OFF) SELECT * FROM ft1 t1 WHERE t1.c1 = 101 AND t1.c6 = '1' AND t1.c7 >= '1';
                                                       QUERY PLAN                                                       
------------------------------------------------------------------------------------------------------------------------
 Foreign Scan on public.ft1 t1
   Output: c1, c2, c3, c4, c5, c6, c7, c8
   Filter: ((t1.c6)::text = '1'::text)
   Remote SQL: SELECT `C_1`, c2, c3, c4, c5, c6, c7, c8 FROM odbc_fdw_post.`T1` WHERE ((c7 >= '1')) AND ((`C_1` = 101))
(4 rows)

--Testcase 41:
SELECT * FROM ft1 t1 WHERE t1.c1 = 101 AND t1.c6 = '1' AND t1.c7 >= '1';
 c1  | c2 |  c3   |            c4            |            c5            | c6 |     c7     | c8  
-----+----+-------+--------------------------+--------------------------+----+------------+-----
 101 |  1 | 00101 | Fri Jan 02 00:00:00 1970 | Fri Jan 02 00:00:00 1970 | 1  | 1          | foo
(1 row)

-- with FOR UPDATE/SHARE
--Testcase 42:
EXPLAIN (VERBOSE, COSTS OFF) SELECT * FROM ft1 t1 WHERE c1 = 101 FOR UPDATE;
                                                 QUERY PLAN                                                 
------------------------------------------------------------------------------------------------------------
 LockRows
   Output: c1, c2, c3, c4, c5, c6, c7, c8, t1.*
   ->  Foreign Scan on public.ft1 t1
         Output: c1, c2, c3, c4, c5, c6, c7, c8, t1.*
         Remote SQL: SELECT `C_1`, c2, c3, c4, c5, c6, c7, c8 FROM odbc_fdw_post.`T1` WHERE ((`C_1` = 101))
(5 rows)

--Testcase 43:
SELECT * FROM ft1 t1 WHERE c1 = 101 FOR UPDATE;
 c1  | c2 |  c3   |            c4            |            c5            | c6 |     c7     | c8  
-----+----+-------+--------------------------+--------------------------+----+------------+-----
 101 |  1 | 00101 | Fri Jan 02 00:00:00 1970 | Fri Jan 02 00:00:00 1970 | 1  | 1          | foo
(1 row)

--Testcase 44:
EXPLAIN (VERBOSE, COSTS OFF) SELECT * FROM ft1 t1 WHERE c1 = 102 FOR SHARE;
                                                 QUERY PLAN                                                 
------------------------------------------------------------------------------------------------------------
 LockRows
   Output: c1, c2, c3, c4, c5, c6, c7, c8, t1.*
   ->  Foreign Scan on public.ft1 t1
         Output: c1, c2, c3, c4, c5, c6, c7, c8, t1.*
         Remote SQL: SELECT `C_1`, c2, c3, c4, c5, c6, c7, c8 FROM odbc_fdw_post.`T1` WHERE ((`C_1` = 102))
(5 rows)

--Testcase 45:
SELECT * FROM ft1 t1 WHERE c1 = 102 FOR SHARE;
 c1  | c2 |  c3   |            c4            |            c5            | c6 |     c7     | c8  
-----+----+-------+--------------------------+--------------------------+----+------------+-----
 102 |  2 | 00102 | Sat Jan 03 00:00:00 1970 | Sat Jan 03 00:00:00 1970 | 2  | 2          | foo
(1 row)

-- aggregate
--Testcase 46:
SELECT COUNT(*) FROM ft1 t1;
 count 
-------
  1000
(1 row)

-- subquery
--Testcase 47:
SELECT * FROM ft1 t1 WHERE t1.c3 IN (SELECT c3 FROM ft2 t2 WHERE c1 <= 10) ORDER BY c1;
 c1 | c2 |  c3   |            c4            |            c5            | c6 |     c7     | c8  
----+----+-------+--------------------------+--------------------------+----+------------+-----
  1 |  1 | 00001 | Fri Jan 02 00:00:00 1970 | Fri Jan 02 00:00:00 1970 | 1  | 1          | foo
  2 |  2 | 00002 | Sat Jan 03 00:00:00 1970 | Sat Jan 03 00:00:00 1970 | 2  | 2          | foo
  3 |  3 | 00003 | Sun Jan 04 00:00:00 1970 | Sun Jan 04 00:00:00 1970 | 3  | 3          | foo
  4 |  4 | 00004 | Mon Jan 05 00:00:00 1970 | Mon Jan 05 00:00:00 1970 | 4  | 4          | foo
  5 |  5 | 00005 | Tue Jan 06 00:00:00 1970 | Tue Jan 06 00:00:00 1970 | 5  | 5          | foo
  6 |  6 | 00006 | Wed Jan 07 00:00:00 1970 | Wed Jan 07 00:00:00 1970 | 6  | 6          | foo
  7 |  7 | 00007 | Thu Jan 08 00:00:00 1970 | Thu Jan 08 00:00:00 1970 | 7  | 7          | foo
  8 |  8 | 00008 | Fri Jan 09 00:00:00 1970 | Fri Jan 09 00:00:00 1970 | 8  | 8          | foo
  9 |  9 | 00009 | Sat Jan 10 00:00:00 1970 | Sat Jan 10 00:00:00 1970 | 9  | 9          | foo
 10 |  0 | 00010 | Sun Jan 11 00:00:00 1970 | Sun Jan 11 00:00:00 1970 | 0  | 0          | foo
(10 rows)

-- subquery+MAX
--Testcase 48:
SELECT * FROM ft1 t1 WHERE t1.c3 = (SELECT MAX(c3) FROM ft2 t2) ORDER BY c1;
  c1  | c2 |  c3   |            c4            |            c5            | c6 |     c7     | c8  
------+----+-------+--------------------------+--------------------------+----+------------+-----
 1000 |  0 | 01000 | Thu Jan 01 00:00:00 1970 | Thu Jan 01 00:00:00 1970 | 0  | 0          | foo
(1 row)

-- used in CTE
--Testcase 49:
WITH t1 AS (SELECT * FROM ft1 WHERE c1 <= 10) SELECT t2.c1, t2.c2, t2.c3, t2.c4 FROM t1, ft2 t2 WHERE t1.c1 = t2.c1 ORDER BY t1.c1;
 c1 | c2 |  c3   |            c4            
----+----+-------+--------------------------
  1 |  1 | 00001 | Fri Jan 02 00:00:00 1970
  2 |  2 | 00002 | Sat Jan 03 00:00:00 1970
  3 |  3 | 00003 | Sun Jan 04 00:00:00 1970
  4 |  4 | 00004 | Mon Jan 05 00:00:00 1970
  5 |  5 | 00005 | Tue Jan 06 00:00:00 1970
  6 |  6 | 00006 | Wed Jan 07 00:00:00 1970
  7 |  7 | 00007 | Thu Jan 08 00:00:00 1970
  8 |  8 | 00008 | Fri Jan 09 00:00:00 1970
  9 |  9 | 00009 | Sat Jan 10 00:00:00 1970
 10 |  0 | 00010 | Sun Jan 11 00:00:00 1970
(10 rows)

-- fixed values
--Testcase 50:
SELECT 'fixed', NULL FROM ft1 t1 WHERE c1 = 1;
 ?column? | ?column? 
----------+----------
 fixed    | 
(1 row)

-- Test forcing the remote server to produce sorted data for a merge join.
--Testcase 51:
SET enable_hashjoin TO false;
--Testcase 52:
SET enable_nestloop TO false;
-- inner join; expressions in the clauses appear in the equivalence class list
--Testcase 53:
EXPLAIN (VERBOSE, COSTS OFF)
	SELECT t1.c1, t2."C_1" FROM ft2 t1 JOIN "S 1"."T1" t2 ON (t1.c1 = t2."C_1") OFFSET 100 LIMIT 10;
                              QUERY PLAN                              
----------------------------------------------------------------------
 Limit
   Output: t1.c1, t2."C_1"
   ->  Merge Join
         Output: t1.c1, t2."C_1"
         Merge Cond: (t1.c1 = t2."C_1")
         ->  Sort
               Output: t1.c1
               Sort Key: t1.c1
               ->  Foreign Scan on public.ft2 t1
                     Output: t1.c1
                     Remote SQL: SELECT `C_1` FROM odbc_fdw_post.`T1`
         ->  Sort
               Output: t2."C_1"
               Sort Key: t2."C_1"
               ->  Foreign Scan on "S 1"."T1" t2
                     Output: t2."C_1"
                     Remote SQL: SELECT `C_1` FROM odbc_fdw_post.`T1`
(17 rows)

--Testcase 54:
SELECT t1.c1, t2."C_1" FROM ft2 t1 JOIN "S 1"."T1" t2 ON (t1.c1 = t2."C_1") OFFSET 100 LIMIT 10;
 c1  | C_1 
-----+-----
 101 | 101
 102 | 102
 103 | 103
 104 | 104
 105 | 105
 106 | 106
 107 | 107
 108 | 108
 109 | 109
 110 | 110
(10 rows)

-- outer join; expressions in the clauses do not appear in equivalence class
-- list but no output change as compared to the previous query
--Testcase 55:
EXPLAIN (VERBOSE, COSTS OFF)
	SELECT t1.c1, t2."C_1" FROM ft2 t1 LEFT JOIN "S 1"."T1" t2 ON (t1.c1 = t2."C_1") OFFSET 100 LIMIT 10;
                              QUERY PLAN                              
----------------------------------------------------------------------
 Limit
   Output: t1.c1, t2."C_1"
   ->  Merge Left Join
         Output: t1.c1, t2."C_1"
         Merge Cond: (t1.c1 = t2."C_1")
         ->  Sort
               Output: t1.c1
               Sort Key: t1.c1
               ->  Foreign Scan on public.ft2 t1
                     Output: t1.c1
                     Remote SQL: SELECT `C_1` FROM odbc_fdw_post.`T1`
         ->  Sort
               Output: t2."C_1"
               Sort Key: t2."C_1"
               ->  Foreign Scan on "S 1"."T1" t2
                     Output: t2."C_1"
                     Remote SQL: SELECT `C_1` FROM odbc_fdw_post.`T1`
(17 rows)

--Testcase 56:
SELECT t1.c1, t2."C_1" FROM ft2 t1 LEFT JOIN "S 1"."T1" t2 ON (t1.c1 = t2."C_1") OFFSET 100 LIMIT 10;
 c1  | C_1 
-----+-----
 101 | 101
 102 | 102
 103 | 103
 104 | 104
 105 | 105
 106 | 106
 107 | 107
 108 | 108
 109 | 109
 110 | 110
(10 rows)

-- A join between local table and foreign join. ORDER BY clause is added to the
-- foreign join so that the local table can be joined using merge join strategy.
--Testcase 57:
EXPLAIN (VERBOSE, COSTS OFF)
	SELECT t1."C_1" FROM "S 1"."T1" t1 left join ft1 t2 join ft2 t3 on (t2.c1 = t3.c1) on (t3.c1 = t1."C_1") OFFSET 100 LIMIT 10;
                                    QUERY PLAN                                    
----------------------------------------------------------------------------------
 Limit
   Output: t1."C_1"
   ->  Merge Left Join
         Output: t1."C_1"
         Merge Cond: (t1."C_1" = t3.c1)
         ->  Sort
               Output: t1."C_1"
               Sort Key: t1."C_1"
               ->  Foreign Scan on "S 1"."T1" t1
                     Output: t1."C_1"
                     Remote SQL: SELECT `C_1` FROM odbc_fdw_post.`T1`
         ->  Materialize
               Output: t3.c1
               ->  Merge Join
                     Output: t3.c1
                     Merge Cond: (t2.c1 = t3.c1)
                     ->  Sort
                           Output: t2.c1
                           Sort Key: t2.c1
                           ->  Foreign Scan on public.ft1 t2
                                 Output: t2.c1
                                 Remote SQL: SELECT `C_1` FROM odbc_fdw_post.`T1`
                     ->  Sort
                           Output: t3.c1
                           Sort Key: t3.c1
                           ->  Foreign Scan on public.ft2 t3
                                 Output: t3.c1
                                 Remote SQL: SELECT `C_1` FROM odbc_fdw_post.`T1`
(28 rows)

--Testcase 58:
SELECT t1."C_1" FROM "S 1"."T1" t1 left join ft1 t2 join ft2 t3 on (t2.c1 = t3.c1) on (t3.c1 = t1."C_1") OFFSET 100 LIMIT 10;
 C_1 
-----
 101
 102
 103
 104
 105
 106
 107
 108
 109
 110
(10 rows)

-- Test similar to above, except that the full join prevents any equivalence
-- classes from being merged. This produces single relation equivalence classes
-- included in join restrictions.
--Testcase 59:
EXPLAIN (VERBOSE, COSTS OFF)
	SELECT t1."C_1", t2.c1, t3.c1 FROM "S 1"."T1" t1 left join ft1 t2 full join ft2 t3 on (t2.c1 = t3.c1) on (t3.c1 = t1."C_1") OFFSET 100 LIMIT 10;
                                    QUERY PLAN                                    
----------------------------------------------------------------------------------
 Limit
   Output: t1."C_1", t2.c1, t3.c1
   ->  Merge Left Join
         Output: t1."C_1", t2.c1, t3.c1
         Merge Cond: (t1."C_1" = t3.c1)
         ->  Sort
               Output: t1."C_1"
               Sort Key: t1."C_1"
               ->  Foreign Scan on "S 1"."T1" t1
                     Output: t1."C_1"
                     Remote SQL: SELECT `C_1` FROM odbc_fdw_post.`T1`
         ->  Materialize
               Output: t3.c1, t2.c1
               ->  Merge Left Join
                     Output: t3.c1, t2.c1
                     Merge Cond: (t3.c1 = t2.c1)
                     ->  Sort
                           Output: t3.c1
                           Sort Key: t3.c1
                           ->  Foreign Scan on public.ft2 t3
                                 Output: t3.c1
                                 Remote SQL: SELECT `C_1` FROM odbc_fdw_post.`T1`
                     ->  Sort
                           Output: t2.c1
                           Sort Key: t2.c1
                           ->  Foreign Scan on public.ft1 t2
                                 Output: t2.c1
                                 Remote SQL: SELECT `C_1` FROM odbc_fdw_post.`T1`
(28 rows)

--Testcase 60:
SELECT t1."C_1", t2.c1, t3.c1 FROM "S 1"."T1" t1 left join ft1 t2 full join ft2 t3 on (t2.c1 = t3.c1) on (t3.c1 = t1."C_1") OFFSET 100 LIMIT 10;
 C_1 | c1  | c1  
-----+-----+-----
 101 | 101 | 101
 102 | 102 | 102
 103 | 103 | 103
 104 | 104 | 104
 105 | 105 | 105
 106 | 106 | 106
 107 | 107 | 107
 108 | 108 | 108
 109 | 109 | 109
 110 | 110 | 110
(10 rows)

-- Test similar to above with all full outer joins
--Testcase 61:
EXPLAIN (VERBOSE, COSTS OFF)
	SELECT t1."C_1", t2.c1, t3.c1 FROM "S 1"."T1" t1 full join ft1 t2 full join ft2 t3 on (t2.c1 = t3.c1) on (t3.c1 = t1."C_1") OFFSET 100 LIMIT 10;
                                    QUERY PLAN                                    
----------------------------------------------------------------------------------
 Limit
   Output: t1."C_1", t2.c1, t3.c1
   ->  Merge Full Join
         Output: t1."C_1", t2.c1, t3.c1
         Merge Cond: (t1."C_1" = t3.c1)
         ->  Sort
               Output: t1."C_1"
               Sort Key: t1."C_1"
               ->  Foreign Scan on "S 1"."T1" t1
                     Output: t1."C_1"
                     Remote SQL: SELECT `C_1` FROM odbc_fdw_post.`T1`
         ->  Sort
               Output: t2.c1, t3.c1
               Sort Key: t3.c1
               ->  Merge Full Join
                     Output: t2.c1, t3.c1
                     Merge Cond: (t2.c1 = t3.c1)
                     ->  Sort
                           Output: t2.c1
                           Sort Key: t2.c1
                           ->  Foreign Scan on public.ft1 t2
                                 Output: t2.c1
                                 Remote SQL: SELECT `C_1` FROM odbc_fdw_post.`T1`
                     ->  Sort
                           Output: t3.c1
                           Sort Key: t3.c1
                           ->  Foreign Scan on public.ft2 t3
                                 Output: t3.c1
                                 Remote SQL: SELECT `C_1` FROM odbc_fdw_post.`T1`
(29 rows)

--Testcase 62:
SELECT t1."C_1", t2.c1, t3.c1 FROM "S 1"."T1" t1 full join ft1 t2 full join ft2 t3 on (t2.c1 = t3.c1) on (t3.c1 = t1."C_1") OFFSET 100 LIMIT 10;
 C_1 | c1  | c1  
-----+-----+-----
 101 | 101 | 101
 102 | 102 | 102
 103 | 103 | 103
 104 | 104 | 104
 105 | 105 | 105
 106 | 106 | 106
 107 | 107 | 107
 108 | 108 | 108
 109 | 109 | 109
 110 | 110 | 110
(10 rows)

--Testcase 63:
RESET enable_hashjoin;
--Testcase 64:
RESET enable_nestloop;
-- Test executing assertion in estimate_path_cost_size() that makes sure that
-- retrieved_rows for foreign rel re-used to cost pre-sorted foreign paths is
-- a sensible value even when the rel has tuples=0
--Testcase 65:
CREATE FOREIGN TABLE ft_empty (c1 int OPTIONS (key 'true'), c2 text)
  SERVER :DB_SERVERNAME OPTIONS (schema :DB_SCHEMA_PORT_TEST, table 'loct_empty');
--Testcase 66:
INSERT INTO ft_empty
  SELECT id, 'AAA' || to_char(id, 'FM000') FROM generate_series(1, 100) id;
--Testcase 67:
DELETE FROM ft_empty;
-- ANALYZE ft_empty;
--Testcase 68:
EXPLAIN (VERBOSE, COSTS OFF) SELECT * FROM ft_empty ORDER BY c1;
                           QUERY PLAN                            
-----------------------------------------------------------------
 Sort
   Output: c1, c2
   Sort Key: ft_empty.c1
   ->  Foreign Scan on public.ft_empty
         Output: c1, c2
         Remote SQL: SELECT c1, c2 FROM odbc_fdw_post.loct_empty
(6 rows)

-- ===================================================================
-- WHERE with remotely-executable conditions
-- ===================================================================
--Testcase 69:
EXPLAIN (VERBOSE, COSTS OFF) SELECT * FROM ft1 t1 WHERE t1.c1 = 1;         -- Var, OpExpr(b), Const
                                             QUERY PLAN                                             
----------------------------------------------------------------------------------------------------
 Foreign Scan on public.ft1 t1
   Output: c1, c2, c3, c4, c5, c6, c7, c8
   Remote SQL: SELECT `C_1`, c2, c3, c4, c5, c6, c7, c8 FROM odbc_fdw_post.`T1` WHERE ((`C_1` = 1))
(3 rows)

--Testcase 70:
EXPLAIN (VERBOSE, COSTS OFF) SELECT * FROM ft1 t1 WHERE t1.c1 = 100 AND t1.c2 = 0; -- BoolExpr
                                                     QUERY PLAN                                                      
---------------------------------------------------------------------------------------------------------------------
 Foreign Scan on public.ft1 t1
   Output: c1, c2, c3, c4, c5, c6, c7, c8
   Remote SQL: SELECT `C_1`, c2, c3, c4, c5, c6, c7, c8 FROM odbc_fdw_post.`T1` WHERE ((`C_1` = 100)) AND ((c2 = 0))
(3 rows)

--Testcase 71:
EXPLAIN (VERBOSE, COSTS OFF) SELECT * FROM ft1 t1 WHERE c1 IS NULL;        -- NullTest
                                               QUERY PLAN                                               
--------------------------------------------------------------------------------------------------------
 Foreign Scan on public.ft1 t1
   Output: c1, c2, c3, c4, c5, c6, c7, c8
   Remote SQL: SELECT `C_1`, c2, c3, c4, c5, c6, c7, c8 FROM odbc_fdw_post.`T1` WHERE ((`C_1` IS NULL))
(3 rows)

--Testcase 72:
EXPLAIN (VERBOSE, COSTS OFF) SELECT * FROM ft1 t1 WHERE c1 IS NOT NULL;    -- NullTest
                                                 QUERY PLAN                                                 
------------------------------------------------------------------------------------------------------------
 Foreign Scan on public.ft1 t1
   Output: c1, c2, c3, c4, c5, c6, c7, c8
   Remote SQL: SELECT `C_1`, c2, c3, c4, c5, c6, c7, c8 FROM odbc_fdw_post.`T1` WHERE ((`C_1` IS NOT NULL))
(3 rows)

--Testcase 73:
EXPLAIN (VERBOSE, COSTS OFF) SELECT * FROM ft1 t1 WHERE round(abs(c1), 0) = 1; -- FuncExpr
                                                    QUERY PLAN                                                     
-------------------------------------------------------------------------------------------------------------------
 Foreign Scan on public.ft1 t1
   Output: c1, c2, c3, c4, c5, c6, c7, c8
   Remote SQL: SELECT `C_1`, c2, c3, c4, c5, c6, c7, c8 FROM odbc_fdw_post.`T1` WHERE ((round(abs(`C_1`), 0) = 1))
(3 rows)

--Testcase 74:
EXPLAIN (VERBOSE, COSTS OFF) SELECT * FROM ft1 t1 WHERE c1 = -c1;          -- OpExpr(l)
                                                 QUERY PLAN                                                 
------------------------------------------------------------------------------------------------------------
 Foreign Scan on public.ft1 t1
   Output: c1, c2, c3, c4, c5, c6, c7, c8
   Remote SQL: SELECT `C_1`, c2, c3, c4, c5, c6, c7, c8 FROM odbc_fdw_post.`T1` WHERE ((`C_1` = (- `C_1`)))
(3 rows)

--Testcase 75:
EXPLAIN (VERBOSE, COSTS OFF) SELECT * FROM ft1 t1 WHERE (c1 IS NOT NULL) IS DISTINCT FROM (c1 IS NOT NULL); -- DistinctExpr
                                   QUERY PLAN                                   
--------------------------------------------------------------------------------
 Foreign Scan on public.ft1 t1
   Output: c1, c2, c3, c4, c5, c6, c7, c8
   Filter: ((t1.c1 IS NOT NULL) IS DISTINCT FROM (t1.c1 IS NOT NULL))
   Remote SQL: SELECT `C_1`, c2, c3, c4, c5, c6, c7, c8 FROM odbc_fdw_post.`T1`
(4 rows)

--Testcase 76:
EXPLAIN (VERBOSE, COSTS OFF) SELECT * FROM ft1 t1 WHERE c1 = ANY(ARRAY[c2, 1, c1 + 0]); -- ScalarArrayOpExpr
                                                      QUERY PLAN                                                      
----------------------------------------------------------------------------------------------------------------------
 Foreign Scan on public.ft1 t1
   Output: c1, c2, c3, c4, c5, c6, c7, c8
   Remote SQL: SELECT `C_1`, c2, c3, c4, c5, c6, c7, c8 FROM odbc_fdw_post.`T1` WHERE (`C_1` IN (c2, 1, (`C_1` + 0)))
(3 rows)

--Testcase 77:
EXPLAIN (VERBOSE, COSTS OFF) SELECT * FROM ft1 t1 WHERE c1 = (ARRAY[c1,c2,3])[1]; -- SubscriptingRef
                                   QUERY PLAN                                   
--------------------------------------------------------------------------------
 Foreign Scan on public.ft1 t1
   Output: c1, c2, c3, c4, c5, c6, c7, c8
   Filter: (t1.c1 = (ARRAY[t1.c1, t1.c2, 3])[1])
   Remote SQL: SELECT `C_1`, c2, c3, c4, c5, c6, c7, c8 FROM odbc_fdw_post.`T1`
(4 rows)

--Testcase 78:
EXPLAIN (VERBOSE, COSTS OFF) SELECT * FROM ft1 t1 WHERE c6 = E'foo''s\\bar';  -- check special chars
                                   QUERY PLAN                                   
--------------------------------------------------------------------------------
 Foreign Scan on public.ft1 t1
   Output: c1, c2, c3, c4, c5, c6, c7, c8
   Filter: ((t1.c6)::text = 'foo''s\bar'::text)
   Remote SQL: SELECT `C_1`, c2, c3, c4, c5, c6, c7, c8 FROM odbc_fdw_post.`T1`
(4 rows)

--Testcase 79:
EXPLAIN (VERBOSE, COSTS OFF) SELECT * FROM ft1 t1 WHERE c8 = 'foo';  -- can't be sent to remote
                                             QUERY PLAN                                              
-----------------------------------------------------------------------------------------------------
 Foreign Scan on public.ft1 t1
   Output: c1, c2, c3, c4, c5, c6, c7, c8
   Remote SQL: SELECT `C_1`, c2, c3, c4, c5, c6, c7, c8 FROM odbc_fdw_post.`T1` WHERE ((c8 = 'foo'))
(3 rows)

-- parameterized remote path for foreign table
--Testcase 80:
EXPLAIN (VERBOSE, COSTS OFF)
  SELECT * FROM "S 1"."T1" a, ft2 b WHERE a."C_1" = 47 AND b.c1 = a.c2;
                                                 QUERY PLAN                                                  
-------------------------------------------------------------------------------------------------------------
 Hash Join
   Output: a."C_1", a.c2, a.c3, a.c4, a.c5, a.c6, a.c7, a.c8, b.c1, b.c2, b.c3, b.c4, b.c5, b.c6, b.c7, b.c8
   Hash Cond: (a.c2 = b.c1)
   ->  Foreign Scan on "S 1"."T1" a
         Output: a."C_1", a.c2, a.c3, a.c4, a.c5, a.c6, a.c7, a.c8
         Remote SQL: SELECT `C_1`, c2, c3, c4, c5, c6, c7, c8 FROM odbc_fdw_post.`T1` WHERE ((`C_1` = 47))
   ->  Hash
         Output: b.c1, b.c2, b.c3, b.c4, b.c5, b.c6, b.c7, b.c8
         ->  Foreign Scan on public.ft2 b
               Output: b.c1, b.c2, b.c3, b.c4, b.c5, b.c6, b.c7, b.c8
               Remote SQL: SELECT `C_1`, c2, c3, c4, c5, c6, c7, c8 FROM odbc_fdw_post.`T1`
(11 rows)

--Testcase 81:
SELECT * FROM ft2 a, ft2 b WHERE a.c1 = 47 AND b.c1 = a.c2;
 c1 | c2 |  c3   |            c4            |            c5            | c6 |     c7     | c8  | c1 | c2 |  c3   |            c4            |            c5            | c6 |     c7     | c8  
----+----+-------+--------------------------+--------------------------+----+------------+-----+----+----+-------+--------------------------+--------------------------+----+------------+-----
 47 |  7 | 00047 | Tue Feb 17 00:00:00 1970 | Tue Feb 17 00:00:00 1970 | 7  | 7          | foo |  7 |  7 | 00007 | Thu Jan 08 00:00:00 1970 | Thu Jan 08 00:00:00 1970 | 7  | 7          | foo
(1 row)

-- check both safe and unsafe join conditions
--Testcase 82:
EXPLAIN (VERBOSE, COSTS OFF)
  SELECT * FROM ft2 a, ft2 b
  WHERE a.c2 = 6 AND b.c1 = a.c1 AND a.c8 = 'foo' AND b.c7 = upper(a.c7);
                                                           QUERY PLAN                                                           
--------------------------------------------------------------------------------------------------------------------------------
 Merge Join
   Output: a.c1, a.c2, a.c3, a.c4, a.c5, a.c6, a.c7, a.c8, b.c1, b.c2, b.c3, b.c4, b.c5, b.c6, b.c7, b.c8
   Merge Cond: ((a.c1 = b.c1) AND ((upper((a.c7)::text)) = ((b.c7)::text)))
   ->  Sort
         Output: a.c1, a.c2, a.c3, a.c4, a.c5, a.c6, a.c7, a.c8, (upper((a.c7)::text))
         Sort Key: a.c1, (upper((a.c7)::text))
         ->  Foreign Scan on public.ft2 a
               Output: a.c1, a.c2, a.c3, a.c4, a.c5, a.c6, a.c7, a.c8, upper((a.c7)::text)
               Remote SQL: SELECT `C_1`, c2, c3, c4, c5, c6, c7, c8 FROM odbc_fdw_post.`T1` WHERE ((c2 = 6)) AND ((c8 = 'foo'))
   ->  Sort
         Output: b.c1, b.c2, b.c3, b.c4, b.c5, b.c6, b.c7, b.c8, ((b.c7)::text)
         Sort Key: b.c1, ((b.c7)::text)
         ->  Foreign Scan on public.ft2 b
               Output: b.c1, b.c2, b.c3, b.c4, b.c5, b.c6, b.c7, b.c8, b.c7
               Remote SQL: SELECT `C_1`, c2, c3, c4, c5, c6, c7, c8 FROM odbc_fdw_post.`T1`
(15 rows)

--Testcase 83:
SELECT * FROM ft2 a, ft2 b
WHERE a.c2 = 6 AND b.c1 = a.c1 AND a.c8 = 'foo' AND b.c7 = upper(a.c7);
 c1  | c2 |  c3   |            c4            |            c5            | c6 |     c7     | c8  | c1  | c2 |  c3   |            c4            |            c5            | c6 |     c7     | c8  
-----+----+-------+--------------------------+--------------------------+----+------------+-----+-----+----+-------+--------------------------+--------------------------+----+------------+-----
   6 |  6 | 00006 | Wed Jan 07 00:00:00 1970 | Wed Jan 07 00:00:00 1970 | 6  | 6          | foo |   6 |  6 | 00006 | Wed Jan 07 00:00:00 1970 | Wed Jan 07 00:00:00 1970 | 6  | 6          | foo
  16 |  6 | 00016 | Sat Jan 17 00:00:00 1970 | Sat Jan 17 00:00:00 1970 | 6  | 6          | foo |  16 |  6 | 00016 | Sat Jan 17 00:00:00 1970 | Sat Jan 17 00:00:00 1970 | 6  | 6          | foo
  26 |  6 | 00026 | Tue Jan 27 00:00:00 1970 | Tue Jan 27 00:00:00 1970 | 6  | 6          | foo |  26 |  6 | 00026 | Tue Jan 27 00:00:00 1970 | Tue Jan 27 00:00:00 1970 | 6  | 6          | foo
  36 |  6 | 00036 | Fri Feb 06 00:00:00 1970 | Fri Feb 06 00:00:00 1970 | 6  | 6          | foo |  36 |  6 | 00036 | Fri Feb 06 00:00:00 1970 | Fri Feb 06 00:00:00 1970 | 6  | 6          | foo
  46 |  6 | 00046 | Mon Feb 16 00:00:00 1970 | Mon Feb 16 00:00:00 1970 | 6  | 6          | foo |  46 |  6 | 00046 | Mon Feb 16 00:00:00 1970 | Mon Feb 16 00:00:00 1970 | 6  | 6          | foo
  56 |  6 | 00056 | Thu Feb 26 00:00:00 1970 | Thu Feb 26 00:00:00 1970 | 6  | 6          | foo |  56 |  6 | 00056 | Thu Feb 26 00:00:00 1970 | Thu Feb 26 00:00:00 1970 | 6  | 6          | foo
  66 |  6 | 00066 | Sun Mar 08 00:00:00 1970 | Sun Mar 08 00:00:00 1970 | 6  | 6          | foo |  66 |  6 | 00066 | Sun Mar 08 00:00:00 1970 | Sun Mar 08 00:00:00 1970 | 6  | 6          | foo
  76 |  6 | 00076 | Wed Mar 18 00:00:00 1970 | Wed Mar 18 00:00:00 1970 | 6  | 6          | foo |  76 |  6 | 00076 | Wed Mar 18 00:00:00 1970 | Wed Mar 18 00:00:00 1970 | 6  | 6          | foo
  86 |  6 | 00086 | Sat Mar 28 00:00:00 1970 | Sat Mar 28 00:00:00 1970 | 6  | 6          | foo |  86 |  6 | 00086 | Sat Mar 28 00:00:00 1970 | Sat Mar 28 00:00:00 1970 | 6  | 6          | foo
  96 |  6 | 00096 | Tue Apr 07 00:00:00 1970 | Tue Apr 07 00:00:00 1970 | 6  | 6          | foo |  96 |  6 | 00096 | Tue Apr 07 00:00:00 1970 | Tue Apr 07 00:00:00 1970 | 6  | 6          | foo
 106 |  6 | 00106 | Wed Jan 07 00:00:00 1970 | Wed Jan 07 00:00:00 1970 | 6  | 6          | foo | 106 |  6 | 00106 | Wed Jan 07 00:00:00 1970 | Wed Jan 07 00:00:00 1970 | 6  | 6          | foo
 116 |  6 | 00116 | Sat Jan 17 00:00:00 1970 | Sat Jan 17 00:00:00 1970 | 6  | 6          | foo | 116 |  6 | 00116 | Sat Jan 17 00:00:00 1970 | Sat Jan 17 00:00:00 1970 | 6  | 6          | foo
 126 |  6 | 00126 | Tue Jan 27 00:00:00 1970 | Tue Jan 27 00:00:00 1970 | 6  | 6          | foo | 126 |  6 | 00126 | Tue Jan 27 00:00:00 1970 | Tue Jan 27 00:00:00 1970 | 6  | 6          | foo
 136 |  6 | 00136 | Fri Feb 06 00:00:00 1970 | Fri Feb 06 00:00:00 1970 | 6  | 6          | foo | 136 |  6 | 00136 | Fri Feb 06 00:00:00 1970 | Fri Feb 06 00:00:00 1970 | 6  | 6          | foo
 146 |  6 | 00146 | Mon Feb 16 00:00:00 1970 | Mon Feb 16 00:00:00 1970 | 6  | 6          | foo | 146 |  6 | 00146 | Mon Feb 16 00:00:00 1970 | Mon Feb 16 00:00:00 1970 | 6  | 6          | foo
 156 |  6 | 00156 | Thu Feb 26 00:00:00 1970 | Thu Feb 26 00:00:00 1970 | 6  | 6          | foo | 156 |  6 | 00156 | Thu Feb 26 00:00:00 1970 | Thu Feb 26 00:00:00 1970 | 6  | 6          | foo
 166 |  6 | 00166 | Sun Mar 08 00:00:00 1970 | Sun Mar 08 00:00:00 1970 | 6  | 6          | foo | 166 |  6 | 00166 | Sun Mar 08 00:00:00 1970 | Sun Mar 08 00:00:00 1970 | 6  | 6          | foo
 176 |  6 | 00176 | Wed Mar 18 00:00:00 1970 | Wed Mar 18 00:00:00 1970 | 6  | 6          | foo | 176 |  6 | 00176 | Wed Mar 18 00:00:00 1970 | Wed Mar 18 00:00:00 1970 | 6  | 6          | foo
 186 |  6 | 00186 | Sat Mar 28 00:00:00 1970 | Sat Mar 28 00:00:00 1970 | 6  | 6          | foo | 186 |  6 | 00186 | Sat Mar 28 00:00:00 1970 | Sat Mar 28 00:00:00 1970 | 6  | 6          | foo
 196 |  6 | 00196 | Tue Apr 07 00:00:00 1970 | Tue Apr 07 00:00:00 1970 | 6  | 6          | foo | 196 |  6 | 00196 | Tue Apr 07 00:00:00 1970 | Tue Apr 07 00:00:00 1970 | 6  | 6          | foo
 206 |  6 | 00206 | Wed Jan 07 00:00:00 1970 | Wed Jan 07 00:00:00 1970 | 6  | 6          | foo | 206 |  6 | 00206 | Wed Jan 07 00:00:00 1970 | Wed Jan 07 00:00:00 1970 | 6  | 6          | foo
 216 |  6 | 00216 | Sat Jan 17 00:00:00 1970 | Sat Jan 17 00:00:00 1970 | 6  | 6          | foo | 216 |  6 | 00216 | Sat Jan 17 00:00:00 1970 | Sat Jan 17 00:00:00 1970 | 6  | 6          | foo
 226 |  6 | 00226 | Tue Jan 27 00:00:00 1970 | Tue Jan 27 00:00:00 1970 | 6  | 6          | foo | 226 |  6 | 00226 | Tue Jan 27 00:00:00 1970 | Tue Jan 27 00:00:00 1970 | 6  | 6          | foo
 236 |  6 | 00236 | Fri Feb 06 00:00:00 1970 | Fri Feb 06 00:00:00 1970 | 6  | 6          | foo | 236 |  6 | 00236 | Fri Feb 06 00:00:00 1970 | Fri Feb 06 00:00:00 1970 | 6  | 6          | foo
 246 |  6 | 00246 | Mon Feb 16 00:00:00 1970 | Mon Feb 16 00:00:00 1970 | 6  | 6          | foo | 246 |  6 | 00246 | Mon Feb 16 00:00:00 1970 | Mon Feb 16 00:00:00 1970 | 6  | 6          | foo
 256 |  6 | 00256 | Thu Feb 26 00:00:00 1970 | Thu Feb 26 00:00:00 1970 | 6  | 6          | foo | 256 |  6 | 00256 | Thu Feb 26 00:00:00 1970 | Thu Feb 26 00:00:00 1970 | 6  | 6          | foo
 266 |  6 | 00266 | Sun Mar 08 00:00:00 1970 | Sun Mar 08 00:00:00 1970 | 6  | 6          | foo | 266 |  6 | 00266 | Sun Mar 08 00:00:00 1970 | Sun Mar 08 00:00:00 1970 | 6  | 6          | foo
 276 |  6 | 00276 | Wed Mar 18 00:00:00 1970 | Wed Mar 18 00:00:00 1970 | 6  | 6          | foo | 276 |  6 | 00276 | Wed Mar 18 00:00:00 1970 | Wed Mar 18 00:00:00 1970 | 6  | 6          | foo
 286 |  6 | 00286 | Sat Mar 28 00:00:00 1970 | Sat Mar 28 00:00:00 1970 | 6  | 6          | foo | 286 |  6 | 00286 | Sat Mar 28 00:00:00 1970 | Sat Mar 28 00:00:00 1970 | 6  | 6          | foo
 296 |  6 | 00296 | Tue Apr 07 00:00:00 1970 | Tue Apr 07 00:00:00 1970 | 6  | 6          | foo | 296 |  6 | 00296 | Tue Apr 07 00:00:00 1970 | Tue Apr 07 00:00:00 1970 | 6  | 6          | foo
 306 |  6 | 00306 | Wed Jan 07 00:00:00 1970 | Wed Jan 07 00:00:00 1970 | 6  | 6          | foo | 306 |  6 | 00306 | Wed Jan 07 00:00:00 1970 | Wed Jan 07 00:00:00 1970 | 6  | 6          | foo
 316 |  6 | 00316 | Sat Jan 17 00:00:00 1970 | Sat Jan 17 00:00:00 1970 | 6  | 6          | foo | 316 |  6 | 00316 | Sat Jan 17 00:00:00 1970 | Sat Jan 17 00:00:00 1970 | 6  | 6          | foo
 326 |  6 | 00326 | Tue Jan 27 00:00:00 1970 | Tue Jan 27 00:00:00 1970 | 6  | 6          | foo | 326 |  6 | 00326 | Tue Jan 27 00:00:00 1970 | Tue Jan 27 00:00:00 1970 | 6  | 6          | foo
 336 |  6 | 00336 | Fri Feb 06 00:00:00 1970 | Fri Feb 06 00:00:00 1970 | 6  | 6          | foo | 336 |  6 | 00336 | Fri Feb 06 00:00:00 1970 | Fri Feb 06 00:00:00 1970 | 6  | 6          | foo
 346 |  6 | 00346 | Mon Feb 16 00:00:00 1970 | Mon Feb 16 00:00:00 1970 | 6  | 6          | foo | 346 |  6 | 00346 | Mon Feb 16 00:00:00 1970 | Mon Feb 16 00:00:00 1970 | 6  | 6          | foo
 356 |  6 | 00356 | Thu Feb 26 00:00:00 1970 | Thu Feb 26 00:00:00 1970 | 6  | 6          | foo | 356 |  6 | 00356 | Thu Feb 26 00:00:00 1970 | Thu Feb 26 00:00:00 1970 | 6  | 6          | foo
 366 |  6 | 00366 | Sun Mar 08 00:00:00 1970 | Sun Mar 08 00:00:00 1970 | 6  | 6          | foo | 366 |  6 | 00366 | Sun Mar 08 00:00:00 1970 | Sun Mar 08 00:00:00 1970 | 6  | 6          | foo
 376 |  6 | 00376 | Wed Mar 18 00:00:00 1970 | Wed Mar 18 00:00:00 1970 | 6  | 6          | foo | 376 |  6 | 00376 | Wed Mar 18 00:00:00 1970 | Wed Mar 18 00:00:00 1970 | 6  | 6          | foo
 386 |  6 | 00386 | Sat Mar 28 00:00:00 1970 | Sat Mar 28 00:00:00 1970 | 6  | 6          | foo | 386 |  6 | 00386 | Sat Mar 28 00:00:00 1970 | Sat Mar 28 00:00:00 1970 | 6  | 6          | foo
 396 |  6 | 00396 | Tue Apr 07 00:00:00 1970 | Tue Apr 07 00:00:00 1970 | 6  | 6          | foo | 396 |  6 | 00396 | Tue Apr 07 00:00:00 1970 | Tue Apr 07 00:00:00 1970 | 6  | 6          | foo
 406 |  6 | 00406 | Wed Jan 07 00:00:00 1970 | Wed Jan 07 00:00:00 1970 | 6  | 6          | foo | 406 |  6 | 00406 | Wed Jan 07 00:00:00 1970 | Wed Jan 07 00:00:00 1970 | 6  | 6          | foo
 416 |  6 | 00416 | Sat Jan 17 00:00:00 1970 | Sat Jan 17 00:00:00 1970 | 6  | 6          | foo | 416 |  6 | 00416 | Sat Jan 17 00:00:00 1970 | Sat Jan 17 00:00:00 1970 | 6  | 6          | foo
 426 |  6 | 00426 | Tue Jan 27 00:00:00 1970 | Tue Jan 27 00:00:00 1970 | 6  | 6          | foo | 426 |  6 | 00426 | Tue Jan 27 00:00:00 1970 | Tue Jan 27 00:00:00 1970 | 6  | 6          | foo
 436 |  6 | 00436 | Fri Feb 06 00:00:00 1970 | Fri Feb 06 00:00:00 1970 | 6  | 6          | foo | 436 |  6 | 00436 | Fri Feb 06 00:00:00 1970 | Fri Feb 06 00:00:00 1970 | 6  | 6          | foo
 446 |  6 | 00446 | Mon Feb 16 00:00:00 1970 | Mon Feb 16 00:00:00 1970 | 6  | 6          | foo | 446 |  6 | 00446 | Mon Feb 16 00:00:00 1970 | Mon Feb 16 00:00:00 1970 | 6  | 6          | foo
 456 |  6 | 00456 | Thu Feb 26 00:00:00 1970 | Thu Feb 26 00:00:00 1970 | 6  | 6          | foo | 456 |  6 | 00456 | Thu Feb 26 00:00:00 1970 | Thu Feb 26 00:00:00 1970 | 6  | 6          | foo
 466 |  6 | 00466 | Sun Mar 08 00:00:00 1970 | Sun Mar 08 00:00:00 1970 | 6  | 6          | foo | 466 |  6 | 00466 | Sun Mar 08 00:00:00 1970 | Sun Mar 08 00:00:00 1970 | 6  | 6          | foo
 476 |  6 | 00476 | Wed Mar 18 00:00:00 1970 | Wed Mar 18 00:00:00 1970 | 6  | 6          | foo | 476 |  6 | 00476 | Wed Mar 18 00:00:00 1970 | Wed Mar 18 00:00:00 1970 | 6  | 6          | foo
 486 |  6 | 00486 | Sat Mar 28 00:00:00 1970 | Sat Mar 28 00:00:00 1970 | 6  | 6          | foo | 486 |  6 | 00486 | Sat Mar 28 00:00:00 1970 | Sat Mar 28 00:00:00 1970 | 6  | 6          | foo
 496 |  6 | 00496 | Tue Apr 07 00:00:00 1970 | Tue Apr 07 00:00:00 1970 | 6  | 6          | foo | 496 |  6 | 00496 | Tue Apr 07 00:00:00 1970 | Tue Apr 07 00:00:00 1970 | 6  | 6          | foo
 506 |  6 | 00506 | Wed Jan 07 00:00:00 1970 | Wed Jan 07 00:00:00 1970 | 6  | 6          | foo | 506 |  6 | 00506 | Wed Jan 07 00:00:00 1970 | Wed Jan 07 00:00:00 1970 | 6  | 6          | foo
 516 |  6 | 00516 | Sat Jan 17 00:00:00 1970 | Sat Jan 17 00:00:00 1970 | 6  | 6          | foo | 516 |  6 | 00516 | Sat Jan 17 00:00:00 1970 | Sat Jan 17 00:00:00 1970 | 6  | 6          | foo
 526 |  6 | 00526 | Tue Jan 27 00:00:00 1970 | Tue Jan 27 00:00:00 1970 | 6  | 6          | foo | 526 |  6 | 00526 | Tue Jan 27 00:00:00 1970 | Tue Jan 27 00:00:00 1970 | 6  | 6          | foo
 536 |  6 | 00536 | Fri Feb 06 00:00:00 1970 | Fri Feb 06 00:00:00 1970 | 6  | 6          | foo | 536 |  6 | 00536 | Fri Feb 06 00:00:00 1970 | Fri Feb 06 00:00:00 1970 | 6  | 6          | foo
 546 |  6 | 00546 | Mon Feb 16 00:00:00 1970 | Mon Feb 16 00:00:00 1970 | 6  | 6          | foo | 546 |  6 | 00546 | Mon Feb 16 00:00:00 1970 | Mon Feb 16 00:00:00 1970 | 6  | 6          | foo
 556 |  6 | 00556 | Thu Feb 26 00:00:00 1970 | Thu Feb 26 00:00:00 1970 | 6  | 6          | foo | 556 |  6 | 00556 | Thu Feb 26 00:00:00 1970 | Thu Feb 26 00:00:00 1970 | 6  | 6          | foo
 566 |  6 | 00566 | Sun Mar 08 00:00:00 1970 | Sun Mar 08 00:00:00 1970 | 6  | 6          | foo | 566 |  6 | 00566 | Sun Mar 08 00:00:00 1970 | Sun Mar 08 00:00:00 1970 | 6  | 6          | foo
 576 |  6 | 00576 | Wed Mar 18 00:00:00 1970 | Wed Mar 18 00:00:00 1970 | 6  | 6          | foo | 576 |  6 | 00576 | Wed Mar 18 00:00:00 1970 | Wed Mar 18 00:00:00 1970 | 6  | 6          | foo
 586 |  6 | 00586 | Sat Mar 28 00:00:00 1970 | Sat Mar 28 00:00:00 1970 | 6  | 6          | foo | 586 |  6 | 00586 | Sat Mar 28 00:00:00 1970 | Sat Mar 28 00:00:00 1970 | 6  | 6          | foo
 596 |  6 | 00596 | Tue Apr 07 00:00:00 1970 | Tue Apr 07 00:00:00 1970 | 6  | 6          | foo | 596 |  6 | 00596 | Tue Apr 07 00:00:00 1970 | Tue Apr 07 00:00:00 1970 | 6  | 6          | foo
 606 |  6 | 00606 | Wed Jan 07 00:00:00 1970 | Wed Jan 07 00:00:00 1970 | 6  | 6          | foo | 606 |  6 | 00606 | Wed Jan 07 00:00:00 1970 | Wed Jan 07 00:00:00 1970 | 6  | 6          | foo
 616 |  6 | 00616 | Sat Jan 17 00:00:00 1970 | Sat Jan 17 00:00:00 1970 | 6  | 6          | foo | 616 |  6 | 00616 | Sat Jan 17 00:00:00 1970 | Sat Jan 17 00:00:00 1970 | 6  | 6          | foo
 626 |  6 | 00626 | Tue Jan 27 00:00:00 1970 | Tue Jan 27 00:00:00 1970 | 6  | 6          | foo | 626 |  6 | 00626 | Tue Jan 27 00:00:00 1970 | Tue Jan 27 00:00:00 1970 | 6  | 6          | foo
 636 |  6 | 00636 | Fri Feb 06 00:00:00 1970 | Fri Feb 06 00:00:00 1970 | 6  | 6          | foo | 636 |  6 | 00636 | Fri Feb 06 00:00:00 1970 | Fri Feb 06 00:00:00 1970 | 6  | 6          | foo
 646 |  6 | 00646 | Mon Feb 16 00:00:00 1970 | Mon Feb 16 00:00:00 1970 | 6  | 6          | foo | 646 |  6 | 00646 | Mon Feb 16 00:00:00 1970 | Mon Feb 16 00:00:00 1970 | 6  | 6          | foo
 656 |  6 | 00656 | Thu Feb 26 00:00:00 1970 | Thu Feb 26 00:00:00 1970 | 6  | 6          | foo | 656 |  6 | 00656 | Thu Feb 26 00:00:00 1970 | Thu Feb 26 00:00:00 1970 | 6  | 6          | foo
 666 |  6 | 00666 | Sun Mar 08 00:00:00 1970 | Sun Mar 08 00:00:00 1970 | 6  | 6          | foo | 666 |  6 | 00666 | Sun Mar 08 00:00:00 1970 | Sun Mar 08 00:00:00 1970 | 6  | 6          | foo
 676 |  6 | 00676 | Wed Mar 18 00:00:00 1970 | Wed Mar 18 00:00:00 1970 | 6  | 6          | foo | 676 |  6 | 00676 | Wed Mar 18 00:00:00 1970 | Wed Mar 18 00:00:00 1970 | 6  | 6          | foo
 686 |  6 | 00686 | Sat Mar 28 00:00:00 1970 | Sat Mar 28 00:00:00 1970 | 6  | 6          | foo | 686 |  6 | 00686 | Sat Mar 28 00:00:00 1970 | Sat Mar 28 00:00:00 1970 | 6  | 6          | foo
 696 |  6 | 00696 | Tue Apr 07 00:00:00 1970 | Tue Apr 07 00:00:00 1970 | 6  | 6          | foo | 696 |  6 | 00696 | Tue Apr 07 00:00:00 1970 | Tue Apr 07 00:00:00 1970 | 6  | 6          | foo
 706 |  6 | 00706 | Wed Jan 07 00:00:00 1970 | Wed Jan 07 00:00:00 1970 | 6  | 6          | foo | 706 |  6 | 00706 | Wed Jan 07 00:00:00 1970 | Wed Jan 07 00:00:00 1970 | 6  | 6          | foo
 716 |  6 | 00716 | Sat Jan 17 00:00:00 1970 | Sat Jan 17 00:00:00 1970 | 6  | 6          | foo | 716 |  6 | 00716 | Sat Jan 17 00:00:00 1970 | Sat Jan 17 00:00:00 1970 | 6  | 6          | foo
 726 |  6 | 00726 | Tue Jan 27 00:00:00 1970 | Tue Jan 27 00:00:00 1970 | 6  | 6          | foo | 726 |  6 | 00726 | Tue Jan 27 00:00:00 1970 | Tue Jan 27 00:00:00 1970 | 6  | 6          | foo
 736 |  6 | 00736 | Fri Feb 06 00:00:00 1970 | Fri Feb 06 00:00:00 1970 | 6  | 6          | foo | 736 |  6 | 00736 | Fri Feb 06 00:00:00 1970 | Fri Feb 06 00:00:00 1970 | 6  | 6          | foo
 746 |  6 | 00746 | Mon Feb 16 00:00:00 1970 | Mon Feb 16 00:00:00 1970 | 6  | 6          | foo | 746 |  6 | 00746 | Mon Feb 16 00:00:00 1970 | Mon Feb 16 00:00:00 1970 | 6  | 6          | foo
 756 |  6 | 00756 | Thu Feb 26 00:00:00 1970 | Thu Feb 26 00:00:00 1970 | 6  | 6          | foo | 756 |  6 | 00756 | Thu Feb 26 00:00:00 1970 | Thu Feb 26 00:00:00 1970 | 6  | 6          | foo
 766 |  6 | 00766 | Sun Mar 08 00:00:00 1970 | Sun Mar 08 00:00:00 1970 | 6  | 6          | foo | 766 |  6 | 00766 | Sun Mar 08 00:00:00 1970 | Sun Mar 08 00:00:00 1970 | 6  | 6          | foo
 776 |  6 | 00776 | Wed Mar 18 00:00:00 1970 | Wed Mar 18 00:00:00 1970 | 6  | 6          | foo | 776 |  6 | 00776 | Wed Mar 18 00:00:00 1970 | Wed Mar 18 00:00:00 1970 | 6  | 6          | foo
 786 |  6 | 00786 | Sat Mar 28 00:00:00 1970 | Sat Mar 28 00:00:00 1970 | 6  | 6          | foo | 786 |  6 | 00786 | Sat Mar 28 00:00:00 1970 | Sat Mar 28 00:00:00 1970 | 6  | 6          | foo
 796 |  6 | 00796 | Tue Apr 07 00:00:00 1970 | Tue Apr 07 00:00:00 1970 | 6  | 6          | foo | 796 |  6 | 00796 | Tue Apr 07 00:00:00 1970 | Tue Apr 07 00:00:00 1970 | 6  | 6          | foo
 806 |  6 | 00806 | Wed Jan 07 00:00:00 1970 | Wed Jan 07 00:00:00 1970 | 6  | 6          | foo | 806 |  6 | 00806 | Wed Jan 07 00:00:00 1970 | Wed Jan 07 00:00:00 1970 | 6  | 6          | foo
 816 |  6 | 00816 | Sat Jan 17 00:00:00 1970 | Sat Jan 17 00:00:00 1970 | 6  | 6          | foo | 816 |  6 | 00816 | Sat Jan 17 00:00:00 1970 | Sat Jan 17 00:00:00 1970 | 6  | 6          | foo
 826 |  6 | 00826 | Tue Jan 27 00:00:00 1970 | Tue Jan 27 00:00:00 1970 | 6  | 6          | foo | 826 |  6 | 00826 | Tue Jan 27 00:00:00 1970 | Tue Jan 27 00:00:00 1970 | 6  | 6          | foo
 836 |  6 | 00836 | Fri Feb 06 00:00:00 1970 | Fri Feb 06 00:00:00 1970 | 6  | 6          | foo | 836 |  6 | 00836 | Fri Feb 06 00:00:00 1970 | Fri Feb 06 00:00:00 1970 | 6  | 6          | foo
 846 |  6 | 00846 | Mon Feb 16 00:00:00 1970 | Mon Feb 16 00:00:00 1970 | 6  | 6          | foo | 846 |  6 | 00846 | Mon Feb 16 00:00:00 1970 | Mon Feb 16 00:00:00 1970 | 6  | 6          | foo
 856 |  6 | 00856 | Thu Feb 26 00:00:00 1970 | Thu Feb 26 00:00:00 1970 | 6  | 6          | foo | 856 |  6 | 00856 | Thu Feb 26 00:00:00 1970 | Thu Feb 26 00:00:00 1970 | 6  | 6          | foo
 866 |  6 | 00866 | Sun Mar 08 00:00:00 1970 | Sun Mar 08 00:00:00 1970 | 6  | 6          | foo | 866 |  6 | 00866 | Sun Mar 08 00:00:00 1970 | Sun Mar 08 00:00:00 1970 | 6  | 6          | foo
 876 |  6 | 00876 | Wed Mar 18 00:00:00 1970 | Wed Mar 18 00:00:00 1970 | 6  | 6          | foo | 876 |  6 | 00876 | Wed Mar 18 00:00:00 1970 | Wed Mar 18 00:00:00 1970 | 6  | 6          | foo
 886 |  6 | 00886 | Sat Mar 28 00:00:00 1970 | Sat Mar 28 00:00:00 1970 | 6  | 6          | foo | 886 |  6 | 00886 | Sat Mar 28 00:00:00 1970 | Sat Mar 28 00:00:00 1970 | 6  | 6          | foo
 896 |  6 | 00896 | Tue Apr 07 00:00:00 1970 | Tue Apr 07 00:00:00 1970 | 6  | 6          | foo | 896 |  6 | 00896 | Tue Apr 07 00:00:00 1970 | Tue Apr 07 00:00:00 1970 | 6  | 6          | foo
 906 |  6 | 00906 | Wed Jan 07 00:00:00 1970 | Wed Jan 07 00:00:00 1970 | 6  | 6          | foo | 906 |  6 | 00906 | Wed Jan 07 00:00:00 1970 | Wed Jan 07 00:00:00 1970 | 6  | 6          | foo
 916 |  6 | 00916 | Sat Jan 17 00:00:00 1970 | Sat Jan 17 00:00:00 1970 | 6  | 6          | foo | 916 |  6 | 00916 | Sat Jan 17 00:00:00 1970 | Sat Jan 17 00:00:00 1970 | 6  | 6          | foo
 926 |  6 | 00926 | Tue Jan 27 00:00:00 1970 | Tue Jan 27 00:00:00 1970 | 6  | 6          | foo | 926 |  6 | 00926 | Tue Jan 27 00:00:00 1970 | Tue Jan 27 00:00:00 1970 | 6  | 6          | foo
 936 |  6 | 00936 | Fri Feb 06 00:00:00 1970 | Fri Feb 06 00:00:00 1970 | 6  | 6          | foo | 936 |  6 | 00936 | Fri Feb 06 00:00:00 1970 | Fri Feb 06 00:00:00 1970 | 6  | 6          | foo
 946 |  6 | 00946 | Mon Feb 16 00:00:00 1970 | Mon Feb 16 00:00:00 1970 | 6  | 6          | foo | 946 |  6 | 00946 | Mon Feb 16 00:00:00 1970 | Mon Feb 16 00:00:00 1970 | 6  | 6          | foo
 956 |  6 | 00956 | Thu Feb 26 00:00:00 1970 | Thu Feb 26 00:00:00 1970 | 6  | 6          | foo | 956 |  6 | 00956 | Thu Feb 26 00:00:00 1970 | Thu Feb 26 00:00:00 1970 | 6  | 6          | foo
 966 |  6 | 00966 | Sun Mar 08 00:00:00 1970 | Sun Mar 08 00:00:00 1970 | 6  | 6          | foo | 966 |  6 | 00966 | Sun Mar 08 00:00:00 1970 | Sun Mar 08 00:00:00 1970 | 6  | 6          | foo
 976 |  6 | 00976 | Wed Mar 18 00:00:00 1970 | Wed Mar 18 00:00:00 1970 | 6  | 6          | foo | 976 |  6 | 00976 | Wed Mar 18 00:00:00 1970 | Wed Mar 18 00:00:00 1970 | 6  | 6          | foo
 986 |  6 | 00986 | Sat Mar 28 00:00:00 1970 | Sat Mar 28 00:00:00 1970 | 6  | 6          | foo | 986 |  6 | 00986 | Sat Mar 28 00:00:00 1970 | Sat Mar 28 00:00:00 1970 | 6  | 6          | foo
 996 |  6 | 00996 | Tue Apr 07 00:00:00 1970 | Tue Apr 07 00:00:00 1970 | 6  | 6          | foo | 996 |  6 | 00996 | Tue Apr 07 00:00:00 1970 | Tue Apr 07 00:00:00 1970 | 6  | 6          | foo
(100 rows)

-- bug before 9.3.5 due to sloppy handling of remote-estimate parameters
--Testcase 84:
SELECT * FROM ft1 WHERE c1 = ANY (ARRAY(SELECT c1 FROM ft2 WHERE c1 < 5));
 c1 | c2 |  c3   |            c4            |            c5            | c6 |     c7     | c8  
----+----+-------+--------------------------+--------------------------+----+------------+-----
  1 |  1 | 00001 | Fri Jan 02 00:00:00 1970 | Fri Jan 02 00:00:00 1970 | 1  | 1          | foo
  2 |  2 | 00002 | Sat Jan 03 00:00:00 1970 | Sat Jan 03 00:00:00 1970 | 2  | 2          | foo
  3 |  3 | 00003 | Sun Jan 04 00:00:00 1970 | Sun Jan 04 00:00:00 1970 | 3  | 3          | foo
  4 |  4 | 00004 | Mon Jan 05 00:00:00 1970 | Mon Jan 05 00:00:00 1970 | 4  | 4          | foo
(4 rows)

--Testcase 85:
SELECT * FROM ft2 WHERE c1 = ANY (ARRAY(SELECT c1 FROM ft1 WHERE c1 < 5));
 c1 | c2 |  c3   |            c4            |            c5            | c6 |     c7     | c8  
----+----+-------+--------------------------+--------------------------+----+------------+-----
  1 |  1 | 00001 | Fri Jan 02 00:00:00 1970 | Fri Jan 02 00:00:00 1970 | 1  | 1          | foo
  2 |  2 | 00002 | Sat Jan 03 00:00:00 1970 | Sat Jan 03 00:00:00 1970 | 2  | 2          | foo
  3 |  3 | 00003 | Sun Jan 04 00:00:00 1970 | Sun Jan 04 00:00:00 1970 | 3  | 3          | foo
  4 |  4 | 00004 | Mon Jan 05 00:00:00 1970 | Mon Jan 05 00:00:00 1970 | 4  | 4          | foo
(4 rows)

-- we should not push order by clause with volatile expressions or unsafe
-- collations
--Testcase 86:
EXPLAIN (VERBOSE, COSTS OFF)
	SELECT * FROM ft2 ORDER BY ft2.c1, random();
                                      QUERY PLAN                                      
--------------------------------------------------------------------------------------
 Sort
   Output: c1, c2, c3, c4, c5, c6, c7, c8, (random())
   Sort Key: ft2.c1, (random())
   ->  Foreign Scan on public.ft2
         Output: c1, c2, c3, c4, c5, c6, c7, c8, random()
         Remote SQL: SELECT `C_1`, c2, c3, c4, c5, c6, c7, c8 FROM odbc_fdw_post.`T1`
(6 rows)

--Testcase 87:
EXPLAIN (VERBOSE, COSTS OFF)
	SELECT * FROM ft2 ORDER BY ft2.c1, ft2.c3 collate "C";
                                      QUERY PLAN                                      
--------------------------------------------------------------------------------------
 Sort
   Output: c1, c2, c3, c4, c5, c6, c7, c8, ((c3)::text)
   Sort Key: ft2.c1, ft2.c3 COLLATE "C"
   ->  Foreign Scan on public.ft2
         Output: c1, c2, c3, c4, c5, c6, c7, c8, c3
         Remote SQL: SELECT `C_1`, c2, c3, c4, c5, c6, c7, c8 FROM odbc_fdw_post.`T1`
(6 rows)

-- user-defined operator/function
--Testcase 88:
CREATE FUNCTION postgres_fdw_abs(int) RETURNS int AS $$
BEGIN
RETURN abs($1);
END
$$ LANGUAGE plpgsql IMMUTABLE;
--Testcase 89:
CREATE OPERATOR === (
    LEFTARG = int,
    RIGHTARG = int,
    PROCEDURE = int4eq,
    COMMUTATOR = ===
);
-- built-in operators and functions can be shipped for remote execution
--Testcase 90:
EXPLAIN (VERBOSE, COSTS OFF)
  SELECT count(c3) FROM ft1 t1 WHERE t1.c1 = abs(t1.c2);
                                    QUERY PLAN                                    
----------------------------------------------------------------------------------
 Foreign Scan
   Output: (count(c3))
   Remote SQL: SELECT count(c3) FROM odbc_fdw_post.`T1` WHERE ((`C_1` = abs(c2)))
(3 rows)

--Testcase 91:
SELECT count(c3) FROM ft1 t1 WHERE t1.c1 = abs(t1.c2);
 count 
-------
     9
(1 row)

--Testcase 92:
EXPLAIN (VERBOSE, COSTS OFF)
  SELECT count(c3) FROM ft1 t1 WHERE t1.c1 = t1.c2;
                                 QUERY PLAN                                  
-----------------------------------------------------------------------------
 Foreign Scan
   Output: (count(c3))
   Remote SQL: SELECT count(c3) FROM odbc_fdw_post.`T1` WHERE ((`C_1` = c2))
(3 rows)

--Testcase 93:
SELECT count(c3) FROM ft1 t1 WHERE t1.c1 = t1.c2;
 count 
-------
     9
(1 row)

-- by default, user-defined ones cannot
--Testcase 94:
EXPLAIN (VERBOSE, COSTS OFF)
  SELECT count(c3) FROM ft1 t1 WHERE t1.c1 = postgres_fdw_abs(t1.c2);
                            QUERY PLAN                            
------------------------------------------------------------------
 Aggregate
   Output: count(c3)
   ->  Foreign Scan on public.ft1 t1
         Output: c1, c2, c3, c4, c5, c6, c7, c8
         Filter: (t1.c1 = postgres_fdw_abs(t1.c2))
         Remote SQL: SELECT `C_1`, c2, c3 FROM odbc_fdw_post.`T1`
(6 rows)

--Testcase 95:
SELECT count(c3) FROM ft1 t1 WHERE t1.c1 = postgres_fdw_abs(t1.c2);
 count 
-------
     9
(1 row)

--Testcase 96:
EXPLAIN (VERBOSE, COSTS OFF)
  SELECT count(c3) FROM ft1 t1 WHERE t1.c1 === t1.c2;
                            QUERY PLAN                            
------------------------------------------------------------------
 Aggregate
   Output: count(c3)
   ->  Foreign Scan on public.ft1 t1
         Output: c1, c2, c3, c4, c5, c6, c7, c8
         Filter: (t1.c1 === t1.c2)
         Remote SQL: SELECT `C_1`, c2, c3 FROM odbc_fdw_post.`T1`
(6 rows)

--Testcase 97:
SELECT count(c3) FROM ft1 t1 WHERE t1.c1 === t1.c2;
 count 
-------
     9
(1 row)

-- ORDER BY can be shipped, though
--Testcase 98:
EXPLAIN (VERBOSE, COSTS OFF)
  SELECT * FROM ft1 t1 WHERE t1.c1 === t1.c2 order by t1.c2 limit 1;
                                         QUERY PLAN                                         
--------------------------------------------------------------------------------------------
 Limit
   Output: c1, c2, c3, c4, c5, c6, c7, c8
   ->  Sort
         Output: c1, c2, c3, c4, c5, c6, c7, c8
         Sort Key: t1.c2
         ->  Foreign Scan on public.ft1 t1
               Output: c1, c2, c3, c4, c5, c6, c7, c8
               Filter: (t1.c1 === t1.c2)
               Remote SQL: SELECT `C_1`, c2, c3, c4, c5, c6, c7, c8 FROM odbc_fdw_post.`T1`
(9 rows)

--Testcase 99:
SELECT * FROM ft1 t1 WHERE t1.c1 === t1.c2 order by t1.c2 limit 1;
 c1 | c2 |  c3   |            c4            |            c5            | c6 |     c7     | c8  
----+----+-------+--------------------------+--------------------------+----+------------+-----
  1 |  1 | 00001 | Fri Jan 02 00:00:00 1970 | Fri Jan 02 00:00:00 1970 | 1  | 1          | foo
(1 row)

-- but let's put them in an extension ...
--Testcase 100:
ALTER EXTENSION :DB_EXTENSIONNAME ADD FUNCTION postgres_fdw_abs(int);
--Testcase 101:
ALTER EXTENSION :DB_EXTENSIONNAME ADD OPERATOR === (int, int);
-- Option 'extensions' is not supported
-- ALTER SERVER :DB_SERVERNAME OPTIONS (ADD extensions :DB_EXTENSIONNAME);
-- ... now they can be shipped
--Testcase 102:
EXPLAIN (VERBOSE, COSTS OFF)
  SELECT count(c3) FROM ft1 t1 WHERE t1.c1 = postgres_fdw_abs(t1.c2);
                            QUERY PLAN                            
------------------------------------------------------------------
 Aggregate
   Output: count(c3)
   ->  Foreign Scan on public.ft1 t1
         Output: c1, c2, c3, c4, c5, c6, c7, c8
         Filter: (t1.c1 = postgres_fdw_abs(t1.c2))
         Remote SQL: SELECT `C_1`, c2, c3 FROM odbc_fdw_post.`T1`
(6 rows)

--Testcase 103:
SELECT count(c3) FROM ft1 t1 WHERE t1.c1 = postgres_fdw_abs(t1.c2);
 count 
-------
     9
(1 row)

--Testcase 104:
EXPLAIN (VERBOSE, COSTS OFF)
  SELECT count(c3) FROM ft1 t1 WHERE t1.c1 === t1.c2;
                            QUERY PLAN                            
------------------------------------------------------------------
 Aggregate
   Output: count(c3)
   ->  Foreign Scan on public.ft1 t1
         Output: c1, c2, c3, c4, c5, c6, c7, c8
         Filter: (t1.c1 === t1.c2)
         Remote SQL: SELECT `C_1`, c2, c3 FROM odbc_fdw_post.`T1`
(6 rows)

--Testcase 105:
SELECT count(c3) FROM ft1 t1 WHERE t1.c1 === t1.c2;
 count 
-------
     9
(1 row)

-- and both ORDER BY and LIMIT can be shipped
--Testcase 106:
EXPLAIN (VERBOSE, COSTS OFF)
  SELECT * FROM ft1 t1 WHERE t1.c1 === t1.c2 order by t1.c2 limit 1;
                                         QUERY PLAN                                         
--------------------------------------------------------------------------------------------
 Limit
   Output: c1, c2, c3, c4, c5, c6, c7, c8
   ->  Sort
         Output: c1, c2, c3, c4, c5, c6, c7, c8
         Sort Key: t1.c2
         ->  Foreign Scan on public.ft1 t1
               Output: c1, c2, c3, c4, c5, c6, c7, c8
               Filter: (t1.c1 === t1.c2)
               Remote SQL: SELECT `C_1`, c2, c3, c4, c5, c6, c7, c8 FROM odbc_fdw_post.`T1`
(9 rows)

--Testcase 107:
SELECT * FROM ft1 t1 WHERE t1.c1 === t1.c2 order by t1.c2 limit 1;
 c1 | c2 |  c3   |            c4            |            c5            | c6 |     c7     | c8  
----+----+-------+--------------------------+--------------------------+----+------------+-----
  1 |  1 | 00001 | Fri Jan 02 00:00:00 1970 | Fri Jan 02 00:00:00 1970 | 1  | 1          | foo
(1 row)

-- ===================================================================
-- JOIN queries
-- ===================================================================
-- Analyze ft4 and ft5 so that we have better statistics. These tables do not
-- have use_remote_estimate set.
-- ANALYZE ft4;
-- ANALYZE ft5;
-- join two tables
--Testcase 108:
EXPLAIN (VERBOSE, COSTS OFF)
SELECT t1.c1, t2.c1 FROM ft1 t1 JOIN ft2 t2 ON (t1.c1 = t2.c1) ORDER BY t1.c3, t1.c1 OFFSET 100 LIMIT 10;
                                     QUERY PLAN                                     
------------------------------------------------------------------------------------
 Limit
   Output: t1.c1, t2.c1, t1.c3
   ->  Sort
         Output: t1.c1, t2.c1, t1.c3
         Sort Key: t1.c3, t1.c1
         ->  Hash Join
               Output: t1.c1, t2.c1, t1.c3
               Hash Cond: (t1.c1 = t2.c1)
               ->  Foreign Scan on public.ft1 t1
                     Output: t1.c1, t1.c2, t1.c3, t1.c4, t1.c5, t1.c6, t1.c7, t1.c8
                     Remote SQL: SELECT `C_1`, c3 FROM odbc_fdw_post.`T1`
               ->  Hash
                     Output: t2.c1
                     ->  Foreign Scan on public.ft2 t2
                           Output: t2.c1
                           Remote SQL: SELECT `C_1` FROM odbc_fdw_post.`T1`
(16 rows)

--Testcase 109:
SELECT t1.c1, t2.c1 FROM ft1 t1 JOIN ft2 t2 ON (t1.c1 = t2.c1) ORDER BY t1.c3, t1.c1 OFFSET 100 LIMIT 10;
 c1  | c1  
-----+-----
 101 | 101
 102 | 102
 103 | 103
 104 | 104
 105 | 105
 106 | 106
 107 | 107
 108 | 108
 109 | 109
 110 | 110
(10 rows)

-- join three tables
--Testcase 110:
EXPLAIN (VERBOSE, COSTS OFF)
SELECT t1.c1, t2.c2, t3.c3 FROM ft1 t1 JOIN ft2 t2 ON (t1.c1 = t2.c1) JOIN ft4 t3 ON (t3.c1 = t1.c1) ORDER BY t1.c3, t1.c1 OFFSET 10 LIMIT 10;
                                           QUERY PLAN                                           
------------------------------------------------------------------------------------------------
 Limit
   Output: t1.c1, t2.c2, t3.c3, t1.c3
   ->  Sort
         Output: t1.c1, t2.c2, t3.c3, t1.c3
         Sort Key: t1.c3, t1.c1
         ->  Hash Join
               Output: t1.c1, t2.c2, t3.c3, t1.c3
               Hash Cond: (t2.c1 = t1.c1)
               ->  Foreign Scan on public.ft2 t2
                     Output: t2.c1, t2.c2, t2.c3, t2.c4, t2.c5, t2.c6, t2.c7, t2.c8
                     Remote SQL: SELECT `C_1`, c2 FROM odbc_fdw_post.`T1`
               ->  Hash
                     Output: t1.c1, t1.c3, t3.c3, t3.c1
                     ->  Hash Join
                           Output: t1.c1, t1.c3, t3.c3, t3.c1
                           Hash Cond: (t1.c1 = t3.c1)
                           ->  Foreign Scan on public.ft1 t1
                                 Output: t1.c1, t1.c2, t1.c3, t1.c4, t1.c5, t1.c6, t1.c7, t1.c8
                                 Remote SQL: SELECT `C_1`, c3 FROM odbc_fdw_post.`T1`
                           ->  Hash
                                 Output: t3.c3, t3.c1
                                 ->  Foreign Scan on public.ft4 t3
                                       Output: t3.c3, t3.c1
                                       Remote SQL: SELECT c1, c3 FROM odbc_fdw_post.`T3`
(24 rows)

--Testcase 111:
SELECT t1.c1, t2.c2, t3.c3 FROM ft1 t1 JOIN ft2 t2 ON (t1.c1 = t2.c1) JOIN ft4 t3 ON (t3.c1 = t1.c1) ORDER BY t1.c3, t1.c1 OFFSET 10 LIMIT 10;
 c1 | c2 |   c3   
----+----+--------
 22 |  2 | AAA022
 24 |  4 | AAA024
 26 |  6 | AAA026
 28 |  8 | AAA028
 30 |  0 | AAA030
 32 |  2 | AAA032
 34 |  4 | AAA034
 36 |  6 | AAA036
 38 |  8 | AAA038
 40 |  0 | AAA040
(10 rows)

-- left outer join
--Testcase 112:
EXPLAIN (VERBOSE, COSTS OFF)
SELECT t1.c1, t2.c1 FROM ft4 t1 LEFT JOIN ft5 t2 ON (t1.c1 = t2.c1) ORDER BY t1.c1, t2.c1 OFFSET 10 LIMIT 10;
                               QUERY PLAN                                
-------------------------------------------------------------------------
 Limit
   Output: t1.c1, t2.c1
   ->  Sort
         Output: t1.c1, t2.c1
         Sort Key: t1.c1, t2.c1
         ->  Hash Left Join
               Output: t1.c1, t2.c1
               Hash Cond: (t1.c1 = t2.c1)
               ->  Foreign Scan on public.ft4 t1
                     Output: t1.c1, t1.c2, t1.c3
                     Remote SQL: SELECT c1 FROM odbc_fdw_post.`T3`
               ->  Hash
                     Output: t2.c1
                     ->  Foreign Scan on public.ft5 t2
                           Output: t2.c1
                           Remote SQL: SELECT c1 FROM odbc_fdw_post.`T4`
(16 rows)

--Testcase 113:
SELECT t1.c1, t2.c1 FROM ft4 t1 LEFT JOIN ft5 t2 ON (t1.c1 = t2.c1) ORDER BY t1.c1, t2.c1 OFFSET 10 LIMIT 10;
 c1 | c1 
----+----
 22 |   
 24 | 24
 26 |   
 28 |   
 30 | 30
 32 |   
 34 |   
 36 | 36
 38 |   
 40 |   
(10 rows)

-- left outer join three tables
--Testcase 114:
EXPLAIN (VERBOSE, COSTS OFF)
SELECT t1.c1, t2.c2, t3.c3 FROM ft2 t1 LEFT JOIN ft2 t2 ON (t1.c1 = t2.c1) LEFT JOIN ft4 t3 ON (t2.c1 = t3.c1) OFFSET 10 LIMIT 10;
                                     QUERY PLAN                                     
------------------------------------------------------------------------------------
 Limit
   Output: t1.c1, t2.c2, t3.c3
   ->  Nested Loop Left Join
         Output: t1.c1, t2.c2, t3.c3
         Join Filter: (t2.c1 = t3.c1)
         ->  Nested Loop Left Join
               Output: t1.c1, t2.c2, t2.c1
               Join Filter: (t1.c1 = t2.c1)
               ->  Foreign Scan on public.ft2 t1
                     Output: t1.c1, t1.c2, t1.c3, t1.c4, t1.c5, t1.c6, t1.c7, t1.c8
                     Remote SQL: SELECT `C_1` FROM odbc_fdw_post.`T1`
               ->  Materialize
                     Output: t2.c2, t2.c1
                     ->  Foreign Scan on public.ft2 t2
                           Output: t2.c2, t2.c1
                           Remote SQL: SELECT `C_1`, c2 FROM odbc_fdw_post.`T1`
         ->  Materialize
               Output: t3.c3, t3.c1
               ->  Foreign Scan on public.ft4 t3
                     Output: t3.c3, t3.c1
                     Remote SQL: SELECT c1, c3 FROM odbc_fdw_post.`T3`
(21 rows)

--Testcase 115:
SELECT t1.c1, t2.c2, t3.c3 FROM ft2 t1 LEFT JOIN ft2 t2 ON (t1.c1 = t2.c1) LEFT JOIN ft4 t3 ON (t2.c1 = t3.c1) OFFSET 10 LIMIT 10;
 c1 | c2 |   c3   
----+----+--------
 11 |  1 | 
 12 |  2 | AAA012
 13 |  3 | 
 14 |  4 | AAA014
 15 |  5 | 
 16 |  6 | AAA016
 17 |  7 | 
 18 |  8 | AAA018
 19 |  9 | 
 20 |  0 | AAA020
(10 rows)

-- left outer join + placement of clauses.
-- clauses within the nullable side are not pulled up, but top level clause on
-- non-nullable side is pushed into non-nullable side
--Testcase 116:
EXPLAIN (VERBOSE, COSTS OFF)
SELECT t1.c1, t1.c2, t2.c1, t2.c2 FROM ft4 t1 LEFT JOIN (SELECT * FROM ft5 WHERE c1 < 10) t2 ON (t1.c1 = t2.c1) WHERE t1.c1 < 10;
                                    QUERY PLAN                                     
-----------------------------------------------------------------------------------
 Hash Left Join
   Output: t1.c1, t1.c2, ft5.c1, ft5.c2
   Hash Cond: (t1.c1 = ft5.c1)
   ->  Foreign Scan on public.ft4 t1
         Output: t1.c1, t1.c2, t1.c3
         Remote SQL: SELECT c1, c2 FROM odbc_fdw_post.`T3` WHERE ((c1 < 10))
   ->  Hash
         Output: ft5.c1, ft5.c2
         ->  Foreign Scan on public.ft5
               Output: ft5.c1, ft5.c2
               Remote SQL: SELECT c1, c2 FROM odbc_fdw_post.`T4` WHERE ((c1 < 10))
(11 rows)

--Testcase 117:
SELECT t1.c1, t1.c2, t2.c1, t2.c2 FROM ft4 t1 LEFT JOIN (SELECT * FROM ft5 WHERE c1 < 10) t2 ON (t1.c1 = t2.c1) WHERE t1.c1 < 10;
 c1 | c2 | c1 | c2 
----+----+----+----
  2 |  3 |    |   
  4 |  5 |    |   
  6 |  7 |  6 |  7
  8 |  9 |    |   
(4 rows)

-- clauses within the nullable side are not pulled up, but the top level clause
-- on nullable side is not pushed down into nullable side
--Testcase 118:
EXPLAIN (VERBOSE, COSTS OFF)
SELECT t1.c1, t1.c2, t2.c1, t2.c2 FROM ft4 t1 LEFT JOIN (SELECT * FROM ft5 WHERE c1 < 10) t2 ON (t1.c1 = t2.c1)
			WHERE (t2.c1 < 10 OR t2.c1 IS NULL) AND t1.c1 < 10;
                                    QUERY PLAN                                     
-----------------------------------------------------------------------------------
 Hash Left Join
   Output: t1.c1, t1.c2, ft5.c1, ft5.c2
   Hash Cond: (t1.c1 = ft5.c1)
   Filter: ((ft5.c1 < 10) OR (ft5.c1 IS NULL))
   ->  Foreign Scan on public.ft4 t1
         Output: t1.c1, t1.c2, t1.c3
         Remote SQL: SELECT c1, c2 FROM odbc_fdw_post.`T3` WHERE ((c1 < 10))
   ->  Hash
         Output: ft5.c1, ft5.c2
         ->  Foreign Scan on public.ft5
               Output: ft5.c1, ft5.c2
               Remote SQL: SELECT c1, c2 FROM odbc_fdw_post.`T4` WHERE ((c1 < 10))
(12 rows)

--Testcase 119:
SELECT t1.c1, t1.c2, t2.c1, t2.c2 FROM ft4 t1 LEFT JOIN (SELECT * FROM ft5 WHERE c1 < 10) t2 ON (t1.c1 = t2.c1)
			WHERE (t2.c1 < 10 OR t2.c1 IS NULL) AND t1.c1 < 10;
 c1 | c2 | c1 | c2 
----+----+----+----
  2 |  3 |    |   
  4 |  5 |    |   
  6 |  7 |  6 |  7
  8 |  9 |    |   
(4 rows)

-- right outer join
--Testcase 120:
EXPLAIN (VERBOSE, COSTS OFF)
SELECT t1.c1, t2.c1 FROM ft5 t1 RIGHT JOIN ft4 t2 ON (t1.c1 = t2.c1) ORDER BY t2.c1, t1.c1 OFFSET 10 LIMIT 10;
                               QUERY PLAN                                
-------------------------------------------------------------------------
 Limit
   Output: t1.c1, t2.c1
   ->  Sort
         Output: t1.c1, t2.c1
         Sort Key: t2.c1, t1.c1
         ->  Hash Left Join
               Output: t1.c1, t2.c1
               Hash Cond: (t2.c1 = t1.c1)
               ->  Foreign Scan on public.ft4 t2
                     Output: t2.c1, t2.c2, t2.c3
                     Remote SQL: SELECT c1 FROM odbc_fdw_post.`T3`
               ->  Hash
                     Output: t1.c1
                     ->  Foreign Scan on public.ft5 t1
                           Output: t1.c1
                           Remote SQL: SELECT c1 FROM odbc_fdw_post.`T4`
(16 rows)

--Testcase 121:
SELECT t1.c1, t2.c1 FROM ft5 t1 RIGHT JOIN ft4 t2 ON (t1.c1 = t2.c1) ORDER BY t2.c1, t1.c1 OFFSET 10 LIMIT 10;
 c1 | c1 
----+----
    | 22
 24 | 24
    | 26
    | 28
 30 | 30
    | 32
    | 34
 36 | 36
    | 38
    | 40
(10 rows)

-- right outer join three tables
--Testcase 122:
EXPLAIN (VERBOSE, COSTS OFF)
SELECT t1.c1, t2.c2, t3.c3 FROM ft2 t1 RIGHT JOIN ft2 t2 ON (t1.c1 = t2.c1) RIGHT JOIN ft4 t3 ON (t2.c1 = t3.c1) OFFSET 10 LIMIT 10;
                                   QUERY PLAN                                   
--------------------------------------------------------------------------------
 Limit
   Output: t1.c1, t2.c2, t3.c3
   ->  Nested Loop Left Join
         Output: t1.c1, t2.c2, t3.c3
         Join Filter: (t1.c1 = t2.c1)
         ->  Nested Loop Left Join
               Output: t3.c3, t2.c2, t2.c1
               Join Filter: (t2.c1 = t3.c1)
               ->  Foreign Scan on public.ft4 t3
                     Output: t3.c1, t3.c2, t3.c3
                     Remote SQL: SELECT c1, c3 FROM odbc_fdw_post.`T3`
               ->  Materialize
                     Output: t2.c2, t2.c1
                     ->  Foreign Scan on public.ft2 t2
                           Output: t2.c2, t2.c1
                           Remote SQL: SELECT `C_1`, c2 FROM odbc_fdw_post.`T1`
         ->  Materialize
               Output: t1.c1
               ->  Foreign Scan on public.ft2 t1
                     Output: t1.c1
                     Remote SQL: SELECT `C_1` FROM odbc_fdw_post.`T1`
(21 rows)

--Testcase 123:
SELECT t1.c1, t2.c2, t3.c3 FROM ft2 t1 RIGHT JOIN ft2 t2 ON (t1.c1 = t2.c1) RIGHT JOIN ft4 t3 ON (t2.c1 = t3.c1) OFFSET 10 LIMIT 10;
 c1 | c2 |   c3   
----+----+--------
 22 |  2 | AAA022
 24 |  4 | AAA024
 26 |  6 | AAA026
 28 |  8 | AAA028
 30 |  0 | AAA030
 32 |  2 | AAA032
 34 |  4 | AAA034
 36 |  6 | AAA036
 38 |  8 | AAA038
 40 |  0 | AAA040
(10 rows)

-- full outer join
--Testcase 124:
EXPLAIN (VERBOSE, COSTS OFF)
SELECT t1.c1, t2.c1 FROM ft4 t1 FULL JOIN ft5 t2 ON (t1.c1 = t2.c1) ORDER BY t1.c1, t2.c1 OFFSET 45 LIMIT 10;
                               QUERY PLAN                                
-------------------------------------------------------------------------
 Limit
   Output: t1.c1, t2.c1
   ->  Sort
         Output: t1.c1, t2.c1
         Sort Key: t1.c1, t2.c1
         ->  Hash Full Join
               Output: t1.c1, t2.c1
               Hash Cond: (t1.c1 = t2.c1)
               ->  Foreign Scan on public.ft4 t1
                     Output: t1.c1, t1.c2, t1.c3
                     Remote SQL: SELECT c1 FROM odbc_fdw_post.`T3`
               ->  Hash
                     Output: t2.c1
                     ->  Foreign Scan on public.ft5 t2
                           Output: t2.c1
                           Remote SQL: SELECT c1 FROM odbc_fdw_post.`T4`
(16 rows)

--Testcase 125:
SELECT t1.c1, t2.c1 FROM ft4 t1 FULL JOIN ft5 t2 ON (t1.c1 = t2.c1) ORDER BY t1.c1, t2.c1 OFFSET 45 LIMIT 10;
 c1  | c1 
-----+----
  92 |   
  94 |   
  96 | 96
  98 |   
 100 |   
     |  3
     |  9
     | 15
     | 21
     | 27
(10 rows)

-- full outer join with restrictions on the joining relations
-- a. the joining relations are both base relations
--Testcase 126:
EXPLAIN (VERBOSE, COSTS OFF)
SELECT t1.c1, t2.c1 FROM (SELECT c1 FROM ft4 WHERE c1 between 50 and 60) t1 FULL JOIN (SELECT c1 FROM ft5 WHERE c1 between 50 and 60) t2 ON (t1.c1 = t2.c1) ORDER BY t1.c1, t2.c1;
                                              QUERY PLAN                                               
-------------------------------------------------------------------------------------------------------
 Sort
   Output: ft4.c1, ft5.c1
   Sort Key: ft4.c1, ft5.c1
   ->  Hash Full Join
         Output: ft4.c1, ft5.c1
         Hash Cond: (ft4.c1 = ft5.c1)
         ->  Foreign Scan on public.ft4
               Output: ft4.c1, ft4.c2, ft4.c3
               Remote SQL: SELECT c1 FROM odbc_fdw_post.`T3` WHERE ((c1 >= 50)) AND ((c1 <= 60))
         ->  Hash
               Output: ft5.c1
               ->  Foreign Scan on public.ft5
                     Output: ft5.c1
                     Remote SQL: SELECT c1 FROM odbc_fdw_post.`T4` WHERE ((c1 >= 50)) AND ((c1 <= 60))
(14 rows)

--Testcase 127:
SELECT t1.c1, t2.c1 FROM (SELECT c1 FROM ft4 WHERE c1 between 50 and 60) t1 FULL JOIN (SELECT c1 FROM ft5 WHERE c1 between 50 and 60) t2 ON (t1.c1 = t2.c1) ORDER BY t1.c1, t2.c1;
 c1 | c1 
----+----
 50 |   
 52 |   
 54 | 54
 56 |   
 58 |   
 60 | 60
    | 51
    | 57
(8 rows)

--Testcase 128:
EXPLAIN (VERBOSE, COSTS OFF)
SELECT 1 FROM (SELECT c1 FROM ft4 WHERE c1 between 50 and 60) t1 FULL JOIN (SELECT c1 FROM ft5 WHERE c1 between 50 and 60) t2 ON (TRUE) OFFSET 10 LIMIT 10;
                                               QUERY PLAN                                                
---------------------------------------------------------------------------------------------------------
 Limit
   Output: 1
   ->  Merge Full Join
         Output: 1
         ->  Foreign Scan on public.ft4
               Output: ft4.c1, ft4.c2, ft4.c3
               Remote SQL: SELECT NULL FROM odbc_fdw_post.`T3` WHERE ((c1 >= 50)) AND ((c1 <= 60))
         ->  Materialize
               Output: ft5.c1, ft5.c2, ft5.c3
               ->  Foreign Scan on public.ft5
                     Output: ft5.c1, ft5.c2, ft5.c3
                     Remote SQL: SELECT NULL FROM odbc_fdw_post.`T4` WHERE ((c1 >= 50)) AND ((c1 <= 60))
(12 rows)

--Testcase 129:
SELECT 1 FROM (SELECT c1 FROM ft4 WHERE c1 between 50 and 60) t1 FULL JOIN (SELECT c1 FROM ft5 WHERE c1 between 50 and 60) t2 ON (TRUE) OFFSET 10 LIMIT 10;
 ?column? 
----------
        1
        1
        1
        1
        1
        1
        1
        1
        1
        1
(10 rows)

-- b. one of the joining relations is a base relation and the other is a join
-- relation
--Testcase 130:
EXPLAIN (VERBOSE, COSTS OFF)
SELECT t1.c1, ss.a, ss.b FROM (SELECT c1 FROM ft4 WHERE c1 between 50 and 60) t1 FULL JOIN (SELECT t2.c1, t3.c1 FROM ft4 t2 LEFT JOIN ft5 t3 ON (t2.c1 = t3.c1) WHERE (t2.c1 between 50 and 60)) ss(a, b) ON (t1.c1 = ss.a) ORDER BY t1.c1, ss.a, ss.b;
                                              QUERY PLAN                                               
-------------------------------------------------------------------------------------------------------
 Sort
   Output: ft4.c1, t2.c1, t3.c1
   Sort Key: ft4.c1, t2.c1, t3.c1
   ->  Hash Full Join
         Output: ft4.c1, t2.c1, t3.c1
         Hash Cond: (t2.c1 = ft4.c1)
         ->  Hash Left Join
               Output: t2.c1, t3.c1
               Hash Cond: (t2.c1 = t3.c1)
               ->  Foreign Scan on public.ft4 t2
                     Output: t2.c1, t2.c2, t2.c3
                     Remote SQL: SELECT c1 FROM odbc_fdw_post.`T3` WHERE ((c1 >= 50)) AND ((c1 <= 60))
               ->  Hash
                     Output: t3.c1
                     ->  Foreign Scan on public.ft5 t3
                           Output: t3.c1
                           Remote SQL: SELECT c1 FROM odbc_fdw_post.`T4`
         ->  Hash
               Output: ft4.c1
               ->  Foreign Scan on public.ft4
                     Output: ft4.c1
                     Remote SQL: SELECT c1 FROM odbc_fdw_post.`T3` WHERE ((c1 >= 50)) AND ((c1 <= 60))
(22 rows)

--Testcase 131:
SELECT t1.c1, ss.a, ss.b FROM (SELECT c1 FROM ft4 WHERE c1 between 50 and 60) t1 FULL JOIN (SELECT t2.c1, t3.c1 FROM ft4 t2 LEFT JOIN ft5 t3 ON (t2.c1 = t3.c1) WHERE (t2.c1 between 50 and 60)) ss(a, b) ON (t1.c1 = ss.a) ORDER BY t1.c1, ss.a, ss.b;
 c1 | a  | b  
----+----+----
 50 | 50 |   
 52 | 52 |   
 54 | 54 | 54
 56 | 56 |   
 58 | 58 |   
 60 | 60 | 60
(6 rows)

-- c. test deparsing the remote query as nested subqueries
--Testcase 132:
EXPLAIN (VERBOSE, COSTS OFF)
SELECT t1.c1, ss.a, ss.b FROM (SELECT c1 FROM ft4 WHERE c1 between 50 and 60) t1 FULL JOIN (SELECT t2.c1, t3.c1 FROM (SELECT c1 FROM ft4 WHERE c1 between 50 and 60) t2 FULL JOIN (SELECT c1 FROM ft5 WHERE c1 between 50 and 60) t3 ON (t2.c1 = t3.c1) WHERE t2.c1 IS NULL OR t2.c1 IS NOT NULL) ss(a, b) ON (t1.c1 = ss.a) ORDER BY t1.c1, ss.a, ss.b;
                                                 QUERY PLAN                                                  
-------------------------------------------------------------------------------------------------------------
 Sort
   Output: ft4.c1, ft4_1.c1, ft5.c1
   Sort Key: ft4.c1, ft4_1.c1, ft5.c1
   ->  Hash Full Join
         Output: ft4.c1, ft4_1.c1, ft5.c1
         Hash Cond: (ft4_1.c1 = ft4.c1)
         ->  Hash Full Join
               Output: ft4_1.c1, ft5.c1
               Hash Cond: (ft4_1.c1 = ft5.c1)
               Filter: ((ft4_1.c1 IS NULL) OR (ft4_1.c1 IS NOT NULL))
               ->  Foreign Scan on public.ft4 ft4_1
                     Output: ft4_1.c1, ft4_1.c2, ft4_1.c3
                     Remote SQL: SELECT c1 FROM odbc_fdw_post.`T3` WHERE ((c1 >= 50)) AND ((c1 <= 60))
               ->  Hash
                     Output: ft5.c1
                     ->  Foreign Scan on public.ft5
                           Output: ft5.c1
                           Remote SQL: SELECT c1 FROM odbc_fdw_post.`T4` WHERE ((c1 >= 50)) AND ((c1 <= 60))
         ->  Hash
               Output: ft4.c1
               ->  Foreign Scan on public.ft4
                     Output: ft4.c1
                     Remote SQL: SELECT c1 FROM odbc_fdw_post.`T3` WHERE ((c1 >= 50)) AND ((c1 <= 60))
(23 rows)

--Testcase 133:
SELECT t1.c1, ss.a, ss.b FROM (SELECT c1 FROM ft4 WHERE c1 between 50 and 60) t1 FULL JOIN (SELECT t2.c1, t3.c1 FROM (SELECT c1 FROM ft4 WHERE c1 between 50 and 60) t2 FULL JOIN (SELECT c1 FROM ft5 WHERE c1 between 50 and 60) t3 ON (t2.c1 = t3.c1) WHERE t2.c1 IS NULL OR t2.c1 IS NOT NULL) ss(a, b) ON (t1.c1 = ss.a) ORDER BY t1.c1, ss.a, ss.b;
 c1 | a  | b  
----+----+----
 50 | 50 |   
 52 | 52 |   
 54 | 54 | 54
 56 | 56 |   
 58 | 58 |   
 60 | 60 | 60
    |    | 51
    |    | 57
(8 rows)

-- d. test deparsing rowmarked relations as subqueries
--Testcase 134:
EXPLAIN (VERBOSE, COSTS OFF)
SELECT t1.c1, ss.a, ss.b FROM (SELECT c1 FROM "S 1"."T3" WHERE c1 = 50) t1 INNER JOIN (SELECT t2.c1, t3.c1 FROM (SELECT c1 FROM ft4 WHERE c1 between 50 and 60) t2 FULL JOIN (SELECT c1 FROM ft5 WHERE c1 between 50 and 60) t3 ON (t2.c1 = t3.c1) WHERE t2.c1 IS NULL OR t2.c1 IS NOT NULL) ss(a, b) ON (TRUE) ORDER BY t1.c1, ss.a, ss.b FOR UPDATE OF t1;
                                                           QUERY PLAN                                                            
---------------------------------------------------------------------------------------------------------------------------------
 LockRows
   Output: "T3".c1, ft4.c1, ft5.c1, "T3".*, ft4.*, ft5.*
   ->  Sort
         Output: "T3".c1, ft4.c1, ft5.c1, "T3".*, ft4.*, ft5.*
         Sort Key: ft4.c1, ft5.c1
         ->  Nested Loop
               Output: "T3".c1, ft4.c1, ft5.c1, "T3".*, ft4.*, ft5.*
               ->  Foreign Scan on "S 1"."T3"
                     Output: "T3".c1, "T3".*
                     Remote SQL: SELECT c1, c2, c3 FROM odbc_fdw_post.`T3` WHERE ((c1 = 50))
               ->  Materialize
                     Output: ft4.c1, ft4.*, ft5.c1, ft5.*
                     ->  Hash Full Join
                           Output: ft4.c1, ft4.*, ft5.c1, ft5.*
                           Hash Cond: (ft4.c1 = ft5.c1)
                           Filter: ((ft4.c1 IS NULL) OR (ft4.c1 IS NOT NULL))
                           ->  Foreign Scan on public.ft4
                                 Output: ft4.c1, ft4.*
                                 Remote SQL: SELECT c1, c2, c3 FROM odbc_fdw_post.`T3` WHERE ((c1 >= 50)) AND ((c1 <= 60))
                           ->  Hash
                                 Output: ft5.c1, ft5.*
                                 ->  Foreign Scan on public.ft5
                                       Output: ft5.c1, ft5.*
                                       Remote SQL: SELECT c1, c2, c3 FROM odbc_fdw_post.`T4` WHERE ((c1 >= 50)) AND ((c1 <= 60))
(24 rows)

--Testcase 135:
SELECT t1.c1, ss.a, ss.b FROM (SELECT c1 FROM "S 1"."T3" WHERE c1 = 50) t1 INNER JOIN (SELECT t2.c1, t3.c1 FROM (SELECT c1 FROM ft4 WHERE c1 between 50 and 60) t2 FULL JOIN (SELECT c1 FROM ft5 WHERE c1 between 50 and 60) t3 ON (t2.c1 = t3.c1) WHERE t2.c1 IS NULL OR t2.c1 IS NOT NULL) ss(a, b) ON (TRUE) ORDER BY t1.c1, ss.a, ss.b FOR UPDATE OF t1;
 c1 | a  | b  
----+----+----
 50 | 50 |   
 50 | 52 |   
 50 | 54 | 54
 50 | 56 |   
 50 | 58 |   
 50 | 60 | 60
 50 |    | 51
 50 |    | 57
(8 rows)

-- full outer join + inner join
--Testcase 136:
EXPLAIN (VERBOSE, COSTS OFF)
SELECT t1.c1, t2.c1, t3.c1 FROM ft4 t1 INNER JOIN ft5 t2 ON (t1.c1 = t2.c1 + 1 and t1.c1 between 50 and 60) FULL JOIN ft4 t3 ON (t2.c1 = t3.c1) ORDER BY t1.c1, t2.c1, t3.c1 LIMIT 10;
                                                 QUERY PLAN                                                  
-------------------------------------------------------------------------------------------------------------
 Limit
   Output: t1.c1, t2.c1, t3.c1
   ->  Sort
         Output: t1.c1, t2.c1, t3.c1
         Sort Key: t1.c1, t2.c1, t3.c1
         ->  Hash Full Join
               Output: t1.c1, t2.c1, t3.c1
               Hash Cond: (t2.c1 = t3.c1)
               ->  Hash Join
                     Output: t1.c1, t2.c1
                     Hash Cond: (t1.c1 = (t2.c1 + 1))
                     ->  Foreign Scan on public.ft4 t1
                           Output: t1.c1, t1.c2, t1.c3
                           Remote SQL: SELECT c1 FROM odbc_fdw_post.`T3` WHERE ((c1 >= 50)) AND ((c1 <= 60))
                     ->  Hash
                           Output: t2.c1
                           ->  Foreign Scan on public.ft5 t2
                                 Output: t2.c1
                                 Remote SQL: SELECT c1 FROM odbc_fdw_post.`T4`
               ->  Hash
                     Output: t3.c1
                     ->  Foreign Scan on public.ft4 t3
                           Output: t3.c1
                           Remote SQL: SELECT c1 FROM odbc_fdw_post.`T3`
(24 rows)

--Testcase 137:
SELECT t1.c1, t2.c1, t3.c1 FROM ft4 t1 INNER JOIN ft5 t2 ON (t1.c1 = t2.c1 + 1 and t1.c1 between 50 and 60) FULL JOIN ft4 t3 ON (t2.c1 = t3.c1) ORDER BY t1.c1, t2.c1, t3.c1 LIMIT 10;
 c1 | c1 | c1 
----+----+----
 52 | 51 |   
 58 | 57 |   
    |    |  2
    |    |  4
    |    |  6
    |    |  8
    |    | 10
    |    | 12
    |    | 14
    |    | 16
(10 rows)

-- full outer join three tables
--Testcase 138:
EXPLAIN (VERBOSE, COSTS OFF)
SELECT t1.c1, t2.c2, t3.c3 FROM ft2 t1 FULL JOIN ft2 t2 ON (t1.c1 = t2.c1) FULL JOIN ft4 t3 ON (t2.c1 = t3.c1) OFFSET 10 LIMIT 10;
                                     QUERY PLAN                                     
------------------------------------------------------------------------------------
 Limit
   Output: t1.c1, t2.c2, t3.c3
   ->  Hash Full Join
         Output: t1.c1, t2.c2, t3.c3
         Hash Cond: (t2.c1 = t3.c1)
         ->  Hash Full Join
               Output: t1.c1, t2.c2, t2.c1
               Hash Cond: (t1.c1 = t2.c1)
               ->  Foreign Scan on public.ft2 t1
                     Output: t1.c1, t1.c2, t1.c3, t1.c4, t1.c5, t1.c6, t1.c7, t1.c8
                     Remote SQL: SELECT `C_1` FROM odbc_fdw_post.`T1`
               ->  Hash
                     Output: t2.c2, t2.c1
                     ->  Foreign Scan on public.ft2 t2
                           Output: t2.c2, t2.c1
                           Remote SQL: SELECT `C_1`, c2 FROM odbc_fdw_post.`T1`
         ->  Hash
               Output: t3.c3, t3.c1
               ->  Foreign Scan on public.ft4 t3
                     Output: t3.c3, t3.c1
                     Remote SQL: SELECT c1, c3 FROM odbc_fdw_post.`T3`
(21 rows)

--Testcase 139:
SELECT t1.c1, t2.c2, t3.c3 FROM ft2 t1 FULL JOIN ft2 t2 ON (t1.c1 = t2.c1) FULL JOIN ft4 t3 ON (t2.c1 = t3.c1) OFFSET 10 LIMIT 10;
 c1 | c2 |   c3   
----+----+--------
 11 |  1 | 
 12 |  2 | AAA012
 13 |  3 | 
 14 |  4 | AAA014
 15 |  5 | 
 16 |  6 | AAA016
 17 |  7 | 
 18 |  8 | AAA018
 19 |  9 | 
 20 |  0 | AAA020
(10 rows)

-- full outer join + right outer join
--Testcase 140:
EXPLAIN (VERBOSE, COSTS OFF)
SELECT t1.c1, t2.c2, t3.c3 FROM ft2 t1 FULL JOIN ft2 t2 ON (t1.c1 = t2.c1) RIGHT JOIN ft4 t3 ON (t2.c1 = t3.c1) OFFSET 10 LIMIT 10;
                                   QUERY PLAN                                   
--------------------------------------------------------------------------------
 Limit
   Output: t1.c1, t2.c2, t3.c3
   ->  Nested Loop Left Join
         Output: t1.c1, t2.c2, t3.c3
         Join Filter: (t1.c1 = t2.c1)
         ->  Nested Loop Left Join
               Output: t3.c3, t2.c2, t2.c1
               Join Filter: (t2.c1 = t3.c1)
               ->  Foreign Scan on public.ft4 t3
                     Output: t3.c1, t3.c2, t3.c3
                     Remote SQL: SELECT c1, c3 FROM odbc_fdw_post.`T3`
               ->  Materialize
                     Output: t2.c2, t2.c1
                     ->  Foreign Scan on public.ft2 t2
                           Output: t2.c2, t2.c1
                           Remote SQL: SELECT `C_1`, c2 FROM odbc_fdw_post.`T1`
         ->  Materialize
               Output: t1.c1
               ->  Foreign Scan on public.ft2 t1
                     Output: t1.c1
                     Remote SQL: SELECT `C_1` FROM odbc_fdw_post.`T1`
(21 rows)

--Testcase 141:
SELECT t1.c1, t2.c2, t3.c3 FROM ft2 t1 FULL JOIN ft2 t2 ON (t1.c1 = t2.c1) RIGHT JOIN ft4 t3 ON (t2.c1 = t3.c1) OFFSET 10 LIMIT 10;
 c1 | c2 |   c3   
----+----+--------
 22 |  2 | AAA022
 24 |  4 | AAA024
 26 |  6 | AAA026
 28 |  8 | AAA028
 30 |  0 | AAA030
 32 |  2 | AAA032
 34 |  4 | AAA034
 36 |  6 | AAA036
 38 |  8 | AAA038
 40 |  0 | AAA040
(10 rows)

-- right outer join + full outer join
--Testcase 142:
EXPLAIN (VERBOSE, COSTS OFF)
SELECT t1.c1, t2.c2, t3.c3 FROM ft2 t1 RIGHT JOIN ft2 t2 ON (t1.c1 = t2.c1) FULL JOIN ft4 t3 ON (t2.c1 = t3.c1) OFFSET 10 LIMIT 10;
                                     QUERY PLAN                                     
------------------------------------------------------------------------------------
 Limit
   Output: t1.c1, t2.c2, t3.c3
   ->  Hash Full Join
         Output: t1.c1, t2.c2, t3.c3
         Hash Cond: (t2.c1 = t3.c1)
         ->  Nested Loop Left Join
               Output: t2.c2, t2.c1, t1.c1
               Join Filter: (t1.c1 = t2.c1)
               ->  Foreign Scan on public.ft2 t2
                     Output: t2.c1, t2.c2, t2.c3, t2.c4, t2.c5, t2.c6, t2.c7, t2.c8
                     Remote SQL: SELECT `C_1`, c2 FROM odbc_fdw_post.`T1`
               ->  Materialize
                     Output: t1.c1
                     ->  Foreign Scan on public.ft2 t1
                           Output: t1.c1
                           Remote SQL: SELECT `C_1` FROM odbc_fdw_post.`T1`
         ->  Hash
               Output: t3.c3, t3.c1
               ->  Foreign Scan on public.ft4 t3
                     Output: t3.c3, t3.c1
                     Remote SQL: SELECT c1, c3 FROM odbc_fdw_post.`T3`
(21 rows)

--Testcase 143:
SELECT t1.c1, t2.c2, t3.c3 FROM ft2 t1 RIGHT JOIN ft2 t2 ON (t1.c1 = t2.c1) FULL JOIN ft4 t3 ON (t2.c1 = t3.c1) OFFSET 10 LIMIT 10;
 c1 | c2 |   c3   
----+----+--------
 11 |  1 | 
 12 |  2 | AAA012
 13 |  3 | 
 14 |  4 | AAA014
 15 |  5 | 
 16 |  6 | AAA016
 17 |  7 | 
 18 |  8 | AAA018
 19 |  9 | 
 20 |  0 | AAA020
(10 rows)

-- full outer join + left outer join
--Testcase 144:
EXPLAIN (VERBOSE, COSTS OFF)
SELECT t1.c1, t2.c2, t3.c3 FROM ft2 t1 FULL JOIN ft2 t2 ON (t1.c1 = t2.c1) LEFT JOIN ft4 t3 ON (t2.c1 = t3.c1) OFFSET 10 LIMIT 10;
                                     QUERY PLAN                                     
------------------------------------------------------------------------------------
 Limit
   Output: t1.c1, t2.c2, t3.c3
   ->  Nested Loop Left Join
         Output: t1.c1, t2.c2, t3.c3
         Join Filter: (t2.c1 = t3.c1)
         ->  Hash Full Join
               Output: t1.c1, t2.c2, t2.c1
               Hash Cond: (t1.c1 = t2.c1)
               ->  Foreign Scan on public.ft2 t1
                     Output: t1.c1, t1.c2, t1.c3, t1.c4, t1.c5, t1.c6, t1.c7, t1.c8
                     Remote SQL: SELECT `C_1` FROM odbc_fdw_post.`T1`
               ->  Hash
                     Output: t2.c2, t2.c1
                     ->  Foreign Scan on public.ft2 t2
                           Output: t2.c2, t2.c1
                           Remote SQL: SELECT `C_1`, c2 FROM odbc_fdw_post.`T1`
         ->  Materialize
               Output: t3.c3, t3.c1
               ->  Foreign Scan on public.ft4 t3
                     Output: t3.c3, t3.c1
                     Remote SQL: SELECT c1, c3 FROM odbc_fdw_post.`T3`
(21 rows)

--Testcase 145:
SELECT t1.c1, t2.c2, t3.c3 FROM ft2 t1 FULL JOIN ft2 t2 ON (t1.c1 = t2.c1) LEFT JOIN ft4 t3 ON (t2.c1 = t3.c1) OFFSET 10 LIMIT 10;
 c1 | c2 |   c3   
----+----+--------
 11 |  1 | 
 12 |  2 | AAA012
 13 |  3 | 
 14 |  4 | AAA014
 15 |  5 | 
 16 |  6 | AAA016
 17 |  7 | 
 18 |  8 | AAA018
 19 |  9 | 
 20 |  0 | AAA020
(10 rows)

-- left outer join + full outer join
--Testcase 146:
EXPLAIN (VERBOSE, COSTS OFF)
SELECT t1.c1, t2.c2, t3.c3 FROM ft2 t1 LEFT JOIN ft2 t2 ON (t1.c1 = t2.c1) FULL JOIN ft4 t3 ON (t2.c1 = t3.c1) OFFSET 10 LIMIT 10;
                                     QUERY PLAN                                     
------------------------------------------------------------------------------------
 Limit
   Output: t1.c1, t2.c2, t3.c3
   ->  Hash Full Join
         Output: t1.c1, t2.c2, t3.c3
         Hash Cond: (t2.c1 = t3.c1)
         ->  Nested Loop Left Join
               Output: t1.c1, t2.c2, t2.c1
               Join Filter: (t1.c1 = t2.c1)
               ->  Foreign Scan on public.ft2 t1
                     Output: t1.c1, t1.c2, t1.c3, t1.c4, t1.c5, t1.c6, t1.c7, t1.c8
                     Remote SQL: SELECT `C_1` FROM odbc_fdw_post.`T1`
               ->  Materialize
                     Output: t2.c2, t2.c1
                     ->  Foreign Scan on public.ft2 t2
                           Output: t2.c2, t2.c1
                           Remote SQL: SELECT `C_1`, c2 FROM odbc_fdw_post.`T1`
         ->  Hash
               Output: t3.c3, t3.c1
               ->  Foreign Scan on public.ft4 t3
                     Output: t3.c3, t3.c1
                     Remote SQL: SELECT c1, c3 FROM odbc_fdw_post.`T3`
(21 rows)

--Testcase 147:
SELECT t1.c1, t2.c2, t3.c3 FROM ft2 t1 LEFT JOIN ft2 t2 ON (t1.c1 = t2.c1) FULL JOIN ft4 t3 ON (t2.c1 = t3.c1) OFFSET 10 LIMIT 10;
 c1 | c2 |   c3   
----+----+--------
 11 |  1 | 
 12 |  2 | AAA012
 13 |  3 | 
 14 |  4 | AAA014
 15 |  5 | 
 16 |  6 | AAA016
 17 |  7 | 
 18 |  8 | AAA018
 19 |  9 | 
 20 |  0 | AAA020
(10 rows)

-- right outer join + left outer join
--Testcase 148:
EXPLAIN (VERBOSE, COSTS OFF)
SELECT t1.c1, t2.c2, t3.c3 FROM ft2 t1 RIGHT JOIN ft2 t2 ON (t1.c1 = t2.c1) LEFT JOIN ft4 t3 ON (t2.c1 = t3.c1) OFFSET 10 LIMIT 10;
                                     QUERY PLAN                                     
------------------------------------------------------------------------------------
 Limit
   Output: t1.c1, t2.c2, t3.c3
   ->  Nested Loop Left Join
         Output: t1.c1, t2.c2, t3.c3
         Join Filter: (t1.c1 = t2.c1)
         ->  Nested Loop Left Join
               Output: t2.c2, t2.c1, t3.c3
               Join Filter: (t2.c1 = t3.c1)
               ->  Foreign Scan on public.ft2 t2
                     Output: t2.c1, t2.c2, t2.c3, t2.c4, t2.c5, t2.c6, t2.c7, t2.c8
                     Remote SQL: SELECT `C_1`, c2 FROM odbc_fdw_post.`T1`
               ->  Materialize
                     Output: t3.c3, t3.c1
                     ->  Foreign Scan on public.ft4 t3
                           Output: t3.c3, t3.c1
                           Remote SQL: SELECT c1, c3 FROM odbc_fdw_post.`T3`
         ->  Materialize
               Output: t1.c1
               ->  Foreign Scan on public.ft2 t1
                     Output: t1.c1
                     Remote SQL: SELECT `C_1` FROM odbc_fdw_post.`T1`
(21 rows)

--Testcase 149:
SELECT t1.c1, t2.c2, t3.c3 FROM ft2 t1 RIGHT JOIN ft2 t2 ON (t1.c1 = t2.c1) LEFT JOIN ft4 t3 ON (t2.c1 = t3.c1) OFFSET 10 LIMIT 10;
 c1 | c2 |   c3   
----+----+--------
 11 |  1 | 
 12 |  2 | AAA012
 13 |  3 | 
 14 |  4 | AAA014
 15 |  5 | 
 16 |  6 | AAA016
 17 |  7 | 
 18 |  8 | AAA018
 19 |  9 | 
 20 |  0 | AAA020
(10 rows)

-- left outer join + right outer join
--Testcase 150:
EXPLAIN (VERBOSE, COSTS OFF)
SELECT t1.c1, t2.c2, t3.c3 FROM ft2 t1 LEFT JOIN ft2 t2 ON (t1.c1 = t2.c1) RIGHT JOIN ft4 t3 ON (t2.c1 = t3.c1) OFFSET 10 LIMIT 10;
                                     QUERY PLAN                                     
------------------------------------------------------------------------------------
 Limit
   Output: t1.c1, t2.c2, t3.c3
   ->  Hash Right Join
         Output: t1.c1, t2.c2, t3.c3
         Hash Cond: (t2.c1 = t3.c1)
         ->  Nested Loop
               Output: t1.c1, t2.c2, t2.c1
               Join Filter: (t1.c1 = t2.c1)
               ->  Foreign Scan on public.ft2 t1
                     Output: t1.c1, t1.c2, t1.c3, t1.c4, t1.c5, t1.c6, t1.c7, t1.c8
                     Remote SQL: SELECT `C_1` FROM odbc_fdw_post.`T1`
               ->  Materialize
                     Output: t2.c2, t2.c1
                     ->  Foreign Scan on public.ft2 t2
                           Output: t2.c2, t2.c1
                           Remote SQL: SELECT `C_1`, c2 FROM odbc_fdw_post.`T1`
         ->  Hash
               Output: t3.c3, t3.c1
               ->  Foreign Scan on public.ft4 t3
                     Output: t3.c3, t3.c1
                     Remote SQL: SELECT c1, c3 FROM odbc_fdw_post.`T3`
(21 rows)

--Testcase 151:
SELECT t1.c1, t2.c2, t3.c3 FROM ft2 t1 LEFT JOIN ft2 t2 ON (t1.c1 = t2.c1) RIGHT JOIN ft4 t3 ON (t2.c1 = t3.c1) OFFSET 10 LIMIT 10;
 c1 | c2 |   c3   
----+----+--------
 22 |  2 | AAA022
 24 |  4 | AAA024
 26 |  6 | AAA026
 28 |  8 | AAA028
 30 |  0 | AAA030
 32 |  2 | AAA032
 34 |  4 | AAA034
 36 |  6 | AAA036
 38 |  8 | AAA038
 40 |  0 | AAA040
(10 rows)

-- full outer join + WHERE clause, only matched rows
--Testcase 152:
EXPLAIN (VERBOSE, COSTS OFF)
SELECT t1.c1, t2.c1 FROM ft4 t1 FULL JOIN ft5 t2 ON (t1.c1 = t2.c1) WHERE (t1.c1 = t2.c1 OR t1.c1 IS NULL) ORDER BY t1.c1, t2.c1 OFFSET 10 LIMIT 10;
                               QUERY PLAN                                
-------------------------------------------------------------------------
 Limit
   Output: t1.c1, t2.c1
   ->  Sort
         Output: t1.c1, t2.c1
         Sort Key: t1.c1, t2.c1
         ->  Hash Full Join
               Output: t1.c1, t2.c1
               Hash Cond: (t1.c1 = t2.c1)
               Filter: ((t1.c1 = t2.c1) OR (t1.c1 IS NULL))
               ->  Foreign Scan on public.ft4 t1
                     Output: t1.c1, t1.c2, t1.c3
                     Remote SQL: SELECT c1 FROM odbc_fdw_post.`T3`
               ->  Hash
                     Output: t2.c1
                     ->  Foreign Scan on public.ft5 t2
                           Output: t2.c1
                           Remote SQL: SELECT c1 FROM odbc_fdw_post.`T4`
(17 rows)

--Testcase 153:
SELECT t1.c1, t2.c1 FROM ft4 t1 FULL JOIN ft5 t2 ON (t1.c1 = t2.c1) WHERE (t1.c1 = t2.c1 OR t1.c1 IS NULL) ORDER BY t1.c1, t2.c1 OFFSET 10 LIMIT 10;
 c1 | c1 
----+----
 66 | 66
 72 | 72
 78 | 78
 84 | 84
 90 | 90
 96 | 96
    |  3
    |  9
    | 15
    | 21
(10 rows)

-- full outer join + WHERE clause with shippable extensions set
--Testcase 154:
EXPLAIN (VERBOSE, COSTS OFF)
SELECT t1.c1, t2.c2, t1.c3 FROM ft1 t1 FULL JOIN ft2 t2 ON (t1.c1 = t2.c1) WHERE postgres_fdw_abs(t1.c1) > 0 OFFSET 10 LIMIT 10;
                                  QUERY PLAN                                  
------------------------------------------------------------------------------
 Limit
   Output: t1.c1, t2.c2, t1.c3
   ->  Hash Full Join
         Output: t1.c1, t2.c2, t1.c3
         Hash Cond: (t1.c1 = t2.c1)
         Filter: (postgres_fdw_abs(t1.c1) > 0)
         ->  Foreign Scan on public.ft1 t1
               Output: t1.c1, t1.c2, t1.c3, t1.c4, t1.c5, t1.c6, t1.c7, t1.c8
               Remote SQL: SELECT `C_1`, c3 FROM odbc_fdw_post.`T1`
         ->  Hash
               Output: t2.c2, t2.c1
               ->  Foreign Scan on public.ft2 t2
                     Output: t2.c2, t2.c1
                     Remote SQL: SELECT `C_1`, c2 FROM odbc_fdw_post.`T1`
(14 rows)

-- Option 'extensions' is not supported
-- ALTER SERVER :DB_SERVERNAME OPTIONS (DROP extensions);
-- full outer join + WHERE clause with shippable extensions not set
--Testcase 155:
EXPLAIN (VERBOSE, COSTS OFF)
SELECT t1.c1, t2.c2, t1.c3 FROM ft1 t1 FULL JOIN ft2 t2 ON (t1.c1 = t2.c1) WHERE postgres_fdw_abs(t1.c1) > 0 OFFSET 10 LIMIT 10;
                                  QUERY PLAN                                  
------------------------------------------------------------------------------
 Limit
   Output: t1.c1, t2.c2, t1.c3
   ->  Hash Full Join
         Output: t1.c1, t2.c2, t1.c3
         Hash Cond: (t1.c1 = t2.c1)
         Filter: (postgres_fdw_abs(t1.c1) > 0)
         ->  Foreign Scan on public.ft1 t1
               Output: t1.c1, t1.c2, t1.c3, t1.c4, t1.c5, t1.c6, t1.c7, t1.c8
               Remote SQL: SELECT `C_1`, c3 FROM odbc_fdw_post.`T1`
         ->  Hash
               Output: t2.c2, t2.c1
               ->  Foreign Scan on public.ft2 t2
                     Output: t2.c2, t2.c1
                     Remote SQL: SELECT `C_1`, c2 FROM odbc_fdw_post.`T1`
(14 rows)

-- ALTER SERVER :DB_SERVERNAME OPTIONS (ADD extensions :DB_EXTENSIONNAME);
-- join two tables with FOR UPDATE clause
-- tests whole-row reference for row marks
--Testcase 156:
EXPLAIN (VERBOSE, COSTS OFF)
SELECT t1.c1, t2.c1 FROM ft1 t1 JOIN ft2 t2 ON (t1.c1 = t2.c1) ORDER BY t1.c3, t1.c1 OFFSET 100 LIMIT 10 FOR UPDATE OF t1;
                                                  QUERY PLAN                                                  
--------------------------------------------------------------------------------------------------------------
 Limit
   Output: t1.c1, t2.c1, t1.c3, t1.*, t2.*
   ->  LockRows
         Output: t1.c1, t2.c1, t1.c3, t1.*, t2.*
         ->  Sort
               Output: t1.c1, t2.c1, t1.c3, t1.*, t2.*
               Sort Key: t1.c3, t1.c1
               ->  Hash Join
                     Output: t1.c1, t2.c1, t1.c3, t1.*, t2.*
                     Hash Cond: (t1.c1 = t2.c1)
                     ->  Foreign Scan on public.ft1 t1
                           Output: t1.c1, t1.c3, t1.*
                           Remote SQL: SELECT `C_1`, c2, c3, c4, c5, c6, c7, c8 FROM odbc_fdw_post.`T1`
                     ->  Hash
                           Output: t2.c1, t2.*
                           ->  Foreign Scan on public.ft2 t2
                                 Output: t2.c1, t2.*
                                 Remote SQL: SELECT `C_1`, c2, c3, c4, c5, c6, c7, c8 FROM odbc_fdw_post.`T1`
(18 rows)

--Testcase 157:
SELECT t1.c1, t2.c1 FROM ft1 t1 JOIN ft2 t2 ON (t1.c1 = t2.c1) ORDER BY t1.c3, t1.c1 OFFSET 100 LIMIT 10 FOR UPDATE OF t1;
 c1  | c1  
-----+-----
 101 | 101
 102 | 102
 103 | 103
 104 | 104
 105 | 105
 106 | 106
 107 | 107
 108 | 108
 109 | 109
 110 | 110
(10 rows)

--Testcase 158:
EXPLAIN (VERBOSE, COSTS OFF)
SELECT t1.c1, t2.c1 FROM ft1 t1 JOIN ft2 t2 ON (t1.c1 = t2.c1) ORDER BY t1.c3, t1.c1 OFFSET 100 LIMIT 10 FOR UPDATE;
                                                  QUERY PLAN                                                  
--------------------------------------------------------------------------------------------------------------
 Limit
   Output: t1.c1, t2.c1, t1.c3, t1.*, t2.*
   ->  LockRows
         Output: t1.c1, t2.c1, t1.c3, t1.*, t2.*
         ->  Sort
               Output: t1.c1, t2.c1, t1.c3, t1.*, t2.*
               Sort Key: t1.c3, t1.c1
               ->  Hash Join
                     Output: t1.c1, t2.c1, t1.c3, t1.*, t2.*
                     Hash Cond: (t1.c1 = t2.c1)
                     ->  Foreign Scan on public.ft1 t1
                           Output: t1.c1, t1.c3, t1.*
                           Remote SQL: SELECT `C_1`, c2, c3, c4, c5, c6, c7, c8 FROM odbc_fdw_post.`T1`
                     ->  Hash
                           Output: t2.c1, t2.*
                           ->  Foreign Scan on public.ft2 t2
                                 Output: t2.c1, t2.*
                                 Remote SQL: SELECT `C_1`, c2, c3, c4, c5, c6, c7, c8 FROM odbc_fdw_post.`T1`
(18 rows)

--Testcase 159:
SELECT t1.c1, t2.c1 FROM ft1 t1 JOIN ft2 t2 ON (t1.c1 = t2.c1) ORDER BY t1.c3, t1.c1 OFFSET 100 LIMIT 10 FOR UPDATE;
 c1  | c1  
-----+-----
 101 | 101
 102 | 102
 103 | 103
 104 | 104
 105 | 105
 106 | 106
 107 | 107
 108 | 108
 109 | 109
 110 | 110
(10 rows)

-- join two tables with FOR SHARE clause
--Testcase 160:
EXPLAIN (VERBOSE, COSTS OFF)
SELECT t1.c1, t2.c1 FROM ft1 t1 JOIN ft2 t2 ON (t1.c1 = t2.c1) ORDER BY t1.c3, t1.c1 OFFSET 100 LIMIT 10 FOR SHARE OF t1;
                                                  QUERY PLAN                                                  
--------------------------------------------------------------------------------------------------------------
 Limit
   Output: t1.c1, t2.c1, t1.c3, t1.*, t2.*
   ->  LockRows
         Output: t1.c1, t2.c1, t1.c3, t1.*, t2.*
         ->  Sort
               Output: t1.c1, t2.c1, t1.c3, t1.*, t2.*
               Sort Key: t1.c3, t1.c1
               ->  Hash Join
                     Output: t1.c1, t2.c1, t1.c3, t1.*, t2.*
                     Hash Cond: (t1.c1 = t2.c1)
                     ->  Foreign Scan on public.ft1 t1
                           Output: t1.c1, t1.c3, t1.*
                           Remote SQL: SELECT `C_1`, c2, c3, c4, c5, c6, c7, c8 FROM odbc_fdw_post.`T1`
                     ->  Hash
                           Output: t2.c1, t2.*
                           ->  Foreign Scan on public.ft2 t2
                                 Output: t2.c1, t2.*
                                 Remote SQL: SELECT `C_1`, c2, c3, c4, c5, c6, c7, c8 FROM odbc_fdw_post.`T1`
(18 rows)

--Testcase 161:
SELECT t1.c1, t2.c1 FROM ft1 t1 JOIN ft2 t2 ON (t1.c1 = t2.c1) ORDER BY t1.c3, t1.c1 OFFSET 100 LIMIT 10 FOR SHARE OF t1;
 c1  | c1  
-----+-----
 101 | 101
 102 | 102
 103 | 103
 104 | 104
 105 | 105
 106 | 106
 107 | 107
 108 | 108
 109 | 109
 110 | 110
(10 rows)

--Testcase 162:
EXPLAIN (VERBOSE, COSTS OFF)
SELECT t1.c1, t2.c1 FROM ft1 t1 JOIN ft2 t2 ON (t1.c1 = t2.c1) ORDER BY t1.c3, t1.c1 OFFSET 100 LIMIT 10 FOR SHARE;
                                                  QUERY PLAN                                                  
--------------------------------------------------------------------------------------------------------------
 Limit
   Output: t1.c1, t2.c1, t1.c3, t1.*, t2.*
   ->  LockRows
         Output: t1.c1, t2.c1, t1.c3, t1.*, t2.*
         ->  Sort
               Output: t1.c1, t2.c1, t1.c3, t1.*, t2.*
               Sort Key: t1.c3, t1.c1
               ->  Hash Join
                     Output: t1.c1, t2.c1, t1.c3, t1.*, t2.*
                     Hash Cond: (t1.c1 = t2.c1)
                     ->  Foreign Scan on public.ft1 t1
                           Output: t1.c1, t1.c3, t1.*
                           Remote SQL: SELECT `C_1`, c2, c3, c4, c5, c6, c7, c8 FROM odbc_fdw_post.`T1`
                     ->  Hash
                           Output: t2.c1, t2.*
                           ->  Foreign Scan on public.ft2 t2
                                 Output: t2.c1, t2.*
                                 Remote SQL: SELECT `C_1`, c2, c3, c4, c5, c6, c7, c8 FROM odbc_fdw_post.`T1`
(18 rows)

--Testcase 163:
SELECT t1.c1, t2.c1 FROM ft1 t1 JOIN ft2 t2 ON (t1.c1 = t2.c1) ORDER BY t1.c3, t1.c1 OFFSET 100 LIMIT 10 FOR SHARE;
 c1  | c1  
-----+-----
 101 | 101
 102 | 102
 103 | 103
 104 | 104
 105 | 105
 106 | 106
 107 | 107
 108 | 108
 109 | 109
 110 | 110
(10 rows)

-- join in CTE
--Testcase 164:
EXPLAIN (VERBOSE, COSTS OFF)
WITH t (c1_1, c1_3, c2_1) AS MATERIALIZED (SELECT t1.c1, t1.c3, t2.c1 FROM ft1 t1 JOIN ft2 t2 ON (t1.c1 = t2.c1)) SELECT c1_1, c2_1 FROM t ORDER BY c1_3, c1_1 OFFSET 100 LIMIT 10;
                                   QUERY PLAN                                   
--------------------------------------------------------------------------------
 Limit
   Output: t.c1_1, t.c2_1, t.c1_3
   CTE t
     ->  Hash Join
           Output: t1.c1, t1.c3, t2.c1
           Hash Cond: (t1.c1 = t2.c1)
           ->  Foreign Scan on public.ft1 t1
                 Output: t1.c1, t1.c2, t1.c3, t1.c4, t1.c5, t1.c6, t1.c7, t1.c8
                 Remote SQL: SELECT `C_1`, c3 FROM odbc_fdw_post.`T1`
           ->  Hash
                 Output: t2.c1
                 ->  Foreign Scan on public.ft2 t2
                       Output: t2.c1
                       Remote SQL: SELECT `C_1` FROM odbc_fdw_post.`T1`
   ->  Sort
         Output: t.c1_1, t.c2_1, t.c1_3
         Sort Key: t.c1_3, t.c1_1
         ->  CTE Scan on t
               Output: t.c1_1, t.c2_1, t.c1_3
(19 rows)

--Testcase 165:
WITH t (c1_1, c1_3, c2_1) AS MATERIALIZED (SELECT t1.c1, t1.c3, t2.c1 FROM ft1 t1 JOIN ft2 t2 ON (t1.c1 = t2.c1)) SELECT c1_1, c2_1 FROM t ORDER BY c1_3, c1_1 OFFSET 100 LIMIT 10;
 c1_1 | c2_1 
------+------
  101 |  101
  102 |  102
  103 |  103
  104 |  104
  105 |  105
  106 |  106
  107 |  107
  108 |  108
  109 |  109
  110 |  110
(10 rows)

-- ctid with whole-row reference
--Testcase 166:
EXPLAIN (VERBOSE, COSTS OFF)
SELECT t1.ctid, t1, t2, t1.c1 FROM ft1 t1 JOIN ft2 t2 ON (t1.c1 = t2.c1) ORDER BY t1.c3, t1.c1 OFFSET 100 LIMIT 10;
                                               QUERY PLAN                                               
--------------------------------------------------------------------------------------------------------
 Limit
   Output: t1.ctid, t1.*, t2.*, t1.c1, t1.c3
   ->  Sort
         Output: t1.ctid, t1.*, t2.*, t1.c1, t1.c3
         Sort Key: t1.c3, t1.c1
         ->  Hash Join
               Output: t1.ctid, t1.*, t2.*, t1.c1, t1.c3
               Hash Cond: (t1.c1 = t2.c1)
               ->  Foreign Scan on public.ft1 t1
                     Output: t1.ctid, t1.*, t1.c1, t1.c3
                     Remote SQL: SELECT `C_1`, c2, c3, c4, c5, c6, c7, c8 FROM odbc_fdw_post.`T1`
               ->  Hash
                     Output: t2.*, t2.c1
                     ->  Foreign Scan on public.ft2 t2
                           Output: t2.*, t2.c1
                           Remote SQL: SELECT `C_1`, c2, c3, c4, c5, c6, c7, c8 FROM odbc_fdw_post.`T1`
(16 rows)

-- SEMI JOIN, not pushed down
--Testcase 167:
EXPLAIN (VERBOSE, COSTS OFF)
SELECT t1.c1 FROM ft1 t1 WHERE EXISTS (SELECT 1 FROM ft2 t2 WHERE t1.c1 = t2.c1) ORDER BY t1.c1 OFFSET 100 LIMIT 10;
                                     QUERY PLAN                                     
------------------------------------------------------------------------------------
 Limit
   Output: t1.c1
   ->  Sort
         Output: t1.c1
         Sort Key: t1.c1
         ->  Hash Join
               Output: t1.c1
               Inner Unique: true
               Hash Cond: (t1.c1 = t2.c1)
               ->  Foreign Scan on public.ft1 t1
                     Output: t1.c1, t1.c2, t1.c3, t1.c4, t1.c5, t1.c6, t1.c7, t1.c8
                     Remote SQL: SELECT `C_1` FROM odbc_fdw_post.`T1`
               ->  Hash
                     Output: t2.c1
                     ->  HashAggregate
                           Output: t2.c1
                           Group Key: t2.c1
                           ->  Foreign Scan on public.ft2 t2
                                 Output: t2.c1
                                 Remote SQL: SELECT `C_1` FROM odbc_fdw_post.`T1`
(20 rows)

--Testcase 168:
SELECT t1.c1 FROM ft1 t1 WHERE EXISTS (SELECT 1 FROM ft2 t2 WHERE t1.c1 = t2.c1) ORDER BY t1.c1 OFFSET 100 LIMIT 10;
 c1  
-----
 101
 102
 103
 104
 105
 106
 107
 108
 109
 110
(10 rows)

-- ANTI JOIN, not pushed down
--Testcase 169:
EXPLAIN (VERBOSE, COSTS OFF)
SELECT t1.c1 FROM ft1 t1 WHERE NOT EXISTS (SELECT 1 FROM ft2 t2 WHERE t1.c1 = t2.c2) ORDER BY t1.c1 OFFSET 100 LIMIT 10;
                                     QUERY PLAN                                     
------------------------------------------------------------------------------------
 Limit
   Output: t1.c1
   ->  Sort
         Output: t1.c1
         Sort Key: t1.c1
         ->  Hash Anti Join
               Output: t1.c1
               Hash Cond: (t1.c1 = t2.c2)
               ->  Foreign Scan on public.ft1 t1
                     Output: t1.c1, t1.c2, t1.c3, t1.c4, t1.c5, t1.c6, t1.c7, t1.c8
                     Remote SQL: SELECT `C_1` FROM odbc_fdw_post.`T1`
               ->  Hash
                     Output: t2.c2
                     ->  Foreign Scan on public.ft2 t2
                           Output: t2.c2
                           Remote SQL: SELECT c2 FROM odbc_fdw_post.`T1`
(16 rows)

--Testcase 170:
SELECT t1.c1 FROM ft1 t1 WHERE NOT EXISTS (SELECT 1 FROM ft2 t2 WHERE t1.c1 = t2.c2) ORDER BY t1.c1 OFFSET 100 LIMIT 10;
 c1  
-----
 110
 111
 112
 113
 114
 115
 116
 117
 118
 119
(10 rows)

-- CROSS JOIN can be pushed down
--Testcase 171:
EXPLAIN (VERBOSE, COSTS OFF)
SELECT t1.c1, t2.c1 FROM ft1 t1 CROSS JOIN ft2 t2 ORDER BY t1.c1, t2.c1 OFFSET 100 LIMIT 10;
                                     QUERY PLAN                                     
------------------------------------------------------------------------------------
 Limit
   Output: t1.c1, t2.c1
   ->  Sort
         Output: t1.c1, t2.c1
         Sort Key: t1.c1, t2.c1
         ->  Nested Loop
               Output: t1.c1, t2.c1
               ->  Foreign Scan on public.ft1 t1
                     Output: t1.c1, t1.c2, t1.c3, t1.c4, t1.c5, t1.c6, t1.c7, t1.c8
                     Remote SQL: SELECT `C_1` FROM odbc_fdw_post.`T1`
               ->  Materialize
                     Output: t2.c1
                     ->  Foreign Scan on public.ft2 t2
                           Output: t2.c1
                           Remote SQL: SELECT `C_1` FROM odbc_fdw_post.`T1`
(15 rows)

--Testcase 172:
SELECT t1.c1, t2.c1 FROM ft1 t1 CROSS JOIN ft2 t2 ORDER BY t1.c1, t2.c1 OFFSET 100 LIMIT 10;
 c1 | c1  
----+-----
  1 | 101
  1 | 102
  1 | 103
  1 | 104
  1 | 105
  1 | 106
  1 | 107
  1 | 108
  1 | 109
  1 | 110
(10 rows)

-- different server, not pushed down. No result expected.
--Testcase 173:
EXPLAIN (VERBOSE, COSTS OFF)
SELECT t1.c1, t2.c1 FROM ft5 t1 JOIN ft6 t2 ON (t1.c1 = t2.c1) ORDER BY t1.c1, t2.c1 OFFSET 100 LIMIT 10;
                               QUERY PLAN                                
-------------------------------------------------------------------------
 Limit
   Output: t1.c1, t2.c1
   ->  Sort
         Output: t1.c1, t2.c1
         Sort Key: t1.c1
         ->  Hash Join
               Output: t1.c1, t2.c1
               Hash Cond: (t1.c1 = t2.c1)
               ->  Foreign Scan on public.ft5 t1
                     Output: t1.c1, t1.c2, t1.c3
                     Remote SQL: SELECT c1 FROM odbc_fdw_post.`T4`
               ->  Hash
                     Output: t2.c1
                     ->  Foreign Scan on public.ft6 t2
                           Output: t2.c1
                           Remote SQL: SELECT c1 FROM odbc_fdw_post.`T4`
(16 rows)

--Testcase 174:
SELECT t1.c1, t2.c1 FROM ft5 t1 JOIN ft6 t2 ON (t1.c1 = t2.c1) ORDER BY t1.c1, t2.c1 OFFSET 100 LIMIT 10;
 c1 | c1 
----+----
(0 rows)

-- unsafe join conditions (c8 has a UDT), not pushed down. Practically a CROSS
-- JOIN since c8 in both tables has same value.
--Testcase 175:
EXPLAIN (VERBOSE, COSTS OFF)
SELECT t1.c1, t2.c1 FROM ft1 t1 LEFT JOIN ft2 t2 ON (t1.c8 = t2.c8) ORDER BY t1.c1, t2.c1 OFFSET 100 LIMIT 10;
                                     QUERY PLAN                                     
------------------------------------------------------------------------------------
 Limit
   Output: t1.c1, t2.c1
   ->  Sort
         Output: t1.c1, t2.c1
         Sort Key: t1.c1, t2.c1
         ->  Hash Left Join
               Output: t1.c1, t2.c1
               Hash Cond: (t1.c8 = t2.c8)
               ->  Foreign Scan on public.ft1 t1
                     Output: t1.c1, t1.c2, t1.c3, t1.c4, t1.c5, t1.c6, t1.c7, t1.c8
                     Remote SQL: SELECT `C_1`, c8 FROM odbc_fdw_post.`T1`
               ->  Hash
                     Output: t2.c1, t2.c8
                     ->  Foreign Scan on public.ft2 t2
                           Output: t2.c1, t2.c8
                           Remote SQL: SELECT `C_1`, c8 FROM odbc_fdw_post.`T1`
(16 rows)

--Testcase 176:
SELECT t1.c1, t2.c1 FROM ft1 t1 LEFT JOIN ft2 t2 ON (t1.c8 = t2.c8) ORDER BY t1.c1, t2.c1 OFFSET 100 LIMIT 10;
 c1 | c1  
----+-----
  1 | 101
  1 | 102
  1 | 103
  1 | 104
  1 | 105
  1 | 106
  1 | 107
  1 | 108
  1 | 109
  1 | 110
(10 rows)

-- unsafe conditions on one side (c8 has a UDT), not pushed down.
--Testcase 177:
EXPLAIN (VERBOSE, COSTS OFF)
SELECT t1.c1, t2.c1 FROM ft1 t1 LEFT JOIN ft2 t2 ON (t1.c1 = t2.c1) WHERE t1.c8 = 'foo' ORDER BY t1.c3, t1.c1 OFFSET 100 LIMIT 10;
                                          QUERY PLAN                                           
-----------------------------------------------------------------------------------------------
 Limit
   Output: t1.c1, t2.c1, t1.c3
   ->  Sort
         Output: t1.c1, t2.c1, t1.c3
         Sort Key: t1.c3, t1.c1
         ->  Hash Left Join
               Output: t1.c1, t2.c1, t1.c3
               Hash Cond: (t1.c1 = t2.c1)
               ->  Foreign Scan on public.ft1 t1
                     Output: t1.c1, t1.c2, t1.c3, t1.c4, t1.c5, t1.c6, t1.c7, t1.c8
                     Remote SQL: SELECT `C_1`, c3 FROM odbc_fdw_post.`T1` WHERE ((c8 = 'foo'))
               ->  Hash
                     Output: t2.c1
                     ->  Foreign Scan on public.ft2 t2
                           Output: t2.c1
                           Remote SQL: SELECT `C_1` FROM odbc_fdw_post.`T1`
(16 rows)

--Testcase 178:
SELECT t1.c1, t2.c1 FROM ft1 t1 LEFT JOIN ft2 t2 ON (t1.c1 = t2.c1) WHERE t1.c8 = 'foo' ORDER BY t1.c3, t1.c1 OFFSET 100 LIMIT 10;
 c1  | c1  
-----+-----
 101 | 101
 102 | 102
 103 | 103
 104 | 104
 105 | 105
 106 | 106
 107 | 107
 108 | 108
 109 | 109
 110 | 110
(10 rows)

-- join where unsafe to pushdown condition in WHERE clause has a column not
-- in the SELECT clause. In this test unsafe clause needs to have column
-- references from both joining sides so that the clause is not pushed down
-- into one of the joining sides.
--Testcase 179:
EXPLAIN (VERBOSE, COSTS OFF)
SELECT t1.c1, t2.c1 FROM ft1 t1 JOIN ft2 t2 ON (t1.c1 = t2.c1) WHERE t1.c8 = t2.c8 ORDER BY t1.c3, t1.c1 OFFSET 100 LIMIT 10;
                                     QUERY PLAN                                     
------------------------------------------------------------------------------------
 Limit
   Output: t1.c1, t2.c1, t1.c3
   ->  Sort
         Output: t1.c1, t2.c1, t1.c3
         Sort Key: t1.c3, t1.c1
         ->  Merge Join
               Output: t1.c1, t2.c1, t1.c3
               Merge Cond: ((t1.c1 = t2.c1) AND (t1.c8 = t2.c8))
               ->  Sort
                     Output: t1.c1, t1.c3, t1.c8
                     Sort Key: t1.c1, t1.c8
                     ->  Foreign Scan on public.ft1 t1
                           Output: t1.c1, t1.c3, t1.c8
                           Remote SQL: SELECT `C_1`, c3, c8 FROM odbc_fdw_post.`T1`
               ->  Sort
                     Output: t2.c1, t2.c8
                     Sort Key: t2.c1, t2.c8
                     ->  Foreign Scan on public.ft2 t2
                           Output: t2.c1, t2.c8
                           Remote SQL: SELECT `C_1`, c8 FROM odbc_fdw_post.`T1`
(20 rows)

--Testcase 180:
SELECT t1.c1, t2.c1 FROM ft1 t1 JOIN ft2 t2 ON (t1.c1 = t2.c1) WHERE t1.c8 = t2.c8 ORDER BY t1.c3, t1.c1 OFFSET 100 LIMIT 10;
 c1  | c1  
-----+-----
 101 | 101
 102 | 102
 103 | 103
 104 | 104
 105 | 105
 106 | 106
 107 | 107
 108 | 108
 109 | 109
 110 | 110
(10 rows)

-- Aggregate after UNION, for testing setrefs
--Testcase 181:
EXPLAIN (VERBOSE, COSTS OFF)
SELECT t1c1, avg(t1c1 + t2c1) FROM (SELECT t1.c1, t2.c1 FROM ft1 t1 JOIN ft2 t2 ON (t1.c1 = t2.c1) UNION SELECT t1.c1, t2.c1 FROM ft1 t1 JOIN ft2 t2 ON (t1.c1 = t2.c1)) AS t (t1c1, t2c1) GROUP BY t1c1 ORDER BY t1c1 OFFSET 100 LIMIT 10;
                                                      QUERY PLAN                                                      
----------------------------------------------------------------------------------------------------------------------
 Limit
   Output: t1.c1, (avg((t1.c1 + t2.c1)))
   ->  Sort
         Output: t1.c1, (avg((t1.c1 + t2.c1)))
         Sort Key: t1.c1
         ->  HashAggregate
               Output: t1.c1, avg((t1.c1 + t2.c1))
               Group Key: t1.c1
               ->  HashAggregate
                     Output: t1.c1, t2.c1
                     Group Key: t1.c1, t2.c1
                     ->  Append
                           ->  Hash Join
                                 Output: t1.c1, t2.c1
                                 Hash Cond: (t1.c1 = t2.c1)
                                 ->  Foreign Scan on public.ft1 t1
                                       Output: t1.c1, t1.c2, t1.c3, t1.c4, t1.c5, t1.c6, t1.c7, t1.c8
                                       Remote SQL: SELECT `C_1` FROM odbc_fdw_post.`T1`
                                 ->  Hash
                                       Output: t2.c1
                                       ->  Foreign Scan on public.ft2 t2
                                             Output: t2.c1
                                             Remote SQL: SELECT `C_1` FROM odbc_fdw_post.`T1`
                           ->  Hash Join
                                 Output: t1_1.c1, t2_1.c1
                                 Hash Cond: (t1_1.c1 = t2_1.c1)
                                 ->  Foreign Scan on public.ft1 t1_1
                                       Output: t1_1.c1, t1_1.c2, t1_1.c3, t1_1.c4, t1_1.c5, t1_1.c6, t1_1.c7, t1_1.c8
                                       Remote SQL: SELECT `C_1` FROM odbc_fdw_post.`T1`
                                 ->  Hash
                                       Output: t2_1.c1
                                       ->  Foreign Scan on public.ft2 t2_1
                                             Output: t2_1.c1
                                             Remote SQL: SELECT `C_1` FROM odbc_fdw_post.`T1`
(34 rows)

--Testcase 182:
SELECT t1c1, avg(t1c1 + t2c1) FROM (SELECT t1.c1, t2.c1 FROM ft1 t1 JOIN ft2 t2 ON (t1.c1 = t2.c1) UNION SELECT t1.c1, t2.c1 FROM ft1 t1 JOIN ft2 t2 ON (t1.c1 = t2.c1)) AS t (t1c1, t2c1) GROUP BY t1c1 ORDER BY t1c1 OFFSET 100 LIMIT 10;
 t1c1 |         avg          
------+----------------------
  101 | 202.0000000000000000
  102 | 204.0000000000000000
  103 | 206.0000000000000000
  104 | 208.0000000000000000
  105 | 210.0000000000000000
  106 | 212.0000000000000000
  107 | 214.0000000000000000
  108 | 216.0000000000000000
  109 | 218.0000000000000000
  110 | 220.0000000000000000
(10 rows)

-- join with lateral reference
--Testcase 183:
EXPLAIN (VERBOSE, COSTS OFF)
SELECT t1."C_1" FROM "S 1"."T1" t1, LATERAL (SELECT DISTINCT t2.c1, t3.c1 FROM ft1 t2, ft2 t3 WHERE t2.c1 = t3.c1 AND t2.c2 = t1.c2) q ORDER BY t1."C_1" OFFSET 10 LIMIT 10;
                                         QUERY PLAN                                         
--------------------------------------------------------------------------------------------
 Limit
   Output: t1."C_1"
   ->  Sort
         Output: t1."C_1"
         Sort Key: t1."C_1"
         ->  Nested Loop
               Output: t1."C_1"
               ->  Foreign Scan on "S 1"."T1" t1
                     Output: t1."C_1", t1.c2, t1.c3, t1.c4, t1.c5, t1.c6, t1.c7, t1.c8
                     Remote SQL: SELECT `C_1`, c2 FROM odbc_fdw_post.`T1`
               ->  Unique
                     Output: t2.c1, t3.c1
                     ->  Merge Join
                           Output: t2.c1, t3.c1
                           Merge Cond: (t2.c1 = t3.c1)
                           ->  Sort
                                 Output: t2.c1
                                 Sort Key: t2.c1
                                 ->  Foreign Scan on public.ft1 t2
                                       Output: t2.c1
                                       Filter: (t2.c2 = t1.c2)
                                       Remote SQL: SELECT `C_1`, c2 FROM odbc_fdw_post.`T1`
                           ->  Sort
                                 Output: t3.c1
                                 Sort Key: t3.c1
                                 ->  Foreign Scan on public.ft2 t3
                                       Output: t3.c1
                                       Remote SQL: SELECT `C_1` FROM odbc_fdw_post.`T1`
(28 rows)

--Testcase 184:
SELECT t1."C_1" FROM "S 1"."T1" t1, LATERAL (SELECT DISTINCT t2.c1, t3.c1 FROM ft1 t2, ft2 t3 WHERE t2.c1 = t3.c1 AND t2.c2 = t1.c2) q ORDER BY t1."C_1" OFFSET 10 LIMIT 10;
 C_1 
-----
   1
   1
   1
   1
   1
   1
   1
   1
   1
   1
(10 rows)

-- non-Var items in targetlist of the nullable rel of a join preventing
-- push-down in some cases
-- unable to push {ft1, ft2}
--Testcase 185:
EXPLAIN (VERBOSE, COSTS OFF)
SELECT q.a, ft2.c1 FROM (SELECT 13 FROM ft1 WHERE c1 = 13) q(a) RIGHT JOIN ft2 ON (q.a = ft2.c1) WHERE ft2.c1 BETWEEN 10 AND 15;
                                             QUERY PLAN                                             
----------------------------------------------------------------------------------------------------
 Nested Loop Left Join
   Output: (13), ft2.c1
   Join Filter: (13 = ft2.c1)
   ->  Foreign Scan on public.ft2
         Output: ft2.c1, ft2.c2, ft2.c3, ft2.c4, ft2.c5, ft2.c6, ft2.c7, ft2.c8
         Remote SQL: SELECT `C_1` FROM odbc_fdw_post.`T1` WHERE ((`C_1` >= 10)) AND ((`C_1` <= 15))
   ->  Materialize
         Output: (13)
         ->  Foreign Scan on public.ft1
               Output: 13
               Remote SQL: SELECT NULL FROM odbc_fdw_post.`T1` WHERE ((`C_1` = 13))
(11 rows)

--Testcase 186:
SELECT q.a, ft2.c1 FROM (SELECT 13 FROM ft1 WHERE c1 = 13) q(a) RIGHT JOIN ft2 ON (q.a = ft2.c1) WHERE ft2.c1 BETWEEN 10 AND 15;
 a  | c1 
----+----
    | 10
    | 11
    | 12
 13 | 13
    | 14
    | 15
(6 rows)

-- ok to push {ft1, ft2} but not {ft1, ft2, ft4}
--Testcase 187:
EXPLAIN (VERBOSE, COSTS OFF)
SELECT ft4.c1, q.* FROM ft4 LEFT JOIN (SELECT 13, ft1.c1, ft2.c1 FROM ft1 RIGHT JOIN ft2 ON (ft1.c1 = ft2.c1) WHERE ft1.c1 = 12) q(a, b, c) ON (ft4.c1 = q.b) WHERE ft4.c1 BETWEEN 10 AND 15;
                                           QUERY PLAN                                            
-------------------------------------------------------------------------------------------------
 Hash Right Join
   Output: ft4.c1, (13), ft1.c1, ft2.c1
   Hash Cond: (ft1.c1 = ft4.c1)
   ->  Nested Loop
         Output: ft1.c1, ft2.c1, 13
         ->  Foreign Scan on public.ft1
               Output: ft1.c1, ft1.c2, ft1.c3, ft1.c4, ft1.c5, ft1.c6, ft1.c7, ft1.c8
               Remote SQL: SELECT `C_1` FROM odbc_fdw_post.`T1` WHERE ((`C_1` = 12))
         ->  Materialize
               Output: ft2.c1
               ->  Foreign Scan on public.ft2
                     Output: ft2.c1
                     Remote SQL: SELECT `C_1` FROM odbc_fdw_post.`T1` WHERE ((`C_1` = 12))
   ->  Hash
         Output: ft4.c1
         ->  Foreign Scan on public.ft4
               Output: ft4.c1
               Remote SQL: SELECT c1 FROM odbc_fdw_post.`T3` WHERE ((c1 >= 10)) AND ((c1 <= 15))
(18 rows)

--Testcase 188:
SELECT ft4.c1, q.* FROM ft4 LEFT JOIN (SELECT 13, ft1.c1, ft2.c1 FROM ft1 RIGHT JOIN ft2 ON (ft1.c1 = ft2.c1) WHERE ft1.c1 = 12) q(a, b, c) ON (ft4.c1 = q.b) WHERE ft4.c1 BETWEEN 10 AND 15 ORDER BY ft4.c1;
 c1 | a  | b  | c  
----+----+----+----
 10 |    |    |   
 12 | 13 | 12 | 12
 14 |    |    |   
(3 rows)

-- join with nullable side with some columns with null values
--Testcase 189:
UPDATE ft5 SET c3 = null where c1 % 9 = 0;
--Testcase 190:
EXPLAIN (VERBOSE, COSTS OFF)
SELECT ft5, ft5.c1, ft5.c2, ft5.c3, ft4.c1, ft4.c2 FROM ft5 left join ft4 on ft5.c1 = ft4.c1 WHERE ft4.c1 BETWEEN 10 and 30 ORDER BY ft5.c1, ft4.c1;
                                             QUERY PLAN                                              
-----------------------------------------------------------------------------------------------------
 Sort
   Output: ft5.*, ft5.c1, ft5.c2, ft5.c3, ft4.c1, ft4.c2
   Sort Key: ft5.c1
   ->  Hash Join
         Output: ft5.*, ft5.c1, ft5.c2, ft5.c3, ft4.c1, ft4.c2
         Hash Cond: (ft4.c1 = ft5.c1)
         ->  Foreign Scan on public.ft4
               Output: ft4.c1, ft4.c2, ft4.c3
               Remote SQL: SELECT c1, c2 FROM odbc_fdw_post.`T3` WHERE ((c1 >= 10)) AND ((c1 <= 30))
         ->  Hash
               Output: ft5.*, ft5.c1, ft5.c2, ft5.c3
               ->  Foreign Scan on public.ft5
                     Output: ft5.*, ft5.c1, ft5.c2, ft5.c3
                     Remote SQL: SELECT c1, c2, c3 FROM odbc_fdw_post.`T4`
(14 rows)

--Testcase 191:
SELECT ft5, ft5.c1, ft5.c2, ft5.c3, ft4.c1, ft4.c2 FROM ft5 left join ft4 on ft5.c1 = ft4.c1 WHERE ft4.c1 BETWEEN 10 and 30 ORDER BY ft5.c1, ft4.c1;
      ft5       | c1 | c2 |   c3   | c1 | c2 
----------------+----+----+--------+----+----
 (12,13,AAA012) | 12 | 13 | AAA012 | 12 | 13
 (18,19,)       | 18 | 19 |        | 18 | 19
 (24,25,AAA024) | 24 | 25 | AAA024 | 24 | 25
 (30,31,AAA030) | 30 | 31 | AAA030 | 30 | 31
(4 rows)

-- multi-way join involving multiple merge joins
-- (this case used to have EPQ-related planning problems)
--Testcase 192:
CREATE TABLE local_tbl (c1 int NOT NULL, c2 int NOT NULL, c3 text, CONSTRAINT local_tbl_pkey PRIMARY KEY (c1));
--Testcase 193:
INSERT INTO local_tbl SELECT id, id % 10, to_char(id, 'FM0000') FROM generate_series(1, 1000) id;
ANALYZE local_tbl;
--Testcase 194:
SET enable_nestloop TO false;
--Testcase 195:
SET enable_hashjoin TO false;
--Testcase 196:
EXPLAIN (VERBOSE, COSTS OFF)
SELECT * FROM ft1, ft2, ft4, ft5, local_tbl WHERE ft1.c1 = ft2.c1 AND ft1.c2 = ft4.c1
    AND ft1.c2 = ft5.c1 AND ft1.c2 = local_tbl.c1 AND ft1.c1 < 100 AND ft2.c1 < 100 FOR UPDATE;
                                                                                                                                      QUERY PLAN                                                                                                                                      
--------------------------------------------------------------------------------------------------------------------------------------------------------------------------------------------------------------------------------------------------------------------------------------
 LockRows
   Output: ft1.c1, ft1.c2, ft1.c3, ft1.c4, ft1.c5, ft1.c6, ft1.c7, ft1.c8, ft2.c1, ft2.c2, ft2.c3, ft2.c4, ft2.c5, ft2.c6, ft2.c7, ft2.c8, ft4.c1, ft4.c2, ft4.c3, ft5.c1, ft5.c2, ft5.c3, local_tbl.c1, local_tbl.c2, local_tbl.c3, ft1.*, ft2.*, ft4.*, ft5.*, local_tbl.ctid
   ->  Merge Join
         Output: ft1.c1, ft1.c2, ft1.c3, ft1.c4, ft1.c5, ft1.c6, ft1.c7, ft1.c8, ft2.c1, ft2.c2, ft2.c3, ft2.c4, ft2.c5, ft2.c6, ft2.c7, ft2.c8, ft4.c1, ft4.c2, ft4.c3, ft5.c1, ft5.c2, ft5.c3, local_tbl.c1, local_tbl.c2, local_tbl.c3, ft1.*, ft2.*, ft4.*, ft5.*, local_tbl.ctid
         Merge Cond: (local_tbl.c1 = ft1.c2)
         ->  Index Scan using local_tbl_pkey on public.local_tbl
               Output: local_tbl.c1, local_tbl.c2, local_tbl.c3, local_tbl.ctid
         ->  Sort
               Output: ft1.c1, ft1.c2, ft1.c3, ft1.c4, ft1.c5, ft1.c6, ft1.c7, ft1.c8, ft1.*, ft2.c1, ft2.c2, ft2.c3, ft2.c4, ft2.c5, ft2.c6, ft2.c7, ft2.c8, ft2.*, ft4.c1, ft4.c2, ft4.c3, ft4.*, ft5.c1, ft5.c2, ft5.c3, ft5.*
               Sort Key: ft1.c2
               ->  Merge Join
                     Output: ft1.c1, ft1.c2, ft1.c3, ft1.c4, ft1.c5, ft1.c6, ft1.c7, ft1.c8, ft1.*, ft2.c1, ft2.c2, ft2.c3, ft2.c4, ft2.c5, ft2.c6, ft2.c7, ft2.c8, ft2.*, ft4.c1, ft4.c2, ft4.c3, ft4.*, ft5.c1, ft5.c2, ft5.c3, ft5.*
                     Merge Cond: (ft1.c1 = ft2.c1)
                     ->  Sort
                           Output: ft1.c1, ft1.c2, ft1.c3, ft1.c4, ft1.c5, ft1.c6, ft1.c7, ft1.c8, ft1.*, ft4.c1, ft4.c2, ft4.c3, ft4.*, ft5.c1, ft5.c2, ft5.c3, ft5.*
                           Sort Key: ft1.c1
                           ->  Merge Join
                                 Output: ft1.c1, ft1.c2, ft1.c3, ft1.c4, ft1.c5, ft1.c6, ft1.c7, ft1.c8, ft1.*, ft4.c1, ft4.c2, ft4.c3, ft4.*, ft5.c1, ft5.c2, ft5.c3, ft5.*
                                 Merge Cond: (ft4.c1 = ft1.c2)
                                 ->  Merge Join
                                       Output: ft4.c1, ft4.c2, ft4.c3, ft4.*, ft5.c1, ft5.c2, ft5.c3, ft5.*
                                       Merge Cond: (ft4.c1 = ft5.c1)
                                       ->  Sort
                                             Output: ft4.c1, ft4.c2, ft4.c3, ft4.*
                                             Sort Key: ft4.c1
                                             ->  Foreign Scan on public.ft4
                                                   Output: ft4.c1, ft4.c2, ft4.c3, ft4.*
                                                   Remote SQL: SELECT c1, c2, c3 FROM odbc_fdw_post.`T3`
                                       ->  Sort
                                             Output: ft5.c1, ft5.c2, ft5.c3, ft5.*
                                             Sort Key: ft5.c1
                                             ->  Foreign Scan on public.ft5
                                                   Output: ft5.c1, ft5.c2, ft5.c3, ft5.*
                                                   Remote SQL: SELECT c1, c2, c3 FROM odbc_fdw_post.`T4`
                                 ->  Sort
                                       Output: ft1.c1, ft1.c2, ft1.c3, ft1.c4, ft1.c5, ft1.c6, ft1.c7, ft1.c8, ft1.*
                                       Sort Key: ft1.c2
                                       ->  Foreign Scan on public.ft1
                                             Output: ft1.c1, ft1.c2, ft1.c3, ft1.c4, ft1.c5, ft1.c6, ft1.c7, ft1.c8, ft1.*
                                             Remote SQL: SELECT `C_1`, c2, c3, c4, c5, c6, c7, c8 FROM odbc_fdw_post.`T1` WHERE ((`C_1` < 100))
                     ->  Sort
                           Output: ft2.c1, ft2.c2, ft2.c3, ft2.c4, ft2.c5, ft2.c6, ft2.c7, ft2.c8, ft2.*
                           Sort Key: ft2.c1
                           ->  Foreign Scan on public.ft2
                                 Output: ft2.c1, ft2.c2, ft2.c3, ft2.c4, ft2.c5, ft2.c6, ft2.c7, ft2.c8, ft2.*
                                 Remote SQL: SELECT `C_1`, c2, c3, c4, c5, c6, c7, c8 FROM odbc_fdw_post.`T1` WHERE ((`C_1` < 100))
(46 rows)

--Testcase 197:
SELECT * FROM ft1, ft2, ft4, ft5, local_tbl WHERE ft1.c1 = ft2.c1 AND ft1.c2 = ft4.c1
    AND ft1.c2 = ft5.c1 AND ft1.c2 = local_tbl.c1 AND ft1.c1 < 100 AND ft2.c1 < 100 FOR UPDATE;
 c1 | c2 |  c3   |            c4            |            c5            | c6 |     c7     | c8  | c1 | c2 |  c3   |            c4            |            c5            | c6 |     c7     | c8  | c1 | c2 |   c3   | c1 | c2 |   c3   | c1 | c2 |  c3  
----+----+-------+--------------------------+--------------------------+----+------------+-----+----+----+-------+--------------------------+--------------------------+----+------------+-----+----+----+--------+----+----+--------+----+----+------
  6 |  6 | 00006 | Wed Jan 07 00:00:00 1970 | Wed Jan 07 00:00:00 1970 | 6  | 6          | foo |  6 |  6 | 00006 | Wed Jan 07 00:00:00 1970 | Wed Jan 07 00:00:00 1970 | 6  | 6          | foo |  6 |  7 | AAA006 |  6 |  7 | AAA006 |  6 |  6 | 0006
 16 |  6 | 00016 | Sat Jan 17 00:00:00 1970 | Sat Jan 17 00:00:00 1970 | 6  | 6          | foo | 16 |  6 | 00016 | Sat Jan 17 00:00:00 1970 | Sat Jan 17 00:00:00 1970 | 6  | 6          | foo |  6 |  7 | AAA006 |  6 |  7 | AAA006 |  6 |  6 | 0006
 26 |  6 | 00026 | Tue Jan 27 00:00:00 1970 | Tue Jan 27 00:00:00 1970 | 6  | 6          | foo | 26 |  6 | 00026 | Tue Jan 27 00:00:00 1970 | Tue Jan 27 00:00:00 1970 | 6  | 6          | foo |  6 |  7 | AAA006 |  6 |  7 | AAA006 |  6 |  6 | 0006
 36 |  6 | 00036 | Fri Feb 06 00:00:00 1970 | Fri Feb 06 00:00:00 1970 | 6  | 6          | foo | 36 |  6 | 00036 | Fri Feb 06 00:00:00 1970 | Fri Feb 06 00:00:00 1970 | 6  | 6          | foo |  6 |  7 | AAA006 |  6 |  7 | AAA006 |  6 |  6 | 0006
 46 |  6 | 00046 | Mon Feb 16 00:00:00 1970 | Mon Feb 16 00:00:00 1970 | 6  | 6          | foo | 46 |  6 | 00046 | Mon Feb 16 00:00:00 1970 | Mon Feb 16 00:00:00 1970 | 6  | 6          | foo |  6 |  7 | AAA006 |  6 |  7 | AAA006 |  6 |  6 | 0006
 56 |  6 | 00056 | Thu Feb 26 00:00:00 1970 | Thu Feb 26 00:00:00 1970 | 6  | 6          | foo | 56 |  6 | 00056 | Thu Feb 26 00:00:00 1970 | Thu Feb 26 00:00:00 1970 | 6  | 6          | foo |  6 |  7 | AAA006 |  6 |  7 | AAA006 |  6 |  6 | 0006
 66 |  6 | 00066 | Sun Mar 08 00:00:00 1970 | Sun Mar 08 00:00:00 1970 | 6  | 6          | foo | 66 |  6 | 00066 | Sun Mar 08 00:00:00 1970 | Sun Mar 08 00:00:00 1970 | 6  | 6          | foo |  6 |  7 | AAA006 |  6 |  7 | AAA006 |  6 |  6 | 0006
 76 |  6 | 00076 | Wed Mar 18 00:00:00 1970 | Wed Mar 18 00:00:00 1970 | 6  | 6          | foo | 76 |  6 | 00076 | Wed Mar 18 00:00:00 1970 | Wed Mar 18 00:00:00 1970 | 6  | 6          | foo |  6 |  7 | AAA006 |  6 |  7 | AAA006 |  6 |  6 | 0006
 86 |  6 | 00086 | Sat Mar 28 00:00:00 1970 | Sat Mar 28 00:00:00 1970 | 6  | 6          | foo | 86 |  6 | 00086 | Sat Mar 28 00:00:00 1970 | Sat Mar 28 00:00:00 1970 | 6  | 6          | foo |  6 |  7 | AAA006 |  6 |  7 | AAA006 |  6 |  6 | 0006
 96 |  6 | 00096 | Tue Apr 07 00:00:00 1970 | Tue Apr 07 00:00:00 1970 | 6  | 6          | foo | 96 |  6 | 00096 | Tue Apr 07 00:00:00 1970 | Tue Apr 07 00:00:00 1970 | 6  | 6          | foo |  6 |  7 | AAA006 |  6 |  7 | AAA006 |  6 |  6 | 0006
(10 rows)

--Testcase 198:
RESET enable_nestloop;
--Testcase 199:
RESET enable_hashjoin;
--Testcase 200:
DROP TABLE local_tbl;
-- check join pushdown in situations where multiple userids are involved
--Testcase 201:
CREATE ROLE regress_view_owner SUPERUSER;
--Testcase 202:
CREATE USER MAPPING FOR regress_view_owner SERVER :DB_SERVERNAME;
GRANT SELECT ON ft4 TO regress_view_owner;
GRANT SELECT ON ft5 TO regress_view_owner;
--Testcase 203:
CREATE VIEW v4 AS SELECT * FROM ft4;
--Testcase 204:
CREATE VIEW v5 AS SELECT * FROM ft5;
--Testcase 205:
ALTER VIEW v5 OWNER TO regress_view_owner;
--Testcase 206:
EXPLAIN (VERBOSE, COSTS OFF)
SELECT t1.c1, t2.c2 FROM v4 t1 LEFT JOIN v5 t2 ON (t1.c1 = t2.c1) ORDER BY t1.c1, t2.c1 OFFSET 10 LIMIT 10;  -- can't be pushed down, different view owners
                                 QUERY PLAN                                  
-----------------------------------------------------------------------------
 Limit
   Output: ft4.c1, ft5.c2, ft5.c1
   ->  Sort
         Output: ft4.c1, ft5.c2, ft5.c1
         Sort Key: ft4.c1, ft5.c1
         ->  Hash Left Join
               Output: ft4.c1, ft5.c2, ft5.c1
               Hash Cond: (ft4.c1 = ft5.c1)
               ->  Foreign Scan on public.ft4
                     Output: ft4.c1, ft4.c2, ft4.c3
                     Remote SQL: SELECT c1 FROM odbc_fdw_post.`T3`
               ->  Hash
                     Output: ft5.c2, ft5.c1
                     ->  Foreign Scan on public.ft5
                           Output: ft5.c2, ft5.c1
                           Remote SQL: SELECT c1, c2 FROM odbc_fdw_post.`T4`
(16 rows)

--Testcase 207:
SELECT t1.c1, t2.c2 FROM v4 t1 LEFT JOIN v5 t2 ON (t1.c1 = t2.c1) ORDER BY t1.c1, t2.c1 OFFSET 10 LIMIT 10;
 c1 | c2 
----+----
 22 |   
 24 | 25
 26 |   
 28 |   
 30 | 31
 32 |   
 34 |   
 36 | 37
 38 |   
 40 |   
(10 rows)

--Testcase 208:
ALTER VIEW v4 OWNER TO regress_view_owner;
--Testcase 209:
EXPLAIN (VERBOSE, COSTS OFF)
SELECT t1.c1, t2.c2 FROM v4 t1 LEFT JOIN v5 t2 ON (t1.c1 = t2.c1) ORDER BY t1.c1, t2.c1 OFFSET 10 LIMIT 10;  -- can be pushed down
                                 QUERY PLAN                                  
-----------------------------------------------------------------------------
 Limit
   Output: ft4.c1, ft5.c2, ft5.c1
   ->  Sort
         Output: ft4.c1, ft5.c2, ft5.c1
         Sort Key: ft4.c1, ft5.c1
         ->  Hash Left Join
               Output: ft4.c1, ft5.c2, ft5.c1
               Hash Cond: (ft4.c1 = ft5.c1)
               ->  Foreign Scan on public.ft4
                     Output: ft4.c1, ft4.c2, ft4.c3
                     Remote SQL: SELECT c1 FROM odbc_fdw_post.`T3`
               ->  Hash
                     Output: ft5.c2, ft5.c1
                     ->  Foreign Scan on public.ft5
                           Output: ft5.c2, ft5.c1
                           Remote SQL: SELECT c1, c2 FROM odbc_fdw_post.`T4`
(16 rows)

--Testcase 210:
SELECT t1.c1, t2.c2 FROM v4 t1 LEFT JOIN v5 t2 ON (t1.c1 = t2.c1) ORDER BY t1.c1, t2.c1 OFFSET 10 LIMIT 10;
 c1 | c2 
----+----
 22 |   
 24 | 25
 26 |   
 28 |   
 30 | 31
 32 |   
 34 |   
 36 | 37
 38 |   
 40 |   
(10 rows)

--Testcase 211:
EXPLAIN (VERBOSE, COSTS OFF)
SELECT t1.c1, t2.c2 FROM v4 t1 LEFT JOIN ft5 t2 ON (t1.c1 = t2.c1) ORDER BY t1.c1, t2.c1 OFFSET 10 LIMIT 10;  -- can't be pushed down, view owner not current user
                                 QUERY PLAN                                  
-----------------------------------------------------------------------------
 Limit
   Output: ft4.c1, t2.c2, t2.c1
   ->  Sort
         Output: ft4.c1, t2.c2, t2.c1
         Sort Key: ft4.c1, t2.c1
         ->  Hash Left Join
               Output: ft4.c1, t2.c2, t2.c1
               Hash Cond: (ft4.c1 = t2.c1)
               ->  Foreign Scan on public.ft4
                     Output: ft4.c1, ft4.c2, ft4.c3
                     Remote SQL: SELECT c1 FROM odbc_fdw_post.`T3`
               ->  Hash
                     Output: t2.c2, t2.c1
                     ->  Foreign Scan on public.ft5 t2
                           Output: t2.c2, t2.c1
                           Remote SQL: SELECT c1, c2 FROM odbc_fdw_post.`T4`
(16 rows)

--Testcase 212:
SELECT t1.c1, t2.c2 FROM v4 t1 LEFT JOIN ft5 t2 ON (t1.c1 = t2.c1) ORDER BY t1.c1, t2.c1 OFFSET 10 LIMIT 10;
 c1 | c2 
----+----
 22 |   
 24 | 25
 26 |   
 28 |   
 30 | 31
 32 |   
 34 |   
 36 | 37
 38 |   
 40 |   
(10 rows)

--Testcase 213:
ALTER VIEW v4 OWNER TO CURRENT_USER;
--Testcase 214:
EXPLAIN (VERBOSE, COSTS OFF)
SELECT t1.c1, t2.c2 FROM v4 t1 LEFT JOIN ft5 t2 ON (t1.c1 = t2.c1) ORDER BY t1.c1, t2.c1 OFFSET 10 LIMIT 10;  -- can be pushed down
                                 QUERY PLAN                                  
-----------------------------------------------------------------------------
 Limit
   Output: ft4.c1, t2.c2, t2.c1
   ->  Sort
         Output: ft4.c1, t2.c2, t2.c1
         Sort Key: ft4.c1, t2.c1
         ->  Hash Left Join
               Output: ft4.c1, t2.c2, t2.c1
               Hash Cond: (ft4.c1 = t2.c1)
               ->  Foreign Scan on public.ft4
                     Output: ft4.c1, ft4.c2, ft4.c3
                     Remote SQL: SELECT c1 FROM odbc_fdw_post.`T3`
               ->  Hash
                     Output: t2.c2, t2.c1
                     ->  Foreign Scan on public.ft5 t2
                           Output: t2.c2, t2.c1
                           Remote SQL: SELECT c1, c2 FROM odbc_fdw_post.`T4`
(16 rows)

--Testcase 215:
SELECT t1.c1, t2.c2 FROM v4 t1 LEFT JOIN ft5 t2 ON (t1.c1 = t2.c1) ORDER BY t1.c1, t2.c1 OFFSET 10 LIMIT 10;
 c1 | c2 
----+----
 22 |   
 24 | 25
 26 |   
 28 |   
 30 | 31
 32 |   
 34 |   
 36 | 37
 38 |   
 40 |   
(10 rows)

--Testcase 216:
ALTER VIEW v4 OWNER TO regress_view_owner;
-- cleanup
--Testcase 217:
DROP OWNED BY regress_view_owner;
--Testcase 218:
DROP ROLE regress_view_owner;
-- ===================================================================
-- Aggregate and grouping queries
-- ===================================================================
-- Simple aggregates
--Testcase 219:
explain (verbose, costs off)
select count(c6), sum(c1), avg(c1), min(c2), max(c1), stddev(c2), sum(c1) * (random() <= 1)::int as sum2 from ft1 where c2 < 5 group by c2 order by 1, 2;
                                                                    QUERY PLAN                                                                     
---------------------------------------------------------------------------------------------------------------------------------------------------
 Result
   Output: (count(c6)), (sum(c1)), (avg(c1)), (min(c2)), (max(c1)), (stddev(c2)), ((sum(c1)) * ((random() <= '1'::double precision))::integer), c2
   ->  Sort
         Output: (count(c6)), (sum(c1)), (avg(c1)), (min(c2)), (max(c1)), (stddev(c2)), c2
         Sort Key: (count(ft1.c6)), (sum(ft1.c1))
         ->  HashAggregate
               Output: count(c6), sum(c1), avg(c1), min(c2), max(c1), stddev(c2), c2
               Group Key: ft1.c2
               ->  Foreign Scan on public.ft1
                     Output: c1, c2, c3, c4, c5, c6, c7, c8
                     Remote SQL: SELECT `C_1`, c2, c6 FROM odbc_fdw_post.`T1` WHERE ((c2 < 5))
(11 rows)

--Testcase 220:
select count(c6), sum(c1), avg(c1), min(c2), max(c1), stddev(c2), sum(c1) * (random() <= 1)::int as sum2 from ft1 where c2 < 5 group by c2 order by 1, 2;
 count |  sum  |         avg          | min | max  | stddev | sum2  
-------+-------+----------------------+-----+------+--------+-------
   100 | 49600 | 496.0000000000000000 |   1 |  991 |      0 | 49600
   100 | 49700 | 497.0000000000000000 |   2 |  992 |      0 | 49700
   100 | 49800 | 498.0000000000000000 |   3 |  993 |      0 | 49800
   100 | 49900 | 499.0000000000000000 |   4 |  994 |      0 | 49900
   100 | 50500 | 505.0000000000000000 |   0 | 1000 |      0 | 50500
(5 rows)

--Testcase 221:
explain (verbose, costs off)
select count(c6), sum(c1), avg(c1), min(c2), max(c1), stddev(c2), sum(c1) * (random() <= 1)::int as sum2 from ft1 where c2 < 5 group by c2 order by 1, 2 limit 1;
                                                                       QUERY PLAN                                                                        
---------------------------------------------------------------------------------------------------------------------------------------------------------
 Limit
   Output: (count(c6)), (sum(c1)), (avg(c1)), (min(c2)), (max(c1)), (stddev(c2)), (((sum(c1)) * ((random() <= '1'::double precision))::integer)), c2
   ->  Result
         Output: (count(c6)), (sum(c1)), (avg(c1)), (min(c2)), (max(c1)), (stddev(c2)), ((sum(c1)) * ((random() <= '1'::double precision))::integer), c2
         ->  Sort
               Output: (count(c6)), (sum(c1)), (avg(c1)), (min(c2)), (max(c1)), (stddev(c2)), c2
               Sort Key: (count(ft1.c6)), (sum(ft1.c1))
               ->  HashAggregate
                     Output: count(c6), sum(c1), avg(c1), min(c2), max(c1), stddev(c2), c2
                     Group Key: ft1.c2
                     ->  Foreign Scan on public.ft1
                           Output: c1, c2, c3, c4, c5, c6, c7, c8
                           Remote SQL: SELECT `C_1`, c2, c6 FROM odbc_fdw_post.`T1` WHERE ((c2 < 5))
(13 rows)

--Testcase 222:
select count(c6), sum(c1), avg(c1), min(c2), max(c1), stddev(c2), sum(c1) * (random() <= 1)::int as sum2 from ft1 where c2 < 5 group by c2 order by 1, 2 limit 1;
 count |  sum  |         avg          | min | max | stddev | sum2  
-------+-------+----------------------+-----+-----+--------+-------
   100 | 49600 | 496.0000000000000000 |   1 | 991 |      0 | 49600
(1 row)

-- Aggregate is not pushed down as aggregation contains random()
--Testcase 223:
explain (verbose, costs off)
select sum(c1 * (random() <= 1)::int) as sum, avg(c1) from ft1;
                                  QUERY PLAN                                   
-------------------------------------------------------------------------------
 Aggregate
   Output: sum((c1 * ((random() <= '1'::double precision))::integer)), avg(c1)
   ->  Foreign Scan on public.ft1
         Output: c1, c2, c3, c4, c5, c6, c7, c8
         Remote SQL: SELECT `C_1` FROM odbc_fdw_post.`T1`
(5 rows)

-- Aggregate over join query
--Testcase 224:
explain (verbose, costs off)
select count(*), sum(t1.c1), avg(t2.c1) from ft1 t1 inner join ft1 t2 on (t1.c2 = t2.c2) where t1.c2 = 6;
                                        QUERY PLAN                                         
-------------------------------------------------------------------------------------------
 Aggregate
   Output: count(*), sum(t1.c1), avg(t2.c1)
   ->  Nested Loop
         Output: t1.c1, t2.c1
         ->  Foreign Scan on public.ft1 t1
               Output: t1.c1, t1.c2, t1.c3, t1.c4, t1.c5, t1.c6, t1.c7, t1.c8
               Remote SQL: SELECT `C_1`, c2 FROM odbc_fdw_post.`T1` WHERE ((c2 = 6))
         ->  Materialize
               Output: t2.c1, t2.c2
               ->  Foreign Scan on public.ft1 t2
                     Output: t2.c1, t2.c2
                     Remote SQL: SELECT `C_1`, c2 FROM odbc_fdw_post.`T1` WHERE ((c2 = 6))
(12 rows)

--Testcase 225:
select count(*), sum(t1.c1), avg(t2.c1) from ft1 t1 inner join ft1 t2 on (t1.c2 = t2.c2) where t1.c2 = 6;
 count |   sum   |         avg          
-------+---------+----------------------
 10000 | 5010000 | 501.0000000000000000
(1 row)

-- Not pushed down due to local conditions present in underneath input rel
--Testcase 226:
explain (verbose, costs off)
select sum(t1.c1), count(t2.c1) from ft1 t1 inner join ft2 t2 on (t1.c1 = t2.c1) where ((t1.c1 * t2.c1)/(t1.c1 * t2.c1)) * random() <= 1;
                                                      QUERY PLAN                                                      
----------------------------------------------------------------------------------------------------------------------
 Aggregate
   Output: sum(t1.c1), count(t2.c1)
   ->  Hash Join
         Output: t1.c1, t2.c1
         Hash Cond: (t1.c1 = t2.c1)
         Join Filter: (((((t1.c1 * t2.c1) / (t1.c1 * t2.c1)))::double precision * random()) <= '1'::double precision)
         ->  Foreign Scan on public.ft1 t1
               Output: t1.c1, t1.c2, t1.c3, t1.c4, t1.c5, t1.c6, t1.c7, t1.c8
               Remote SQL: SELECT `C_1` FROM odbc_fdw_post.`T1`
         ->  Hash
               Output: t2.c1
               ->  Foreign Scan on public.ft2 t2
                     Output: t2.c1
                     Remote SQL: SELECT `C_1` FROM odbc_fdw_post.`T1`
(14 rows)

-- GROUP BY clause having expressions
--Testcase 227:
explain (verbose, costs off)
select c2/2, sum(c2) * (c2/2) from ft1 group by c2/2 order by c2/2;
                         QUERY PLAN                          
-------------------------------------------------------------
 Sort
   Output: ((c2 / 2)), ((sum(c2) * ((c2 / 2))))
   Sort Key: ((ft1.c2 / 2))
   ->  HashAggregate
         Output: ((c2 / 2)), (sum(c2) * ((c2 / 2)))
         Group Key: (ft1.c2 / 2)
         ->  Foreign Scan on public.ft1
               Output: (c2 / 2), c2
               Remote SQL: SELECT c2 FROM odbc_fdw_post.`T1`
(9 rows)

--Testcase 228:
select c2/2, sum(c2) * (c2/2) from ft1 group by c2/2 order by c2/2;
 ?column? | ?column? 
----------+----------
        0 |        0
        1 |      500
        2 |     1800
        3 |     3900
        4 |     6800
(5 rows)

-- Aggregates in subquery are pushed down.
--Testcase 229:
explain (verbose, costs off)
select count(x.a), sum(x.a) from (select c2 a, sum(c1) b from ft1 group by c2, sqrt(c1) order by 1, 2) x;
                                  QUERY PLAN                                   
-------------------------------------------------------------------------------
 Aggregate
   Output: count(ft1.c2), sum(ft1.c2)
   ->  Sort
         Output: ft1.c2, (sum(ft1.c1)), (sqrt((ft1.c1)::double precision))
         Sort Key: ft1.c2, (sum(ft1.c1))
         ->  HashAggregate
               Output: ft1.c2, sum(ft1.c1), (sqrt((ft1.c1)::double precision))
               Group Key: ft1.c2, sqrt((ft1.c1)::double precision)
               ->  Foreign Scan on public.ft1
                     Output: ft1.c2, sqrt((ft1.c1)::double precision), ft1.c1
                     Remote SQL: SELECT `C_1`, c2 FROM odbc_fdw_post.`T1`
(11 rows)

--Testcase 230:
select count(x.a), sum(x.a) from (select c2 a, sum(c1) b from ft1 group by c2, sqrt(c1) order by 1, 2) x;
 count | sum  
-------+------
  1000 | 4500
(1 row)

-- Aggregate is still pushed down by taking unshippable expression out
--Testcase 231:
explain (verbose, costs off)
select c2 * (random() <= 1)::int as sum1, sum(c1) * c2 as sum2 from ft1 group by c2 order by 1, 2;
                                            QUERY PLAN                                             
---------------------------------------------------------------------------------------------------
 Sort
   Output: ((c2 * ((random() <= '1'::double precision))::integer)), ((sum(c1) * c2)), c2
   Sort Key: ((ft1.c2 * ((random() <= '1'::double precision))::integer)), ((sum(ft1.c1) * ft1.c2))
   ->  HashAggregate
         Output: (c2 * ((random() <= '1'::double precision))::integer), (sum(c1) * c2), c2
         Group Key: ft1.c2
         ->  Foreign Scan on public.ft1
               Output: c1, c2, c3, c4, c5, c6, c7, c8
               Remote SQL: SELECT `C_1`, c2 FROM odbc_fdw_post.`T1`
(9 rows)

--Testcase 232:
select c2 * (random() <= 1)::int as sum1, sum(c1) * c2 as sum2 from ft1 group by c2 order by 1, 2;
 sum1 |  sum2  
------+--------
    0 |      0
    1 |  49600
    2 |  99400
    3 | 149400
    4 | 199600
    5 | 250000
    6 | 300600
    7 | 351400
    8 | 402400
    9 | 453600
(10 rows)

-- Aggregate with unshippable GROUP BY clause are not pushed
--Testcase 233:
explain (verbose, costs off)
select c2 * (random() <= 1)::int as c2 from ft2 group by c2 * (random() <= 1)::int order by 1;
                                  QUERY PLAN                                  
------------------------------------------------------------------------------
 Sort
   Output: ((c2 * ((random() <= '1'::double precision))::integer))
   Sort Key: ((ft2.c2 * ((random() <= '1'::double precision))::integer))
   ->  HashAggregate
         Output: ((c2 * ((random() <= '1'::double precision))::integer))
         Group Key: (ft2.c2 * ((random() <= '1'::double precision))::integer)
         ->  Foreign Scan on public.ft2
               Output: (c2 * ((random() <= '1'::double precision))::integer)
               Remote SQL: SELECT c2 FROM odbc_fdw_post.`T1`
(9 rows)

-- GROUP BY clause in various forms, cardinal, alias and constant expression
--Testcase 234:
explain (verbose, costs off)
select count(c2) w, c2 x, 5 y, 7.0 z from ft1 group by 2, y, 9.0::int order by 2;
                         QUERY PLAN                          
-------------------------------------------------------------
 Sort
   Output: (count(c2)), c2, 5, 7.0, 9
   Sort Key: ft1.c2
   ->  HashAggregate
         Output: count(c2), c2, (5), 7.0, (9)
         Group Key: ft1.c2, 5, 9
         ->  Foreign Scan on public.ft1
               Output: c2, 5, 9
               Remote SQL: SELECT c2 FROM odbc_fdw_post.`T1`
(9 rows)

--Testcase 235:
select count(c2) w, c2 x, 5 y, 7.0 z from ft1 group by 2, y, 9.0::int order by 2;
  w  | x | y |  z  
-----+---+---+-----
 100 | 0 | 5 | 7.0
 100 | 1 | 5 | 7.0
 100 | 2 | 5 | 7.0
 100 | 3 | 5 | 7.0
 100 | 4 | 5 | 7.0
 100 | 5 | 5 | 7.0
 100 | 6 | 5 | 7.0
 100 | 7 | 5 | 7.0
 100 | 8 | 5 | 7.0
 100 | 9 | 5 | 7.0
(10 rows)

-- GROUP BY clause referring to same column multiple times
-- Also, ORDER BY contains an aggregate function
--Testcase 236:
explain (verbose, costs off)
select c2, c2 from ft1 where c2 > 6 group by 1, 2 order by sum(c1);
                                     QUERY PLAN                                      
-------------------------------------------------------------------------------------
 Sort
   Output: c2, c2, (sum(c1))
   Sort Key: (sum(ft1.c1))
   ->  HashAggregate
         Output: c2, c2, sum(c1)
         Group Key: ft1.c2, ft1.c2
         ->  Foreign Scan on public.ft1
               Output: c2, c2, c1
               Remote SQL: SELECT `C_1`, c2 FROM odbc_fdw_post.`T1` WHERE ((c2 > 6))
(9 rows)

--Testcase 237:
select c2, c2 from ft1 where c2 > 6 group by 1, 2 order by sum(c1);
 c2 | c2 
----+----
  7 |  7
  8 |  8
  9 |  9
(3 rows)

-- Testing HAVING clause shippability
--Testcase 238:
explain (verbose, costs off)
select c2, sum(c1) from ft2 group by c2 having avg(c1) < 500 and sum(c1) < 49800 order by c2;
                                 QUERY PLAN                                 
----------------------------------------------------------------------------
 Sort
   Output: c2, (sum(c1))
   Sort Key: ft2.c2
   ->  HashAggregate
         Output: c2, sum(c1)
         Group Key: ft2.c2
         Filter: ((avg(ft2.c1) < '500'::numeric) AND (sum(ft2.c1) < 49800))
         ->  Foreign Scan on public.ft2
               Output: c1, c2, c3, c4, c5, c6, c7, c8
               Remote SQL: SELECT `C_1`, c2 FROM odbc_fdw_post.`T1`
(10 rows)

--Testcase 239:
select c2, sum(c1) from ft2 group by c2 having avg(c1) < 500 and sum(c1) < 49800 order by c2;
 c2 |  sum  
----+-------
  1 | 49600
  2 | 49700
(2 rows)

-- Unshippable HAVING clause will be evaluated locally, and other qual in HAVING clause is pushed down
--Testcase 240:
explain (verbose, costs off)
select count(*) from (select c5, count(c1) from ft1 group by c5, sqrt(c2) having (avg(c1) / avg(c1)) * random() <= 1 and avg(c1) < 500) x;
                                                                  QUERY PLAN                                                                  
----------------------------------------------------------------------------------------------------------------------------------------------
 Aggregate
   Output: count(*)
   ->  HashAggregate
         Output: ft1.c5, NULL::bigint, (sqrt((ft1.c2)::double precision))
         Group Key: ft1.c5, sqrt((ft1.c2)::double precision)
         Filter: ((avg(ft1.c1) < '500'::numeric) AND ((((avg(ft1.c1) / avg(ft1.c1)))::double precision * random()) <= '1'::double precision))
         ->  Foreign Scan on public.ft1
               Output: ft1.c5, sqrt((ft1.c2)::double precision), ft1.c1
               Remote SQL: SELECT `C_1`, c2, c5 FROM odbc_fdw_post.`T1`
(9 rows)

--Testcase 241:
select count(*) from (select c5, count(c1) from ft1 group by c5, sqrt(c2) having (avg(c1) / avg(c1)) * random() <= 1 and avg(c1) < 500) x;
 count 
-------
    49
(1 row)

-- Aggregate in HAVING clause is not pushable, and thus aggregation is not pushed down
--Testcase 242:
explain (verbose, costs off)
select sum(c1) from ft1 group by c2 having avg(c1 * (random() <= 1)::int) > 100 order by 1;
                                            QUERY PLAN                                             
---------------------------------------------------------------------------------------------------
 Sort
   Output: (sum(c1)), c2
   Sort Key: (sum(ft1.c1))
   ->  HashAggregate
         Output: sum(c1), c2
         Group Key: ft1.c2
         Filter: (avg((ft1.c1 * ((random() <= '1'::double precision))::integer)) > '100'::numeric)
         ->  Foreign Scan on public.ft1
               Output: c1, c2, c3, c4, c5, c6, c7, c8
               Remote SQL: SELECT `C_1`, c2 FROM odbc_fdw_post.`T1`
(10 rows)

-- Remote aggregate in combination with a local Param (for the output
-- of an initplan) can be trouble, per bug #15781
--Testcase 243:
explain (verbose, costs off)
select exists(select 1 from pg_enum), sum(c1) from ft1;
                       QUERY PLAN                        
---------------------------------------------------------
 Foreign Scan
   Output: $0, (sum(ft1.c1))
   Remote SQL: SELECT sum(`C_1`) FROM odbc_fdw_post.`T1`
   InitPlan 1 (returns $0)
     ->  Seq Scan on pg_catalog.pg_enum
(5 rows)

--Testcase 244:
select exists(select 1 from pg_enum), sum(c1) from ft1;
 exists |  sum   
--------+--------
 t      | 500500
(1 row)

--Testcase 245:
explain (verbose, costs off)
select exists(select 1 from pg_enum), sum(c1) from ft1 group by 1;
                        QUERY PLAN                        
----------------------------------------------------------
 GroupAggregate
   Output: ($0), sum(ft1.c1)
   Group Key: $0
   InitPlan 1 (returns $0)
     ->  Seq Scan on pg_catalog.pg_enum
   ->  Foreign Scan on public.ft1
         Output: $0, ft1.c1
         Remote SQL: SELECT `C_1` FROM odbc_fdw_post.`T1`
(8 rows)

--Testcase 246:
select exists(select 1 from pg_enum), sum(c1) from ft1 group by 1;
 exists |  sum   
--------+--------
 t      | 500500
(1 row)

-- Testing ORDER BY, DISTINCT, FILTER, Ordered-sets and VARIADIC within aggregates
-- ORDER BY within aggregate, same column used to order
--Testcase 247:
explain (verbose, costs off)
select array_agg(c1 order by c1) from ft1 where c1 < 100 group by c2 order by 1;
                                           QUERY PLAN                                           
------------------------------------------------------------------------------------------------
 Sort
   Output: (array_agg(c1 ORDER BY c1)), c2
   Sort Key: (array_agg(ft1.c1 ORDER BY ft1.c1))
   ->  GroupAggregate
         Output: array_agg(c1 ORDER BY c1), c2
         Group Key: ft1.c2
         ->  Sort
               Output: c2, c1
               Sort Key: ft1.c2
               ->  Foreign Scan on public.ft1
                     Output: c2, c1
                     Remote SQL: SELECT `C_1`, c2 FROM odbc_fdw_post.`T1` WHERE ((`C_1` < 100))
(12 rows)

--Testcase 248:
select array_agg(c1 order by c1) from ft1 where c1 < 100 group by c2 order by 1;
           array_agg            
--------------------------------
 {1,11,21,31,41,51,61,71,81,91}
 {2,12,22,32,42,52,62,72,82,92}
 {3,13,23,33,43,53,63,73,83,93}
 {4,14,24,34,44,54,64,74,84,94}
 {5,15,25,35,45,55,65,75,85,95}
 {6,16,26,36,46,56,66,76,86,96}
 {7,17,27,37,47,57,67,77,87,97}
 {8,18,28,38,48,58,68,78,88,98}
 {9,19,29,39,49,59,69,79,89,99}
 {10,20,30,40,50,60,70,80,90}
(10 rows)

-- ORDER BY within aggregate, different column used to order also using DESC
--Testcase 249:
explain (verbose, costs off)
select array_agg(c5 order by c1 desc) from ft2 where c2 = 6 and c1 < 50;
                                            QUERY PLAN                                            
--------------------------------------------------------------------------------------------------
 Aggregate
   Output: array_agg(c5 ORDER BY c1 DESC)
   ->  Foreign Scan on public.ft2
         Output: c1, c2, c3, c4, c5, c6, c7, c8
         Remote SQL: SELECT `C_1`, c5 FROM odbc_fdw_post.`T1` WHERE ((`C_1` < 50)) AND ((c2 = 6))
(5 rows)

--Testcase 250:
select array_agg(c5 order by c1 desc) from ft2 where c2 = 6 and c1 < 50;
                                                                array_agg                                                                 
------------------------------------------------------------------------------------------------------------------------------------------
 {"Mon Feb 16 00:00:00 1970","Fri Feb 06 00:00:00 1970","Tue Jan 27 00:00:00 1970","Sat Jan 17 00:00:00 1970","Wed Jan 07 00:00:00 1970"}
(1 row)

-- DISTINCT within aggregate
--Testcase 251:
explain (verbose, costs off)
select array_agg(distinct (t1.c1)%5) from ft4 t1 full join ft5 t2 on (t1.c1 = t2.c1) where t1.c1 < 20 or (t1.c1 is null and t2.c1 < 5) group by (t2.c1)%3 order by 1;
                                   QUERY PLAN                                    
---------------------------------------------------------------------------------
 Sort
   Output: (array_agg(DISTINCT (t1.c1 % 5))), ((t2.c1 % 3))
   Sort Key: (array_agg(DISTINCT (t1.c1 % 5)))
   ->  GroupAggregate
         Output: array_agg(DISTINCT (t1.c1 % 5)), ((t2.c1 % 3))
         Group Key: ((t2.c1 % 3))
         ->  Sort
               Output: ((t2.c1 % 3)), t1.c1
               Sort Key: ((t2.c1 % 3))
               ->  Hash Full Join
                     Output: (t2.c1 % 3), t1.c1
                     Hash Cond: (t1.c1 = t2.c1)
                     Filter: ((t1.c1 < 20) OR ((t1.c1 IS NULL) AND (t2.c1 < 5)))
                     ->  Foreign Scan on public.ft4 t1
                           Output: t1.c1, t1.c2, t1.c3
                           Remote SQL: SELECT c1 FROM odbc_fdw_post.`T3`
                     ->  Hash
                           Output: t2.c1
                           ->  Foreign Scan on public.ft5 t2
                                 Output: t2.c1
                                 Remote SQL: SELECT c1 FROM odbc_fdw_post.`T4`
(21 rows)

--Testcase 252:
select array_agg(distinct (t1.c1)%5) from ft4 t1 full join ft5 t2 on (t1.c1 = t2.c1) where t1.c1 < 20 or (t1.c1 is null and t2.c1 < 5) group by (t2.c1)%3 order by 1;
  array_agg   
--------------
 {0,1,2,3,4}
 {1,2,3,NULL}
(2 rows)

-- DISTINCT combined with ORDER BY within aggregate
--Testcase 253:
explain (verbose, costs off)
select array_agg(distinct (t1.c1)%5 order by (t1.c1)%5) from ft4 t1 full join ft5 t2 on (t1.c1 = t2.c1) where t1.c1 < 20 or (t1.c1 is null and t2.c1 < 5) group by (t2.c1)%3 order by 1;
                                     QUERY PLAN                                      
-------------------------------------------------------------------------------------
 Sort
   Output: (array_agg(DISTINCT (t1.c1 % 5) ORDER BY (t1.c1 % 5))), ((t2.c1 % 3))
   Sort Key: (array_agg(DISTINCT (t1.c1 % 5) ORDER BY (t1.c1 % 5)))
   ->  GroupAggregate
         Output: array_agg(DISTINCT (t1.c1 % 5) ORDER BY (t1.c1 % 5)), ((t2.c1 % 3))
         Group Key: ((t2.c1 % 3))
         ->  Sort
               Output: ((t2.c1 % 3)), t1.c1
               Sort Key: ((t2.c1 % 3))
               ->  Hash Full Join
                     Output: (t2.c1 % 3), t1.c1
                     Hash Cond: (t1.c1 = t2.c1)
                     Filter: ((t1.c1 < 20) OR ((t1.c1 IS NULL) AND (t2.c1 < 5)))
                     ->  Foreign Scan on public.ft4 t1
                           Output: t1.c1, t1.c2, t1.c3
                           Remote SQL: SELECT c1 FROM odbc_fdw_post.`T3`
                     ->  Hash
                           Output: t2.c1
                           ->  Foreign Scan on public.ft5 t2
                                 Output: t2.c1
                                 Remote SQL: SELECT c1 FROM odbc_fdw_post.`T4`
(21 rows)

--Testcase 254:
select array_agg(distinct (t1.c1)%5 order by (t1.c1)%5) from ft4 t1 full join ft5 t2 on (t1.c1 = t2.c1) where t1.c1 < 20 or (t1.c1 is null and t2.c1 < 5) group by (t2.c1)%3 order by 1;
  array_agg   
--------------
 {0,1,2,3,4}
 {1,2,3,NULL}
(2 rows)

--Testcase 255:
explain (verbose, costs off)
select array_agg(distinct (t1.c1)%5 order by (t1.c1)%5 desc nulls last) from ft4 t1 full join ft5 t2 on (t1.c1 = t2.c1) where t1.c1 < 20 or (t1.c1 is null and t2.c1 < 5) group by (t2.c1)%3 order by 1;
                                             QUERY PLAN                                              
-----------------------------------------------------------------------------------------------------
 Sort
   Output: (array_agg(DISTINCT (t1.c1 % 5) ORDER BY (t1.c1 % 5) DESC NULLS LAST)), ((t2.c1 % 3))
   Sort Key: (array_agg(DISTINCT (t1.c1 % 5) ORDER BY (t1.c1 % 5) DESC NULLS LAST))
   ->  GroupAggregate
         Output: array_agg(DISTINCT (t1.c1 % 5) ORDER BY (t1.c1 % 5) DESC NULLS LAST), ((t2.c1 % 3))
         Group Key: ((t2.c1 % 3))
         ->  Sort
               Output: ((t2.c1 % 3)), t1.c1
               Sort Key: ((t2.c1 % 3))
               ->  Hash Full Join
                     Output: (t2.c1 % 3), t1.c1
                     Hash Cond: (t1.c1 = t2.c1)
                     Filter: ((t1.c1 < 20) OR ((t1.c1 IS NULL) AND (t2.c1 < 5)))
                     ->  Foreign Scan on public.ft4 t1
                           Output: t1.c1, t1.c2, t1.c3
                           Remote SQL: SELECT c1 FROM odbc_fdw_post.`T3`
                     ->  Hash
                           Output: t2.c1
                           ->  Foreign Scan on public.ft5 t2
                                 Output: t2.c1
                                 Remote SQL: SELECT c1 FROM odbc_fdw_post.`T4`
(21 rows)

--Testcase 256:
select array_agg(distinct (t1.c1)%5 order by (t1.c1)%5 desc nulls last) from ft4 t1 full join ft5 t2 on (t1.c1 = t2.c1) where t1.c1 < 20 or (t1.c1 is null and t2.c1 < 5) group by (t2.c1)%3 order by 1;
  array_agg   
--------------
 {3,2,1,NULL}
 {4,3,2,1,0}
(2 rows)

-- FILTER within aggregate
--Testcase 257:
explain (verbose, costs off)
select sum(c1) filter (where c1 < 100 and c2 > 5) from ft1 group by c2 order by 1 nulls last;
                                 QUERY PLAN                                 
----------------------------------------------------------------------------
 Sort
   Output: (sum(c1) FILTER (WHERE ((c1 < 100) AND (c2 > 5)))), c2
   Sort Key: (sum(ft1.c1) FILTER (WHERE ((ft1.c1 < 100) AND (ft1.c2 > 5))))
   ->  HashAggregate
         Output: sum(c1) FILTER (WHERE ((c1 < 100) AND (c2 > 5))), c2
         Group Key: ft1.c2
         ->  Foreign Scan on public.ft1
               Output: c1, c2, c3, c4, c5, c6, c7, c8
               Remote SQL: SELECT `C_1`, c2 FROM odbc_fdw_post.`T1`
(9 rows)

--Testcase 258:
select sum(c1) filter (where c1 < 100 and c2 > 5) from ft1 group by c2 order by 1 nulls last;
 sum 
-----
 510
 520
 530
 540
    
    
    
    
    
    
(10 rows)

-- DISTINCT, ORDER BY and FILTER within aggregate
--Testcase 259:
explain (verbose, costs off)
select sum(c1%3), sum(distinct c1%3 order by c1%3) filter (where c1%3 < 2), c2 from ft1 where c2 = 6 group by c2;
                                             QUERY PLAN                                              
-----------------------------------------------------------------------------------------------------
 GroupAggregate
   Output: sum((c1 % 3)), sum(DISTINCT (c1 % 3) ORDER BY (c1 % 3)) FILTER (WHERE ((c1 % 3) < 2)), c2
   Group Key: ft1.c2
   ->  Foreign Scan on public.ft1
         Output: c1, c2, c3, c4, c5, c6, c7, c8
         Remote SQL: SELECT `C_1`, c2 FROM odbc_fdw_post.`T1` WHERE ((c2 = 6))
(6 rows)

--Testcase 260:
select sum(c1%3), sum(distinct c1%3 order by c1%3) filter (where c1%3 < 2), c2 from ft1 where c2 = 6 group by c2;
 sum | sum | c2 
-----+-----+----
  99 |   1 |  6
(1 row)

-- Outer query is aggregation query
--Testcase 261:
explain (verbose, costs off)
select distinct (select count(*) filter (where t2.c2 = 6 and t2.c1 < 10) from ft1 t1 where t1.c1 = 6) from ft2 t2 where t2.c2 % 6 = 0 order by 1;
                                           QUERY PLAN                                            
-------------------------------------------------------------------------------------------------
 Unique
   Output: ((SubPlan 1))
   ->  Sort
         Output: ((SubPlan 1))
         Sort Key: ((SubPlan 1))
         ->  Aggregate
               Output: (SubPlan 1)
               ->  Foreign Scan on public.ft2 t2
                     Output: t2.c1, t2.c2, t2.c3, t2.c4, t2.c5, t2.c6, t2.c7, t2.c8
                     Remote SQL: SELECT `C_1`, c2 FROM odbc_fdw_post.`T1` WHERE (((c2 % 6) = 0))
               SubPlan 1
                 ->  Foreign Scan on public.ft1 t1
                       Output: count(*) FILTER (WHERE ((t2.c2 = 6) AND (t2.c1 < 10)))
                       Remote SQL: SELECT NULL FROM odbc_fdw_post.`T1` WHERE ((`C_1` = 6))
(14 rows)

--Testcase 262:
select distinct (select count(*) filter (where t2.c2 = 6 and t2.c1 < 10) from ft1 t1 where t1.c1 = 6) from ft2 t2 where t2.c2 % 6 = 0 order by 1;
 count 
-------
     1
(1 row)

-- Inner query is aggregation query
--Testcase 263:
explain (verbose, costs off)
select distinct (select count(t1.c1) filter (where t2.c2 = 6 and t2.c1 < 10) from ft1 t1 where t1.c1 = 6) from ft2 t2 where t2.c2 % 6 = 0 order by 1;
                                            QUERY PLAN                                            
--------------------------------------------------------------------------------------------------
 Unique
   Output: ((SubPlan 1))
   ->  Sort
         Output: ((SubPlan 1))
         Sort Key: ((SubPlan 1))
         ->  Foreign Scan on public.ft2 t2
               Output: (SubPlan 1)
               Remote SQL: SELECT `C_1`, c2 FROM odbc_fdw_post.`T1` WHERE (((c2 % 6) = 0))
               SubPlan 1
                 ->  Aggregate
                       Output: count(t1.c1) FILTER (WHERE ((t2.c2 = 6) AND (t2.c1 < 10)))
                       ->  Foreign Scan on public.ft1 t1
                             Output: t1.c1, t1.c2, t1.c3, t1.c4, t1.c5, t1.c6, t1.c7, t1.c8
                             Remote SQL: SELECT `C_1` FROM odbc_fdw_post.`T1` WHERE ((`C_1` = 6))
(14 rows)

--Testcase 264:
select distinct (select count(t1.c1) filter (where t2.c2 = 6 and t2.c1 < 10) from ft1 t1 where t1.c1 = 6) from ft2 t2 where t2.c2 % 6 = 0 order by 1;
 count 
-------
     0
     1
(2 rows)

-- Aggregate not pushed down as FILTER condition is not pushable
--Testcase 265:
explain (verbose, costs off)
select sum(c1) filter (where (c1 / c1) * random() <= 1) from ft1 group by c2 order by 1;
                                                       QUERY PLAN                                                       
------------------------------------------------------------------------------------------------------------------------
 Sort
   Output: (sum(c1) FILTER (WHERE ((((c1 / c1))::double precision * random()) <= '1'::double precision))), c2
   Sort Key: (sum(ft1.c1) FILTER (WHERE ((((ft1.c1 / ft1.c1))::double precision * random()) <= '1'::double precision)))
   ->  HashAggregate
         Output: sum(c1) FILTER (WHERE ((((c1 / c1))::double precision * random()) <= '1'::double precision)), c2
         Group Key: ft1.c2
         ->  Foreign Scan on public.ft1
               Output: c1, c2, c3, c4, c5, c6, c7, c8
               Remote SQL: SELECT `C_1`, c2 FROM odbc_fdw_post.`T1`
(9 rows)

--Testcase 266:
explain (verbose, costs off)
select sum(c2) filter (where c2 in (select c2 from ft1 where c2 < 5)) from ft1;
                                   QUERY PLAN                                   
--------------------------------------------------------------------------------
 Aggregate
   Output: sum(ft1.c2) FILTER (WHERE (hashed SubPlan 1))
   ->  Foreign Scan on public.ft1
         Output: ft1.c1, ft1.c2, ft1.c3, ft1.c4, ft1.c5, ft1.c6, ft1.c7, ft1.c8
         Remote SQL: SELECT c2 FROM odbc_fdw_post.`T1`
   SubPlan 1
     ->  Foreign Scan on public.ft1 ft1_1
           Output: ft1_1.c2
           Remote SQL: SELECT c2 FROM odbc_fdw_post.`T1` WHERE ((c2 < 5))
(9 rows)

-- Ordered-sets within aggregate
--Testcase 267:
explain (verbose, costs off)
select c2, rank('10'::varchar) within group (order by c6), percentile_cont(c2/10::numeric) within group (order by c1) from ft1 where c2 < 10 group by c2 having percentile_cont(c2/10::numeric) within group (order by c1) < 500 order by c2;
                                                                                          QUERY PLAN                                                                                           
-----------------------------------------------------------------------------------------------------------------------------------------------------------------------------------------------
 GroupAggregate
   Output: c2, rank('10'::character varying) WITHIN GROUP (ORDER BY c6), percentile_cont((((c2)::numeric / '10'::numeric))::double precision) WITHIN GROUP (ORDER BY ((c1)::double precision))
   Group Key: ft1.c2
   Filter: (percentile_cont((((ft1.c2)::numeric / '10'::numeric))::double precision) WITHIN GROUP (ORDER BY ((ft1.c1)::double precision)) < '500'::double precision)
   ->  Sort
         Output: c2, c6, c1
         Sort Key: ft1.c2
         ->  Foreign Scan on public.ft1
               Output: c2, c6, c1
               Remote SQL: SELECT `C_1`, c2, c6 FROM odbc_fdw_post.`T1` WHERE ((c2 < 10))
(10 rows)

--Testcase 268:
select c2, rank('10'::varchar) within group (order by c6), percentile_cont(c2/10::numeric) within group (order by c1) from ft1 where c2 < 10 group by c2 having percentile_cont(c2/10::numeric) within group (order by c1) < 500 order by c2;
 c2 | rank | percentile_cont 
----+------+-----------------
  0 |  101 |              10
  1 |  101 |             100
  2 |    1 |             200
  3 |    1 |             300
  4 |    1 |             400
(5 rows)

-- Using multiple arguments within aggregates
--Testcase 269:
explain (verbose, costs off)
select c1, rank(c1, c2) within group (order by c1, c2) from ft1 group by c1, c2 having c1 = 6 order by 1;
                                       QUERY PLAN                                       
----------------------------------------------------------------------------------------
 GroupAggregate
   Output: c1, rank(c1, c2) WITHIN GROUP (ORDER BY c1, c2), c2
   Group Key: ft1.c1, ft1.c2
   ->  Sort
         Output: c1, c2
         Sort Key: ft1.c2
         ->  Foreign Scan on public.ft1
               Output: c1, c2
               Remote SQL: SELECT `C_1`, c2 FROM odbc_fdw_post.`T1` WHERE ((`C_1` = 6))
(9 rows)

--Testcase 270:
select c1, rank(c1, c2) within group (order by c1, c2) from ft1 group by c1, c2 having c1 = 6 order by 1;
 c1 | rank 
----+------
  6 |    1
(1 row)

-- User defined function for user defined aggregate, VARIADIC
--Testcase 271:
create function least_accum(anyelement, variadic anyarray)
returns anyelement language sql as
  'select least($1, min($2[i])) from generate_subscripts($2,1) g(i)';
--Testcase 272:
create aggregate least_agg(variadic items anyarray) (
  stype = anyelement, sfunc = least_accum
);
-- Disable hash aggregation for plan stability.
--Testcase 273:
set enable_hashagg to false;
-- Not pushed down due to user defined aggregate
--Testcase 274:
explain (verbose, costs off)
select c2, least_agg(c1) from ft1 group by c2 order by c2;
                             QUERY PLAN                             
--------------------------------------------------------------------
 GroupAggregate
   Output: c2, least_agg(VARIADIC ARRAY[c1])
   Group Key: ft1.c2
   ->  Sort
         Output: c2, c1
         Sort Key: ft1.c2
         ->  Foreign Scan on public.ft1
               Output: c2, c1
               Remote SQL: SELECT `C_1`, c2 FROM odbc_fdw_post.`T1`
(9 rows)

-- Add function and aggregate into extension
--Testcase 275:
alter extension :DB_EXTENSIONNAME add function least_accum(anyelement, variadic anyarray);
--Testcase 276:
alter extension :DB_EXTENSIONNAME add aggregate least_agg(variadic items anyarray);
-- alter server :DB_SERVERNAME options (set extensions :DB_EXTENSIONNAME);
-- Now aggregate will be pushed.  Aggregate will display VARIADIC argument.
--Testcase 277:
explain (verbose, costs off)
select c2, least_agg(c1) from ft1 where c2 < 100 group by c2 order by c2;
                                      QUERY PLAN                                       
---------------------------------------------------------------------------------------
 GroupAggregate
   Output: c2, least_agg(VARIADIC ARRAY[c1])
   Group Key: ft1.c2
   ->  Sort
         Output: c2, c1
         Sort Key: ft1.c2
         ->  Foreign Scan on public.ft1
               Output: c2, c1
               Remote SQL: SELECT `C_1`, c2 FROM odbc_fdw_post.`T1` WHERE ((c2 < 100))
(9 rows)

--Testcase 278:
select c2, least_agg(c1) from ft1 where c2 < 100 group by c2 order by c2;
 c2 | least_agg 
----+-----------
  0 |        10
  1 |         1
  2 |         2
  3 |         3
  4 |         4
  5 |         5
  6 |         6
  7 |         7
  8 |         8
  9 |         9
(10 rows)

-- Remove function and aggregate from extension
--Testcase 279:
alter extension :DB_EXTENSIONNAME drop function least_accum(anyelement, variadic anyarray);
--Testcase 280:
alter extension :DB_EXTENSIONNAME drop aggregate least_agg(variadic items anyarray);
-- alter server :DB_SERVERNAME options (set extensions :DB_EXTENSIONNAME);
-- Not pushed down as we have dropped objects from extension.
--Testcase 281:
explain (verbose, costs off)
select c2, least_agg(c1) from ft1 group by c2 order by c2;
                             QUERY PLAN                             
--------------------------------------------------------------------
 GroupAggregate
   Output: c2, least_agg(VARIADIC ARRAY[c1])
   Group Key: ft1.c2
   ->  Sort
         Output: c2, c1
         Sort Key: ft1.c2
         ->  Foreign Scan on public.ft1
               Output: c2, c1
               Remote SQL: SELECT `C_1`, c2 FROM odbc_fdw_post.`T1`
(9 rows)

-- Cleanup
--Testcase 282:
reset enable_hashagg;
--Testcase 283:
drop aggregate least_agg(variadic items anyarray);
--Testcase 284:
drop function least_accum(anyelement, variadic anyarray);
-- Testing USING OPERATOR() in ORDER BY within aggregate.
-- For this, we need user defined operators along with operator family and
-- operator class.  Create those and then add them in extension.  Note that
-- user defined objects are considered unshippable unless they are part of
-- the extension.
--Testcase 285:
create operator public.<^ (
 leftarg = int4,
 rightarg = int4,
 procedure = int4eq
);
--Testcase 286:
create operator public.=^ (
 leftarg = int4,
 rightarg = int4,
 procedure = int4lt
);
--Testcase 287:
create operator public.>^ (
 leftarg = int4,
 rightarg = int4,
 procedure = int4gt
);
--Testcase 288:
create operator family my_op_family using btree;
--Testcase 289:
create function my_op_cmp(a int, b int) returns int as
  $$begin return btint4cmp(a, b); end $$ language plpgsql;
--Testcase 290:
create operator class my_op_class for type int using btree family my_op_family as
 operator 1 public.<^,
 operator 3 public.=^,
 operator 5 public.>^,
 function 1 my_op_cmp(int, int);
-- This will not be pushed as user defined sort operator is not part of the
-- extension yet.
--Testcase 291:
explain (verbose, costs off)
select array_agg(c1 order by c1 using operator(public.<^)) from ft2 where c2 = 6 and c1 < 100 group by c2;
                                            QUERY PLAN                                             
---------------------------------------------------------------------------------------------------
 GroupAggregate
   Output: array_agg(c1 ORDER BY c1 USING <^ NULLS LAST), c2
   Group Key: ft2.c2
   ->  Foreign Scan on public.ft2
         Output: c1, c2, c3, c4, c5, c6, c7, c8
         Remote SQL: SELECT `C_1`, c2 FROM odbc_fdw_post.`T1` WHERE ((`C_1` < 100)) AND ((c2 = 6))
(6 rows)

-- Update local stats on ft2
ANALYZE ft2;
psql:sql/14.5/ported_postgres_fdw.sql:1118: WARNING:  skipping "ft2" --- cannot analyze this foreign table
-- Add into extension
--Testcase 292:
alter extension :DB_EXTENSIONNAME add operator class my_op_class using btree;
--Testcase 293:
alter extension :DB_EXTENSIONNAME add function my_op_cmp(a int, b int);
--Testcase 294:
alter extension :DB_EXTENSIONNAME add operator family my_op_family using btree;
--Testcase 295:
alter extension :DB_EXTENSIONNAME add operator public.<^(int, int);
--Testcase 296:
alter extension :DB_EXTENSIONNAME add operator public.=^(int, int);
--Testcase 297:
alter extension :DB_EXTENSIONNAME add operator public.>^(int, int);
-- alter server :DB_SERVERNAME options (set extensions :DB_EXTENSIONNAME);
-- Now this will be pushed as sort operator is part of the extension.
--Testcase 298:
explain (verbose, costs off)
select array_agg(c1 order by c1 using operator(public.<^)) from ft2 where c2 = 6 and c1 < 100 group by c2;
                                            QUERY PLAN                                             
---------------------------------------------------------------------------------------------------
 GroupAggregate
   Output: array_agg(c1 ORDER BY c1 USING <^ NULLS LAST), c2
   Group Key: ft2.c2
   ->  Foreign Scan on public.ft2
         Output: c1, c2, c3, c4, c5, c6, c7, c8
         Remote SQL: SELECT `C_1`, c2 FROM odbc_fdw_post.`T1` WHERE ((`C_1` < 100)) AND ((c2 = 6))
(6 rows)

--Testcase 299:
select array_agg(c1 order by c1 using operator(public.<^)) from ft2 where c2 = 6 and c1 < 100 group by c2;
           array_agg            
--------------------------------
 {6,16,26,36,46,56,66,76,86,96}
(1 row)

-- Remove from extension
--Testcase 300:
alter extension :DB_EXTENSIONNAME drop operator class my_op_class using btree;
--Testcase 301:
alter extension :DB_EXTENSIONNAME drop function my_op_cmp(a int, b int);
--Testcase 302:
alter extension :DB_EXTENSIONNAME drop operator family my_op_family using btree;
--Testcase 303:
alter extension :DB_EXTENSIONNAME drop operator public.<^(int, int);
--Testcase 304:
alter extension :DB_EXTENSIONNAME drop operator public.=^(int, int);
--Testcase 305:
alter extension :DB_EXTENSIONNAME drop operator public.>^(int, int);
-- alter server :DB_SERVERNAME options (set extensions :DB_EXTENSIONNAME);
-- This will not be pushed as sort operator is now removed from the extension.
--Testcase 306:
explain (verbose, costs off)
select array_agg(c1 order by c1 using operator(public.<^)) from ft2 where c2 = 6 and c1 < 100 group by c2;
                                            QUERY PLAN                                             
---------------------------------------------------------------------------------------------------
 GroupAggregate
   Output: array_agg(c1 ORDER BY c1 USING <^ NULLS LAST), c2
   Group Key: ft2.c2
   ->  Foreign Scan on public.ft2
         Output: c1, c2, c3, c4, c5, c6, c7, c8
         Remote SQL: SELECT `C_1`, c2 FROM odbc_fdw_post.`T1` WHERE ((`C_1` < 100)) AND ((c2 = 6))
(6 rows)

-- Cleanup
--Testcase 307:
drop operator class my_op_class using btree;
--Testcase 308:
drop function my_op_cmp(a int, b int);
--Testcase 309:
drop operator family my_op_family using btree;
--Testcase 310:
drop operator public.>^(int, int);
--Testcase 311:
drop operator public.=^(int, int);
--Testcase 312:
drop operator public.<^(int, int);
-- Input relation to aggregate push down hook is not safe to pushdown and thus
-- the aggregate cannot be pushed down to foreign server.
--Testcase 313:
explain (verbose, costs off)
select count(t1.c3) from ft2 t1 left join ft2 t2 on (t1.c1 = random() * t2.c2);
                                        QUERY PLAN                                         
-------------------------------------------------------------------------------------------
 Aggregate
   Output: count(t1.c3)
   ->  Nested Loop Left Join
         Output: t1.c3
         Join Filter: ((t1.c1)::double precision = (random() * (t2.c2)::double precision))
         ->  Foreign Scan on public.ft2 t1
               Output: t1.c1, t1.c2, t1.c3, t1.c4, t1.c5, t1.c6, t1.c7, t1.c8
               Remote SQL: SELECT `C_1`, c3 FROM odbc_fdw_post.`T1`
         ->  Materialize
               Output: t2.c2
               ->  Foreign Scan on public.ft2 t2
                     Output: t2.c2
                     Remote SQL: SELECT c2 FROM odbc_fdw_post.`T1`
(13 rows)

-- Subquery in FROM clause having aggregate
--Testcase 314:
explain (verbose, costs off)
select count(*), x.b from ft1, (select c2 a, sum(c1) b from ft1 group by c2) x where ft1.c2 = x.a group by x.b order by 1, 2;
                                                          QUERY PLAN                                                          
------------------------------------------------------------------------------------------------------------------------------
 Sort
   Output: (count(*)), x.b
   Sort Key: (count(*)), x.b
   ->  HashAggregate
         Output: count(*), x.b
         Group Key: x.b
         ->  Hash Join
               Output: x.b
               Inner Unique: true
               Hash Cond: (ft1.c2 = x.a)
               ->  Foreign Scan on public.ft1
                     Output: ft1.c1, ft1.c2, ft1.c3, ft1.c4, ft1.c5, ft1.c6, ft1.c7, ft1.c8
                     Remote SQL: SELECT c2 FROM odbc_fdw_post.`T1`
               ->  Hash
                     Output: x.b, x.a
                     ->  Subquery Scan on x
                           Output: x.b, x.a
                           ->  HashAggregate
                                 Output: ft1_1.c2, sum(ft1_1.c1)
                                 Group Key: ft1_1.c2
                                 ->  Foreign Scan on public.ft1 ft1_1
                                       Output: ft1_1.c1, ft1_1.c2, ft1_1.c3, ft1_1.c4, ft1_1.c5, ft1_1.c6, ft1_1.c7, ft1_1.c8
                                       Remote SQL: SELECT `C_1`, c2 FROM odbc_fdw_post.`T1`
(23 rows)

--Testcase 315:
select count(*), x.b from ft1, (select c2 a, sum(c1) b from ft1 group by c2) x where ft1.c2 = x.a group by x.b order by 1, 2;
 count |   b   
-------+-------
   100 | 49600
   100 | 49700
   100 | 49800
   100 | 49900
   100 | 50000
   100 | 50100
   100 | 50200
   100 | 50300
   100 | 50400
   100 | 50500
(10 rows)

-- FULL join with IS NULL check in HAVING
--Testcase 316:
explain (verbose, costs off)
select avg(t1.c1), sum(t2.c1) from ft4 t1 full join ft5 t2 on (t1.c1 = t2.c1) group by t2.c1 having (avg(t1.c1) is null and sum(t2.c1) < 10) or sum(t2.c1) is null order by 1 nulls last, 2;
                                       QUERY PLAN                                       
----------------------------------------------------------------------------------------
 Sort
   Output: (avg(t1.c1)), (sum(t2.c1)), t2.c1
   Sort Key: (avg(t1.c1)), (sum(t2.c1))
   ->  HashAggregate
         Output: avg(t1.c1), sum(t2.c1), t2.c1
         Group Key: t2.c1
         Filter: (((avg(t1.c1) IS NULL) AND (sum(t2.c1) < 10)) OR (sum(t2.c1) IS NULL))
         ->  Hash Full Join
               Output: t2.c1, t1.c1
               Hash Cond: (t1.c1 = t2.c1)
               ->  Foreign Scan on public.ft4 t1
                     Output: t1.c1, t1.c2, t1.c3
                     Remote SQL: SELECT c1 FROM odbc_fdw_post.`T3`
               ->  Hash
                     Output: t2.c1
                     ->  Foreign Scan on public.ft5 t2
                           Output: t2.c1
                           Remote SQL: SELECT c1 FROM odbc_fdw_post.`T4`
(18 rows)

--Testcase 317:
select avg(t1.c1), sum(t2.c1) from ft4 t1 full join ft5 t2 on (t1.c1 = t2.c1) group by t2.c1 having (avg(t1.c1) is null and sum(t2.c1) < 10) or sum(t2.c1) is null order by 1 nulls last, 2;
         avg         | sum 
---------------------+-----
 51.0000000000000000 |    
                     |   3
                     |   9
(3 rows)

-- Aggregate over FULL join needing to deparse the joining relations as
-- subqueries.
--Testcase 318:
explain (verbose, costs off)
select count(*), sum(t1.c1), avg(t2.c1) from (select c1 from ft4 where c1 between 50 and 60) t1 full join (select c1 from ft5 where c1 between 50 and 60) t2 on (t1.c1 = t2.c1);
                                              QUERY PLAN                                               
-------------------------------------------------------------------------------------------------------
 Aggregate
   Output: count(*), sum(ft4.c1), avg(ft5.c1)
   ->  Hash Full Join
         Output: ft4.c1, ft5.c1
         Hash Cond: (ft4.c1 = ft5.c1)
         ->  Foreign Scan on public.ft4
               Output: ft4.c1, ft4.c2, ft4.c3
               Remote SQL: SELECT c1 FROM odbc_fdw_post.`T3` WHERE ((c1 >= 50)) AND ((c1 <= 60))
         ->  Hash
               Output: ft5.c1
               ->  Foreign Scan on public.ft5
                     Output: ft5.c1
                     Remote SQL: SELECT c1 FROM odbc_fdw_post.`T4` WHERE ((c1 >= 50)) AND ((c1 <= 60))
(13 rows)

--Testcase 319:
select count(*), sum(t1.c1), avg(t2.c1) from (select c1 from ft4 where c1 between 50 and 60) t1 full join (select c1 from ft5 where c1 between 50 and 60) t2 on (t1.c1 = t2.c1);
 count | sum |         avg         
-------+-----+---------------------
     8 | 330 | 55.5000000000000000
(1 row)

-- ORDER BY expression is part of the target list but not pushed down to
-- foreign server.
--Testcase 320:
explain (verbose, costs off)
select sum(c2) * (random() <= 1)::int as sum from ft1 order by 1;
                                   QUERY PLAN                                   
--------------------------------------------------------------------------------
 Sort
   Output: (((sum(c2)) * ((random() <= '1'::double precision))::integer))
   Sort Key: (((sum(ft1.c2)) * ((random() <= '1'::double precision))::integer))
   ->  Foreign Scan
         Output: ((sum(c2)) * ((random() <= '1'::double precision))::integer)
         Remote SQL: SELECT sum(c2) FROM odbc_fdw_post.`T1`
(6 rows)

--Testcase 321:
select sum(c2) * (random() <= 1)::int as sum from ft1 order by 1;
 sum  
------
 4500
(1 row)

-- LATERAL join, with parameterization
--Testcase 322:
set enable_hashagg to false;
--Testcase 323:
explain (verbose, costs off)
select c2, sum from "S 1"."T1" t1, lateral (select sum(t2.c1 + t1."C_1") sum from ft2 t2 group by t2.c1) qry where t1.c2 * 2 = qry.sum and t1.c2 < 3 and t1."C_1" < 100 order by 1;
                                               QUERY PLAN                                                
---------------------------------------------------------------------------------------------------------
 Sort
   Output: t1.c2, qry.sum
   Sort Key: t1.c2
   ->  Nested Loop
         Output: t1.c2, qry.sum
         ->  Foreign Scan on "S 1"."T1" t1
               Output: t1."C_1", t1.c2, t1.c3, t1.c4, t1.c5, t1.c6, t1.c7, t1.c8
               Remote SQL: SELECT `C_1`, c2 FROM odbc_fdw_post.`T1` WHERE ((c2 < 3)) AND ((`C_1` < 100))
         ->  Subquery Scan on qry
               Output: qry.sum, t2.c1
               Filter: ((t1.c2 * 2) = qry.sum)
               ->  GroupAggregate
                     Output: sum((t2.c1 + t1."C_1")), t2.c1
                     Group Key: t2.c1
                     ->  Sort
                           Output: t2.c1
                           Sort Key: t2.c1
                           ->  Foreign Scan on public.ft2 t2
                                 Output: t2.c1
                                 Remote SQL: SELECT `C_1` FROM odbc_fdw_post.`T1`
(20 rows)

--Testcase 324:
select c2, sum from "S 1"."T1" t1, lateral (select sum(t2.c1 + t1."C_1") sum from ft2 t2 group by t2.c1) qry where t1.c2 * 2 = qry.sum and t1.c2 < 3 and t1."C_1" < 100 order by 1;
 c2 | sum 
----+-----
  1 |   2
  2 |   4
(2 rows)

--Testcase 325:
reset enable_hashagg;
-- bug #15613: bad plan for foreign table scan with lateral reference
--Testcase 326:
EXPLAIN (VERBOSE, COSTS OFF)
SELECT ref_0.c2, subq_1.*
FROM
    "S 1"."T1" AS ref_0,
    LATERAL (
        SELECT ref_0."C_1" c1, subq_0.*
        FROM (SELECT ref_0.c2, ref_1.c3
              FROM ft1 AS ref_1) AS subq_0
             RIGHT JOIN ft2 AS ref_3 ON (subq_0.c3 = ref_3.c3)
    ) AS subq_1
WHERE ref_0."C_1" < 10 AND subq_1.c3 = '00001'
ORDER BY ref_0."C_1";
                                                  QUERY PLAN                                                   
---------------------------------------------------------------------------------------------------------------
 Sort
   Output: ref_0.c2, ref_0."C_1", (ref_0.c2), ref_1.c3, ref_0."C_1"
   Sort Key: ref_0."C_1"
   ->  Nested Loop
         Output: ref_0.c2, ref_0."C_1", (ref_0.c2), ref_1.c3, ref_0."C_1"
         ->  Nested Loop
               Output: ref_0.c2, ref_0."C_1", ref_1.c3, (ref_0.c2)
               ->  Foreign Scan on "S 1"."T1" ref_0
                     Output: ref_0."C_1", ref_0.c2, ref_0.c3, ref_0.c4, ref_0.c5, ref_0.c6, ref_0.c7, ref_0.c8
                     Remote SQL: SELECT `C_1`, c2 FROM odbc_fdw_post.`T1` WHERE ((`C_1` < 10))
               ->  Foreign Scan on public.ft1 ref_1
                     Output: ref_1.c3, ref_0.c2
                     Remote SQL: SELECT c3 FROM odbc_fdw_post.`T1` WHERE ((c3 = '00001'))
         ->  Materialize
               Output: ref_3.c3
               ->  Foreign Scan on public.ft2 ref_3
                     Output: ref_3.c3
                     Remote SQL: SELECT c3 FROM odbc_fdw_post.`T1` WHERE ((c3 = '00001'))
(18 rows)

--Testcase 327:
SELECT ref_0.c2, subq_1.*
FROM
    "S 1"."T1" AS ref_0,
    LATERAL (
        SELECT ref_0."C_1" c1, subq_0.*
        FROM (SELECT ref_0.c2, ref_1.c3
              FROM ft1 AS ref_1) AS subq_0
             RIGHT JOIN ft2 AS ref_3 ON (subq_0.c3 = ref_3.c3)
    ) AS subq_1
WHERE ref_0."C_1" < 10 AND subq_1.c3 = '00001'
ORDER BY ref_0."C_1";
 c2 | c1 | c2 |  c3   
----+----+----+-------
  1 |  1 |  1 | 00001
  2 |  2 |  2 | 00001
  3 |  3 |  3 | 00001
  4 |  4 |  4 | 00001
  5 |  5 |  5 | 00001
  6 |  6 |  6 | 00001
  7 |  7 |  7 | 00001
  8 |  8 |  8 | 00001
  9 |  9 |  9 | 00001
(9 rows)

-- Check with placeHolderVars
--Testcase 328:
explain (verbose, costs off)
select sum(q.a), count(q.b) from ft4 left join (select 13, avg(ft1.c1), sum(ft2.c1) from ft1 right join ft2 on (ft1.c1 = ft2.c1)) q(a, b, c) on (ft4.c1 <= q.b);
                                                  QUERY PLAN                                                  
--------------------------------------------------------------------------------------------------------------
 Aggregate
   Output: sum(q.a), count(q.b)
   ->  Nested Loop Left Join
         Output: q.a, q.b
         Inner Unique: true
         Join Filter: ((ft4.c1)::numeric <= q.b)
         ->  Foreign Scan on public.ft4
               Output: ft4.c1, ft4.c2, ft4.c3
               Remote SQL: SELECT c1 FROM odbc_fdw_post.`T3`
         ->  Materialize
               Output: q.a, q.b
               ->  Subquery Scan on q
                     Output: q.a, q.b
                     ->  Aggregate
                           Output: 13, avg(ft1.c1), NULL::bigint
                           ->  Hash Left Join
                                 Output: ft1.c1
                                 Hash Cond: (ft2.c1 = ft1.c1)
                                 ->  Foreign Scan on public.ft2
                                       Output: ft2.c1, ft2.c2, ft2.c3, ft2.c4, ft2.c5, ft2.c6, ft2.c7, ft2.c8
                                       Remote SQL: SELECT `C_1` FROM odbc_fdw_post.`T1`
                                 ->  Hash
                                       Output: ft1.c1
                                       ->  Foreign Scan on public.ft1
                                             Output: ft1.c1
                                             Remote SQL: SELECT `C_1` FROM odbc_fdw_post.`T1`
(26 rows)

--Testcase 329:
select sum(q.a), count(q.b) from ft4 left join (select 13, avg(ft1.c1), sum(ft2.c1) from ft1 right join ft2 on (ft1.c1 = ft2.c1)) q(a, b, c) on (ft4.c1 <= q.b);
 sum | count 
-----+-------
 650 |    50
(1 row)

-- Not supported cases
-- Grouping sets
--Testcase 330:
explain (verbose, costs off)
select c2, sum(c1) from ft1 where c2 < 3 group by rollup(c2) order by 1 nulls last;
                                     QUERY PLAN                                      
-------------------------------------------------------------------------------------
 Sort
   Output: c2, (sum(c1))
   Sort Key: ft1.c2
   ->  MixedAggregate
         Output: c2, sum(c1)
         Hash Key: ft1.c2
         Group Key: ()
         ->  Foreign Scan on public.ft1
               Output: c1, c2, c3, c4, c5, c6, c7, c8
               Remote SQL: SELECT `C_1`, c2 FROM odbc_fdw_post.`T1` WHERE ((c2 < 3))
(10 rows)

--Testcase 331:
select c2, sum(c1) from ft1 where c2 < 3 group by rollup(c2) order by 1 nulls last;
 c2 |  sum   
----+--------
  0 |  50500
  1 |  49600
  2 |  49700
    | 149800
(4 rows)

--Testcase 332:
explain (verbose, costs off)
select c2, sum(c1) from ft1 where c2 < 3 group by cube(c2) order by 1 nulls last;
                                     QUERY PLAN                                      
-------------------------------------------------------------------------------------
 Sort
   Output: c2, (sum(c1))
   Sort Key: ft1.c2
   ->  MixedAggregate
         Output: c2, sum(c1)
         Hash Key: ft1.c2
         Group Key: ()
         ->  Foreign Scan on public.ft1
               Output: c1, c2, c3, c4, c5, c6, c7, c8
               Remote SQL: SELECT `C_1`, c2 FROM odbc_fdw_post.`T1` WHERE ((c2 < 3))
(10 rows)

--Testcase 333:
select c2, sum(c1) from ft1 where c2 < 3 group by cube(c2) order by 1 nulls last;
 c2 |  sum   
----+--------
  0 |  50500
  1 |  49600
  2 |  49700
    | 149800
(4 rows)

--Testcase 334:
explain (verbose, costs off)
select c2, c6, sum(c1) from ft1 where c2 < 3 group by grouping sets(c2, c6) order by 1 nulls last, 2 nulls last;
                                       QUERY PLAN                                        
-----------------------------------------------------------------------------------------
 Sort
   Output: c2, c6, (sum(c1))
   Sort Key: ft1.c2, ft1.c6
   ->  HashAggregate
         Output: c2, c6, sum(c1)
         Hash Key: ft1.c2
         Hash Key: ft1.c6
         ->  Foreign Scan on public.ft1
               Output: c1, c2, c3, c4, c5, c6, c7, c8
               Remote SQL: SELECT `C_1`, c2, c6 FROM odbc_fdw_post.`T1` WHERE ((c2 < 3))
(10 rows)

--Testcase 335:
select c2, c6, sum(c1) from ft1 where c2 < 3 group by grouping sets(c2, c6) order by 1 nulls last, 2 nulls last;
 c2 | c6 |  sum  
----+----+-------
  0 |    | 50500
  1 |    | 49600
  2 |    | 49700
    | 0  | 50500
    | 1  | 49600
    | 2  | 49700
(6 rows)

--Testcase 336:
explain (verbose, costs off)
select c2, sum(c1), grouping(c2) from ft1 where c2 < 3 group by c2 order by 1 nulls last;
                                     QUERY PLAN                                      
-------------------------------------------------------------------------------------
 Sort
   Output: c2, (sum(c1)), (GROUPING(c2))
   Sort Key: ft1.c2
   ->  HashAggregate
         Output: c2, sum(c1), GROUPING(c2)
         Group Key: ft1.c2
         ->  Foreign Scan on public.ft1
               Output: c1, c2, c3, c4, c5, c6, c7, c8
               Remote SQL: SELECT `C_1`, c2 FROM odbc_fdw_post.`T1` WHERE ((c2 < 3))
(9 rows)

--Testcase 337:
select c2, sum(c1), grouping(c2) from ft1 where c2 < 3 group by c2 order by 1 nulls last;
 c2 |  sum  | grouping 
----+-------+----------
  0 | 50500 |        0
  1 | 49600 |        0
  2 | 49700 |        0
(3 rows)

-- DISTINCT itself is not pushed down, whereas underneath aggregate is pushed
--Testcase 338:
explain (verbose, costs off)
select distinct sum(c1)/1000 s from ft2 where c2 < 6 group by c2 order by 1;
                                        QUERY PLAN                                         
-------------------------------------------------------------------------------------------
 Unique
   Output: ((sum(c1) / 1000)), c2
   ->  Sort
         Output: ((sum(c1) / 1000)), c2
         Sort Key: ((sum(ft2.c1) / 1000))
         ->  HashAggregate
               Output: (sum(c1) / 1000), c2
               Group Key: ft2.c2
               ->  Foreign Scan on public.ft2
                     Output: c1, c2, c3, c4, c5, c6, c7, c8
                     Remote SQL: SELECT `C_1`, c2 FROM odbc_fdw_post.`T1` WHERE ((c2 < 6))
(11 rows)

--Testcase 339:
select distinct sum(c1)/1000 s from ft2 where c2 < 6 group by c2 order by 1;
 s  
----
 49
 50
(2 rows)

-- WindowAgg
--Testcase 340:
explain (verbose, costs off)
select c2, sum(c2), count(c2) over (partition by c2%2) from ft2 where c2 < 10 group by c2 order by 1;
                                        QUERY PLAN                                         
-------------------------------------------------------------------------------------------
 Sort
   Output: c2, (sum(c2)), (count(c2) OVER (?)), ((c2 % 2))
   Sort Key: ft2.c2
   ->  WindowAgg
         Output: c2, (sum(c2)), count(c2) OVER (?), ((c2 % 2))
         ->  Sort
               Output: c2, ((c2 % 2)), (sum(c2))
               Sort Key: ((ft2.c2 % 2))
               ->  HashAggregate
                     Output: c2, (c2 % 2), sum(c2)
                     Group Key: ft2.c2
                     ->  Foreign Scan on public.ft2
                           Output: c1, c2, c3, c4, c5, c6, c7, c8
                           Remote SQL: SELECT c2 FROM odbc_fdw_post.`T1` WHERE ((c2 < 10))
(14 rows)

--Testcase 341:
select c2, sum(c2), count(c2) over (partition by c2%2) from ft2 where c2 < 10 group by c2 order by 1;
 c2 | sum | count 
----+-----+-------
  0 |   0 |     5
  1 | 100 |     5
  2 | 200 |     5
  3 | 300 |     5
  4 | 400 |     5
  5 | 500 |     5
  6 | 600 |     5
  7 | 700 |     5
  8 | 800 |     5
  9 | 900 |     5
(10 rows)

--Testcase 342:
explain (verbose, costs off)
select c2, array_agg(c2) over (partition by c2%2 order by c2 desc) from ft1 where c2 < 10 group by c2 order by 1;
                                        QUERY PLAN                                         
-------------------------------------------------------------------------------------------
 Sort
   Output: c2, (array_agg(c2) OVER (?)), ((c2 % 2))
   Sort Key: ft1.c2
   ->  WindowAgg
         Output: c2, array_agg(c2) OVER (?), ((c2 % 2))
         ->  Sort
               Output: c2, ((c2 % 2))
               Sort Key: ((ft1.c2 % 2)), ft1.c2 DESC
               ->  HashAggregate
                     Output: c2, (c2 % 2)
                     Group Key: ft1.c2
                     ->  Foreign Scan on public.ft1
                           Output: c1, c2, c3, c4, c5, c6, c7, c8
                           Remote SQL: SELECT c2 FROM odbc_fdw_post.`T1` WHERE ((c2 < 10))
(14 rows)

--Testcase 343:
select c2, array_agg(c2) over (partition by c2%2 order by c2 desc) from ft1 where c2 < 10 group by c2 order by 1;
 c2 |  array_agg  
----+-------------
  0 | {8,6,4,2,0}
  1 | {9,7,5,3,1}
  2 | {8,6,4,2}
  3 | {9,7,5,3}
  4 | {8,6,4}
  5 | {9,7,5}
  6 | {8,6}
  7 | {9,7}
  8 | {8}
  9 | {9}
(10 rows)

--Testcase 344:
explain (verbose, costs off)
select c2, array_agg(c2) over (partition by c2%2 order by c2 range between current row and unbounded following) from ft1 where c2 < 10 group by c2 order by 1;
                                        QUERY PLAN                                         
-------------------------------------------------------------------------------------------
 Sort
   Output: c2, (array_agg(c2) OVER (?)), ((c2 % 2))
   Sort Key: ft1.c2
   ->  WindowAgg
         Output: c2, array_agg(c2) OVER (?), ((c2 % 2))
         ->  Sort
               Output: c2, ((c2 % 2))
               Sort Key: ((ft1.c2 % 2)), ft1.c2
               ->  HashAggregate
                     Output: c2, (c2 % 2)
                     Group Key: ft1.c2
                     ->  Foreign Scan on public.ft1
                           Output: c1, c2, c3, c4, c5, c6, c7, c8
                           Remote SQL: SELECT c2 FROM odbc_fdw_post.`T1` WHERE ((c2 < 10))
(14 rows)

--Testcase 345:
select c2, array_agg(c2) over (partition by c2%2 order by c2 range between current row and unbounded following) from ft1 where c2 < 10 group by c2 order by 1;
 c2 |  array_agg  
----+-------------
  0 | {0,2,4,6,8}
  1 | {1,3,5,7,9}
  2 | {2,4,6,8}
  3 | {3,5,7,9}
  4 | {4,6,8}
  5 | {5,7,9}
  6 | {6,8}
  7 | {7,9}
  8 | {8}
  9 | {9}
(10 rows)

-- ===================================================================
-- parameterized queries
-- ===================================================================
-- simple join
--Testcase 346:
PREPARE st1(int, int) AS SELECT t1.c3, t2.c3 FROM ft1 t1, ft2 t2 WHERE t1.c1 = $1 AND t2.c1 = $2;
--Testcase 347:
EXPLAIN (VERBOSE, COSTS OFF) EXECUTE st1(1, 2);
                                   QUERY PLAN                                    
---------------------------------------------------------------------------------
 Nested Loop
   Output: t1.c3, t2.c3
   ->  Foreign Scan on public.ft1 t1
         Output: t1.c1, t1.c2, t1.c3, t1.c4, t1.c5, t1.c6, t1.c7, t1.c8
         Remote SQL: SELECT c3 FROM odbc_fdw_post.`T1` WHERE ((`C_1` = 1))
   ->  Materialize
         Output: t2.c3
         ->  Foreign Scan on public.ft2 t2
               Output: t2.c3
               Remote SQL: SELECT c3 FROM odbc_fdw_post.`T1` WHERE ((`C_1` = 2))
(10 rows)

--Testcase 348:
EXECUTE st1(1, 1);
  c3   |  c3   
-------+-------
 00001 | 00001
(1 row)

--Testcase 349:
EXECUTE st1(101, 101);
  c3   |  c3   
-------+-------
 00101 | 00101
(1 row)

-- subquery using stable function (can't be sent to remote)
--Testcase 350:
PREPARE st2(int) AS SELECT * FROM ft1 t1 WHERE t1.c1 < $2 AND t1.c3 IN (SELECT c3 FROM ft2 t2 WHERE c1 > $1 AND date(c4) = '1970-01-17'::date) ORDER BY c1;
--Testcase 351:
EXPLAIN (VERBOSE, COSTS OFF) EXECUTE st2(10, 20);
                                                          QUERY PLAN                                                          
------------------------------------------------------------------------------------------------------------------------------
 Sort
   Output: t1.c1, t1.c2, t1.c3, t1.c4, t1.c5, t1.c6, t1.c7, t1.c8
   Sort Key: t1.c1
   ->  Hash Join
         Output: t1.c1, t1.c2, t1.c3, t1.c4, t1.c5, t1.c6, t1.c7, t1.c8
         Inner Unique: true
         Hash Cond: (t1.c3 = t2.c3)
         ->  Foreign Scan on public.ft1 t1
               Output: t1.c1, t1.c2, t1.c3, t1.c4, t1.c5, t1.c6, t1.c7, t1.c8
               Remote SQL: SELECT `C_1`, c2, c3, c4, c5, c6, c7, c8 FROM odbc_fdw_post.`T1` WHERE ((`C_1` < 20))
         ->  Hash
               Output: t2.c3
               ->  HashAggregate
                     Output: t2.c3
                     Group Key: t2.c3
                     ->  Foreign Scan on public.ft2 t2
                           Output: t2.c3
                           Remote SQL: SELECT c3 FROM odbc_fdw_post.`T1` WHERE ((`C_1` > 10)) AND ((date(c4) = '1970-01-17'))
(18 rows)

--Testcase 352:
EXECUTE st2(10, 20);
 c1 | c2 |  c3   |            c4            |            c5            | c6 |     c7     | c8  
----+----+-------+--------------------------+--------------------------+----+------------+-----
 16 |  6 | 00016 | Sat Jan 17 00:00:00 1970 | Sat Jan 17 00:00:00 1970 | 6  | 6          | foo
(1 row)

--Testcase 353:
EXECUTE st2(101, 121);
 c1  | c2 |  c3   |            c4            |            c5            | c6 |     c7     | c8  
-----+----+-------+--------------------------+--------------------------+----+------------+-----
 116 |  6 | 00116 | Sat Jan 17 00:00:00 1970 | Sat Jan 17 00:00:00 1970 | 6  | 6          | foo
(1 row)

-- subquery using immutable function (can be sent to remote)
--Testcase 354:
PREPARE st3(int) AS SELECT * FROM ft1 t1 WHERE t1.c1 < $2 AND t1.c3 IN (SELECT c3 FROM ft2 t2 WHERE c1 > $1 AND date(c5) = '1970-01-17'::date) ORDER BY c1;
--Testcase 355:
EXPLAIN (VERBOSE, COSTS OFF) EXECUTE st3(10, 20);
                                                          QUERY PLAN                                                          
------------------------------------------------------------------------------------------------------------------------------
 Sort
   Output: t1.c1, t1.c2, t1.c3, t1.c4, t1.c5, t1.c6, t1.c7, t1.c8
   Sort Key: t1.c1
   ->  Hash Join
         Output: t1.c1, t1.c2, t1.c3, t1.c4, t1.c5, t1.c6, t1.c7, t1.c8
         Inner Unique: true
         Hash Cond: (t1.c3 = t2.c3)
         ->  Foreign Scan on public.ft1 t1
               Output: t1.c1, t1.c2, t1.c3, t1.c4, t1.c5, t1.c6, t1.c7, t1.c8
               Remote SQL: SELECT `C_1`, c2, c3, c4, c5, c6, c7, c8 FROM odbc_fdw_post.`T1` WHERE ((`C_1` < 20))
         ->  Hash
               Output: t2.c3
               ->  HashAggregate
                     Output: t2.c3
                     Group Key: t2.c3
                     ->  Foreign Scan on public.ft2 t2
                           Output: t2.c3
                           Remote SQL: SELECT c3 FROM odbc_fdw_post.`T1` WHERE ((`C_1` > 10)) AND ((date(c5) = '1970-01-17'))
(18 rows)

--Testcase 356:
EXECUTE st3(10, 20);
 c1 | c2 |  c3   |            c4            |            c5            | c6 |     c7     | c8  
----+----+-------+--------------------------+--------------------------+----+------------+-----
 16 |  6 | 00016 | Sat Jan 17 00:00:00 1970 | Sat Jan 17 00:00:00 1970 | 6  | 6          | foo
(1 row)

--Testcase 357:
EXECUTE st3(20, 30);
 c1 | c2 | c3 | c4 | c5 | c6 | c7 | c8 
----+----+----+----+----+----+----+----
(0 rows)

-- custom plan should be chosen initially
--Testcase 358:
PREPARE st4(int) AS SELECT * FROM ft1 t1 WHERE t1.c1 = $1;
--Testcase 359:
EXPLAIN (VERBOSE, COSTS OFF) EXECUTE st4(1);
                                             QUERY PLAN                                             
----------------------------------------------------------------------------------------------------
 Foreign Scan on public.ft1 t1
   Output: c1, c2, c3, c4, c5, c6, c7, c8
   Remote SQL: SELECT `C_1`, c2, c3, c4, c5, c6, c7, c8 FROM odbc_fdw_post.`T1` WHERE ((`C_1` = 1))
(3 rows)

--Testcase 360:
EXPLAIN (VERBOSE, COSTS OFF) EXECUTE st4(1);
                                             QUERY PLAN                                             
----------------------------------------------------------------------------------------------------
 Foreign Scan on public.ft1 t1
   Output: c1, c2, c3, c4, c5, c6, c7, c8
   Remote SQL: SELECT `C_1`, c2, c3, c4, c5, c6, c7, c8 FROM odbc_fdw_post.`T1` WHERE ((`C_1` = 1))
(3 rows)

--Testcase 361:
EXPLAIN (VERBOSE, COSTS OFF) EXECUTE st4(1);
                                             QUERY PLAN                                             
----------------------------------------------------------------------------------------------------
 Foreign Scan on public.ft1 t1
   Output: c1, c2, c3, c4, c5, c6, c7, c8
   Remote SQL: SELECT `C_1`, c2, c3, c4, c5, c6, c7, c8 FROM odbc_fdw_post.`T1` WHERE ((`C_1` = 1))
(3 rows)

--Testcase 362:
EXPLAIN (VERBOSE, COSTS OFF) EXECUTE st4(1);
                                             QUERY PLAN                                             
----------------------------------------------------------------------------------------------------
 Foreign Scan on public.ft1 t1
   Output: c1, c2, c3, c4, c5, c6, c7, c8
   Remote SQL: SELECT `C_1`, c2, c3, c4, c5, c6, c7, c8 FROM odbc_fdw_post.`T1` WHERE ((`C_1` = 1))
(3 rows)

--Testcase 363:
EXPLAIN (VERBOSE, COSTS OFF) EXECUTE st4(1);
                                             QUERY PLAN                                             
----------------------------------------------------------------------------------------------------
 Foreign Scan on public.ft1 t1
   Output: c1, c2, c3, c4, c5, c6, c7, c8
   Remote SQL: SELECT `C_1`, c2, c3, c4, c5, c6, c7, c8 FROM odbc_fdw_post.`T1` WHERE ((`C_1` = 1))
(3 rows)

-- once we try it enough times, should switch to generic plan
--Testcase 364:
EXPLAIN (VERBOSE, COSTS OFF) EXECUTE st4(1);
                                   QUERY PLAN                                   
--------------------------------------------------------------------------------
 Foreign Scan on public.ft1 t1
   Output: c1, c2, c3, c4, c5, c6, c7, c8
   Filter: (t1.c1 = $1)
   Remote SQL: SELECT `C_1`, c2, c3, c4, c5, c6, c7, c8 FROM odbc_fdw_post.`T1`
(4 rows)

-- value of $1 should not be sent to remote
--Testcase 365:
PREPARE st5(text,int) AS SELECT * FROM ft1 t1 WHERE c8 = $1 and c1 = $2;
--Testcase 366:
EXPLAIN (VERBOSE, COSTS OFF) EXECUTE st5('foo', 1);
                                                      QUERY PLAN                                                       
-----------------------------------------------------------------------------------------------------------------------
 Foreign Scan on public.ft1 t1
   Output: c1, c2, c3, c4, c5, c6, c7, c8
   Remote SQL: SELECT `C_1`, c2, c3, c4, c5, c6, c7, c8 FROM odbc_fdw_post.`T1` WHERE ((c8 = 'foo')) AND ((`C_1` = 1))
(3 rows)

--Testcase 367:
EXPLAIN (VERBOSE, COSTS OFF) EXECUTE st5('foo', 1);
                                                      QUERY PLAN                                                       
-----------------------------------------------------------------------------------------------------------------------
 Foreign Scan on public.ft1 t1
   Output: c1, c2, c3, c4, c5, c6, c7, c8
   Remote SQL: SELECT `C_1`, c2, c3, c4, c5, c6, c7, c8 FROM odbc_fdw_post.`T1` WHERE ((c8 = 'foo')) AND ((`C_1` = 1))
(3 rows)

--Testcase 368:
EXPLAIN (VERBOSE, COSTS OFF) EXECUTE st5('foo', 1);
                                                      QUERY PLAN                                                       
-----------------------------------------------------------------------------------------------------------------------
 Foreign Scan on public.ft1 t1
   Output: c1, c2, c3, c4, c5, c6, c7, c8
   Remote SQL: SELECT `C_1`, c2, c3, c4, c5, c6, c7, c8 FROM odbc_fdw_post.`T1` WHERE ((c8 = 'foo')) AND ((`C_1` = 1))
(3 rows)

--Testcase 369:
EXPLAIN (VERBOSE, COSTS OFF) EXECUTE st5('foo', 1);
                                                      QUERY PLAN                                                       
-----------------------------------------------------------------------------------------------------------------------
 Foreign Scan on public.ft1 t1
   Output: c1, c2, c3, c4, c5, c6, c7, c8
   Remote SQL: SELECT `C_1`, c2, c3, c4, c5, c6, c7, c8 FROM odbc_fdw_post.`T1` WHERE ((c8 = 'foo')) AND ((`C_1` = 1))
(3 rows)

--Testcase 370:
EXPLAIN (VERBOSE, COSTS OFF) EXECUTE st5('foo', 1);
                                                      QUERY PLAN                                                       
-----------------------------------------------------------------------------------------------------------------------
 Foreign Scan on public.ft1 t1
   Output: c1, c2, c3, c4, c5, c6, c7, c8
   Remote SQL: SELECT `C_1`, c2, c3, c4, c5, c6, c7, c8 FROM odbc_fdw_post.`T1` WHERE ((c8 = 'foo')) AND ((`C_1` = 1))
(3 rows)

--Testcase 371:
EXPLAIN (VERBOSE, COSTS OFF) EXECUTE st5('foo', 1);
                                   QUERY PLAN                                   
--------------------------------------------------------------------------------
 Foreign Scan on public.ft1 t1
   Output: c1, c2, c3, c4, c5, c6, c7, c8
   Filter: ((t1.c8 = $1) AND (t1.c1 = $2))
   Remote SQL: SELECT `C_1`, c2, c3, c4, c5, c6, c7, c8 FROM odbc_fdw_post.`T1`
(4 rows)

--Testcase 372:
EXECUTE st5('foo', 1);
 c1 | c2 |  c3   |            c4            |            c5            | c6 |     c7     | c8  
----+----+-------+--------------------------+--------------------------+----+------------+-----
  1 |  1 | 00001 | Fri Jan 02 00:00:00 1970 | Fri Jan 02 00:00:00 1970 | 1  | 1          | foo
(1 row)

-- altering FDW options requires replanning
--Testcase 373:
PREPARE st6 AS SELECT * FROM ft1 t1 WHERE t1.c1 = t1.c2;
--Testcase 374:
EXPLAIN (VERBOSE, COSTS OFF) EXECUTE st6;
                                             QUERY PLAN                                              
-----------------------------------------------------------------------------------------------------
 Foreign Scan on public.ft1 t1
   Output: c1, c2, c3, c4, c5, c6, c7, c8
   Remote SQL: SELECT `C_1`, c2, c3, c4, c5, c6, c7, c8 FROM odbc_fdw_post.`T1` WHERE ((`C_1` = c2))
(3 rows)

--Testcase 375:
PREPARE st7 AS INSERT INTO ft1 (c1,c2,c3) VALUES (1001,101,'foo');
--Testcase 376:
EXPLAIN (VERBOSE, COSTS OFF) EXECUTE st7;
                                                                                   QUERY PLAN                                                                                   
--------------------------------------------------------------------------------------------------------------------------------------------------------------------------------
 Insert on public.ft1
   Remote SQL: INSERT INTO odbc_fdw_post.`T1`(`C_1`, c2, c3, c4, c5, c6, c7, c8) VALUES (?, ?, ?, ?, ?, ?, ?, ?)
   ->  Result
         Output: 1001, 101, 'foo'::text, NULL::timestamp without time zone, NULL::timestamp without time zone, NULL::character varying, 'ft1       '::character(10), NULL::text
(4 rows)

-- ALTER TABLE "S 1"."T1" RENAME TO "T 0";
-- ALTER FOREIGN TABLE ft1 OPTIONS (SET table 'T 0');
--Testcase 377:
EXPLAIN (VERBOSE, COSTS OFF) EXECUTE st6;
                                             QUERY PLAN                                              
-----------------------------------------------------------------------------------------------------
 Foreign Scan on public.ft1 t1
   Output: c1, c2, c3, c4, c5, c6, c7, c8
   Remote SQL: SELECT `C_1`, c2, c3, c4, c5, c6, c7, c8 FROM odbc_fdw_post.`T1` WHERE ((`C_1` = c2))
(3 rows)

--Testcase 378:
EXECUTE st6;
 c1 | c2 |  c3   |            c4            |            c5            | c6 |     c7     | c8  
----+----+-------+--------------------------+--------------------------+----+------------+-----
  1 |  1 | 00001 | Fri Jan 02 00:00:00 1970 | Fri Jan 02 00:00:00 1970 | 1  | 1          | foo
  2 |  2 | 00002 | Sat Jan 03 00:00:00 1970 | Sat Jan 03 00:00:00 1970 | 2  | 2          | foo
  3 |  3 | 00003 | Sun Jan 04 00:00:00 1970 | Sun Jan 04 00:00:00 1970 | 3  | 3          | foo
  4 |  4 | 00004 | Mon Jan 05 00:00:00 1970 | Mon Jan 05 00:00:00 1970 | 4  | 4          | foo
  5 |  5 | 00005 | Tue Jan 06 00:00:00 1970 | Tue Jan 06 00:00:00 1970 | 5  | 5          | foo
  6 |  6 | 00006 | Wed Jan 07 00:00:00 1970 | Wed Jan 07 00:00:00 1970 | 6  | 6          | foo
  7 |  7 | 00007 | Thu Jan 08 00:00:00 1970 | Thu Jan 08 00:00:00 1970 | 7  | 7          | foo
  8 |  8 | 00008 | Fri Jan 09 00:00:00 1970 | Fri Jan 09 00:00:00 1970 | 8  | 8          | foo
  9 |  9 | 00009 | Sat Jan 10 00:00:00 1970 | Sat Jan 10 00:00:00 1970 | 9  | 9          | foo
(9 rows)

--Testcase 379:
EXPLAIN (VERBOSE, COSTS OFF) EXECUTE st7;
                                                                                   QUERY PLAN                                                                                   
--------------------------------------------------------------------------------------------------------------------------------------------------------------------------------
 Insert on public.ft1
   Remote SQL: INSERT INTO odbc_fdw_post.`T1`(`C_1`, c2, c3, c4, c5, c6, c7, c8) VALUES (?, ?, ?, ?, ?, ?, ?, ?)
   ->  Result
         Output: 1001, 101, 'foo'::text, NULL::timestamp without time zone, NULL::timestamp without time zone, NULL::character varying, 'ft1       '::character(10), NULL::text
(4 rows)

-- ALTER TABLE "S 1"."T 0" RENAME TO T1;
-- ALTER FOREIGN TABLE ft1 OPTIONS (SET table 'T1');
--Testcase 380:
PREPARE st8 AS SELECT count(c3) FROM ft1 t1 WHERE t1.c1 === t1.c2;
--Testcase 381:
EXPLAIN (VERBOSE, COSTS OFF) EXECUTE st8;
                            QUERY PLAN                            
------------------------------------------------------------------
 Aggregate
   Output: count(c3)
   ->  Foreign Scan on public.ft1 t1
         Output: c1, c2, c3, c4, c5, c6, c7, c8
         Filter: (t1.c1 === t1.c2)
         Remote SQL: SELECT `C_1`, c2, c3 FROM odbc_fdw_post.`T1`
(6 rows)

-- ALTER SERVER :DB_SERVERNAME OPTIONS (DROP extensions);
--Testcase 382:
EXPLAIN (VERBOSE, COSTS OFF) EXECUTE st8;
                            QUERY PLAN                            
------------------------------------------------------------------
 Aggregate
   Output: count(c3)
   ->  Foreign Scan on public.ft1 t1
         Output: c1, c2, c3, c4, c5, c6, c7, c8
         Filter: (t1.c1 === t1.c2)
         Remote SQL: SELECT `C_1`, c2, c3 FROM odbc_fdw_post.`T1`
(6 rows)

--Testcase 383:
EXECUTE st8;
 count 
-------
     9
(1 row)

-- ALTER SERVER :DB_SERVERNAME OPTIONS (ADD extensions :DB_EXTENSIONNAME);
-- cleanup
DEALLOCATE st1;
DEALLOCATE st2;
DEALLOCATE st3;
DEALLOCATE st4;
DEALLOCATE st5;
DEALLOCATE st6;
DEALLOCATE st7;
DEALLOCATE st8;
-- System columns, except ctid and oid, should not be sent to remote
--Testcase 384:
EXPLAIN (VERBOSE, COSTS OFF)
SELECT * FROM ft1 t1 WHERE t1.tableoid = 'pg_class'::regclass LIMIT 1;
                                      QUERY PLAN                                      
--------------------------------------------------------------------------------------
 Limit
   Output: c1, c2, c3, c4, c5, c6, c7, c8
   ->  Foreign Scan on public.ft1 t1
         Output: c1, c2, c3, c4, c5, c6, c7, c8
         Filter: (t1.tableoid = '1259'::oid)
         Remote SQL: SELECT `C_1`, c2, c3, c4, c5, c6, c7, c8 FROM odbc_fdw_post.`T1`
(6 rows)

--Testcase 385:
SELECT * FROM ft1 t1 WHERE t1.tableoid = 'ft1'::regclass LIMIT 1;
 c1 | c2 |  c3   |            c4            |            c5            | c6 |     c7     | c8  
----+----+-------+--------------------------+--------------------------+----+------------+-----
  1 |  1 | 00001 | Fri Jan 02 00:00:00 1970 | Fri Jan 02 00:00:00 1970 | 1  | 1          | foo
(1 row)

--Testcase 386:
EXPLAIN (VERBOSE, COSTS OFF)
SELECT tableoid::regclass, * FROM ft1 t1 LIMIT 1;
                                      QUERY PLAN                                      
--------------------------------------------------------------------------------------
 Limit
   Output: ((tableoid)::regclass), c1, c2, c3, c4, c5, c6, c7, c8
   ->  Foreign Scan on public.ft1 t1
         Output: (tableoid)::regclass, c1, c2, c3, c4, c5, c6, c7, c8
         Remote SQL: SELECT `C_1`, c2, c3, c4, c5, c6, c7, c8 FROM odbc_fdw_post.`T1`
(5 rows)

--Testcase 387:
SELECT tableoid::regclass, * FROM ft1 t1 LIMIT 1;
 tableoid | c1 | c2 |  c3   |            c4            |            c5            | c6 |     c7     | c8  
----------+----+----+-------+--------------------------+--------------------------+----+------------+-----
 ft1      |  1 |  1 | 00001 | Fri Jan 02 00:00:00 1970 | Fri Jan 02 00:00:00 1970 | 1  | 1          | foo
(1 row)

--Testcase 388:
EXPLAIN (VERBOSE, COSTS OFF)
SELECT * FROM ft1 t1 WHERE t1.ctid = '(0,2)';
                                   QUERY PLAN                                   
--------------------------------------------------------------------------------
 Foreign Scan on public.ft1 t1
   Output: c1, c2, c3, c4, c5, c6, c7, c8
   Filter: (t1.ctid = '(0,2)'::tid)
   Remote SQL: SELECT `C_1`, c2, c3, c4, c5, c6, c7, c8 FROM odbc_fdw_post.`T1`
(4 rows)

-- Does not support system column ctid
--Testcase 389:
SELECT * FROM ft1 t1 WHERE t1.ctid = '(0,2)';
 c1 | c2 | c3 | c4 | c5 | c6 | c7 | c8 
----+----+----+----+----+----+----+----
(0 rows)

--Testcase 390:
EXPLAIN (VERBOSE, COSTS OFF)
SELECT ctid, * FROM ft1 t1 LIMIT 1;
                                      QUERY PLAN                                      
--------------------------------------------------------------------------------------
 Limit
   Output: ctid, c1, c2, c3, c4, c5, c6, c7, c8
   ->  Foreign Scan on public.ft1 t1
         Output: ctid, c1, c2, c3, c4, c5, c6, c7, c8
         Remote SQL: SELECT `C_1`, c2, c3, c4, c5, c6, c7, c8 FROM odbc_fdw_post.`T1`
(5 rows)

--Testcase 391:
SELECT ctid, * FROM ft1 t1 LIMIT 1;
      ctid      | c1 | c2 |  c3   |            c4            |            c5            | c6 |     c7     | c8  
----------------+----+----+-------+--------------------------+--------------------------+----+------------+-----
 (4294967295,0) |  1 |  1 | 00001 | Fri Jan 02 00:00:00 1970 | Fri Jan 02 00:00:00 1970 | 1  | 1          | foo
(1 row)

-- ===================================================================
-- used in PL/pgSQL function
-- ===================================================================
--Testcase 392:
CREATE OR REPLACE FUNCTION f_test(p_c1 int) RETURNS int AS $$
DECLARE
	v_c1 int;
BEGIN
--Testcase 393:
    SELECT c1 INTO v_c1 FROM ft1 WHERE c1 = p_c1 LIMIT 1;
    PERFORM c1 FROM ft1 WHERE c1 = p_c1 AND p_c1 = v_c1 LIMIT 1;
    RETURN v_c1;
END;
$$ LANGUAGE plpgsql;
--Testcase 394:
SELECT f_test(100);
 f_test 
--------
    100
(1 row)

--Testcase 395:
DROP FUNCTION f_test(int);
-- ===================================================================
-- REINDEX
-- ===================================================================
-- remote table is not created here
--Testcase 396:
CREATE FOREIGN TABLE reindex_foreign (c1 int, c2 int)
  SERVER :DB_SERVERNAME2 OPTIONS (schema :DB_SCHEMA_PORT_TEST, table 'reindex_local');
REINDEX TABLE reindex_foreign; -- error
psql:sql/14.5/ported_postgres_fdw.sql:1461: ERROR:  "reindex_foreign" is not a table or materialized view
REINDEX TABLE CONCURRENTLY reindex_foreign; -- error
psql:sql/14.5/ported_postgres_fdw.sql:1462: ERROR:  "reindex_foreign" is not a table or materialized view
--Testcase 397:
DROP FOREIGN TABLE reindex_foreign;
-- partitions and foreign tables
--Testcase 398:
CREATE TABLE reind_fdw_parent (c1 int) PARTITION BY RANGE (c1);
--Testcase 399:
CREATE TABLE reind_fdw_0_10 PARTITION OF reind_fdw_parent
  FOR VALUES FROM (0) TO (10);
--Testcase 400:
CREATE FOREIGN TABLE reind_fdw_10_20 PARTITION OF reind_fdw_parent
  FOR VALUES FROM (10) TO (20)
  SERVER :DB_SERVERNAME OPTIONS (schema :DB_SCHEMA_PORT_TEST, table 'reind_local_10_20');
REINDEX TABLE reind_fdw_parent; -- ok
REINDEX TABLE CONCURRENTLY reind_fdw_parent; -- ok
--Testcase 401:
DROP TABLE reind_fdw_parent;
-- ===================================================================
-- conversion error
-- ===================================================================
--Testcase 402:
ALTER FOREIGN TABLE ft1 ALTER COLUMN c8 TYPE int;
--Testcase 403:
SELECT * FROM ft1 ftx(x1,x2,x3,x4,x5,x6,x7,x8) WHERE x1 = 1;  -- ERROR
psql:sql/14.5/ported_postgres_fdw.sql:1486: ERROR:  invalid input syntax for type integer: "foo"
--Testcase 404:
SELECT ftx.x1, ft2.c2, ftx.x8 FROM ft1 ftx(x1,x2,x3,x4,x5,x6,x7,x8), ft2
  WHERE ftx.x1 = ft2.c1 AND ftx.x1 = 1; -- ERROR
psql:sql/14.5/ported_postgres_fdw.sql:1489: ERROR:  invalid input syntax for type integer: "foo"
--Testcase 405:
SELECT ftx.x1, ft2.c2, ftx FROM ft1 ftx(x1,x2,x3,x4,x5,x6,x7,x8), ft2
  WHERE ftx.x1 = ft2.c1 AND ftx.x1 = 1; -- ERROR
psql:sql/14.5/ported_postgres_fdw.sql:1492: ERROR:  invalid input syntax for type integer: "foo"
--Testcase 406:
SELECT sum(c2), array_agg(c8) FROM ft1 GROUP BY c8; -- ERROR
psql:sql/14.5/ported_postgres_fdw.sql:1494: ERROR:  invalid input syntax for type integer: "foo"
--Testcase 407:
ALTER FOREIGN TABLE ft1 ALTER COLUMN c8 TYPE text;
-- does not support savepoint
-- ===================================================================
-- subtransaction
--  + local/remote error doesn't break cursor
-- ===================================================================
-- BEGIN;
-- DECLARE c CURSOR FOR SELECT * FROM ft1 ORDER BY c1;
-- FETCH c;
-- SAVEPOINT s;
-- ERROR OUT;          -- ERROR
-- ROLLBACK TO s;
-- FETCH c;
-- SAVEPOINT s;
-- SELECT * FROM ft1 WHERE 1 / (c1 - 1) > 0;  -- ERROR
-- ROLLBACK TO s;
-- FETCH c;
-- SELECT * FROM ft1 ORDER BY c1 LIMIT 1;
-- COMMIT;
-- ===================================================================
-- test handling of collations
-- ===================================================================
-- create table loct3 (f1 text collate "C" unique, f2 text, f3 varchar(10) unique);
--Testcase 408:
create foreign table ft3 (f1 text collate "C", f2 text, f3 varchar(10))
  server :DB_SERVERNAME options (schema :DB_SCHEMA_PORT_TEST, table 'loct3');
-- can be sent to remote
--Testcase 409:
explain (verbose, costs off) select * from ft3 where f1 = 'foo';
                                  QUERY PLAN                                   
-------------------------------------------------------------------------------
 Foreign Scan on public.ft3
   Output: f1, f2, f3
   Remote SQL: SELECT f1, f2, f3 FROM odbc_fdw_post.loct3 WHERE ((f1 = 'foo'))
(3 rows)

--Testcase 410:
explain (verbose, costs off) select * from ft3 where f1 COLLATE "C" = 'foo';
                                  QUERY PLAN                                   
-------------------------------------------------------------------------------
 Foreign Scan on public.ft3
   Output: f1, f2, f3
   Remote SQL: SELECT f1, f2, f3 FROM odbc_fdw_post.loct3 WHERE ((f1 = 'foo'))
(3 rows)

--Testcase 411:
explain (verbose, costs off) select * from ft3 where f2 = 'foo';
                                  QUERY PLAN                                   
-------------------------------------------------------------------------------
 Foreign Scan on public.ft3
   Output: f1, f2, f3
   Remote SQL: SELECT f1, f2, f3 FROM odbc_fdw_post.loct3 WHERE ((f2 = 'foo'))
(3 rows)

--Testcase 412:
explain (verbose, costs off) select * from ft3 where f3 = 'foo';
                        QUERY PLAN                        
----------------------------------------------------------
 Foreign Scan on public.ft3
   Output: f1, f2, f3
   Filter: ((ft3.f3)::text = 'foo'::text)
   Remote SQL: SELECT f1, f2, f3 FROM odbc_fdw_post.loct3
(4 rows)

--Testcase 413:
explain (verbose, costs off) select * from ft3 f, ft3 l
  where f.f3 = l.f3 and l.f1 = 'foo';
                                     QUERY PLAN                                      
-------------------------------------------------------------------------------------
 Nested Loop
   Output: f.f1, f.f2, f.f3, l.f1, l.f2, l.f3
   Join Filter: ((f.f3)::text = (l.f3)::text)
   ->  Foreign Scan on public.ft3 f
         Output: f.f1, f.f2, f.f3
         Remote SQL: SELECT f1, f2, f3 FROM odbc_fdw_post.loct3
   ->  Foreign Scan on public.ft3 l
         Output: l.f1, l.f2, l.f3
         Remote SQL: SELECT f1, f2, f3 FROM odbc_fdw_post.loct3 WHERE ((f1 = 'foo'))
(9 rows)

-- can't be sent to remote
--Testcase 414:
explain (verbose, costs off) select * from ft3 where f1 COLLATE "POSIX" = 'foo';
                        QUERY PLAN                        
----------------------------------------------------------
 Foreign Scan on public.ft3
   Output: f1, f2, f3
   Filter: ((ft3.f1)::text = 'foo'::text)
   Remote SQL: SELECT f1, f2, f3 FROM odbc_fdw_post.loct3
(4 rows)

--Testcase 415:
explain (verbose, costs off) select * from ft3 where f1 = 'foo' COLLATE "C";
                        QUERY PLAN                        
----------------------------------------------------------
 Foreign Scan on public.ft3
   Output: f1, f2, f3
   Filter: (ft3.f1 = 'foo'::text COLLATE "C")
   Remote SQL: SELECT f1, f2, f3 FROM odbc_fdw_post.loct3
(4 rows)

--Testcase 416:
explain (verbose, costs off) select * from ft3 where f2 COLLATE "C" = 'foo';
                        QUERY PLAN                        
----------------------------------------------------------
 Foreign Scan on public.ft3
   Output: f1, f2, f3
   Filter: ((ft3.f2)::text = 'foo'::text)
   Remote SQL: SELECT f1, f2, f3 FROM odbc_fdw_post.loct3
(4 rows)

--Testcase 417:
explain (verbose, costs off) select * from ft3 where f2 = 'foo' COLLATE "C";
                        QUERY PLAN                        
----------------------------------------------------------
 Foreign Scan on public.ft3
   Output: f1, f2, f3
   Filter: (ft3.f2 = 'foo'::text COLLATE "C")
   Remote SQL: SELECT f1, f2, f3 FROM odbc_fdw_post.loct3
(4 rows)

--Testcase 418:
explain (verbose, costs off) select * from ft3 f, ft3 l
  where f.f3 = l.f3 COLLATE "POSIX" and l.f1 = 'foo';
                                     QUERY PLAN                                      
-------------------------------------------------------------------------------------
 Nested Loop
   Output: f.f1, f.f2, f.f3, l.f1, l.f2, l.f3
   Join Filter: ((f.f3)::text = (l.f3)::text)
   ->  Foreign Scan on public.ft3 f
         Output: f.f1, f.f2, f.f3
         Remote SQL: SELECT f1, f2, f3 FROM odbc_fdw_post.loct3
   ->  Foreign Scan on public.ft3 l
         Output: l.f1, l.f2, l.f3
         Remote SQL: SELECT f1, f2, f3 FROM odbc_fdw_post.loct3 WHERE ((f1 = 'foo'))
(9 rows)

-- ===================================================================
-- test writable foreign table stuff
-- ===================================================================
--Testcase 419:
EXPLAIN (verbose, costs off)
INSERT INTO ft2 (c1,c2,c3) SELECT c1+1000,c2+100, c3 || c3 FROM ft2 LIMIT 20;
                                                                                                           QUERY PLAN                                                                                                            
---------------------------------------------------------------------------------------------------------------------------------------------------------------------------------------------------------------------------------
 Insert on public.ft2
   Remote SQL: INSERT INTO odbc_fdw_post.`T1`(`C_1`, c2, c3, c4, c5, c6, c7, c8) VALUES (?, ?, ?, ?, ?, ?, ?, ?)
   ->  Subquery Scan on "*SELECT*"
         Output: "*SELECT*"."?column?", "*SELECT*"."?column?_1", "*SELECT*"."?column?_2", NULL::timestamp without time zone, NULL::timestamp without time zone, NULL::character varying, 'ft2       '::character(10), NULL::text
         ->  Limit
               Output: ((ft2_1.c1 + 1000)), ((ft2_1.c2 + 100)), ((ft2_1.c3 || ft2_1.c3))
               ->  Foreign Scan on public.ft2 ft2_1
                     Output: (ft2_1.c1 + 1000), (ft2_1.c2 + 100), (ft2_1.c3 || ft2_1.c3)
                     Remote SQL: SELECT `C_1`, c2, c3 FROM odbc_fdw_post.`T1`
(9 rows)

--Testcase 420:
INSERT INTO ft2 (c1,c2,c3) SELECT c1+1000,c2+100, c3 || c3 FROM ft2 LIMIT 20;
--Testcase 421:
INSERT INTO ft2 (c1,c2,c3)
  VALUES (1101,201,'aaa'), (1102,202,'bbb'), (1103,203,'ccc');
--Testcase 422:
SELECT * FROM ft2 WHERE c1 >= 1101 and c1 <= 1103;
  c1  | c2  | c3  | c4 | c5 | c6 |     c7     | c8 
------+-----+-----+----+----+----+------------+----
 1101 | 201 | aaa |    |    |    | ft2        | 
 1102 | 202 | bbb |    |    |    | ft2        | 
 1103 | 203 | ccc |    |    |    | ft2        | 
(3 rows)

--Testcase 423:
INSERT INTO ft2 (c1,c2,c3) VALUES (1104,204,'ddd'), (1105,205,'eee');
--Testcase 424:
EXPLAIN (verbose, costs off)
UPDATE ft2 SET c2 = c2 + 300, c3 = c3 || '_update3' WHERE c1 % 10 = 3;              -- can be pushed down
                                                   QUERY PLAN                                                    
-----------------------------------------------------------------------------------------------------------------
 Update on public.ft2
   Remote SQL: UPDATE odbc_fdw_post.`T1` SET c2 = ?, c3 = ? WHERE `C_1` = ?
   ->  Foreign Scan on public.ft2
         Output: (c2 + 300), (c3 || '_update3'::text), c1, ft2.*
         Remote SQL: SELECT `C_1`, c2, c3, c4, c5, c6, c7, c8 FROM odbc_fdw_post.`T1` WHERE (((`C_1` % 10) = 3))
(5 rows)

--Testcase 425:
UPDATE ft2 SET c2 = c2 + 300, c3 = c3 || '_update3' WHERE c1 % 10 = 3;
--Testcase 426:
EXPLAIN (verbose, costs off)
UPDATE ft2 SET c2 = c2 + 400, c3 = c3 || '_update7' WHERE c1 % 10 = 7;  -- can be pushed down
                                                   QUERY PLAN                                                    
-----------------------------------------------------------------------------------------------------------------
 Update on public.ft2
   Remote SQL: UPDATE odbc_fdw_post.`T1` SET c2 = ?, c3 = ? WHERE `C_1` = ?
   ->  Foreign Scan on public.ft2
         Output: (c2 + 400), (c3 || '_update7'::text), c1, ft2.*
         Remote SQL: SELECT `C_1`, c2, c3, c4, c5, c6, c7, c8 FROM odbc_fdw_post.`T1` WHERE (((`C_1` % 10) = 7))
(5 rows)

--Testcase 427:
UPDATE ft2 SET c2 = c2 + 400, c3 = c3 || '_update7' WHERE c1 % 10 = 7;
--Testcase 428:
SELECT * FROM ft2 WHERE c1 % 10 = 7 ORDER BY c1;
  c1  | c2  |         c3         |            c4            |            c5            | c6 |     c7     | c8  
------+-----+--------------------+--------------------------+--------------------------+----+------------+-----
    7 | 407 | 00007_update7      | Thu Jan 08 00:00:00 1970 | Thu Jan 08 00:00:00 1970 | 7  | 7          | foo
   17 | 407 | 00017_update7      | Sun Jan 18 00:00:00 1970 | Sun Jan 18 00:00:00 1970 | 7  | 7          | foo
   27 | 407 | 00027_update7      | Wed Jan 28 00:00:00 1970 | Wed Jan 28 00:00:00 1970 | 7  | 7          | foo
   37 | 407 | 00037_update7      | Sat Feb 07 00:00:00 1970 | Sat Feb 07 00:00:00 1970 | 7  | 7          | foo
   47 | 407 | 00047_update7      | Tue Feb 17 00:00:00 1970 | Tue Feb 17 00:00:00 1970 | 7  | 7          | foo
   57 | 407 | 00057_update7      | Fri Feb 27 00:00:00 1970 | Fri Feb 27 00:00:00 1970 | 7  | 7          | foo
   67 | 407 | 00067_update7      | Mon Mar 09 00:00:00 1970 | Mon Mar 09 00:00:00 1970 | 7  | 7          | foo
   77 | 407 | 00077_update7      | Thu Mar 19 00:00:00 1970 | Thu Mar 19 00:00:00 1970 | 7  | 7          | foo
   87 | 407 | 00087_update7      | Sun Mar 29 00:00:00 1970 | Sun Mar 29 00:00:00 1970 | 7  | 7          | foo
   97 | 407 | 00097_update7      | Wed Apr 08 00:00:00 1970 | Wed Apr 08 00:00:00 1970 | 7  | 7          | foo
  107 | 407 | 00107_update7      | Thu Jan 08 00:00:00 1970 | Thu Jan 08 00:00:00 1970 | 7  | 7          | foo
  117 | 407 | 00117_update7      | Sun Jan 18 00:00:00 1970 | Sun Jan 18 00:00:00 1970 | 7  | 7          | foo
  127 | 407 | 00127_update7      | Wed Jan 28 00:00:00 1970 | Wed Jan 28 00:00:00 1970 | 7  | 7          | foo
  137 | 407 | 00137_update7      | Sat Feb 07 00:00:00 1970 | Sat Feb 07 00:00:00 1970 | 7  | 7          | foo
  147 | 407 | 00147_update7      | Tue Feb 17 00:00:00 1970 | Tue Feb 17 00:00:00 1970 | 7  | 7          | foo
  157 | 407 | 00157_update7      | Fri Feb 27 00:00:00 1970 | Fri Feb 27 00:00:00 1970 | 7  | 7          | foo
  167 | 407 | 00167_update7      | Mon Mar 09 00:00:00 1970 | Mon Mar 09 00:00:00 1970 | 7  | 7          | foo
  177 | 407 | 00177_update7      | Thu Mar 19 00:00:00 1970 | Thu Mar 19 00:00:00 1970 | 7  | 7          | foo
  187 | 407 | 00187_update7      | Sun Mar 29 00:00:00 1970 | Sun Mar 29 00:00:00 1970 | 7  | 7          | foo
  197 | 407 | 00197_update7      | Wed Apr 08 00:00:00 1970 | Wed Apr 08 00:00:00 1970 | 7  | 7          | foo
  207 | 407 | 00207_update7      | Thu Jan 08 00:00:00 1970 | Thu Jan 08 00:00:00 1970 | 7  | 7          | foo
  217 | 407 | 00217_update7      | Sun Jan 18 00:00:00 1970 | Sun Jan 18 00:00:00 1970 | 7  | 7          | foo
  227 | 407 | 00227_update7      | Wed Jan 28 00:00:00 1970 | Wed Jan 28 00:00:00 1970 | 7  | 7          | foo
  237 | 407 | 00237_update7      | Sat Feb 07 00:00:00 1970 | Sat Feb 07 00:00:00 1970 | 7  | 7          | foo
  247 | 407 | 00247_update7      | Tue Feb 17 00:00:00 1970 | Tue Feb 17 00:00:00 1970 | 7  | 7          | foo
  257 | 407 | 00257_update7      | Fri Feb 27 00:00:00 1970 | Fri Feb 27 00:00:00 1970 | 7  | 7          | foo
  267 | 407 | 00267_update7      | Mon Mar 09 00:00:00 1970 | Mon Mar 09 00:00:00 1970 | 7  | 7          | foo
  277 | 407 | 00277_update7      | Thu Mar 19 00:00:00 1970 | Thu Mar 19 00:00:00 1970 | 7  | 7          | foo
  287 | 407 | 00287_update7      | Sun Mar 29 00:00:00 1970 | Sun Mar 29 00:00:00 1970 | 7  | 7          | foo
  297 | 407 | 00297_update7      | Wed Apr 08 00:00:00 1970 | Wed Apr 08 00:00:00 1970 | 7  | 7          | foo
  307 | 407 | 00307_update7      | Thu Jan 08 00:00:00 1970 | Thu Jan 08 00:00:00 1970 | 7  | 7          | foo
  317 | 407 | 00317_update7      | Sun Jan 18 00:00:00 1970 | Sun Jan 18 00:00:00 1970 | 7  | 7          | foo
  327 | 407 | 00327_update7      | Wed Jan 28 00:00:00 1970 | Wed Jan 28 00:00:00 1970 | 7  | 7          | foo
  337 | 407 | 00337_update7      | Sat Feb 07 00:00:00 1970 | Sat Feb 07 00:00:00 1970 | 7  | 7          | foo
  347 | 407 | 00347_update7      | Tue Feb 17 00:00:00 1970 | Tue Feb 17 00:00:00 1970 | 7  | 7          | foo
  357 | 407 | 00357_update7      | Fri Feb 27 00:00:00 1970 | Fri Feb 27 00:00:00 1970 | 7  | 7          | foo
  367 | 407 | 00367_update7      | Mon Mar 09 00:00:00 1970 | Mon Mar 09 00:00:00 1970 | 7  | 7          | foo
  377 | 407 | 00377_update7      | Thu Mar 19 00:00:00 1970 | Thu Mar 19 00:00:00 1970 | 7  | 7          | foo
  387 | 407 | 00387_update7      | Sun Mar 29 00:00:00 1970 | Sun Mar 29 00:00:00 1970 | 7  | 7          | foo
  397 | 407 | 00397_update7      | Wed Apr 08 00:00:00 1970 | Wed Apr 08 00:00:00 1970 | 7  | 7          | foo
  407 | 407 | 00407_update7      | Thu Jan 08 00:00:00 1970 | Thu Jan 08 00:00:00 1970 | 7  | 7          | foo
  417 | 407 | 00417_update7      | Sun Jan 18 00:00:00 1970 | Sun Jan 18 00:00:00 1970 | 7  | 7          | foo
  427 | 407 | 00427_update7      | Wed Jan 28 00:00:00 1970 | Wed Jan 28 00:00:00 1970 | 7  | 7          | foo
  437 | 407 | 00437_update7      | Sat Feb 07 00:00:00 1970 | Sat Feb 07 00:00:00 1970 | 7  | 7          | foo
  447 | 407 | 00447_update7      | Tue Feb 17 00:00:00 1970 | Tue Feb 17 00:00:00 1970 | 7  | 7          | foo
  457 | 407 | 00457_update7      | Fri Feb 27 00:00:00 1970 | Fri Feb 27 00:00:00 1970 | 7  | 7          | foo
  467 | 407 | 00467_update7      | Mon Mar 09 00:00:00 1970 | Mon Mar 09 00:00:00 1970 | 7  | 7          | foo
  477 | 407 | 00477_update7      | Thu Mar 19 00:00:00 1970 | Thu Mar 19 00:00:00 1970 | 7  | 7          | foo
  487 | 407 | 00487_update7      | Sun Mar 29 00:00:00 1970 | Sun Mar 29 00:00:00 1970 | 7  | 7          | foo
  497 | 407 | 00497_update7      | Wed Apr 08 00:00:00 1970 | Wed Apr 08 00:00:00 1970 | 7  | 7          | foo
  507 | 407 | 00507_update7      | Thu Jan 08 00:00:00 1970 | Thu Jan 08 00:00:00 1970 | 7  | 7          | foo
  517 | 407 | 00517_update7      | Sun Jan 18 00:00:00 1970 | Sun Jan 18 00:00:00 1970 | 7  | 7          | foo
  527 | 407 | 00527_update7      | Wed Jan 28 00:00:00 1970 | Wed Jan 28 00:00:00 1970 | 7  | 7          | foo
  537 | 407 | 00537_update7      | Sat Feb 07 00:00:00 1970 | Sat Feb 07 00:00:00 1970 | 7  | 7          | foo
  547 | 407 | 00547_update7      | Tue Feb 17 00:00:00 1970 | Tue Feb 17 00:00:00 1970 | 7  | 7          | foo
  557 | 407 | 00557_update7      | Fri Feb 27 00:00:00 1970 | Fri Feb 27 00:00:00 1970 | 7  | 7          | foo
  567 | 407 | 00567_update7      | Mon Mar 09 00:00:00 1970 | Mon Mar 09 00:00:00 1970 | 7  | 7          | foo
  577 | 407 | 00577_update7      | Thu Mar 19 00:00:00 1970 | Thu Mar 19 00:00:00 1970 | 7  | 7          | foo
  587 | 407 | 00587_update7      | Sun Mar 29 00:00:00 1970 | Sun Mar 29 00:00:00 1970 | 7  | 7          | foo
  597 | 407 | 00597_update7      | Wed Apr 08 00:00:00 1970 | Wed Apr 08 00:00:00 1970 | 7  | 7          | foo
  607 | 407 | 00607_update7      | Thu Jan 08 00:00:00 1970 | Thu Jan 08 00:00:00 1970 | 7  | 7          | foo
  617 | 407 | 00617_update7      | Sun Jan 18 00:00:00 1970 | Sun Jan 18 00:00:00 1970 | 7  | 7          | foo
  627 | 407 | 00627_update7      | Wed Jan 28 00:00:00 1970 | Wed Jan 28 00:00:00 1970 | 7  | 7          | foo
  637 | 407 | 00637_update7      | Sat Feb 07 00:00:00 1970 | Sat Feb 07 00:00:00 1970 | 7  | 7          | foo
  647 | 407 | 00647_update7      | Tue Feb 17 00:00:00 1970 | Tue Feb 17 00:00:00 1970 | 7  | 7          | foo
  657 | 407 | 00657_update7      | Fri Feb 27 00:00:00 1970 | Fri Feb 27 00:00:00 1970 | 7  | 7          | foo
  667 | 407 | 00667_update7      | Mon Mar 09 00:00:00 1970 | Mon Mar 09 00:00:00 1970 | 7  | 7          | foo
  677 | 407 | 00677_update7      | Thu Mar 19 00:00:00 1970 | Thu Mar 19 00:00:00 1970 | 7  | 7          | foo
  687 | 407 | 00687_update7      | Sun Mar 29 00:00:00 1970 | Sun Mar 29 00:00:00 1970 | 7  | 7          | foo
  697 | 407 | 00697_update7      | Wed Apr 08 00:00:00 1970 | Wed Apr 08 00:00:00 1970 | 7  | 7          | foo
  707 | 407 | 00707_update7      | Thu Jan 08 00:00:00 1970 | Thu Jan 08 00:00:00 1970 | 7  | 7          | foo
  717 | 407 | 00717_update7      | Sun Jan 18 00:00:00 1970 | Sun Jan 18 00:00:00 1970 | 7  | 7          | foo
  727 | 407 | 00727_update7      | Wed Jan 28 00:00:00 1970 | Wed Jan 28 00:00:00 1970 | 7  | 7          | foo
  737 | 407 | 00737_update7      | Sat Feb 07 00:00:00 1970 | Sat Feb 07 00:00:00 1970 | 7  | 7          | foo
  747 | 407 | 00747_update7      | Tue Feb 17 00:00:00 1970 | Tue Feb 17 00:00:00 1970 | 7  | 7          | foo
  757 | 407 | 00757_update7      | Fri Feb 27 00:00:00 1970 | Fri Feb 27 00:00:00 1970 | 7  | 7          | foo
  767 | 407 | 00767_update7      | Mon Mar 09 00:00:00 1970 | Mon Mar 09 00:00:00 1970 | 7  | 7          | foo
  777 | 407 | 00777_update7      | Thu Mar 19 00:00:00 1970 | Thu Mar 19 00:00:00 1970 | 7  | 7          | foo
  787 | 407 | 00787_update7      | Sun Mar 29 00:00:00 1970 | Sun Mar 29 00:00:00 1970 | 7  | 7          | foo
  797 | 407 | 00797_update7      | Wed Apr 08 00:00:00 1970 | Wed Apr 08 00:00:00 1970 | 7  | 7          | foo
  807 | 407 | 00807_update7      | Thu Jan 08 00:00:00 1970 | Thu Jan 08 00:00:00 1970 | 7  | 7          | foo
  817 | 407 | 00817_update7      | Sun Jan 18 00:00:00 1970 | Sun Jan 18 00:00:00 1970 | 7  | 7          | foo
  827 | 407 | 00827_update7      | Wed Jan 28 00:00:00 1970 | Wed Jan 28 00:00:00 1970 | 7  | 7          | foo
  837 | 407 | 00837_update7      | Sat Feb 07 00:00:00 1970 | Sat Feb 07 00:00:00 1970 | 7  | 7          | foo
  847 | 407 | 00847_update7      | Tue Feb 17 00:00:00 1970 | Tue Feb 17 00:00:00 1970 | 7  | 7          | foo
  857 | 407 | 00857_update7      | Fri Feb 27 00:00:00 1970 | Fri Feb 27 00:00:00 1970 | 7  | 7          | foo
  867 | 407 | 00867_update7      | Mon Mar 09 00:00:00 1970 | Mon Mar 09 00:00:00 1970 | 7  | 7          | foo
  877 | 407 | 00877_update7      | Thu Mar 19 00:00:00 1970 | Thu Mar 19 00:00:00 1970 | 7  | 7          | foo
  887 | 407 | 00887_update7      | Sun Mar 29 00:00:00 1970 | Sun Mar 29 00:00:00 1970 | 7  | 7          | foo
  897 | 407 | 00897_update7      | Wed Apr 08 00:00:00 1970 | Wed Apr 08 00:00:00 1970 | 7  | 7          | foo
  907 | 407 | 00907_update7      | Thu Jan 08 00:00:00 1970 | Thu Jan 08 00:00:00 1970 | 7  | 7          | foo
  917 | 407 | 00917_update7      | Sun Jan 18 00:00:00 1970 | Sun Jan 18 00:00:00 1970 | 7  | 7          | foo
  927 | 407 | 00927_update7      | Wed Jan 28 00:00:00 1970 | Wed Jan 28 00:00:00 1970 | 7  | 7          | foo
  937 | 407 | 00937_update7      | Sat Feb 07 00:00:00 1970 | Sat Feb 07 00:00:00 1970 | 7  | 7          | foo
  947 | 407 | 00947_update7      | Tue Feb 17 00:00:00 1970 | Tue Feb 17 00:00:00 1970 | 7  | 7          | foo
  957 | 407 | 00957_update7      | Fri Feb 27 00:00:00 1970 | Fri Feb 27 00:00:00 1970 | 7  | 7          | foo
  967 | 407 | 00967_update7      | Mon Mar 09 00:00:00 1970 | Mon Mar 09 00:00:00 1970 | 7  | 7          | foo
  977 | 407 | 00977_update7      | Thu Mar 19 00:00:00 1970 | Thu Mar 19 00:00:00 1970 | 7  | 7          | foo
  987 | 407 | 00987_update7      | Sun Mar 29 00:00:00 1970 | Sun Mar 29 00:00:00 1970 | 7  | 7          | foo
  997 | 407 | 00997_update7      | Wed Apr 08 00:00:00 1970 | Wed Apr 08 00:00:00 1970 | 7  | 7          | foo
 1007 | 507 | 0000700007_update7 |                          |                          |    | ft2        | 
 1017 | 507 | 0001700017_update7 |                          |                          |    | ft2        | 
(102 rows)

--Testcase 429:
EXPLAIN (verbose, costs off)
UPDATE ft2 SET c2 = ft2.c2 + 500, c3 = ft2.c3 || '_update9', c7 = DEFAULT
  FROM ft1 WHERE ft1.c1 = ft2.c2 AND ft1.c1 % 10 = 9;                               -- can be pushed down
                                                         QUERY PLAN                                                          
-----------------------------------------------------------------------------------------------------------------------------
 Update on public.ft2
   Remote SQL: UPDATE odbc_fdw_post.`T1` SET c2 = ?, c3 = ?, c7 = ? WHERE `C_1` = ?
   ->  Hash Join
         Output: (ft2.c2 + 500), (ft2.c3 || '_update9'::text), 'ft2       '::character(10), ft2.c1, ft2.*, ft1.*
         Hash Cond: (ft2.c2 = ft1.c1)
         ->  Foreign Scan on public.ft2
               Output: ft2.c2, ft2.c3, ft2.c1, ft2.*
               Remote SQL: SELECT `C_1`, c2, c3, c4, c5, c6, c7, c8 FROM odbc_fdw_post.`T1`
         ->  Hash
               Output: ft1.*, ft1.c1
               ->  Foreign Scan on public.ft1
                     Output: ft1.*, ft1.c1
                     Remote SQL: SELECT `C_1`, c2, c3, c4, c5, c6, c7, c8 FROM odbc_fdw_post.`T1` WHERE (((`C_1` % 10) = 9))
(13 rows)

--Testcase 430:
UPDATE ft2 SET c2 = ft2.c2 + 500, c3 = ft2.c3 || '_update9', c7 = DEFAULT
  FROM ft1 WHERE ft1.c1 = ft2.c2 AND ft1.c1 % 10 = 9;
--Testcase 431:
EXPLAIN (verbose, costs off)
  DELETE FROM ft2 WHERE c1 % 10 = 5;                               -- can be pushed down
                                     QUERY PLAN                                      
-------------------------------------------------------------------------------------
 Delete on public.ft2
   Remote SQL: DELETE FROM odbc_fdw_post.`T1` WHERE `C_1` = ?
   ->  Foreign Scan on public.ft2
         Output: c1
         Remote SQL: SELECT `C_1` FROM odbc_fdw_post.`T1` WHERE (((`C_1` % 10) = 5))
(5 rows)

--Testcase 432:
SELECT c1, c4 FROM ft2 WHERE c1 % 10 = 5;
  c1  |            c4            
------+--------------------------
    5 | Tue Jan 06 00:00:00 1970
   15 | Fri Jan 16 00:00:00 1970
   25 | Mon Jan 26 00:00:00 1970
   35 | Thu Feb 05 00:00:00 1970
   45 | Sun Feb 15 00:00:00 1970
   55 | Wed Feb 25 00:00:00 1970
   65 | Sat Mar 07 00:00:00 1970
   75 | Tue Mar 17 00:00:00 1970
   85 | Fri Mar 27 00:00:00 1970
   95 | Mon Apr 06 00:00:00 1970
  105 | Tue Jan 06 00:00:00 1970
  115 | Fri Jan 16 00:00:00 1970
  125 | Mon Jan 26 00:00:00 1970
  135 | Thu Feb 05 00:00:00 1970
  145 | Sun Feb 15 00:00:00 1970
  155 | Wed Feb 25 00:00:00 1970
  165 | Sat Mar 07 00:00:00 1970
  175 | Tue Mar 17 00:00:00 1970
  185 | Fri Mar 27 00:00:00 1970
  195 | Mon Apr 06 00:00:00 1970
  205 | Tue Jan 06 00:00:00 1970
  215 | Fri Jan 16 00:00:00 1970
  225 | Mon Jan 26 00:00:00 1970
  235 | Thu Feb 05 00:00:00 1970
  245 | Sun Feb 15 00:00:00 1970
  255 | Wed Feb 25 00:00:00 1970
  265 | Sat Mar 07 00:00:00 1970
  275 | Tue Mar 17 00:00:00 1970
  285 | Fri Mar 27 00:00:00 1970
  295 | Mon Apr 06 00:00:00 1970
  305 | Tue Jan 06 00:00:00 1970
  315 | Fri Jan 16 00:00:00 1970
  325 | Mon Jan 26 00:00:00 1970
  335 | Thu Feb 05 00:00:00 1970
  345 | Sun Feb 15 00:00:00 1970
  355 | Wed Feb 25 00:00:00 1970
  365 | Sat Mar 07 00:00:00 1970
  375 | Tue Mar 17 00:00:00 1970
  385 | Fri Mar 27 00:00:00 1970
  395 | Mon Apr 06 00:00:00 1970
  405 | Tue Jan 06 00:00:00 1970
  415 | Fri Jan 16 00:00:00 1970
  425 | Mon Jan 26 00:00:00 1970
  435 | Thu Feb 05 00:00:00 1970
  445 | Sun Feb 15 00:00:00 1970
  455 | Wed Feb 25 00:00:00 1970
  465 | Sat Mar 07 00:00:00 1970
  475 | Tue Mar 17 00:00:00 1970
  485 | Fri Mar 27 00:00:00 1970
  495 | Mon Apr 06 00:00:00 1970
  505 | Tue Jan 06 00:00:00 1970
  515 | Fri Jan 16 00:00:00 1970
  525 | Mon Jan 26 00:00:00 1970
  535 | Thu Feb 05 00:00:00 1970
  545 | Sun Feb 15 00:00:00 1970
  555 | Wed Feb 25 00:00:00 1970
  565 | Sat Mar 07 00:00:00 1970
  575 | Tue Mar 17 00:00:00 1970
  585 | Fri Mar 27 00:00:00 1970
  595 | Mon Apr 06 00:00:00 1970
  605 | Tue Jan 06 00:00:00 1970
  615 | Fri Jan 16 00:00:00 1970
  625 | Mon Jan 26 00:00:00 1970
  635 | Thu Feb 05 00:00:00 1970
  645 | Sun Feb 15 00:00:00 1970
  655 | Wed Feb 25 00:00:00 1970
  665 | Sat Mar 07 00:00:00 1970
  675 | Tue Mar 17 00:00:00 1970
  685 | Fri Mar 27 00:00:00 1970
  695 | Mon Apr 06 00:00:00 1970
  705 | Tue Jan 06 00:00:00 1970
  715 | Fri Jan 16 00:00:00 1970
  725 | Mon Jan 26 00:00:00 1970
  735 | Thu Feb 05 00:00:00 1970
  745 | Sun Feb 15 00:00:00 1970
  755 | Wed Feb 25 00:00:00 1970
  765 | Sat Mar 07 00:00:00 1970
  775 | Tue Mar 17 00:00:00 1970
  785 | Fri Mar 27 00:00:00 1970
  795 | Mon Apr 06 00:00:00 1970
  805 | Tue Jan 06 00:00:00 1970
  815 | Fri Jan 16 00:00:00 1970
  825 | Mon Jan 26 00:00:00 1970
  835 | Thu Feb 05 00:00:00 1970
  845 | Sun Feb 15 00:00:00 1970
  855 | Wed Feb 25 00:00:00 1970
  865 | Sat Mar 07 00:00:00 1970
  875 | Tue Mar 17 00:00:00 1970
  885 | Fri Mar 27 00:00:00 1970
  895 | Mon Apr 06 00:00:00 1970
  905 | Tue Jan 06 00:00:00 1970
  915 | Fri Jan 16 00:00:00 1970
  925 | Mon Jan 26 00:00:00 1970
  935 | Thu Feb 05 00:00:00 1970
  945 | Sun Feb 15 00:00:00 1970
  955 | Wed Feb 25 00:00:00 1970
  965 | Sat Mar 07 00:00:00 1970
  975 | Tue Mar 17 00:00:00 1970
  985 | Fri Mar 27 00:00:00 1970
  995 | Mon Apr 06 00:00:00 1970
 1005 | 
 1015 | 
 1105 | 
(103 rows)

--Testcase 433:
DELETE FROM ft2 WHERE c1 % 10 = 5;
--Testcase 434:
EXPLAIN (verbose, costs off)
DELETE FROM ft2 USING ft1 WHERE ft1.c1 = ft2.c2 AND ft1.c1 % 10 = 2;                -- can be pushed down
                                                         QUERY PLAN                                                          
-----------------------------------------------------------------------------------------------------------------------------
 Delete on public.ft2
   Remote SQL: DELETE FROM odbc_fdw_post.`T1` WHERE `C_1` = ?
   ->  Hash Join
         Output: ft2.c1, ft1.*
         Hash Cond: (ft2.c2 = ft1.c1)
         ->  Foreign Scan on public.ft2
               Output: ft2.c1, ft2.c2, ft2.c3, ft2.c4, ft2.c5, ft2.c6, ft2.c7, ft2.c8
               Remote SQL: SELECT `C_1`, c2 FROM odbc_fdw_post.`T1`
         ->  Hash
               Output: ft1.*, ft1.c1
               ->  Foreign Scan on public.ft1
                     Output: ft1.*, ft1.c1
                     Remote SQL: SELECT `C_1`, c2, c3, c4, c5, c6, c7, c8 FROM odbc_fdw_post.`T1` WHERE (((`C_1` % 10) = 2))
(13 rows)

--Testcase 435:
DELETE FROM ft2 USING ft1 WHERE ft1.c1 = ft2.c2 AND ft1.c1 % 10 = 2;
--Testcase 436:
SELECT c1,c2,c3,c4 FROM ft2 ORDER BY c1;
  c1  | c2  |         c3         |            c4            
------+-----+--------------------+--------------------------
    1 |   1 | 00001              | Fri Jan 02 00:00:00 1970
    3 | 303 | 00003_update3      | Sun Jan 04 00:00:00 1970
    4 |   4 | 00004              | Mon Jan 05 00:00:00 1970
    6 |   6 | 00006              | Wed Jan 07 00:00:00 1970
    7 | 407 | 00007_update7      | Thu Jan 08 00:00:00 1970
    8 |   8 | 00008              | Fri Jan 09 00:00:00 1970
    9 | 509 | 00009_update9      | Sat Jan 10 00:00:00 1970
   10 |   0 | 00010              | Sun Jan 11 00:00:00 1970
   11 |   1 | 00011              | Mon Jan 12 00:00:00 1970
   13 | 303 | 00013_update3      | Wed Jan 14 00:00:00 1970
   14 |   4 | 00014              | Thu Jan 15 00:00:00 1970
   16 |   6 | 00016              | Sat Jan 17 00:00:00 1970
   17 | 407 | 00017_update7      | Sun Jan 18 00:00:00 1970
   18 |   8 | 00018              | Mon Jan 19 00:00:00 1970
   19 | 509 | 00019_update9      | Tue Jan 20 00:00:00 1970
   20 |   0 | 00020              | Wed Jan 21 00:00:00 1970
   21 |   1 | 00021              | Thu Jan 22 00:00:00 1970
   23 | 303 | 00023_update3      | Sat Jan 24 00:00:00 1970
   24 |   4 | 00024              | Sun Jan 25 00:00:00 1970
   26 |   6 | 00026              | Tue Jan 27 00:00:00 1970
   27 | 407 | 00027_update7      | Wed Jan 28 00:00:00 1970
   28 |   8 | 00028              | Thu Jan 29 00:00:00 1970
   29 | 509 | 00029_update9      | Fri Jan 30 00:00:00 1970
   30 |   0 | 00030              | Sat Jan 31 00:00:00 1970
   31 |   1 | 00031              | Sun Feb 01 00:00:00 1970
   33 | 303 | 00033_update3      | Tue Feb 03 00:00:00 1970
   34 |   4 | 00034              | Wed Feb 04 00:00:00 1970
   36 |   6 | 00036              | Fri Feb 06 00:00:00 1970
   37 | 407 | 00037_update7      | Sat Feb 07 00:00:00 1970
   38 |   8 | 00038              | Sun Feb 08 00:00:00 1970
   39 | 509 | 00039_update9      | Mon Feb 09 00:00:00 1970
   40 |   0 | 00040              | Tue Feb 10 00:00:00 1970
   41 |   1 | 00041              | Wed Feb 11 00:00:00 1970
   43 | 303 | 00043_update3      | Fri Feb 13 00:00:00 1970
   44 |   4 | 00044              | Sat Feb 14 00:00:00 1970
   46 |   6 | 00046              | Mon Feb 16 00:00:00 1970
   47 | 407 | 00047_update7      | Tue Feb 17 00:00:00 1970
   48 |   8 | 00048              | Wed Feb 18 00:00:00 1970
   49 | 509 | 00049_update9      | Thu Feb 19 00:00:00 1970
   50 |   0 | 00050              | Fri Feb 20 00:00:00 1970
   51 |   1 | 00051              | Sat Feb 21 00:00:00 1970
   53 | 303 | 00053_update3      | Mon Feb 23 00:00:00 1970
   54 |   4 | 00054              | Tue Feb 24 00:00:00 1970
   56 |   6 | 00056              | Thu Feb 26 00:00:00 1970
   57 | 407 | 00057_update7      | Fri Feb 27 00:00:00 1970
   58 |   8 | 00058              | Sat Feb 28 00:00:00 1970
   59 | 509 | 00059_update9      | Sun Mar 01 00:00:00 1970
   60 |   0 | 00060              | Mon Mar 02 00:00:00 1970
   61 |   1 | 00061              | Tue Mar 03 00:00:00 1970
   63 | 303 | 00063_update3      | Thu Mar 05 00:00:00 1970
   64 |   4 | 00064              | Fri Mar 06 00:00:00 1970
   66 |   6 | 00066              | Sun Mar 08 00:00:00 1970
   67 | 407 | 00067_update7      | Mon Mar 09 00:00:00 1970
   68 |   8 | 00068              | Tue Mar 10 00:00:00 1970
   69 | 509 | 00069_update9      | Wed Mar 11 00:00:00 1970
   70 |   0 | 00070              | Thu Mar 12 00:00:00 1970
   71 |   1 | 00071              | Fri Mar 13 00:00:00 1970
   73 | 303 | 00073_update3      | Sun Mar 15 00:00:00 1970
   74 |   4 | 00074              | Mon Mar 16 00:00:00 1970
   76 |   6 | 00076              | Wed Mar 18 00:00:00 1970
   77 | 407 | 00077_update7      | Thu Mar 19 00:00:00 1970
   78 |   8 | 00078              | Fri Mar 20 00:00:00 1970
   79 | 509 | 00079_update9      | Sat Mar 21 00:00:00 1970
   80 |   0 | 00080              | Sun Mar 22 00:00:00 1970
   81 |   1 | 00081              | Mon Mar 23 00:00:00 1970
   83 | 303 | 00083_update3      | Wed Mar 25 00:00:00 1970
   84 |   4 | 00084              | Thu Mar 26 00:00:00 1970
   86 |   6 | 00086              | Sat Mar 28 00:00:00 1970
   87 | 407 | 00087_update7      | Sun Mar 29 00:00:00 1970
   88 |   8 | 00088              | Mon Mar 30 00:00:00 1970
   89 | 509 | 00089_update9      | Tue Mar 31 00:00:00 1970
   90 |   0 | 00090              | Wed Apr 01 00:00:00 1970
   91 |   1 | 00091              | Thu Apr 02 00:00:00 1970
   93 | 303 | 00093_update3      | Sat Apr 04 00:00:00 1970
   94 |   4 | 00094              | Sun Apr 05 00:00:00 1970
   96 |   6 | 00096              | Tue Apr 07 00:00:00 1970
   97 | 407 | 00097_update7      | Wed Apr 08 00:00:00 1970
   98 |   8 | 00098              | Thu Apr 09 00:00:00 1970
   99 | 509 | 00099_update9      | Fri Apr 10 00:00:00 1970
  100 |   0 | 00100              | Thu Jan 01 00:00:00 1970
  101 |   1 | 00101              | Fri Jan 02 00:00:00 1970
  103 | 303 | 00103_update3      | Sun Jan 04 00:00:00 1970
  104 |   4 | 00104              | Mon Jan 05 00:00:00 1970
  106 |   6 | 00106              | Wed Jan 07 00:00:00 1970
  107 | 407 | 00107_update7      | Thu Jan 08 00:00:00 1970
  108 |   8 | 00108              | Fri Jan 09 00:00:00 1970
  109 | 509 | 00109_update9      | Sat Jan 10 00:00:00 1970
  110 |   0 | 00110              | Sun Jan 11 00:00:00 1970
  111 |   1 | 00111              | Mon Jan 12 00:00:00 1970
  113 | 303 | 00113_update3      | Wed Jan 14 00:00:00 1970
  114 |   4 | 00114              | Thu Jan 15 00:00:00 1970
  116 |   6 | 00116              | Sat Jan 17 00:00:00 1970
  117 | 407 | 00117_update7      | Sun Jan 18 00:00:00 1970
  118 |   8 | 00118              | Mon Jan 19 00:00:00 1970
  119 | 509 | 00119_update9      | Tue Jan 20 00:00:00 1970
  120 |   0 | 00120              | Wed Jan 21 00:00:00 1970
  121 |   1 | 00121              | Thu Jan 22 00:00:00 1970
  123 | 303 | 00123_update3      | Sat Jan 24 00:00:00 1970
  124 |   4 | 00124              | Sun Jan 25 00:00:00 1970
  126 |   6 | 00126              | Tue Jan 27 00:00:00 1970
  127 | 407 | 00127_update7      | Wed Jan 28 00:00:00 1970
  128 |   8 | 00128              | Thu Jan 29 00:00:00 1970
  129 | 509 | 00129_update9      | Fri Jan 30 00:00:00 1970
  130 |   0 | 00130              | Sat Jan 31 00:00:00 1970
  131 |   1 | 00131              | Sun Feb 01 00:00:00 1970
  133 | 303 | 00133_update3      | Tue Feb 03 00:00:00 1970
  134 |   4 | 00134              | Wed Feb 04 00:00:00 1970
  136 |   6 | 00136              | Fri Feb 06 00:00:00 1970
  137 | 407 | 00137_update7      | Sat Feb 07 00:00:00 1970
  138 |   8 | 00138              | Sun Feb 08 00:00:00 1970
  139 | 509 | 00139_update9      | Mon Feb 09 00:00:00 1970
  140 |   0 | 00140              | Tue Feb 10 00:00:00 1970
  141 |   1 | 00141              | Wed Feb 11 00:00:00 1970
  143 | 303 | 00143_update3      | Fri Feb 13 00:00:00 1970
  144 |   4 | 00144              | Sat Feb 14 00:00:00 1970
  146 |   6 | 00146              | Mon Feb 16 00:00:00 1970
  147 | 407 | 00147_update7      | Tue Feb 17 00:00:00 1970
  148 |   8 | 00148              | Wed Feb 18 00:00:00 1970
  149 | 509 | 00149_update9      | Thu Feb 19 00:00:00 1970
  150 |   0 | 00150              | Fri Feb 20 00:00:00 1970
  151 |   1 | 00151              | Sat Feb 21 00:00:00 1970
  153 | 303 | 00153_update3      | Mon Feb 23 00:00:00 1970
  154 |   4 | 00154              | Tue Feb 24 00:00:00 1970
  156 |   6 | 00156              | Thu Feb 26 00:00:00 1970
  157 | 407 | 00157_update7      | Fri Feb 27 00:00:00 1970
  158 |   8 | 00158              | Sat Feb 28 00:00:00 1970
  159 | 509 | 00159_update9      | Sun Mar 01 00:00:00 1970
  160 |   0 | 00160              | Mon Mar 02 00:00:00 1970
  161 |   1 | 00161              | Tue Mar 03 00:00:00 1970
  163 | 303 | 00163_update3      | Thu Mar 05 00:00:00 1970
  164 |   4 | 00164              | Fri Mar 06 00:00:00 1970
  166 |   6 | 00166              | Sun Mar 08 00:00:00 1970
  167 | 407 | 00167_update7      | Mon Mar 09 00:00:00 1970
  168 |   8 | 00168              | Tue Mar 10 00:00:00 1970
  169 | 509 | 00169_update9      | Wed Mar 11 00:00:00 1970
  170 |   0 | 00170              | Thu Mar 12 00:00:00 1970
  171 |   1 | 00171              | Fri Mar 13 00:00:00 1970
  173 | 303 | 00173_update3      | Sun Mar 15 00:00:00 1970
  174 |   4 | 00174              | Mon Mar 16 00:00:00 1970
  176 |   6 | 00176              | Wed Mar 18 00:00:00 1970
  177 | 407 | 00177_update7      | Thu Mar 19 00:00:00 1970
  178 |   8 | 00178              | Fri Mar 20 00:00:00 1970
  179 | 509 | 00179_update9      | Sat Mar 21 00:00:00 1970
  180 |   0 | 00180              | Sun Mar 22 00:00:00 1970
  181 |   1 | 00181              | Mon Mar 23 00:00:00 1970
  183 | 303 | 00183_update3      | Wed Mar 25 00:00:00 1970
  184 |   4 | 00184              | Thu Mar 26 00:00:00 1970
  186 |   6 | 00186              | Sat Mar 28 00:00:00 1970
  187 | 407 | 00187_update7      | Sun Mar 29 00:00:00 1970
  188 |   8 | 00188              | Mon Mar 30 00:00:00 1970
  189 | 509 | 00189_update9      | Tue Mar 31 00:00:00 1970
  190 |   0 | 00190              | Wed Apr 01 00:00:00 1970
  191 |   1 | 00191              | Thu Apr 02 00:00:00 1970
  193 | 303 | 00193_update3      | Sat Apr 04 00:00:00 1970
  194 |   4 | 00194              | Sun Apr 05 00:00:00 1970
  196 |   6 | 00196              | Tue Apr 07 00:00:00 1970
  197 | 407 | 00197_update7      | Wed Apr 08 00:00:00 1970
  198 |   8 | 00198              | Thu Apr 09 00:00:00 1970
  199 | 509 | 00199_update9      | Fri Apr 10 00:00:00 1970
  200 |   0 | 00200              | Thu Jan 01 00:00:00 1970
  201 |   1 | 00201              | Fri Jan 02 00:00:00 1970
  203 | 303 | 00203_update3      | Sun Jan 04 00:00:00 1970
  204 |   4 | 00204              | Mon Jan 05 00:00:00 1970
  206 |   6 | 00206              | Wed Jan 07 00:00:00 1970
  207 | 407 | 00207_update7      | Thu Jan 08 00:00:00 1970
  208 |   8 | 00208              | Fri Jan 09 00:00:00 1970
  209 | 509 | 00209_update9      | Sat Jan 10 00:00:00 1970
  210 |   0 | 00210              | Sun Jan 11 00:00:00 1970
  211 |   1 | 00211              | Mon Jan 12 00:00:00 1970
  213 | 303 | 00213_update3      | Wed Jan 14 00:00:00 1970
  214 |   4 | 00214              | Thu Jan 15 00:00:00 1970
  216 |   6 | 00216              | Sat Jan 17 00:00:00 1970
  217 | 407 | 00217_update7      | Sun Jan 18 00:00:00 1970
  218 |   8 | 00218              | Mon Jan 19 00:00:00 1970
  219 | 509 | 00219_update9      | Tue Jan 20 00:00:00 1970
  220 |   0 | 00220              | Wed Jan 21 00:00:00 1970
  221 |   1 | 00221              | Thu Jan 22 00:00:00 1970
  223 | 303 | 00223_update3      | Sat Jan 24 00:00:00 1970
  224 |   4 | 00224              | Sun Jan 25 00:00:00 1970
  226 |   6 | 00226              | Tue Jan 27 00:00:00 1970
  227 | 407 | 00227_update7      | Wed Jan 28 00:00:00 1970
  228 |   8 | 00228              | Thu Jan 29 00:00:00 1970
  229 | 509 | 00229_update9      | Fri Jan 30 00:00:00 1970
  230 |   0 | 00230              | Sat Jan 31 00:00:00 1970
  231 |   1 | 00231              | Sun Feb 01 00:00:00 1970
  233 | 303 | 00233_update3      | Tue Feb 03 00:00:00 1970
  234 |   4 | 00234              | Wed Feb 04 00:00:00 1970
  236 |   6 | 00236              | Fri Feb 06 00:00:00 1970
  237 | 407 | 00237_update7      | Sat Feb 07 00:00:00 1970
  238 |   8 | 00238              | Sun Feb 08 00:00:00 1970
  239 | 509 | 00239_update9      | Mon Feb 09 00:00:00 1970
  240 |   0 | 00240              | Tue Feb 10 00:00:00 1970
  241 |   1 | 00241              | Wed Feb 11 00:00:00 1970
  243 | 303 | 00243_update3      | Fri Feb 13 00:00:00 1970
  244 |   4 | 00244              | Sat Feb 14 00:00:00 1970
  246 |   6 | 00246              | Mon Feb 16 00:00:00 1970
  247 | 407 | 00247_update7      | Tue Feb 17 00:00:00 1970
  248 |   8 | 00248              | Wed Feb 18 00:00:00 1970
  249 | 509 | 00249_update9      | Thu Feb 19 00:00:00 1970
  250 |   0 | 00250              | Fri Feb 20 00:00:00 1970
  251 |   1 | 00251              | Sat Feb 21 00:00:00 1970
  253 | 303 | 00253_update3      | Mon Feb 23 00:00:00 1970
  254 |   4 | 00254              | Tue Feb 24 00:00:00 1970
  256 |   6 | 00256              | Thu Feb 26 00:00:00 1970
  257 | 407 | 00257_update7      | Fri Feb 27 00:00:00 1970
  258 |   8 | 00258              | Sat Feb 28 00:00:00 1970
  259 | 509 | 00259_update9      | Sun Mar 01 00:00:00 1970
  260 |   0 | 00260              | Mon Mar 02 00:00:00 1970
  261 |   1 | 00261              | Tue Mar 03 00:00:00 1970
  263 | 303 | 00263_update3      | Thu Mar 05 00:00:00 1970
  264 |   4 | 00264              | Fri Mar 06 00:00:00 1970
  266 |   6 | 00266              | Sun Mar 08 00:00:00 1970
  267 | 407 | 00267_update7      | Mon Mar 09 00:00:00 1970
  268 |   8 | 00268              | Tue Mar 10 00:00:00 1970
  269 | 509 | 00269_update9      | Wed Mar 11 00:00:00 1970
  270 |   0 | 00270              | Thu Mar 12 00:00:00 1970
  271 |   1 | 00271              | Fri Mar 13 00:00:00 1970
  273 | 303 | 00273_update3      | Sun Mar 15 00:00:00 1970
  274 |   4 | 00274              | Mon Mar 16 00:00:00 1970
  276 |   6 | 00276              | Wed Mar 18 00:00:00 1970
  277 | 407 | 00277_update7      | Thu Mar 19 00:00:00 1970
  278 |   8 | 00278              | Fri Mar 20 00:00:00 1970
  279 | 509 | 00279_update9      | Sat Mar 21 00:00:00 1970
  280 |   0 | 00280              | Sun Mar 22 00:00:00 1970
  281 |   1 | 00281              | Mon Mar 23 00:00:00 1970
  283 | 303 | 00283_update3      | Wed Mar 25 00:00:00 1970
  284 |   4 | 00284              | Thu Mar 26 00:00:00 1970
  286 |   6 | 00286              | Sat Mar 28 00:00:00 1970
  287 | 407 | 00287_update7      | Sun Mar 29 00:00:00 1970
  288 |   8 | 00288              | Mon Mar 30 00:00:00 1970
  289 | 509 | 00289_update9      | Tue Mar 31 00:00:00 1970
  290 |   0 | 00290              | Wed Apr 01 00:00:00 1970
  291 |   1 | 00291              | Thu Apr 02 00:00:00 1970
  293 | 303 | 00293_update3      | Sat Apr 04 00:00:00 1970
  294 |   4 | 00294              | Sun Apr 05 00:00:00 1970
  296 |   6 | 00296              | Tue Apr 07 00:00:00 1970
  297 | 407 | 00297_update7      | Wed Apr 08 00:00:00 1970
  298 |   8 | 00298              | Thu Apr 09 00:00:00 1970
  299 | 509 | 00299_update9      | Fri Apr 10 00:00:00 1970
  300 |   0 | 00300              | Thu Jan 01 00:00:00 1970
  301 |   1 | 00301              | Fri Jan 02 00:00:00 1970
  303 | 303 | 00303_update3      | Sun Jan 04 00:00:00 1970
  304 |   4 | 00304              | Mon Jan 05 00:00:00 1970
  306 |   6 | 00306              | Wed Jan 07 00:00:00 1970
  307 | 407 | 00307_update7      | Thu Jan 08 00:00:00 1970
  308 |   8 | 00308              | Fri Jan 09 00:00:00 1970
  309 | 509 | 00309_update9      | Sat Jan 10 00:00:00 1970
  310 |   0 | 00310              | Sun Jan 11 00:00:00 1970
  311 |   1 | 00311              | Mon Jan 12 00:00:00 1970
  313 | 303 | 00313_update3      | Wed Jan 14 00:00:00 1970
  314 |   4 | 00314              | Thu Jan 15 00:00:00 1970
  316 |   6 | 00316              | Sat Jan 17 00:00:00 1970
  317 | 407 | 00317_update7      | Sun Jan 18 00:00:00 1970
  318 |   8 | 00318              | Mon Jan 19 00:00:00 1970
  319 | 509 | 00319_update9      | Tue Jan 20 00:00:00 1970
  320 |   0 | 00320              | Wed Jan 21 00:00:00 1970
  321 |   1 | 00321              | Thu Jan 22 00:00:00 1970
  323 | 303 | 00323_update3      | Sat Jan 24 00:00:00 1970
  324 |   4 | 00324              | Sun Jan 25 00:00:00 1970
  326 |   6 | 00326              | Tue Jan 27 00:00:00 1970
  327 | 407 | 00327_update7      | Wed Jan 28 00:00:00 1970
  328 |   8 | 00328              | Thu Jan 29 00:00:00 1970
  329 | 509 | 00329_update9      | Fri Jan 30 00:00:00 1970
  330 |   0 | 00330              | Sat Jan 31 00:00:00 1970
  331 |   1 | 00331              | Sun Feb 01 00:00:00 1970
  333 | 303 | 00333_update3      | Tue Feb 03 00:00:00 1970
  334 |   4 | 00334              | Wed Feb 04 00:00:00 1970
  336 |   6 | 00336              | Fri Feb 06 00:00:00 1970
  337 | 407 | 00337_update7      | Sat Feb 07 00:00:00 1970
  338 |   8 | 00338              | Sun Feb 08 00:00:00 1970
  339 | 509 | 00339_update9      | Mon Feb 09 00:00:00 1970
  340 |   0 | 00340              | Tue Feb 10 00:00:00 1970
  341 |   1 | 00341              | Wed Feb 11 00:00:00 1970
  343 | 303 | 00343_update3      | Fri Feb 13 00:00:00 1970
  344 |   4 | 00344              | Sat Feb 14 00:00:00 1970
  346 |   6 | 00346              | Mon Feb 16 00:00:00 1970
  347 | 407 | 00347_update7      | Tue Feb 17 00:00:00 1970
  348 |   8 | 00348              | Wed Feb 18 00:00:00 1970
  349 | 509 | 00349_update9      | Thu Feb 19 00:00:00 1970
  350 |   0 | 00350              | Fri Feb 20 00:00:00 1970
  351 |   1 | 00351              | Sat Feb 21 00:00:00 1970
  353 | 303 | 00353_update3      | Mon Feb 23 00:00:00 1970
  354 |   4 | 00354              | Tue Feb 24 00:00:00 1970
  356 |   6 | 00356              | Thu Feb 26 00:00:00 1970
  357 | 407 | 00357_update7      | Fri Feb 27 00:00:00 1970
  358 |   8 | 00358              | Sat Feb 28 00:00:00 1970
  359 | 509 | 00359_update9      | Sun Mar 01 00:00:00 1970
  360 |   0 | 00360              | Mon Mar 02 00:00:00 1970
  361 |   1 | 00361              | Tue Mar 03 00:00:00 1970
  363 | 303 | 00363_update3      | Thu Mar 05 00:00:00 1970
  364 |   4 | 00364              | Fri Mar 06 00:00:00 1970
  366 |   6 | 00366              | Sun Mar 08 00:00:00 1970
  367 | 407 | 00367_update7      | Mon Mar 09 00:00:00 1970
  368 |   8 | 00368              | Tue Mar 10 00:00:00 1970
  369 | 509 | 00369_update9      | Wed Mar 11 00:00:00 1970
  370 |   0 | 00370              | Thu Mar 12 00:00:00 1970
  371 |   1 | 00371              | Fri Mar 13 00:00:00 1970
  373 | 303 | 00373_update3      | Sun Mar 15 00:00:00 1970
  374 |   4 | 00374              | Mon Mar 16 00:00:00 1970
  376 |   6 | 00376              | Wed Mar 18 00:00:00 1970
  377 | 407 | 00377_update7      | Thu Mar 19 00:00:00 1970
  378 |   8 | 00378              | Fri Mar 20 00:00:00 1970
  379 | 509 | 00379_update9      | Sat Mar 21 00:00:00 1970
  380 |   0 | 00380              | Sun Mar 22 00:00:00 1970
  381 |   1 | 00381              | Mon Mar 23 00:00:00 1970
  383 | 303 | 00383_update3      | Wed Mar 25 00:00:00 1970
  384 |   4 | 00384              | Thu Mar 26 00:00:00 1970
  386 |   6 | 00386              | Sat Mar 28 00:00:00 1970
  387 | 407 | 00387_update7      | Sun Mar 29 00:00:00 1970
  388 |   8 | 00388              | Mon Mar 30 00:00:00 1970
  389 | 509 | 00389_update9      | Tue Mar 31 00:00:00 1970
  390 |   0 | 00390              | Wed Apr 01 00:00:00 1970
  391 |   1 | 00391              | Thu Apr 02 00:00:00 1970
  393 | 303 | 00393_update3      | Sat Apr 04 00:00:00 1970
  394 |   4 | 00394              | Sun Apr 05 00:00:00 1970
  396 |   6 | 00396              | Tue Apr 07 00:00:00 1970
  397 | 407 | 00397_update7      | Wed Apr 08 00:00:00 1970
  398 |   8 | 00398              | Thu Apr 09 00:00:00 1970
  399 | 509 | 00399_update9      | Fri Apr 10 00:00:00 1970
  400 |   0 | 00400              | Thu Jan 01 00:00:00 1970
  401 |   1 | 00401              | Fri Jan 02 00:00:00 1970
  403 | 303 | 00403_update3      | Sun Jan 04 00:00:00 1970
  404 |   4 | 00404              | Mon Jan 05 00:00:00 1970
  406 |   6 | 00406              | Wed Jan 07 00:00:00 1970
  407 | 407 | 00407_update7      | Thu Jan 08 00:00:00 1970
  408 |   8 | 00408              | Fri Jan 09 00:00:00 1970
  409 | 509 | 00409_update9      | Sat Jan 10 00:00:00 1970
  410 |   0 | 00410              | Sun Jan 11 00:00:00 1970
  411 |   1 | 00411              | Mon Jan 12 00:00:00 1970
  413 | 303 | 00413_update3      | Wed Jan 14 00:00:00 1970
  414 |   4 | 00414              | Thu Jan 15 00:00:00 1970
  416 |   6 | 00416              | Sat Jan 17 00:00:00 1970
  417 | 407 | 00417_update7      | Sun Jan 18 00:00:00 1970
  418 |   8 | 00418              | Mon Jan 19 00:00:00 1970
  419 | 509 | 00419_update9      | Tue Jan 20 00:00:00 1970
  420 |   0 | 00420              | Wed Jan 21 00:00:00 1970
  421 |   1 | 00421              | Thu Jan 22 00:00:00 1970
  423 | 303 | 00423_update3      | Sat Jan 24 00:00:00 1970
  424 |   4 | 00424              | Sun Jan 25 00:00:00 1970
  426 |   6 | 00426              | Tue Jan 27 00:00:00 1970
  427 | 407 | 00427_update7      | Wed Jan 28 00:00:00 1970
  428 |   8 | 00428              | Thu Jan 29 00:00:00 1970
  429 | 509 | 00429_update9      | Fri Jan 30 00:00:00 1970
  430 |   0 | 00430              | Sat Jan 31 00:00:00 1970
  431 |   1 | 00431              | Sun Feb 01 00:00:00 1970
  433 | 303 | 00433_update3      | Tue Feb 03 00:00:00 1970
  434 |   4 | 00434              | Wed Feb 04 00:00:00 1970
  436 |   6 | 00436              | Fri Feb 06 00:00:00 1970
  437 | 407 | 00437_update7      | Sat Feb 07 00:00:00 1970
  438 |   8 | 00438              | Sun Feb 08 00:00:00 1970
  439 | 509 | 00439_update9      | Mon Feb 09 00:00:00 1970
  440 |   0 | 00440              | Tue Feb 10 00:00:00 1970
  441 |   1 | 00441              | Wed Feb 11 00:00:00 1970
  443 | 303 | 00443_update3      | Fri Feb 13 00:00:00 1970
  444 |   4 | 00444              | Sat Feb 14 00:00:00 1970
  446 |   6 | 00446              | Mon Feb 16 00:00:00 1970
  447 | 407 | 00447_update7      | Tue Feb 17 00:00:00 1970
  448 |   8 | 00448              | Wed Feb 18 00:00:00 1970
  449 | 509 | 00449_update9      | Thu Feb 19 00:00:00 1970
  450 |   0 | 00450              | Fri Feb 20 00:00:00 1970
  451 |   1 | 00451              | Sat Feb 21 00:00:00 1970
  453 | 303 | 00453_update3      | Mon Feb 23 00:00:00 1970
  454 |   4 | 00454              | Tue Feb 24 00:00:00 1970
  456 |   6 | 00456              | Thu Feb 26 00:00:00 1970
  457 | 407 | 00457_update7      | Fri Feb 27 00:00:00 1970
  458 |   8 | 00458              | Sat Feb 28 00:00:00 1970
  459 | 509 | 00459_update9      | Sun Mar 01 00:00:00 1970
  460 |   0 | 00460              | Mon Mar 02 00:00:00 1970
  461 |   1 | 00461              | Tue Mar 03 00:00:00 1970
  463 | 303 | 00463_update3      | Thu Mar 05 00:00:00 1970
  464 |   4 | 00464              | Fri Mar 06 00:00:00 1970
  466 |   6 | 00466              | Sun Mar 08 00:00:00 1970
  467 | 407 | 00467_update7      | Mon Mar 09 00:00:00 1970
  468 |   8 | 00468              | Tue Mar 10 00:00:00 1970
  469 | 509 | 00469_update9      | Wed Mar 11 00:00:00 1970
  470 |   0 | 00470              | Thu Mar 12 00:00:00 1970
  471 |   1 | 00471              | Fri Mar 13 00:00:00 1970
  473 | 303 | 00473_update3      | Sun Mar 15 00:00:00 1970
  474 |   4 | 00474              | Mon Mar 16 00:00:00 1970
  476 |   6 | 00476              | Wed Mar 18 00:00:00 1970
  477 | 407 | 00477_update7      | Thu Mar 19 00:00:00 1970
  478 |   8 | 00478              | Fri Mar 20 00:00:00 1970
  479 | 509 | 00479_update9      | Sat Mar 21 00:00:00 1970
  480 |   0 | 00480              | Sun Mar 22 00:00:00 1970
  481 |   1 | 00481              | Mon Mar 23 00:00:00 1970
  483 | 303 | 00483_update3      | Wed Mar 25 00:00:00 1970
  484 |   4 | 00484              | Thu Mar 26 00:00:00 1970
  486 |   6 | 00486              | Sat Mar 28 00:00:00 1970
  487 | 407 | 00487_update7      | Sun Mar 29 00:00:00 1970
  488 |   8 | 00488              | Mon Mar 30 00:00:00 1970
  489 | 509 | 00489_update9      | Tue Mar 31 00:00:00 1970
  490 |   0 | 00490              | Wed Apr 01 00:00:00 1970
  491 |   1 | 00491              | Thu Apr 02 00:00:00 1970
  493 | 303 | 00493_update3      | Sat Apr 04 00:00:00 1970
  494 |   4 | 00494              | Sun Apr 05 00:00:00 1970
  496 |   6 | 00496              | Tue Apr 07 00:00:00 1970
  497 | 407 | 00497_update7      | Wed Apr 08 00:00:00 1970
  498 |   8 | 00498              | Thu Apr 09 00:00:00 1970
  499 | 509 | 00499_update9      | Fri Apr 10 00:00:00 1970
  500 |   0 | 00500              | Thu Jan 01 00:00:00 1970
  501 |   1 | 00501              | Fri Jan 02 00:00:00 1970
  503 | 303 | 00503_update3      | Sun Jan 04 00:00:00 1970
  504 |   4 | 00504              | Mon Jan 05 00:00:00 1970
  506 |   6 | 00506              | Wed Jan 07 00:00:00 1970
  507 | 407 | 00507_update7      | Thu Jan 08 00:00:00 1970
  508 |   8 | 00508              | Fri Jan 09 00:00:00 1970
  509 | 509 | 00509_update9      | Sat Jan 10 00:00:00 1970
  510 |   0 | 00510              | Sun Jan 11 00:00:00 1970
  511 |   1 | 00511              | Mon Jan 12 00:00:00 1970
  513 | 303 | 00513_update3      | Wed Jan 14 00:00:00 1970
  514 |   4 | 00514              | Thu Jan 15 00:00:00 1970
  516 |   6 | 00516              | Sat Jan 17 00:00:00 1970
  517 | 407 | 00517_update7      | Sun Jan 18 00:00:00 1970
  518 |   8 | 00518              | Mon Jan 19 00:00:00 1970
  519 | 509 | 00519_update9      | Tue Jan 20 00:00:00 1970
  520 |   0 | 00520              | Wed Jan 21 00:00:00 1970
  521 |   1 | 00521              | Thu Jan 22 00:00:00 1970
  523 | 303 | 00523_update3      | Sat Jan 24 00:00:00 1970
  524 |   4 | 00524              | Sun Jan 25 00:00:00 1970
  526 |   6 | 00526              | Tue Jan 27 00:00:00 1970
  527 | 407 | 00527_update7      | Wed Jan 28 00:00:00 1970
  528 |   8 | 00528              | Thu Jan 29 00:00:00 1970
  529 | 509 | 00529_update9      | Fri Jan 30 00:00:00 1970
  530 |   0 | 00530              | Sat Jan 31 00:00:00 1970
  531 |   1 | 00531              | Sun Feb 01 00:00:00 1970
  533 | 303 | 00533_update3      | Tue Feb 03 00:00:00 1970
  534 |   4 | 00534              | Wed Feb 04 00:00:00 1970
  536 |   6 | 00536              | Fri Feb 06 00:00:00 1970
  537 | 407 | 00537_update7      | Sat Feb 07 00:00:00 1970
  538 |   8 | 00538              | Sun Feb 08 00:00:00 1970
  539 | 509 | 00539_update9      | Mon Feb 09 00:00:00 1970
  540 |   0 | 00540              | Tue Feb 10 00:00:00 1970
  541 |   1 | 00541              | Wed Feb 11 00:00:00 1970
  543 | 303 | 00543_update3      | Fri Feb 13 00:00:00 1970
  544 |   4 | 00544              | Sat Feb 14 00:00:00 1970
  546 |   6 | 00546              | Mon Feb 16 00:00:00 1970
  547 | 407 | 00547_update7      | Tue Feb 17 00:00:00 1970
  548 |   8 | 00548              | Wed Feb 18 00:00:00 1970
  549 | 509 | 00549_update9      | Thu Feb 19 00:00:00 1970
  550 |   0 | 00550              | Fri Feb 20 00:00:00 1970
  551 |   1 | 00551              | Sat Feb 21 00:00:00 1970
  553 | 303 | 00553_update3      | Mon Feb 23 00:00:00 1970
  554 |   4 | 00554              | Tue Feb 24 00:00:00 1970
  556 |   6 | 00556              | Thu Feb 26 00:00:00 1970
  557 | 407 | 00557_update7      | Fri Feb 27 00:00:00 1970
  558 |   8 | 00558              | Sat Feb 28 00:00:00 1970
  559 | 509 | 00559_update9      | Sun Mar 01 00:00:00 1970
  560 |   0 | 00560              | Mon Mar 02 00:00:00 1970
  561 |   1 | 00561              | Tue Mar 03 00:00:00 1970
  563 | 303 | 00563_update3      | Thu Mar 05 00:00:00 1970
  564 |   4 | 00564              | Fri Mar 06 00:00:00 1970
  566 |   6 | 00566              | Sun Mar 08 00:00:00 1970
  567 | 407 | 00567_update7      | Mon Mar 09 00:00:00 1970
  568 |   8 | 00568              | Tue Mar 10 00:00:00 1970
  569 | 509 | 00569_update9      | Wed Mar 11 00:00:00 1970
  570 |   0 | 00570              | Thu Mar 12 00:00:00 1970
  571 |   1 | 00571              | Fri Mar 13 00:00:00 1970
  573 | 303 | 00573_update3      | Sun Mar 15 00:00:00 1970
  574 |   4 | 00574              | Mon Mar 16 00:00:00 1970
  576 |   6 | 00576              | Wed Mar 18 00:00:00 1970
  577 | 407 | 00577_update7      | Thu Mar 19 00:00:00 1970
  578 |   8 | 00578              | Fri Mar 20 00:00:00 1970
  579 | 509 | 00579_update9      | Sat Mar 21 00:00:00 1970
  580 |   0 | 00580              | Sun Mar 22 00:00:00 1970
  581 |   1 | 00581              | Mon Mar 23 00:00:00 1970
  583 | 303 | 00583_update3      | Wed Mar 25 00:00:00 1970
  584 |   4 | 00584              | Thu Mar 26 00:00:00 1970
  586 |   6 | 00586              | Sat Mar 28 00:00:00 1970
  587 | 407 | 00587_update7      | Sun Mar 29 00:00:00 1970
  588 |   8 | 00588              | Mon Mar 30 00:00:00 1970
  589 | 509 | 00589_update9      | Tue Mar 31 00:00:00 1970
  590 |   0 | 00590              | Wed Apr 01 00:00:00 1970
  591 |   1 | 00591              | Thu Apr 02 00:00:00 1970
  593 | 303 | 00593_update3      | Sat Apr 04 00:00:00 1970
  594 |   4 | 00594              | Sun Apr 05 00:00:00 1970
  596 |   6 | 00596              | Tue Apr 07 00:00:00 1970
  597 | 407 | 00597_update7      | Wed Apr 08 00:00:00 1970
  598 |   8 | 00598              | Thu Apr 09 00:00:00 1970
  599 | 509 | 00599_update9      | Fri Apr 10 00:00:00 1970
  600 |   0 | 00600              | Thu Jan 01 00:00:00 1970
  601 |   1 | 00601              | Fri Jan 02 00:00:00 1970
  603 | 303 | 00603_update3      | Sun Jan 04 00:00:00 1970
  604 |   4 | 00604              | Mon Jan 05 00:00:00 1970
  606 |   6 | 00606              | Wed Jan 07 00:00:00 1970
  607 | 407 | 00607_update7      | Thu Jan 08 00:00:00 1970
  608 |   8 | 00608              | Fri Jan 09 00:00:00 1970
  609 | 509 | 00609_update9      | Sat Jan 10 00:00:00 1970
  610 |   0 | 00610              | Sun Jan 11 00:00:00 1970
  611 |   1 | 00611              | Mon Jan 12 00:00:00 1970
  613 | 303 | 00613_update3      | Wed Jan 14 00:00:00 1970
  614 |   4 | 00614              | Thu Jan 15 00:00:00 1970
  616 |   6 | 00616              | Sat Jan 17 00:00:00 1970
  617 | 407 | 00617_update7      | Sun Jan 18 00:00:00 1970
  618 |   8 | 00618              | Mon Jan 19 00:00:00 1970
  619 | 509 | 00619_update9      | Tue Jan 20 00:00:00 1970
  620 |   0 | 00620              | Wed Jan 21 00:00:00 1970
  621 |   1 | 00621              | Thu Jan 22 00:00:00 1970
  623 | 303 | 00623_update3      | Sat Jan 24 00:00:00 1970
  624 |   4 | 00624              | Sun Jan 25 00:00:00 1970
  626 |   6 | 00626              | Tue Jan 27 00:00:00 1970
  627 | 407 | 00627_update7      | Wed Jan 28 00:00:00 1970
  628 |   8 | 00628              | Thu Jan 29 00:00:00 1970
  629 | 509 | 00629_update9      | Fri Jan 30 00:00:00 1970
  630 |   0 | 00630              | Sat Jan 31 00:00:00 1970
  631 |   1 | 00631              | Sun Feb 01 00:00:00 1970
  633 | 303 | 00633_update3      | Tue Feb 03 00:00:00 1970
  634 |   4 | 00634              | Wed Feb 04 00:00:00 1970
  636 |   6 | 00636              | Fri Feb 06 00:00:00 1970
  637 | 407 | 00637_update7      | Sat Feb 07 00:00:00 1970
  638 |   8 | 00638              | Sun Feb 08 00:00:00 1970
  639 | 509 | 00639_update9      | Mon Feb 09 00:00:00 1970
  640 |   0 | 00640              | Tue Feb 10 00:00:00 1970
  641 |   1 | 00641              | Wed Feb 11 00:00:00 1970
  643 | 303 | 00643_update3      | Fri Feb 13 00:00:00 1970
  644 |   4 | 00644              | Sat Feb 14 00:00:00 1970
  646 |   6 | 00646              | Mon Feb 16 00:00:00 1970
  647 | 407 | 00647_update7      | Tue Feb 17 00:00:00 1970
  648 |   8 | 00648              | Wed Feb 18 00:00:00 1970
  649 | 509 | 00649_update9      | Thu Feb 19 00:00:00 1970
  650 |   0 | 00650              | Fri Feb 20 00:00:00 1970
  651 |   1 | 00651              | Sat Feb 21 00:00:00 1970
  653 | 303 | 00653_update3      | Mon Feb 23 00:00:00 1970
  654 |   4 | 00654              | Tue Feb 24 00:00:00 1970
  656 |   6 | 00656              | Thu Feb 26 00:00:00 1970
  657 | 407 | 00657_update7      | Fri Feb 27 00:00:00 1970
  658 |   8 | 00658              | Sat Feb 28 00:00:00 1970
  659 | 509 | 00659_update9      | Sun Mar 01 00:00:00 1970
  660 |   0 | 00660              | Mon Mar 02 00:00:00 1970
  661 |   1 | 00661              | Tue Mar 03 00:00:00 1970
  663 | 303 | 00663_update3      | Thu Mar 05 00:00:00 1970
  664 |   4 | 00664              | Fri Mar 06 00:00:00 1970
  666 |   6 | 00666              | Sun Mar 08 00:00:00 1970
  667 | 407 | 00667_update7      | Mon Mar 09 00:00:00 1970
  668 |   8 | 00668              | Tue Mar 10 00:00:00 1970
  669 | 509 | 00669_update9      | Wed Mar 11 00:00:00 1970
  670 |   0 | 00670              | Thu Mar 12 00:00:00 1970
  671 |   1 | 00671              | Fri Mar 13 00:00:00 1970
  673 | 303 | 00673_update3      | Sun Mar 15 00:00:00 1970
  674 |   4 | 00674              | Mon Mar 16 00:00:00 1970
  676 |   6 | 00676              | Wed Mar 18 00:00:00 1970
  677 | 407 | 00677_update7      | Thu Mar 19 00:00:00 1970
  678 |   8 | 00678              | Fri Mar 20 00:00:00 1970
  679 | 509 | 00679_update9      | Sat Mar 21 00:00:00 1970
  680 |   0 | 00680              | Sun Mar 22 00:00:00 1970
  681 |   1 | 00681              | Mon Mar 23 00:00:00 1970
  683 | 303 | 00683_update3      | Wed Mar 25 00:00:00 1970
  684 |   4 | 00684              | Thu Mar 26 00:00:00 1970
  686 |   6 | 00686              | Sat Mar 28 00:00:00 1970
  687 | 407 | 00687_update7      | Sun Mar 29 00:00:00 1970
  688 |   8 | 00688              | Mon Mar 30 00:00:00 1970
  689 | 509 | 00689_update9      | Tue Mar 31 00:00:00 1970
  690 |   0 | 00690              | Wed Apr 01 00:00:00 1970
  691 |   1 | 00691              | Thu Apr 02 00:00:00 1970
  693 | 303 | 00693_update3      | Sat Apr 04 00:00:00 1970
  694 |   4 | 00694              | Sun Apr 05 00:00:00 1970
  696 |   6 | 00696              | Tue Apr 07 00:00:00 1970
  697 | 407 | 00697_update7      | Wed Apr 08 00:00:00 1970
  698 |   8 | 00698              | Thu Apr 09 00:00:00 1970
  699 | 509 | 00699_update9      | Fri Apr 10 00:00:00 1970
  700 |   0 | 00700              | Thu Jan 01 00:00:00 1970
  701 |   1 | 00701              | Fri Jan 02 00:00:00 1970
  703 | 303 | 00703_update3      | Sun Jan 04 00:00:00 1970
  704 |   4 | 00704              | Mon Jan 05 00:00:00 1970
  706 |   6 | 00706              | Wed Jan 07 00:00:00 1970
  707 | 407 | 00707_update7      | Thu Jan 08 00:00:00 1970
  708 |   8 | 00708              | Fri Jan 09 00:00:00 1970
  709 | 509 | 00709_update9      | Sat Jan 10 00:00:00 1970
  710 |   0 | 00710              | Sun Jan 11 00:00:00 1970
  711 |   1 | 00711              | Mon Jan 12 00:00:00 1970
  713 | 303 | 00713_update3      | Wed Jan 14 00:00:00 1970
  714 |   4 | 00714              | Thu Jan 15 00:00:00 1970
  716 |   6 | 00716              | Sat Jan 17 00:00:00 1970
  717 | 407 | 00717_update7      | Sun Jan 18 00:00:00 1970
  718 |   8 | 00718              | Mon Jan 19 00:00:00 1970
  719 | 509 | 00719_update9      | Tue Jan 20 00:00:00 1970
  720 |   0 | 00720              | Wed Jan 21 00:00:00 1970
  721 |   1 | 00721              | Thu Jan 22 00:00:00 1970
  723 | 303 | 00723_update3      | Sat Jan 24 00:00:00 1970
  724 |   4 | 00724              | Sun Jan 25 00:00:00 1970
  726 |   6 | 00726              | Tue Jan 27 00:00:00 1970
  727 | 407 | 00727_update7      | Wed Jan 28 00:00:00 1970
  728 |   8 | 00728              | Thu Jan 29 00:00:00 1970
  729 | 509 | 00729_update9      | Fri Jan 30 00:00:00 1970
  730 |   0 | 00730              | Sat Jan 31 00:00:00 1970
  731 |   1 | 00731              | Sun Feb 01 00:00:00 1970
  733 | 303 | 00733_update3      | Tue Feb 03 00:00:00 1970
  734 |   4 | 00734              | Wed Feb 04 00:00:00 1970
  736 |   6 | 00736              | Fri Feb 06 00:00:00 1970
  737 | 407 | 00737_update7      | Sat Feb 07 00:00:00 1970
  738 |   8 | 00738              | Sun Feb 08 00:00:00 1970
  739 | 509 | 00739_update9      | Mon Feb 09 00:00:00 1970
  740 |   0 | 00740              | Tue Feb 10 00:00:00 1970
  741 |   1 | 00741              | Wed Feb 11 00:00:00 1970
  743 | 303 | 00743_update3      | Fri Feb 13 00:00:00 1970
  744 |   4 | 00744              | Sat Feb 14 00:00:00 1970
  746 |   6 | 00746              | Mon Feb 16 00:00:00 1970
  747 | 407 | 00747_update7      | Tue Feb 17 00:00:00 1970
  748 |   8 | 00748              | Wed Feb 18 00:00:00 1970
  749 | 509 | 00749_update9      | Thu Feb 19 00:00:00 1970
  750 |   0 | 00750              | Fri Feb 20 00:00:00 1970
  751 |   1 | 00751              | Sat Feb 21 00:00:00 1970
  753 | 303 | 00753_update3      | Mon Feb 23 00:00:00 1970
  754 |   4 | 00754              | Tue Feb 24 00:00:00 1970
  756 |   6 | 00756              | Thu Feb 26 00:00:00 1970
  757 | 407 | 00757_update7      | Fri Feb 27 00:00:00 1970
  758 |   8 | 00758              | Sat Feb 28 00:00:00 1970
  759 | 509 | 00759_update9      | Sun Mar 01 00:00:00 1970
  760 |   0 | 00760              | Mon Mar 02 00:00:00 1970
  761 |   1 | 00761              | Tue Mar 03 00:00:00 1970
  763 | 303 | 00763_update3      | Thu Mar 05 00:00:00 1970
  764 |   4 | 00764              | Fri Mar 06 00:00:00 1970
  766 |   6 | 00766              | Sun Mar 08 00:00:00 1970
  767 | 407 | 00767_update7      | Mon Mar 09 00:00:00 1970
  768 |   8 | 00768              | Tue Mar 10 00:00:00 1970
  769 | 509 | 00769_update9      | Wed Mar 11 00:00:00 1970
  770 |   0 | 00770              | Thu Mar 12 00:00:00 1970
  771 |   1 | 00771              | Fri Mar 13 00:00:00 1970
  773 | 303 | 00773_update3      | Sun Mar 15 00:00:00 1970
  774 |   4 | 00774              | Mon Mar 16 00:00:00 1970
  776 |   6 | 00776              | Wed Mar 18 00:00:00 1970
  777 | 407 | 00777_update7      | Thu Mar 19 00:00:00 1970
  778 |   8 | 00778              | Fri Mar 20 00:00:00 1970
  779 | 509 | 00779_update9      | Sat Mar 21 00:00:00 1970
  780 |   0 | 00780              | Sun Mar 22 00:00:00 1970
  781 |   1 | 00781              | Mon Mar 23 00:00:00 1970
  783 | 303 | 00783_update3      | Wed Mar 25 00:00:00 1970
  784 |   4 | 00784              | Thu Mar 26 00:00:00 1970
  786 |   6 | 00786              | Sat Mar 28 00:00:00 1970
  787 | 407 | 00787_update7      | Sun Mar 29 00:00:00 1970
  788 |   8 | 00788              | Mon Mar 30 00:00:00 1970
  789 | 509 | 00789_update9      | Tue Mar 31 00:00:00 1970
  790 |   0 | 00790              | Wed Apr 01 00:00:00 1970
  791 |   1 | 00791              | Thu Apr 02 00:00:00 1970
  793 | 303 | 00793_update3      | Sat Apr 04 00:00:00 1970
  794 |   4 | 00794              | Sun Apr 05 00:00:00 1970
  796 |   6 | 00796              | Tue Apr 07 00:00:00 1970
  797 | 407 | 00797_update7      | Wed Apr 08 00:00:00 1970
  798 |   8 | 00798              | Thu Apr 09 00:00:00 1970
  799 | 509 | 00799_update9      | Fri Apr 10 00:00:00 1970
  800 |   0 | 00800              | Thu Jan 01 00:00:00 1970
  801 |   1 | 00801              | Fri Jan 02 00:00:00 1970
  803 | 303 | 00803_update3      | Sun Jan 04 00:00:00 1970
  804 |   4 | 00804              | Mon Jan 05 00:00:00 1970
  806 |   6 | 00806              | Wed Jan 07 00:00:00 1970
  807 | 407 | 00807_update7      | Thu Jan 08 00:00:00 1970
  808 |   8 | 00808              | Fri Jan 09 00:00:00 1970
  809 | 509 | 00809_update9      | Sat Jan 10 00:00:00 1970
  810 |   0 | 00810              | Sun Jan 11 00:00:00 1970
  811 |   1 | 00811              | Mon Jan 12 00:00:00 1970
  813 | 303 | 00813_update3      | Wed Jan 14 00:00:00 1970
  814 |   4 | 00814              | Thu Jan 15 00:00:00 1970
  816 |   6 | 00816              | Sat Jan 17 00:00:00 1970
  817 | 407 | 00817_update7      | Sun Jan 18 00:00:00 1970
  818 |   8 | 00818              | Mon Jan 19 00:00:00 1970
  819 | 509 | 00819_update9      | Tue Jan 20 00:00:00 1970
  820 |   0 | 00820              | Wed Jan 21 00:00:00 1970
  821 |   1 | 00821              | Thu Jan 22 00:00:00 1970
  823 | 303 | 00823_update3      | Sat Jan 24 00:00:00 1970
  824 |   4 | 00824              | Sun Jan 25 00:00:00 1970
  826 |   6 | 00826              | Tue Jan 27 00:00:00 1970
  827 | 407 | 00827_update7      | Wed Jan 28 00:00:00 1970
  828 |   8 | 00828              | Thu Jan 29 00:00:00 1970
  829 | 509 | 00829_update9      | Fri Jan 30 00:00:00 1970
  830 |   0 | 00830              | Sat Jan 31 00:00:00 1970
  831 |   1 | 00831              | Sun Feb 01 00:00:00 1970
  833 | 303 | 00833_update3      | Tue Feb 03 00:00:00 1970
  834 |   4 | 00834              | Wed Feb 04 00:00:00 1970
  836 |   6 | 00836              | Fri Feb 06 00:00:00 1970
  837 | 407 | 00837_update7      | Sat Feb 07 00:00:00 1970
  838 |   8 | 00838              | Sun Feb 08 00:00:00 1970
  839 | 509 | 00839_update9      | Mon Feb 09 00:00:00 1970
  840 |   0 | 00840              | Tue Feb 10 00:00:00 1970
  841 |   1 | 00841              | Wed Feb 11 00:00:00 1970
  843 | 303 | 00843_update3      | Fri Feb 13 00:00:00 1970
  844 |   4 | 00844              | Sat Feb 14 00:00:00 1970
  846 |   6 | 00846              | Mon Feb 16 00:00:00 1970
  847 | 407 | 00847_update7      | Tue Feb 17 00:00:00 1970
  848 |   8 | 00848              | Wed Feb 18 00:00:00 1970
  849 | 509 | 00849_update9      | Thu Feb 19 00:00:00 1970
  850 |   0 | 00850              | Fri Feb 20 00:00:00 1970
  851 |   1 | 00851              | Sat Feb 21 00:00:00 1970
  853 | 303 | 00853_update3      | Mon Feb 23 00:00:00 1970
  854 |   4 | 00854              | Tue Feb 24 00:00:00 1970
  856 |   6 | 00856              | Thu Feb 26 00:00:00 1970
  857 | 407 | 00857_update7      | Fri Feb 27 00:00:00 1970
  858 |   8 | 00858              | Sat Feb 28 00:00:00 1970
  859 | 509 | 00859_update9      | Sun Mar 01 00:00:00 1970
  860 |   0 | 00860              | Mon Mar 02 00:00:00 1970
  861 |   1 | 00861              | Tue Mar 03 00:00:00 1970
  863 | 303 | 00863_update3      | Thu Mar 05 00:00:00 1970
  864 |   4 | 00864              | Fri Mar 06 00:00:00 1970
  866 |   6 | 00866              | Sun Mar 08 00:00:00 1970
  867 | 407 | 00867_update7      | Mon Mar 09 00:00:00 1970
  868 |   8 | 00868              | Tue Mar 10 00:00:00 1970
  869 | 509 | 00869_update9      | Wed Mar 11 00:00:00 1970
  870 |   0 | 00870              | Thu Mar 12 00:00:00 1970
  871 |   1 | 00871              | Fri Mar 13 00:00:00 1970
  873 | 303 | 00873_update3      | Sun Mar 15 00:00:00 1970
  874 |   4 | 00874              | Mon Mar 16 00:00:00 1970
  876 |   6 | 00876              | Wed Mar 18 00:00:00 1970
  877 | 407 | 00877_update7      | Thu Mar 19 00:00:00 1970
  878 |   8 | 00878              | Fri Mar 20 00:00:00 1970
  879 | 509 | 00879_update9      | Sat Mar 21 00:00:00 1970
  880 |   0 | 00880              | Sun Mar 22 00:00:00 1970
  881 |   1 | 00881              | Mon Mar 23 00:00:00 1970
  883 | 303 | 00883_update3      | Wed Mar 25 00:00:00 1970
  884 |   4 | 00884              | Thu Mar 26 00:00:00 1970
  886 |   6 | 00886              | Sat Mar 28 00:00:00 1970
  887 | 407 | 00887_update7      | Sun Mar 29 00:00:00 1970
  888 |   8 | 00888              | Mon Mar 30 00:00:00 1970
  889 | 509 | 00889_update9      | Tue Mar 31 00:00:00 1970
  890 |   0 | 00890              | Wed Apr 01 00:00:00 1970
  891 |   1 | 00891              | Thu Apr 02 00:00:00 1970
  893 | 303 | 00893_update3      | Sat Apr 04 00:00:00 1970
  894 |   4 | 00894              | Sun Apr 05 00:00:00 1970
  896 |   6 | 00896              | Tue Apr 07 00:00:00 1970
  897 | 407 | 00897_update7      | Wed Apr 08 00:00:00 1970
  898 |   8 | 00898              | Thu Apr 09 00:00:00 1970
  899 | 509 | 00899_update9      | Fri Apr 10 00:00:00 1970
  900 |   0 | 00900              | Thu Jan 01 00:00:00 1970
  901 |   1 | 00901              | Fri Jan 02 00:00:00 1970
  903 | 303 | 00903_update3      | Sun Jan 04 00:00:00 1970
  904 |   4 | 00904              | Mon Jan 05 00:00:00 1970
  906 |   6 | 00906              | Wed Jan 07 00:00:00 1970
  907 | 407 | 00907_update7      | Thu Jan 08 00:00:00 1970
  908 |   8 | 00908              | Fri Jan 09 00:00:00 1970
  909 | 509 | 00909_update9      | Sat Jan 10 00:00:00 1970
  910 |   0 | 00910              | Sun Jan 11 00:00:00 1970
  911 |   1 | 00911              | Mon Jan 12 00:00:00 1970
  913 | 303 | 00913_update3      | Wed Jan 14 00:00:00 1970
  914 |   4 | 00914              | Thu Jan 15 00:00:00 1970
  916 |   6 | 00916              | Sat Jan 17 00:00:00 1970
  917 | 407 | 00917_update7      | Sun Jan 18 00:00:00 1970
  918 |   8 | 00918              | Mon Jan 19 00:00:00 1970
  919 | 509 | 00919_update9      | Tue Jan 20 00:00:00 1970
  920 |   0 | 00920              | Wed Jan 21 00:00:00 1970
  921 |   1 | 00921              | Thu Jan 22 00:00:00 1970
  923 | 303 | 00923_update3      | Sat Jan 24 00:00:00 1970
  924 |   4 | 00924              | Sun Jan 25 00:00:00 1970
  926 |   6 | 00926              | Tue Jan 27 00:00:00 1970
  927 | 407 | 00927_update7      | Wed Jan 28 00:00:00 1970
  928 |   8 | 00928              | Thu Jan 29 00:00:00 1970
  929 | 509 | 00929_update9      | Fri Jan 30 00:00:00 1970
  930 |   0 | 00930              | Sat Jan 31 00:00:00 1970
  931 |   1 | 00931              | Sun Feb 01 00:00:00 1970
  933 | 303 | 00933_update3      | Tue Feb 03 00:00:00 1970
  934 |   4 | 00934              | Wed Feb 04 00:00:00 1970
  936 |   6 | 00936              | Fri Feb 06 00:00:00 1970
  937 | 407 | 00937_update7      | Sat Feb 07 00:00:00 1970
  938 |   8 | 00938              | Sun Feb 08 00:00:00 1970
  939 | 509 | 00939_update9      | Mon Feb 09 00:00:00 1970
  940 |   0 | 00940              | Tue Feb 10 00:00:00 1970
  941 |   1 | 00941              | Wed Feb 11 00:00:00 1970
  943 | 303 | 00943_update3      | Fri Feb 13 00:00:00 1970
  944 |   4 | 00944              | Sat Feb 14 00:00:00 1970
  946 |   6 | 00946              | Mon Feb 16 00:00:00 1970
  947 | 407 | 00947_update7      | Tue Feb 17 00:00:00 1970
  948 |   8 | 00948              | Wed Feb 18 00:00:00 1970
  949 | 509 | 00949_update9      | Thu Feb 19 00:00:00 1970
  950 |   0 | 00950              | Fri Feb 20 00:00:00 1970
  951 |   1 | 00951              | Sat Feb 21 00:00:00 1970
  953 | 303 | 00953_update3      | Mon Feb 23 00:00:00 1970
  954 |   4 | 00954              | Tue Feb 24 00:00:00 1970
  956 |   6 | 00956              | Thu Feb 26 00:00:00 1970
  957 | 407 | 00957_update7      | Fri Feb 27 00:00:00 1970
  958 |   8 | 00958              | Sat Feb 28 00:00:00 1970
  959 | 509 | 00959_update9      | Sun Mar 01 00:00:00 1970
  960 |   0 | 00960              | Mon Mar 02 00:00:00 1970
  961 |   1 | 00961              | Tue Mar 03 00:00:00 1970
  963 | 303 | 00963_update3      | Thu Mar 05 00:00:00 1970
  964 |   4 | 00964              | Fri Mar 06 00:00:00 1970
  966 |   6 | 00966              | Sun Mar 08 00:00:00 1970
  967 | 407 | 00967_update7      | Mon Mar 09 00:00:00 1970
  968 |   8 | 00968              | Tue Mar 10 00:00:00 1970
  969 | 509 | 00969_update9      | Wed Mar 11 00:00:00 1970
  970 |   0 | 00970              | Thu Mar 12 00:00:00 1970
  971 |   1 | 00971              | Fri Mar 13 00:00:00 1970
  973 | 303 | 00973_update3      | Sun Mar 15 00:00:00 1970
  974 |   4 | 00974              | Mon Mar 16 00:00:00 1970
  976 |   6 | 00976              | Wed Mar 18 00:00:00 1970
  977 | 407 | 00977_update7      | Thu Mar 19 00:00:00 1970
  978 |   8 | 00978              | Fri Mar 20 00:00:00 1970
  979 | 509 | 00979_update9      | Sat Mar 21 00:00:00 1970
  980 |   0 | 00980              | Sun Mar 22 00:00:00 1970
  981 |   1 | 00981              | Mon Mar 23 00:00:00 1970
  983 | 303 | 00983_update3      | Wed Mar 25 00:00:00 1970
  984 |   4 | 00984              | Thu Mar 26 00:00:00 1970
  986 |   6 | 00986              | Sat Mar 28 00:00:00 1970
  987 | 407 | 00987_update7      | Sun Mar 29 00:00:00 1970
  988 |   8 | 00988              | Mon Mar 30 00:00:00 1970
  989 | 509 | 00989_update9      | Tue Mar 31 00:00:00 1970
  990 |   0 | 00990              | Wed Apr 01 00:00:00 1970
  991 |   1 | 00991              | Thu Apr 02 00:00:00 1970
  993 | 303 | 00993_update3      | Sat Apr 04 00:00:00 1970
  994 |   4 | 00994              | Sun Apr 05 00:00:00 1970
  996 |   6 | 00996              | Tue Apr 07 00:00:00 1970
  997 | 407 | 00997_update7      | Wed Apr 08 00:00:00 1970
  998 |   8 | 00998              | Thu Apr 09 00:00:00 1970
  999 | 509 | 00999_update9      | Fri Apr 10 00:00:00 1970
 1000 |   0 | 01000              | Thu Jan 01 00:00:00 1970
 1001 | 101 | 0000100001         | 
 1003 | 403 | 0000300003_update3 | 
 1004 | 104 | 0000400004         | 
 1006 | 106 | 0000600006         | 
 1007 | 507 | 0000700007_update7 | 
 1008 | 108 | 0000800008         | 
 1009 | 609 | 0000900009_update9 | 
 1010 | 100 | 0001000010         | 
 1011 | 101 | 0001100011         | 
 1013 | 403 | 0001300013_update3 | 
 1014 | 104 | 0001400014         | 
 1016 | 106 | 0001600016         | 
 1017 | 507 | 0001700017_update7 | 
 1018 | 108 | 0001800018         | 
 1019 | 609 | 0001900019_update9 | 
 1020 | 100 | 0002000020         | 
 1101 | 201 | aaa                | 
 1103 | 503 | ccc_update3        | 
 1104 | 204 | ddd                | 
(819 rows)

--Testcase 437:
EXPLAIN (verbose, costs off)
INSERT INTO ft2 (c1,c2,c3) VALUES (1200,999,'foo');
                                                                                   QUERY PLAN                                                                                   
--------------------------------------------------------------------------------------------------------------------------------------------------------------------------------
 Insert on public.ft2
   Remote SQL: INSERT INTO odbc_fdw_post.`T1`(`C_1`, c2, c3, c4, c5, c6, c7, c8) VALUES (?, ?, ?, ?, ?, ?, ?, ?)
   ->  Result
         Output: 1200, 999, 'foo'::text, NULL::timestamp without time zone, NULL::timestamp without time zone, NULL::character varying, 'ft2       '::character(10), NULL::text
(4 rows)

--Testcase 438:
INSERT INTO ft2 (c1,c2,c3) VALUES (1200,999,'foo');
--Testcase 439:
SELECT tableoid::regclass FROM ft2 WHERE c1 = 1200;
 tableoid 
----------
 ft2
(1 row)

--Testcase 440:
EXPLAIN (verbose, costs off)
UPDATE ft2 SET c3 = 'bar' WHERE c1 = 1200;             -- can be pushed down
                                                 QUERY PLAN                                                  
-------------------------------------------------------------------------------------------------------------
 Update on public.ft2
   Remote SQL: UPDATE odbc_fdw_post.`T1` SET c3 = ? WHERE `C_1` = ?
   ->  Foreign Scan on public.ft2
         Output: 'bar'::text, c1, ft2.*
         Remote SQL: SELECT `C_1`, c2, c3, c4, c5, c6, c7, c8 FROM odbc_fdw_post.`T1` WHERE ((`C_1` = 1200))
(5 rows)

--Testcase 441:
UPDATE ft2 SET c3 = 'bar' WHERE c1 = 1200;
--Testcase 442:
SELECT tableoid::regclass FROM ft2 WHERE c1 = 1200;
 tableoid 
----------
 ft2
(1 row)

--Testcase 443:
EXPLAIN (verbose, costs off)
DELETE FROM ft2 WHERE c1 = 1200;                       -- can be pushed down
                                   QUERY PLAN                                    
---------------------------------------------------------------------------------
 Delete on public.ft2
   Remote SQL: DELETE FROM odbc_fdw_post.`T1` WHERE `C_1` = ?
   ->  Foreign Scan on public.ft2
         Output: c1
         Remote SQL: SELECT `C_1` FROM odbc_fdw_post.`T1` WHERE ((`C_1` = 1200))
(5 rows)

--Testcase 444:
SELECT tableoid::regclass FROM ft2 WHERE c1 = 1200;
 tableoid 
----------
 ft2
(1 row)

--Testcase 445:
DELETE FROM ft2 WHERE c1 = 1200;
-- Test UPDATE/DELETE with RETURNING on a three-table join
--Testcase 446:
INSERT INTO ft2 (c1,c2,c3)
  SELECT id, id - 1200, to_char(id, 'FM00000') FROM generate_series(1201, 1300) id;
--Testcase 447:
EXPLAIN (verbose, costs off)
UPDATE ft2 SET c3 = 'foo'
  FROM ft4 INNER JOIN ft5 ON (ft4.c1 = ft5.c1)
  WHERE ft2.c1 > 1200 AND ft2.c2 = ft4.c1;       -- can be pushed down
                                                    QUERY PLAN                                                     
-------------------------------------------------------------------------------------------------------------------
 Update on public.ft2
   Remote SQL: UPDATE odbc_fdw_post.`T1` SET c3 = ? WHERE `C_1` = ?
   ->  Hash Join
         Output: 'foo'::text, ft2.c1, ft2.*, ft4.*, ft5.*
         Hash Cond: (ft2.c2 = ft4.c1)
         ->  Foreign Scan on public.ft2
               Output: ft2.c1, ft2.*, ft2.c2
               Remote SQL: SELECT `C_1`, c2, c3, c4, c5, c6, c7, c8 FROM odbc_fdw_post.`T1` WHERE ((`C_1` > 1200))
         ->  Hash
               Output: ft4.*, ft4.c1, ft5.*, ft5.c1
               ->  Hash Join
                     Output: ft4.*, ft4.c1, ft5.*, ft5.c1
                     Hash Cond: (ft4.c1 = ft5.c1)
                     ->  Foreign Scan on public.ft4
                           Output: ft4.*, ft4.c1
                           Remote SQL: SELECT c1, c2, c3 FROM odbc_fdw_post.`T3`
                     ->  Hash
                           Output: ft5.*, ft5.c1
                           ->  Foreign Scan on public.ft5
                                 Output: ft5.*, ft5.c1
                                 Remote SQL: SELECT c1, c2, c3 FROM odbc_fdw_post.`T4`
(21 rows)

--Testcase 448:
UPDATE ft2 SET c3 = 'foo'
  FROM ft4 INNER JOIN ft5 ON (ft4.c1 = ft5.c1)
  WHERE ft2.c1 > 1200 AND ft2.c2 = ft4.c1;
--Testcase 449:
SELECT ft2, ft2.*, ft4, ft4.* FROM ft2, ft4, ft5 WHERE (ft4.c1 = ft5.c1) AND (ft2.c1 > 1200) AND (ft2.c2 = ft4.c1) ORDER BY ft2.c2;
              ft2               |  c1  | c2 | c3  | c4 | c5 | c6 |     c7     | c8 |      ft4       | c1 | c2 |   c3   
--------------------------------+------+----+-----+----+----+----+------------+----+----------------+----+----+--------
 (1206,6,foo,,,,"ft2       ",)  | 1206 |  6 | foo |    |    |    | ft2        |    | (6,7,AAA006)   |  6 |  7 | AAA006
 (1212,12,foo,,,,"ft2       ",) | 1212 | 12 | foo |    |    |    | ft2        |    | (12,13,AAA012) | 12 | 13 | AAA012
 (1218,18,foo,,,,"ft2       ",) | 1218 | 18 | foo |    |    |    | ft2        |    | (18,19,AAA018) | 18 | 19 | AAA018
 (1224,24,foo,,,,"ft2       ",) | 1224 | 24 | foo |    |    |    | ft2        |    | (24,25,AAA024) | 24 | 25 | AAA024
 (1230,30,foo,,,,"ft2       ",) | 1230 | 30 | foo |    |    |    | ft2        |    | (30,31,AAA030) | 30 | 31 | AAA030
 (1236,36,foo,,,,"ft2       ",) | 1236 | 36 | foo |    |    |    | ft2        |    | (36,37,AAA036) | 36 | 37 | AAA036
 (1242,42,foo,,,,"ft2       ",) | 1242 | 42 | foo |    |    |    | ft2        |    | (42,43,AAA042) | 42 | 43 | AAA042
 (1248,48,foo,,,,"ft2       ",) | 1248 | 48 | foo |    |    |    | ft2        |    | (48,49,AAA048) | 48 | 49 | AAA048
 (1254,54,foo,,,,"ft2       ",) | 1254 | 54 | foo |    |    |    | ft2        |    | (54,55,AAA054) | 54 | 55 | AAA054
 (1260,60,foo,,,,"ft2       ",) | 1260 | 60 | foo |    |    |    | ft2        |    | (60,61,AAA060) | 60 | 61 | AAA060
 (1266,66,foo,,,,"ft2       ",) | 1266 | 66 | foo |    |    |    | ft2        |    | (66,67,AAA066) | 66 | 67 | AAA066
 (1272,72,foo,,,,"ft2       ",) | 1272 | 72 | foo |    |    |    | ft2        |    | (72,73,AAA072) | 72 | 73 | AAA072
 (1278,78,foo,,,,"ft2       ",) | 1278 | 78 | foo |    |    |    | ft2        |    | (78,79,AAA078) | 78 | 79 | AAA078
 (1284,84,foo,,,,"ft2       ",) | 1284 | 84 | foo |    |    |    | ft2        |    | (84,85,AAA084) | 84 | 85 | AAA084
 (1290,90,foo,,,,"ft2       ",) | 1290 | 90 | foo |    |    |    | ft2        |    | (90,91,AAA090) | 90 | 91 | AAA090
 (1296,96,foo,,,,"ft2       ",) | 1296 | 96 | foo |    |    |    | ft2        |    | (96,97,AAA096) | 96 | 97 | AAA096
(16 rows)

--Testcase 450:
EXPLAIN (verbose, costs off)
DELETE FROM ft2
  USING ft4 LEFT JOIN ft5 ON (ft4.c1 = ft5.c1)
  WHERE ft2.c1 > 1200 AND ft2.c1 % 10 = 0 AND ft2.c2 = ft4.c1;                          -- can be pushed down
                                                     QUERY PLAN                                                     
--------------------------------------------------------------------------------------------------------------------
 Delete on public.ft2
   Remote SQL: DELETE FROM odbc_fdw_post.`T1` WHERE `C_1` = ?
   ->  Hash Join
         Output: ft2.c1, ft4.*, ft5.*
         Hash Cond: (ft2.c2 = ft4.c1)
         ->  Foreign Scan on public.ft2
               Output: ft2.c1, ft2.c2, ft2.c3, ft2.c4, ft2.c5, ft2.c6, ft2.c7, ft2.c8
               Remote SQL: SELECT `C_1`, c2 FROM odbc_fdw_post.`T1` WHERE ((`C_1` > 1200)) AND (((`C_1` % 10) = 0))
         ->  Hash
               Output: ft4.*, ft4.c1, ft5.*
               ->  Hash Left Join
                     Output: ft4.*, ft4.c1, ft5.*
                     Hash Cond: (ft4.c1 = ft5.c1)
                     ->  Foreign Scan on public.ft4
                           Output: ft4.*, ft4.c1
                           Remote SQL: SELECT c1, c2, c3 FROM odbc_fdw_post.`T3`
                     ->  Hash
                           Output: ft5.*, ft5.c1
                           ->  Foreign Scan on public.ft5
                                 Output: ft5.*, ft5.c1
                                 Remote SQL: SELECT c1, c2, c3 FROM odbc_fdw_post.`T4`
(21 rows)

--Testcase 451:
DELETE FROM ft2 
  USING ft4 LEFT JOIN ft5 ON (ft4.c1 = ft5.c1)
  WHERE ft2.c1 > 1200 AND ft2.c1 % 10 = 0 AND ft2.c2 = ft4.c1;
--Testcase 452:
DELETE FROM ft2 WHERE ft2.c1 > 1200;
-- Test UPDATE with a MULTIEXPR sub-select
-- (maybe someday this'll be remotely executable, but not today)
--Testcase 453:
EXPLAIN (verbose, costs off)
UPDATE ft2 AS target SET (c2, c7) = (
    SELECT c2 * 10, c7
        FROM ft2 AS src
        WHERE target.c1 = src.c1
) WHERE c1 > 1100;
                                                 QUERY PLAN                                                  
-------------------------------------------------------------------------------------------------------------
 Update on public.ft2 target
   Remote SQL: UPDATE odbc_fdw_post.`T1` SET c2 = ?, c7 = ? WHERE `C_1` = ?
   ->  Foreign Scan on public.ft2 target
         Output: $1, $2, (SubPlan 1 (returns $1,$2)), target.c1, target.*
         Remote SQL: SELECT `C_1`, c2, c3, c4, c5, c6, c7, c8 FROM odbc_fdw_post.`T1` WHERE ((`C_1` > 1100))
         SubPlan 1 (returns $1,$2)
           ->  Foreign Scan on public.ft2 src
                 Output: (src.c2 * 10), src.c7
                 Filter: (target.c1 = src.c1)
                 Remote SQL: SELECT `C_1`, c2, c7 FROM odbc_fdw_post.`T1`
(10 rows)

--Testcase 454:
UPDATE ft2 AS target SET (c2, c7) = (
    SELECT c2 * 10, c7
        FROM ft2 AS src
        WHERE target.c1 = src.c1
) WHERE c1 > 1100;
--Testcase 455:
UPDATE ft2 AS target SET (c2) = (
    SELECT c2 / 10
        FROM ft2 AS src
        WHERE target.c1 = src.c1
) WHERE c1 > 1100;
-- Test UPDATE involving a join that can be pushed down,
-- but a SET clause that can't be
--Testcase 456:
EXPLAIN (VERBOSE, COSTS OFF)
UPDATE ft2 d SET c2 = CASE WHEN random() >= 0 THEN d.c2 ELSE 0 END
  FROM ft2 AS t WHERE d.c1 = t.c1 AND d.c1 > 1000;
                                                    QUERY PLAN                                                     
-------------------------------------------------------------------------------------------------------------------
 Update on public.ft2 d
   Remote SQL: UPDATE odbc_fdw_post.`T1` SET c2 = ? WHERE `C_1` = ?
   ->  Hash Join
         Output: CASE WHEN (random() >= '0'::double precision) THEN d.c2 ELSE 0 END, d.c1, d.*, t.*
         Hash Cond: (d.c1 = t.c1)
         ->  Foreign Scan on public.ft2 d
               Output: d.c2, d.c1, d.*
               Remote SQL: SELECT `C_1`, c2, c3, c4, c5, c6, c7, c8 FROM odbc_fdw_post.`T1` WHERE ((`C_1` > 1000))
         ->  Hash
               Output: t.*, t.c1
               ->  Foreign Scan on public.ft2 t
                     Output: t.*, t.c1
                     Remote SQL: SELECT `C_1`, c2, c3, c4, c5, c6, c7, c8 FROM odbc_fdw_post.`T1`
(13 rows)

--Testcase 457:
UPDATE ft2 d SET c2 = CASE WHEN random() >= 0 THEN d.c2 ELSE 0 END
  FROM ft2 AS t WHERE d.c1 = t.c1 AND d.c1 > 1000;
-- Test UPDATE/DELETE with WHERE or JOIN/ON conditions containing
-- user-defined operators/functions
-- ALTER SERVER :DB_SERVERNAME OPTIONS (DROP extensions);
--Testcase 458:
INSERT INTO ft2 (c1,c2,c3)
  SELECT id, id % 10, to_char(id, 'FM00000') FROM generate_series(2001, 2010) id;
--Testcase 459:
EXPLAIN (verbose, costs off)
UPDATE ft2 SET c3 = 'bar' WHERE postgres_fdw_abs(c1) > 2000;            -- can't be pushed down
                                      QUERY PLAN                                      
--------------------------------------------------------------------------------------
 Update on public.ft2
   Remote SQL: UPDATE odbc_fdw_post.`T1` SET c3 = ? WHERE `C_1` = ?
   ->  Foreign Scan on public.ft2
         Output: 'bar'::text, c1, ft2.*
         Filter: (postgres_fdw_abs(ft2.c1) > 2000)
         Remote SQL: SELECT `C_1`, c2, c3, c4, c5, c6, c7, c8 FROM odbc_fdw_post.`T1`
(6 rows)

--Testcase 460:
UPDATE ft2 SET c3 = 'bar' WHERE postgres_fdw_abs(c1) > 2000;
--Testcase 461:
SELECT * FROM ft2 WHERE postgres_fdw_abs(c1) > 2000;
  c1  | c2 | c3  | c4 | c5 | c6 |     c7     | c8 
------+----+-----+----+----+----+------------+----
 2001 |  1 | bar |    |    |    | ft2        | 
 2002 |  2 | bar |    |    |    | ft2        | 
 2003 |  3 | bar |    |    |    | ft2        | 
 2004 |  4 | bar |    |    |    | ft2        | 
 2005 |  5 | bar |    |    |    | ft2        | 
 2006 |  6 | bar |    |    |    | ft2        | 
 2007 |  7 | bar |    |    |    | ft2        | 
 2008 |  8 | bar |    |    |    | ft2        | 
 2009 |  9 | bar |    |    |    | ft2        | 
 2010 |  0 | bar |    |    |    | ft2        | 
(10 rows)

--Testcase 462:
EXPLAIN (verbose, costs off)
UPDATE ft2 SET c3 = 'baz'
  FROM ft4 INNER JOIN ft5 ON (ft4.c1 = ft5.c1)
  WHERE ft2.c1 > 2000 AND ft2.c2 === ft4.c1;                                                    -- can't be pushed down
                                                    QUERY PLAN                                                     
-------------------------------------------------------------------------------------------------------------------
 Update on public.ft2
   Remote SQL: UPDATE odbc_fdw_post.`T1` SET c3 = ? WHERE `C_1` = ?
   ->  Nested Loop
         Output: 'baz'::text, ft2.c1, ft2.*, ft4.*, ft5.*
         Join Filter: (ft2.c2 === ft4.c1)
         ->  Foreign Scan on public.ft2
               Output: ft2.c1, ft2.*, ft2.c2
               Remote SQL: SELECT `C_1`, c2, c3, c4, c5, c6, c7, c8 FROM odbc_fdw_post.`T1` WHERE ((`C_1` > 2000))
         ->  Materialize
               Output: ft4.*, ft4.c1, ft5.*
               ->  Hash Join
                     Output: ft4.*, ft4.c1, ft5.*
                     Hash Cond: (ft4.c1 = ft5.c1)
                     ->  Foreign Scan on public.ft4
                           Output: ft4.*, ft4.c1
                           Remote SQL: SELECT c1, c2, c3 FROM odbc_fdw_post.`T3`
                     ->  Hash
                           Output: ft5.*, ft5.c1
                           ->  Foreign Scan on public.ft5
                                 Output: ft5.*, ft5.c1
                                 Remote SQL: SELECT c1, c2, c3 FROM odbc_fdw_post.`T4`
(21 rows)

--Testcase 463:
UPDATE ft2 SET c3 = 'baz'
  FROM ft4 INNER JOIN ft5 ON (ft4.c1 = ft5.c1)
  WHERE ft2.c1 > 2000 AND ft2.c2 === ft4.c1;
--Testcase 464:
SELECT ft2.*, ft4.*, ft5.* FROM ft2, ft4, ft5 
  WHERE (ft4.c1 = ft5.c1) AND (ft2.c1 > 2000) AND (ft2.c2 === ft4.c1);
  c1  | c2 | c3  | c4 | c5 | c6 |     c7     | c8 | c1 | c2 |   c3   | c1 | c2 |   c3   
------+----+-----+----+----+----+------------+----+----+----+--------+----+----+--------
 2006 |  6 | baz |    |    |    | ft2        |    |  6 |  7 | AAA006 |  6 |  7 | AAA006
(1 row)

--Testcase 465:
EXPLAIN (verbose, costs off)
DELETE FROM ft2
  USING ft4 INNER JOIN ft5 ON (ft4.c1 === ft5.c1)
  WHERE ft2.c1 > 2000 AND ft2.c2 = ft4.c1;       -- can't be pushed down
                                        QUERY PLAN                                         
-------------------------------------------------------------------------------------------
 Delete on public.ft2
   Remote SQL: DELETE FROM odbc_fdw_post.`T1` WHERE `C_1` = ?
   ->  Hash Join
         Output: ft2.c1, ft4.*, ft5.*
         Hash Cond: (ft2.c2 = ft4.c1)
         ->  Foreign Scan on public.ft2
               Output: ft2.c1, ft2.c2, ft2.c3, ft2.c4, ft2.c5, ft2.c6, ft2.c7, ft2.c8
               Remote SQL: SELECT `C_1`, c2 FROM odbc_fdw_post.`T1` WHERE ((`C_1` > 2000))
         ->  Hash
               Output: ft4.*, ft4.c1, ft5.*
               ->  Nested Loop
                     Output: ft4.*, ft4.c1, ft5.*
                     Join Filter: (ft4.c1 === ft5.c1)
                     ->  Foreign Scan on public.ft4
                           Output: ft4.*, ft4.c1
                           Remote SQL: SELECT c1, c2, c3 FROM odbc_fdw_post.`T3`
                     ->  Materialize
                           Output: ft5.*, ft5.c1
                           ->  Foreign Scan on public.ft5
                                 Output: ft5.*, ft5.c1
                                 Remote SQL: SELECT c1, c2, c3 FROM odbc_fdw_post.`T4`
(21 rows)

--Testcase 466:
DELETE FROM ft2
  USING ft4 INNER JOIN ft5 ON (ft4.c1 === ft5.c1)
  WHERE ft2.c1 > 2000 AND ft2.c2 = ft4.c1;
--Testcase 467:
DELETE FROM ft2 WHERE ft2.c1 > 2000;
-- ALTER SERVER :DB_SERVERNAME OPTIONS (ADD extensions :DB_EXTENSIONNAME);
-- Test that trigger on remote table works as expected
--Testcase 468:
CREATE OR REPLACE FUNCTION F_BRTRIG() RETURNS trigger AS $$
BEGIN
    NEW.c3 = NEW.c3 || '_trig_update';
    RETURN NEW;
END;
$$ LANGUAGE plpgsql;
--Testcase 469:
CREATE TRIGGER t1_br_insert BEFORE INSERT OR UPDATE
    ON ft1 FOR EACH ROW EXECUTE PROCEDURE F_BRTRIG();
--Testcase 470:
CREATE TRIGGER t2_br_insert BEFORE INSERT OR UPDATE
    ON ft2 FOR EACH ROW EXECUTE PROCEDURE F_BRTRIG();
--Testcase 471:
INSERT INTO ft2 (c1,c2,c3) VALUES (1208, 818, 'fff');
--Testcase 472:
INSERT INTO ft2 (c1,c2,c3,c6) VALUES (1218, 818, 'ggg', '(--;');
--Testcase 473:
UPDATE ft2 SET c2 = c2 + 600 WHERE c1 % 10 = 8 AND c1 < 1200;
--Testcase 474:
SELECT * FROM ft2 WHERE c1 % 10 = 8 AND c1 < 1200;
  c1  | c2  |           c3           |            c4            |            c5            | c6 |     c7     | c8  
------+-----+------------------------+--------------------------+--------------------------+----+------------+-----
    8 | 608 | 00008_trig_update      | Fri Jan 09 00:00:00 1970 | Fri Jan 09 00:00:00 1970 | 8  | 8          | foo
   18 | 608 | 00018_trig_update      | Mon Jan 19 00:00:00 1970 | Mon Jan 19 00:00:00 1970 | 8  | 8          | foo
   28 | 608 | 00028_trig_update      | Thu Jan 29 00:00:00 1970 | Thu Jan 29 00:00:00 1970 | 8  | 8          | foo
   38 | 608 | 00038_trig_update      | Sun Feb 08 00:00:00 1970 | Sun Feb 08 00:00:00 1970 | 8  | 8          | foo
   48 | 608 | 00048_trig_update      | Wed Feb 18 00:00:00 1970 | Wed Feb 18 00:00:00 1970 | 8  | 8          | foo
   58 | 608 | 00058_trig_update      | Sat Feb 28 00:00:00 1970 | Sat Feb 28 00:00:00 1970 | 8  | 8          | foo
   68 | 608 | 00068_trig_update      | Tue Mar 10 00:00:00 1970 | Tue Mar 10 00:00:00 1970 | 8  | 8          | foo
   78 | 608 | 00078_trig_update      | Fri Mar 20 00:00:00 1970 | Fri Mar 20 00:00:00 1970 | 8  | 8          | foo
   88 | 608 | 00088_trig_update      | Mon Mar 30 00:00:00 1970 | Mon Mar 30 00:00:00 1970 | 8  | 8          | foo
   98 | 608 | 00098_trig_update      | Thu Apr 09 00:00:00 1970 | Thu Apr 09 00:00:00 1970 | 8  | 8          | foo
  108 | 608 | 00108_trig_update      | Fri Jan 09 00:00:00 1970 | Fri Jan 09 00:00:00 1970 | 8  | 8          | foo
  118 | 608 | 00118_trig_update      | Mon Jan 19 00:00:00 1970 | Mon Jan 19 00:00:00 1970 | 8  | 8          | foo
  128 | 608 | 00128_trig_update      | Thu Jan 29 00:00:00 1970 | Thu Jan 29 00:00:00 1970 | 8  | 8          | foo
  138 | 608 | 00138_trig_update      | Sun Feb 08 00:00:00 1970 | Sun Feb 08 00:00:00 1970 | 8  | 8          | foo
  148 | 608 | 00148_trig_update      | Wed Feb 18 00:00:00 1970 | Wed Feb 18 00:00:00 1970 | 8  | 8          | foo
  158 | 608 | 00158_trig_update      | Sat Feb 28 00:00:00 1970 | Sat Feb 28 00:00:00 1970 | 8  | 8          | foo
  168 | 608 | 00168_trig_update      | Tue Mar 10 00:00:00 1970 | Tue Mar 10 00:00:00 1970 | 8  | 8          | foo
  178 | 608 | 00178_trig_update      | Fri Mar 20 00:00:00 1970 | Fri Mar 20 00:00:00 1970 | 8  | 8          | foo
  188 | 608 | 00188_trig_update      | Mon Mar 30 00:00:00 1970 | Mon Mar 30 00:00:00 1970 | 8  | 8          | foo
  198 | 608 | 00198_trig_update      | Thu Apr 09 00:00:00 1970 | Thu Apr 09 00:00:00 1970 | 8  | 8          | foo
  208 | 608 | 00208_trig_update      | Fri Jan 09 00:00:00 1970 | Fri Jan 09 00:00:00 1970 | 8  | 8          | foo
  218 | 608 | 00218_trig_update      | Mon Jan 19 00:00:00 1970 | Mon Jan 19 00:00:00 1970 | 8  | 8          | foo
  228 | 608 | 00228_trig_update      | Thu Jan 29 00:00:00 1970 | Thu Jan 29 00:00:00 1970 | 8  | 8          | foo
  238 | 608 | 00238_trig_update      | Sun Feb 08 00:00:00 1970 | Sun Feb 08 00:00:00 1970 | 8  | 8          | foo
  248 | 608 | 00248_trig_update      | Wed Feb 18 00:00:00 1970 | Wed Feb 18 00:00:00 1970 | 8  | 8          | foo
  258 | 608 | 00258_trig_update      | Sat Feb 28 00:00:00 1970 | Sat Feb 28 00:00:00 1970 | 8  | 8          | foo
  268 | 608 | 00268_trig_update      | Tue Mar 10 00:00:00 1970 | Tue Mar 10 00:00:00 1970 | 8  | 8          | foo
  278 | 608 | 00278_trig_update      | Fri Mar 20 00:00:00 1970 | Fri Mar 20 00:00:00 1970 | 8  | 8          | foo
  288 | 608 | 00288_trig_update      | Mon Mar 30 00:00:00 1970 | Mon Mar 30 00:00:00 1970 | 8  | 8          | foo
  298 | 608 | 00298_trig_update      | Thu Apr 09 00:00:00 1970 | Thu Apr 09 00:00:00 1970 | 8  | 8          | foo
  308 | 608 | 00308_trig_update      | Fri Jan 09 00:00:00 1970 | Fri Jan 09 00:00:00 1970 | 8  | 8          | foo
  318 | 608 | 00318_trig_update      | Mon Jan 19 00:00:00 1970 | Mon Jan 19 00:00:00 1970 | 8  | 8          | foo
  328 | 608 | 00328_trig_update      | Thu Jan 29 00:00:00 1970 | Thu Jan 29 00:00:00 1970 | 8  | 8          | foo
  338 | 608 | 00338_trig_update      | Sun Feb 08 00:00:00 1970 | Sun Feb 08 00:00:00 1970 | 8  | 8          | foo
  348 | 608 | 00348_trig_update      | Wed Feb 18 00:00:00 1970 | Wed Feb 18 00:00:00 1970 | 8  | 8          | foo
  358 | 608 | 00358_trig_update      | Sat Feb 28 00:00:00 1970 | Sat Feb 28 00:00:00 1970 | 8  | 8          | foo
  368 | 608 | 00368_trig_update      | Tue Mar 10 00:00:00 1970 | Tue Mar 10 00:00:00 1970 | 8  | 8          | foo
  378 | 608 | 00378_trig_update      | Fri Mar 20 00:00:00 1970 | Fri Mar 20 00:00:00 1970 | 8  | 8          | foo
  388 | 608 | 00388_trig_update      | Mon Mar 30 00:00:00 1970 | Mon Mar 30 00:00:00 1970 | 8  | 8          | foo
  398 | 608 | 00398_trig_update      | Thu Apr 09 00:00:00 1970 | Thu Apr 09 00:00:00 1970 | 8  | 8          | foo
  408 | 608 | 00408_trig_update      | Fri Jan 09 00:00:00 1970 | Fri Jan 09 00:00:00 1970 | 8  | 8          | foo
  418 | 608 | 00418_trig_update      | Mon Jan 19 00:00:00 1970 | Mon Jan 19 00:00:00 1970 | 8  | 8          | foo
  428 | 608 | 00428_trig_update      | Thu Jan 29 00:00:00 1970 | Thu Jan 29 00:00:00 1970 | 8  | 8          | foo
  438 | 608 | 00438_trig_update      | Sun Feb 08 00:00:00 1970 | Sun Feb 08 00:00:00 1970 | 8  | 8          | foo
  448 | 608 | 00448_trig_update      | Wed Feb 18 00:00:00 1970 | Wed Feb 18 00:00:00 1970 | 8  | 8          | foo
  458 | 608 | 00458_trig_update      | Sat Feb 28 00:00:00 1970 | Sat Feb 28 00:00:00 1970 | 8  | 8          | foo
  468 | 608 | 00468_trig_update      | Tue Mar 10 00:00:00 1970 | Tue Mar 10 00:00:00 1970 | 8  | 8          | foo
  478 | 608 | 00478_trig_update      | Fri Mar 20 00:00:00 1970 | Fri Mar 20 00:00:00 1970 | 8  | 8          | foo
  488 | 608 | 00488_trig_update      | Mon Mar 30 00:00:00 1970 | Mon Mar 30 00:00:00 1970 | 8  | 8          | foo
  498 | 608 | 00498_trig_update      | Thu Apr 09 00:00:00 1970 | Thu Apr 09 00:00:00 1970 | 8  | 8          | foo
  508 | 608 | 00508_trig_update      | Fri Jan 09 00:00:00 1970 | Fri Jan 09 00:00:00 1970 | 8  | 8          | foo
  518 | 608 | 00518_trig_update      | Mon Jan 19 00:00:00 1970 | Mon Jan 19 00:00:00 1970 | 8  | 8          | foo
  528 | 608 | 00528_trig_update      | Thu Jan 29 00:00:00 1970 | Thu Jan 29 00:00:00 1970 | 8  | 8          | foo
  538 | 608 | 00538_trig_update      | Sun Feb 08 00:00:00 1970 | Sun Feb 08 00:00:00 1970 | 8  | 8          | foo
  548 | 608 | 00548_trig_update      | Wed Feb 18 00:00:00 1970 | Wed Feb 18 00:00:00 1970 | 8  | 8          | foo
  558 | 608 | 00558_trig_update      | Sat Feb 28 00:00:00 1970 | Sat Feb 28 00:00:00 1970 | 8  | 8          | foo
  568 | 608 | 00568_trig_update      | Tue Mar 10 00:00:00 1970 | Tue Mar 10 00:00:00 1970 | 8  | 8          | foo
  578 | 608 | 00578_trig_update      | Fri Mar 20 00:00:00 1970 | Fri Mar 20 00:00:00 1970 | 8  | 8          | foo
  588 | 608 | 00588_trig_update      | Mon Mar 30 00:00:00 1970 | Mon Mar 30 00:00:00 1970 | 8  | 8          | foo
  598 | 608 | 00598_trig_update      | Thu Apr 09 00:00:00 1970 | Thu Apr 09 00:00:00 1970 | 8  | 8          | foo
  608 | 608 | 00608_trig_update      | Fri Jan 09 00:00:00 1970 | Fri Jan 09 00:00:00 1970 | 8  | 8          | foo
  618 | 608 | 00618_trig_update      | Mon Jan 19 00:00:00 1970 | Mon Jan 19 00:00:00 1970 | 8  | 8          | foo
  628 | 608 | 00628_trig_update      | Thu Jan 29 00:00:00 1970 | Thu Jan 29 00:00:00 1970 | 8  | 8          | foo
  638 | 608 | 00638_trig_update      | Sun Feb 08 00:00:00 1970 | Sun Feb 08 00:00:00 1970 | 8  | 8          | foo
  648 | 608 | 00648_trig_update      | Wed Feb 18 00:00:00 1970 | Wed Feb 18 00:00:00 1970 | 8  | 8          | foo
  658 | 608 | 00658_trig_update      | Sat Feb 28 00:00:00 1970 | Sat Feb 28 00:00:00 1970 | 8  | 8          | foo
  668 | 608 | 00668_trig_update      | Tue Mar 10 00:00:00 1970 | Tue Mar 10 00:00:00 1970 | 8  | 8          | foo
  678 | 608 | 00678_trig_update      | Fri Mar 20 00:00:00 1970 | Fri Mar 20 00:00:00 1970 | 8  | 8          | foo
  688 | 608 | 00688_trig_update      | Mon Mar 30 00:00:00 1970 | Mon Mar 30 00:00:00 1970 | 8  | 8          | foo
  698 | 608 | 00698_trig_update      | Thu Apr 09 00:00:00 1970 | Thu Apr 09 00:00:00 1970 | 8  | 8          | foo
  708 | 608 | 00708_trig_update      | Fri Jan 09 00:00:00 1970 | Fri Jan 09 00:00:00 1970 | 8  | 8          | foo
  718 | 608 | 00718_trig_update      | Mon Jan 19 00:00:00 1970 | Mon Jan 19 00:00:00 1970 | 8  | 8          | foo
  728 | 608 | 00728_trig_update      | Thu Jan 29 00:00:00 1970 | Thu Jan 29 00:00:00 1970 | 8  | 8          | foo
  738 | 608 | 00738_trig_update      | Sun Feb 08 00:00:00 1970 | Sun Feb 08 00:00:00 1970 | 8  | 8          | foo
  748 | 608 | 00748_trig_update      | Wed Feb 18 00:00:00 1970 | Wed Feb 18 00:00:00 1970 | 8  | 8          | foo
  758 | 608 | 00758_trig_update      | Sat Feb 28 00:00:00 1970 | Sat Feb 28 00:00:00 1970 | 8  | 8          | foo
  768 | 608 | 00768_trig_update      | Tue Mar 10 00:00:00 1970 | Tue Mar 10 00:00:00 1970 | 8  | 8          | foo
  778 | 608 | 00778_trig_update      | Fri Mar 20 00:00:00 1970 | Fri Mar 20 00:00:00 1970 | 8  | 8          | foo
  788 | 608 | 00788_trig_update      | Mon Mar 30 00:00:00 1970 | Mon Mar 30 00:00:00 1970 | 8  | 8          | foo
  798 | 608 | 00798_trig_update      | Thu Apr 09 00:00:00 1970 | Thu Apr 09 00:00:00 1970 | 8  | 8          | foo
  808 | 608 | 00808_trig_update      | Fri Jan 09 00:00:00 1970 | Fri Jan 09 00:00:00 1970 | 8  | 8          | foo
  818 | 608 | 00818_trig_update      | Mon Jan 19 00:00:00 1970 | Mon Jan 19 00:00:00 1970 | 8  | 8          | foo
  828 | 608 | 00828_trig_update      | Thu Jan 29 00:00:00 1970 | Thu Jan 29 00:00:00 1970 | 8  | 8          | foo
  838 | 608 | 00838_trig_update      | Sun Feb 08 00:00:00 1970 | Sun Feb 08 00:00:00 1970 | 8  | 8          | foo
  848 | 608 | 00848_trig_update      | Wed Feb 18 00:00:00 1970 | Wed Feb 18 00:00:00 1970 | 8  | 8          | foo
  858 | 608 | 00858_trig_update      | Sat Feb 28 00:00:00 1970 | Sat Feb 28 00:00:00 1970 | 8  | 8          | foo
  868 | 608 | 00868_trig_update      | Tue Mar 10 00:00:00 1970 | Tue Mar 10 00:00:00 1970 | 8  | 8          | foo
  878 | 608 | 00878_trig_update      | Fri Mar 20 00:00:00 1970 | Fri Mar 20 00:00:00 1970 | 8  | 8          | foo
  888 | 608 | 00888_trig_update      | Mon Mar 30 00:00:00 1970 | Mon Mar 30 00:00:00 1970 | 8  | 8          | foo
  898 | 608 | 00898_trig_update      | Thu Apr 09 00:00:00 1970 | Thu Apr 09 00:00:00 1970 | 8  | 8          | foo
  908 | 608 | 00908_trig_update      | Fri Jan 09 00:00:00 1970 | Fri Jan 09 00:00:00 1970 | 8  | 8          | foo
  918 | 608 | 00918_trig_update      | Mon Jan 19 00:00:00 1970 | Mon Jan 19 00:00:00 1970 | 8  | 8          | foo
  928 | 608 | 00928_trig_update      | Thu Jan 29 00:00:00 1970 | Thu Jan 29 00:00:00 1970 | 8  | 8          | foo
  938 | 608 | 00938_trig_update      | Sun Feb 08 00:00:00 1970 | Sun Feb 08 00:00:00 1970 | 8  | 8          | foo
  948 | 608 | 00948_trig_update      | Wed Feb 18 00:00:00 1970 | Wed Feb 18 00:00:00 1970 | 8  | 8          | foo
  958 | 608 | 00958_trig_update      | Sat Feb 28 00:00:00 1970 | Sat Feb 28 00:00:00 1970 | 8  | 8          | foo
  968 | 608 | 00968_trig_update      | Tue Mar 10 00:00:00 1970 | Tue Mar 10 00:00:00 1970 | 8  | 8          | foo
  978 | 608 | 00978_trig_update      | Fri Mar 20 00:00:00 1970 | Fri Mar 20 00:00:00 1970 | 8  | 8          | foo
  988 | 608 | 00988_trig_update      | Mon Mar 30 00:00:00 1970 | Mon Mar 30 00:00:00 1970 | 8  | 8          | foo
  998 | 608 | 00998_trig_update      | Thu Apr 09 00:00:00 1970 | Thu Apr 09 00:00:00 1970 | 8  | 8          | foo
 1008 | 708 | 0000800008_trig_update |                          |                          |    | ft2        | 
 1018 | 708 | 0001800018_trig_update |                          |                          |    | ft2        | 
(102 rows)

-- Test errors thrown on remote side during update
-- Does not support CHECK
--Testcase 475:
ALTER TABLE ft1 ADD CONSTRAINT c2positive CHECK (c2 >= 0);
--Testcase 476:
INSERT INTO ft1(c1, c2) VALUES(11, 12);  -- duplicate key
psql:sql/14.5/ported_postgres_fdw.sql:1747: ERROR:  Executing ODBC query
[MySQL][ODBC 8.0(w) Driver][mysqld-8.0.31]Duplicate entry '11' for key 'T1.PRIMARY'
-- Does not support ON CONFLICT DO NOTHING
--INSERT INTO ft1(c1, c2) VALUES(11, 12) ON CONFLICT DO NOTHING; -- works
--Testcase 477:
INSERT INTO ft1(c1, c2) VALUES(11, 12) ON CONFLICT (c1, c2) DO NOTHING; -- unsupported
psql:sql/14.5/ported_postgres_fdw.sql:1751: ERROR:  there is no unique or exclusion constraint matching the ON CONFLICT specification
--Testcase 478:
INSERT INTO ft1(c1, c2) VALUES(11, 12) ON CONFLICT (c1, c2) DO UPDATE SET c3 = 'ffg'; -- unsupported
psql:sql/14.5/ported_postgres_fdw.sql:1753: ERROR:  there is no unique or exclusion constraint matching the ON CONFLICT specification
--INSERT INTO ft1(c1, c2) VALUES(1111, -2);  -- c2positive
--UPDATE ft1 SET c2 = -c2 WHERE c1 = 1;  -- c2positive
-- Test savepoint/rollback behavior
--Testcase 479:
select c2, count(*) from ft2 where c2 < 500 group by 1 order by 1;
 c2  | count 
-----+-------
   0 |   100
   1 |   100
   4 |   100
   6 |   100
 100 |     2
 101 |     2
 104 |     2
 106 |     2
 201 |     1
 204 |     1
 303 |   100
 403 |     2
 407 |   100
(13 rows)

--Testcase 480:
select c2, count(*) from "S 1"."T1" where c2 < 500 group by 1 order by 1;
 c2  | count 
-----+-------
   0 |   100
   1 |   100
   4 |   100
   6 |   100
 100 |     2
 101 |     2
 104 |     2
 106 |     2
 201 |     1
 204 |     1
 303 |   100
 403 |     2
 407 |   100
(13 rows)

-- begin;
--Testcase 481:
update ft2 set c2 = 42 where c2 = 0;
--Testcase 482:
select c2, count(*) from ft2 where c2 < 500 group by 1 order by 1;
 c2  | count 
-----+-------
   1 |   100
   4 |   100
   6 |   100
  42 |   100
 100 |     2
 101 |     2
 104 |     2
 106 |     2
 201 |     1
 204 |     1
 303 |   100
 403 |     2
 407 |   100
(13 rows)

-- savepoint s1;
--Testcase 483:
update ft2 set c2 = 44 where c2 = 4;
--Testcase 484:
select c2, count(*) from ft2 where c2 < 500 group by 1 order by 1;
 c2  | count 
-----+-------
   1 |   100
   6 |   100
  42 |   100
  44 |   100
 100 |     2
 101 |     2
 104 |     2
 106 |     2
 201 |     1
 204 |     1
 303 |   100
 403 |     2
 407 |   100
(13 rows)

-- release savepoint s1;
--Testcase 485:
select c2, count(*) from ft2 where c2 < 500 group by 1 order by 1;
 c2  | count 
-----+-------
   1 |   100
   6 |   100
  42 |   100
  44 |   100
 100 |     2
 101 |     2
 104 |     2
 106 |     2
 201 |     1
 204 |     1
 303 |   100
 403 |     2
 407 |   100
(13 rows)

-- savepoint s2;
--Testcase 486:
update ft2 set c2 = 46 where c2 = 6;
--Testcase 487:
select c2, count(*) from ft2 where c2 < 500 group by 1 order by 1;
 c2  | count 
-----+-------
   1 |   100
  42 |   100
  44 |   100
  46 |   100
 100 |     2
 101 |     2
 104 |     2
 106 |     2
 201 |     1
 204 |     1
 303 |   100
 403 |     2
 407 |   100
(13 rows)

-- rollback to savepoint s2;
--Testcase 488:
update ft2 set c2 = 6 where c2 = 46; -- rollback testcase 485
select c2, count(*) from ft2 where c2 < 500 group by 1 order by 1;
 c2  | count 
-----+-------
   1 |   100
   6 |   100
  42 |   100
  44 |   100
 100 |     2
 101 |     2
 104 |     2
 106 |     2
 201 |     1
 204 |     1
 303 |   100
 403 |     2
 407 |   100
(13 rows)

-- release savepoint s2;
--Testcase 489:
select c2, count(*) from ft2 where c2 < 500 group by 1 order by 1;
 c2  | count 
-----+-------
   1 |   100
   6 |   100
  42 |   100
  44 |   100
 100 |     2
 101 |     2
 104 |     2
 106 |     2
 201 |     1
 204 |     1
 303 |   100
 403 |     2
 407 |   100
(13 rows)

-- savepoint s3;
-- update ft2 set c2 = -2 where c2 = 42 and c1 = 10; -- fail on remote side
-- rollback to savepoint s3;
--Testcase 490:
select c2, count(*) from ft2 where c2 < 500 group by 1 order by 1;
 c2  | count 
-----+-------
   1 |   100
   6 |   100
  42 |   100
  44 |   100
 100 |     2
 101 |     2
 104 |     2
 106 |     2
 201 |     1
 204 |     1
 303 |   100
 403 |     2
 407 |   100
(13 rows)

-- release savepoint s3;
--Testcase 491:
select c2, count(*) from ft2 where c2 < 500 group by 1 order by 1;
 c2  | count 
-----+-------
   1 |   100
   6 |   100
  42 |   100
  44 |   100
 100 |     2
 101 |     2
 104 |     2
 106 |     2
 201 |     1
 204 |     1
 303 |   100
 403 |     2
 407 |   100
(13 rows)

-- none of the above is committed yet remotely
--Testcase 492:
select c2, count(*) from "S 1"."T1" where c2 < 500 group by 1 order by 1;
 c2  | count 
-----+-------
   1 |   100
   6 |   100
  42 |   100
  44 |   100
 100 |     2
 101 |     2
 104 |     2
 106 |     2
 201 |     1
 204 |     1
 303 |   100
 403 |     2
 407 |   100
(13 rows)

-- commit;
--Testcase 493:
select c2, count(*) from ft2 where c2 < 500 group by 1 order by 1;
 c2  | count 
-----+-------
   1 |   100
   6 |   100
  42 |   100
  44 |   100
 100 |     2
 101 |     2
 104 |     2
 106 |     2
 201 |     1
 204 |     1
 303 |   100
 403 |     2
 407 |   100
(13 rows)

--Testcase 494:
select c2, count(*) from "S 1"."T1" where c2 < 500 group by 1 order by 1;
 c2  | count 
-----+-------
   1 |   100
   6 |   100
  42 |   100
  44 |   100
 100 |     2
 101 |     2
 104 |     2
 106 |     2
 201 |     1
 204 |     1
 303 |   100
 403 |     2
 407 |   100
(13 rows)

-- VACUUM ANALYZE "S 1"."T1";
-- Above DMLs add data with c6 as NULL in ft1, so test ORDER BY NULLS LAST and NULLs
-- FIRST behavior here.
-- ORDER BY DESC NULLS LAST options
--Testcase 495:
EXPLAIN (VERBOSE, COSTS OFF) SELECT * FROM ft1 ORDER BY c6 DESC NULLS LAST, c1 OFFSET 795 LIMIT 10;
                                         QUERY PLAN                                         
--------------------------------------------------------------------------------------------
 Limit
   Output: c1, c2, c3, c4, c5, c6, c7, c8
   ->  Sort
         Output: c1, c2, c3, c4, c5, c6, c7, c8
         Sort Key: ft1.c6 DESC NULLS LAST, ft1.c1
         ->  Foreign Scan on public.ft1
               Output: c1, c2, c3, c4, c5, c6, c7, c8
               Remote SQL: SELECT `C_1`, c2, c3, c4, c5, c6, c7, c8 FROM odbc_fdw_post.`T1`
(8 rows)

--Testcase 496:
SELECT * FROM ft1 ORDER BY c6 DESC NULLS LAST, c1 OFFSET 795  LIMIT 10;
  c1  | c2  |         c3         |            c4            |            c5            |  c6  |     c7     | c8  
------+-----+--------------------+--------------------------+--------------------------+------+------------+-----
  960 |  42 | 00960_trig_update  | Mon Mar 02 00:00:00 1970 | Mon Mar 02 00:00:00 1970 | 0    | 0          | foo
  970 |  42 | 00970_trig_update  | Thu Mar 12 00:00:00 1970 | Thu Mar 12 00:00:00 1970 | 0    | 0          | foo
  980 |  42 | 00980_trig_update  | Sun Mar 22 00:00:00 1970 | Sun Mar 22 00:00:00 1970 | 0    | 0          | foo
  990 |  42 | 00990_trig_update  | Wed Apr 01 00:00:00 1970 | Wed Apr 01 00:00:00 1970 | 0    | 0          | foo
 1000 |  42 | 01000_trig_update  | Thu Jan 01 00:00:00 1970 | Thu Jan 01 00:00:00 1970 | 0    | 0          | foo
 1218 | 818 | ggg_trig_update    |                          |                          | (--; | ft2        | 
 1001 | 101 | 0000100001         |                          |                          |      | ft2        | 
 1003 | 403 | 0000300003_update3 |                          |                          |      | ft2        | 
 1004 | 104 | 0000400004         |                          |                          |      | ft2        | 
 1006 | 106 | 0000600006         |                          |                          |      | ft2        | 
(10 rows)

-- ORDER BY DESC NULLS FIRST options
--Testcase 497:
EXPLAIN (VERBOSE, COSTS OFF) SELECT * FROM ft1 ORDER BY c6 DESC NULLS FIRST, c1 OFFSET 15 LIMIT 10;
                                         QUERY PLAN                                         
--------------------------------------------------------------------------------------------
 Limit
   Output: c1, c2, c3, c4, c5, c6, c7, c8
   ->  Sort
         Output: c1, c2, c3, c4, c5, c6, c7, c8
         Sort Key: ft1.c6 DESC, ft1.c1
         ->  Foreign Scan on public.ft1
               Output: c1, c2, c3, c4, c5, c6, c7, c8
               Remote SQL: SELECT `C_1`, c2, c3, c4, c5, c6, c7, c8 FROM odbc_fdw_post.`T1`
(8 rows)

--Testcase 498:
SELECT * FROM ft1 ORDER BY c6 DESC NULLS FIRST, c1 OFFSET 15 LIMIT 10;
  c1  | c2  |       c3        |            c4            |            c5            | c6 |     c7     | c8  
------+-----+-----------------+--------------------------+--------------------------+----+------------+-----
 1020 | 100 | 0002000020      |                          |                          |    | ft2        | 
 1101 | 201 | aaa             |                          |                          |    | ft2        | 
 1103 | 503 | ccc_update3     |                          |                          |    | ft2        | 
 1104 | 204 | ddd             |                          |                          |    | ft2        | 
 1208 | 818 | fff_trig_update |                          |                          |    | ft2        | 
    9 | 509 | 00009_update9   | Sat Jan 10 00:00:00 1970 | Sat Jan 10 00:00:00 1970 | 9  | ft2        | foo
   19 | 509 | 00019_update9   | Tue Jan 20 00:00:00 1970 | Tue Jan 20 00:00:00 1970 | 9  | ft2        | foo
   29 | 509 | 00029_update9   | Fri Jan 30 00:00:00 1970 | Fri Jan 30 00:00:00 1970 | 9  | ft2        | foo
   39 | 509 | 00039_update9   | Mon Feb 09 00:00:00 1970 | Mon Feb 09 00:00:00 1970 | 9  | ft2        | foo
   49 | 509 | 00049_update9   | Thu Feb 19 00:00:00 1970 | Thu Feb 19 00:00:00 1970 | 9  | ft2        | foo
(10 rows)

-- ORDER BY ASC NULLS FIRST options
--Testcase 499:
EXPLAIN (VERBOSE, COSTS OFF) SELECT * FROM ft1 ORDER BY c6 ASC NULLS FIRST, c1 OFFSET 15 LIMIT 10;
                                         QUERY PLAN                                         
--------------------------------------------------------------------------------------------
 Limit
   Output: c1, c2, c3, c4, c5, c6, c7, c8
   ->  Sort
         Output: c1, c2, c3, c4, c5, c6, c7, c8
         Sort Key: ft1.c6 NULLS FIRST, ft1.c1
         ->  Foreign Scan on public.ft1
               Output: c1, c2, c3, c4, c5, c6, c7, c8
               Remote SQL: SELECT `C_1`, c2, c3, c4, c5, c6, c7, c8 FROM odbc_fdw_post.`T1`
(8 rows)

--Testcase 500:
SELECT * FROM ft1 ORDER BY c6 ASC NULLS FIRST, c1 OFFSET 15 LIMIT 10;
  c1  | c2  |        c3         |            c4            |            c5            |  c6  |     c7     | c8  
------+-----+-------------------+--------------------------+--------------------------+------+------------+-----
 1020 | 100 | 0002000020        |                          |                          |      | ft2        | 
 1101 | 201 | aaa               |                          |                          |      | ft2        | 
 1103 | 503 | ccc_update3       |                          |                          |      | ft2        | 
 1104 | 204 | ddd               |                          |                          |      | ft2        | 
 1208 | 818 | fff_trig_update   |                          |                          |      | ft2        | 
 1218 | 818 | ggg_trig_update   |                          |                          | (--; | ft2        | 
   10 |  42 | 00010_trig_update | Sun Jan 11 00:00:00 1970 | Sun Jan 11 00:00:00 1970 | 0    | 0          | foo
   20 |  42 | 00020_trig_update | Wed Jan 21 00:00:00 1970 | Wed Jan 21 00:00:00 1970 | 0    | 0          | foo
   30 |  42 | 00030_trig_update | Sat Jan 31 00:00:00 1970 | Sat Jan 31 00:00:00 1970 | 0    | 0          | foo
   40 |  42 | 00040_trig_update | Tue Feb 10 00:00:00 1970 | Tue Feb 10 00:00:00 1970 | 0    | 0          | foo
(10 rows)

-- ===================================================================
-- test check constraints
-- ===================================================================
-- Consistent check constraints provide consistent results
--Testcase 501:
ALTER FOREIGN TABLE ft1 ADD CONSTRAINT ft1_c2positive CHECK (c2 >= 0);
--Testcase 502:
EXPLAIN (VERBOSE, COSTS OFF) SELECT count(*) FROM ft1 WHERE c2 < 0;
                               QUERY PLAN                               
------------------------------------------------------------------------
 Foreign Scan
   Output: (count(*))
   Remote SQL: SELECT count(*) FROM odbc_fdw_post.`T1` WHERE ((c2 < 0))
(3 rows)

--Testcase 503:
SELECT count(*) FROM ft1 WHERE c2 < 0;
 count 
-------
     0
(1 row)

--Testcase 504:
SET constraint_exclusion = 'on';
--Testcase 505:
EXPLAIN (VERBOSE, COSTS OFF) SELECT count(*) FROM ft1 WHERE c2 < 0;
           QUERY PLAN           
--------------------------------
 Aggregate
   Output: count(*)
   ->  Result
         One-Time Filter: false
(4 rows)

--Testcase 506:
SELECT count(*) FROM ft1 WHERE c2 < 0;
 count 
-------
     0
(1 row)

--Testcase 507:
RESET constraint_exclusion;
-- check constraint is enforced on the remote side, not locally
--INSERT INTO ft1(c1, c2) VALUES(1111, -2);  -- c2positive
--UPDATE ft1 SET c2 = -c2 WHERE c1 = 1;  -- c2positive
--Testcase 508:
ALTER FOREIGN TABLE ft1 DROP CONSTRAINT ft1_c2positive;
-- But inconsistent check constraints provide inconsistent results
--Testcase 509:
ALTER FOREIGN TABLE ft1 ADD CONSTRAINT ft1_c2negative CHECK (c2 < 0);
--Testcase 510:
EXPLAIN (VERBOSE, COSTS OFF) SELECT count(*) FROM ft1 WHERE c2 >= 0;
                               QUERY PLAN                                
-------------------------------------------------------------------------
 Foreign Scan
   Output: (count(*))
   Remote SQL: SELECT count(*) FROM odbc_fdw_post.`T1` WHERE ((c2 >= 0))
(3 rows)

--Testcase 511:
SELECT count(*) FROM ft1 WHERE c2 >= 0;
 count 
-------
   821
(1 row)

--Testcase 512:
SET constraint_exclusion = 'on';
--Testcase 513:
EXPLAIN (VERBOSE, COSTS OFF) SELECT count(*) FROM ft1 WHERE c2 >= 0;
           QUERY PLAN           
--------------------------------
 Aggregate
   Output: count(*)
   ->  Result
         One-Time Filter: false
(4 rows)

--Testcase 514:
SELECT count(*) FROM ft1 WHERE c2 >= 0;
 count 
-------
     0
(1 row)

--Testcase 515:
RESET constraint_exclusion;
-- local check constraint is not actually enforced
--Testcase 516:
INSERT INTO ft1(c1, c2) VALUES(1111, 2);
--Testcase 517:
UPDATE ft1 SET c2 = c2 + 1 WHERE c1 = 1;
--Testcase 518:
ALTER FOREIGN TABLE ft1 DROP CONSTRAINT ft1_c2negative;
-- ===================================================================
-- test WITH CHECK OPTION constraints
-- ===================================================================
--Testcase 519:
CREATE FUNCTION row_before_insupd_trigfunc() RETURNS trigger AS $$BEGIN NEW.a := NEW.a + 10; RETURN NEW; END$$ LANGUAGE plpgsql;
--Testcase 520:
CREATE FOREIGN TABLE foreign_tbl (a int OPTIONS (key 'true'), b int)
  SERVER :DB_SERVERNAME OPTIONS (schema :DB_SCHEMA_PORT_TEST, table 'base_tbl');
--Testcase 521:
CREATE TRIGGER row_before_insupd_trigger BEFORE INSERT OR UPDATE ON foreign_tbl FOR EACH ROW EXECUTE PROCEDURE row_before_insupd_trigfunc();
--Testcase 522:
CREATE VIEW rw_view AS SELECT * FROM foreign_tbl
  WHERE a < b WITH CHECK OPTION;
--Testcase 523:
\d+ rw_view
                           View "public.rw_view"
 Column |  Type   | Collation | Nullable | Default | Storage | Description 
--------+---------+-----------+----------+---------+---------+-------------
 a      | integer |           |          |         | plain   | 
 b      | integer |           |          |         | plain   | 
View definition:
 SELECT foreign_tbl.a,
    foreign_tbl.b
   FROM foreign_tbl
  WHERE foreign_tbl.a < foreign_tbl.b;
Options: check_option=cascaded

--Testcase 524:
EXPLAIN (VERBOSE, COSTS OFF)
INSERT INTO rw_view VALUES (0, 5);
                              QUERY PLAN                              
----------------------------------------------------------------------
 Insert on public.foreign_tbl
   Remote SQL: INSERT INTO odbc_fdw_post.base_tbl(a, b) VALUES (?, ?)
   ->  Result
         Output: 0, 5
(4 rows)

-- Bug: data is inserted to table even FDW reports failed
-- Data is shown at testcase 528
INSERT INTO rw_view VALUES (0, 5); -- should fail
psql:sql/14.5/ported_postgres_fdw.sql:1893: ERROR:  new row violates check option for view "rw_view"
DETAIL:  Failing row contains (10, 5).
--Testcase 525:
EXPLAIN (VERBOSE, COSTS OFF)
INSERT INTO rw_view VALUES (0, 15);
                              QUERY PLAN                              
----------------------------------------------------------------------
 Insert on public.foreign_tbl
   Remote SQL: INSERT INTO odbc_fdw_post.base_tbl(a, b) VALUES (?, ?)
   ->  Result
         Output: 0, 15
(4 rows)

--Testcase 526:
INSERT INTO rw_view VALUES (0, 15); -- ok
--Testcase 527:
SELECT * FROM foreign_tbl;
 a  | b  
----+----
 10 |  5
 10 | 15
(2 rows)

--Testcase 528:
EXPLAIN (VERBOSE, COSTS OFF)
UPDATE rw_view SET b = b + 5;
                                 QUERY PLAN                                  
-----------------------------------------------------------------------------
 Update on public.foreign_tbl
   Remote SQL: UPDATE odbc_fdw_post.base_tbl SET a = ?, b = ? WHERE a = ?
   ->  Foreign Scan on public.foreign_tbl
         Output: (foreign_tbl.b + 5), foreign_tbl.a, foreign_tbl.*
         Remote SQL: SELECT a, b FROM odbc_fdw_post.base_tbl WHERE ((a < b))
(5 rows)

--Testcase 529:
UPDATE rw_view SET b = b + 5; -- should fail
psql:sql/14.5/ported_postgres_fdw.sql:1906: ERROR:  new row violates check option for view "rw_view"
DETAIL:  Failing row contains (20, 20).
--Testcase 530:
EXPLAIN (VERBOSE, COSTS OFF)
UPDATE rw_view SET b = b + 15;
                                 QUERY PLAN                                  
-----------------------------------------------------------------------------
 Update on public.foreign_tbl
   Remote SQL: UPDATE odbc_fdw_post.base_tbl SET a = ?, b = ? WHERE a = ?
   ->  Foreign Scan on public.foreign_tbl
         Output: (foreign_tbl.b + 15), foreign_tbl.a, foreign_tbl.*
         Remote SQL: SELECT a, b FROM odbc_fdw_post.base_tbl WHERE ((a < b))
(5 rows)

--Testcase 531:
UPDATE rw_view SET b = b + 15; -- ok
--Testcase 532:
SELECT * FROM foreign_tbl;
 a  | b  
----+----
 20 | 20
 20 | 20
(2 rows)

--Testcase 533:
DROP FOREIGN TABLE foreign_tbl CASCADE;
psql:sql/14.5/ported_postgres_fdw.sql:1916: NOTICE:  drop cascades to view rw_view
-- DROP TRIGGER row_before_insupd_trigger ON base_tbl;
-- DROP TABLE base_tbl;
-- Does not support patition table (regarding tuple routing)
-- test WCO for partitions
--Testcase 534:
CREATE FOREIGN TABLE foreign_tbl (a int, b int, id int OPTIONS (key 'true'))
  SERVER :DB_SERVERNAME OPTIONS (schema :DB_SCHEMA_PORT_TEST, table 'child_tbl');
--Testcase 535:
CREATE TABLE parent_tbl (a int, b int, id int) PARTITION BY RANGE(a);
--Testcase 536:
ALTER TABLE parent_tbl ATTACH PARTITION foreign_tbl FOR VALUES FROM (0) TO (100);
--Testcase 537:
CREATE VIEW rw_view AS SELECT * FROM parent_tbl
  WHERE a < b WITH CHECK OPTION;
--Testcase 538:
\d+ rw_view
                           View "public.rw_view"
 Column |  Type   | Collation | Nullable | Default | Storage | Description 
--------+---------+-----------+----------+---------+---------+-------------
 a      | integer |           |          |         | plain   | 
 b      | integer |           |          |         | plain   | 
 id     | integer |           |          |         | plain   | 
View definition:
 SELECT parent_tbl.a,
    parent_tbl.b,
    parent_tbl.id
   FROM parent_tbl
  WHERE parent_tbl.a < parent_tbl.b;
Options: check_option=cascaded

--Testcase 539:
EXPLAIN (VERBOSE, COSTS OFF)
INSERT INTO rw_view VALUES (0, 5);
             QUERY PLAN              
-------------------------------------
 Insert on public.parent_tbl
   ->  Result
         Output: 0, 5, NULL::integer
(3 rows)

--Testcase 540:
INSERT INTO rw_view VALUES (0, 5); -- should fail
psql:sql/14.5/ported_postgres_fdw.sql:1941: ERROR:  COPY and foreign partition routing not supported in odbc_fdw
--Testcase 541:
EXPLAIN (VERBOSE, COSTS OFF)
INSERT INTO rw_view VALUES (0, 15);
              QUERY PLAN              
--------------------------------------
 Insert on public.parent_tbl
   ->  Result
         Output: 0, 15, NULL::integer
(3 rows)

--Testcase 542:
INSERT INTO rw_view VALUES (0, 15); -- ok
psql:sql/14.5/ported_postgres_fdw.sql:1946: ERROR:  COPY and foreign partition routing not supported in odbc_fdw
--Testcase 543:
SELECT * FROM foreign_tbl;
 a | b | id 
---+---+----
(0 rows)

--Testcase 544:
EXPLAIN (VERBOSE, COSTS OFF)
UPDATE rw_view SET b = b + 5;
                                          QUERY PLAN                                          
----------------------------------------------------------------------------------------------
 Update on public.parent_tbl
   Foreign Update on public.foreign_tbl parent_tbl_1
     Remote SQL: UPDATE odbc_fdw_post.child_tbl SET b = ? WHERE id = ?
   ->  Foreign Scan on public.foreign_tbl parent_tbl_1
         Output: (parent_tbl_1.b + 5), parent_tbl_1.tableoid, parent_tbl_1.id, parent_tbl_1.*
         Remote SQL: SELECT a, b, id FROM odbc_fdw_post.child_tbl WHERE ((a < b))
(6 rows)

--Testcase 545:
UPDATE rw_view SET b = b + 5; -- should fail
--Testcase 546:
EXPLAIN (VERBOSE, COSTS OFF)
UPDATE rw_view SET b = b + 15;
                                          QUERY PLAN                                           
-----------------------------------------------------------------------------------------------
 Update on public.parent_tbl
   Foreign Update on public.foreign_tbl parent_tbl_1
     Remote SQL: UPDATE odbc_fdw_post.child_tbl SET b = ? WHERE id = ?
   ->  Foreign Scan on public.foreign_tbl parent_tbl_1
         Output: (parent_tbl_1.b + 15), parent_tbl_1.tableoid, parent_tbl_1.id, parent_tbl_1.*
         Remote SQL: SELECT a, b, id FROM odbc_fdw_post.child_tbl WHERE ((a < b))
(6 rows)

--Testcase 547:
UPDATE rw_view SET b = b + 15; -- ok
--Testcase 548:
SELECT * FROM foreign_tbl;
 a | b | id 
---+---+----
(0 rows)

--Testcase 549:
DROP FOREIGN TABLE foreign_tbl CASCADE;
-- DROP TRIGGER row_before_insupd_trigger ON child_tbl;
--Testcase 550:
DROP TABLE parent_tbl CASCADE;
psql:sql/14.5/ported_postgres_fdw.sql:1967: NOTICE:  drop cascades to view rw_view
--Testcase 551:
DROP FUNCTION row_before_insupd_trigfunc;
-- ===================================================================
-- test serial columns (ie, sequence-based defaults)
-- ===================================================================
--Testcase 552:
create foreign table loc1 (f1 serial OPTIONS (key 'true'), f2 text)
  server :DB_SERVERNAME options(schema :DB_SCHEMA_PORT_TEST, table 'loc1');
--Testcase 553:
create foreign table rem1 (f1 serial OPTIONS (key 'true'), f2 text)
  server :DB_SERVERNAME options(schema :DB_SCHEMA_PORT_TEST, table 'loc1');
--Testcase 554:
select pg_catalog.setval('rem1_f1_seq', 10, false);
 setval 
--------
     10
(1 row)

--Testcase 555:
insert into loc1(f2) values('hi');
--Testcase 556:
insert into rem1(f2) values('hi remote');
--Testcase 557:
insert into loc1(f2) values('bye');
--Testcase 558:
insert into rem1(f2) values('bye remote');
--Testcase 559:
select f1, f2 from loc1;
 f1 |     f2     
----+------------
  1 | hi
 10 | hi remote
  2 | bye
 11 | bye remote
(4 rows)

--Testcase 560:
select f1, f2 from rem1;
 f1 |     f2     
----+------------
  1 | hi
 10 | hi remote
  2 | bye
 11 | bye remote
(4 rows)

-- ===================================================================
-- test generated columns
-- ===================================================================
-- odbc_fdw does not support generated column like postgres_fdw 14.0
-- data will be generated at FDW layer before inserted to remote table.
--Testcase 561:
create foreign table grem1 (
  a int OPTIONS (key 'true'),
  b int generated always as (a * 2) stored)
  server :DB_SERVERNAME options(schema :DB_SCHEMA_PORT_TEST, table 'gloc1');
--Testcase 562:
explain (verbose, costs off)
insert into grem1 (a) values (1), (2);
                            QUERY PLAN                             
-------------------------------------------------------------------
 Insert on public.grem1
   Remote SQL: INSERT INTO odbc_fdw_post.gloc1(a, b) VALUES (?, ?)
   ->  Values Scan on "*VALUES*"
         Output: "*VALUES*".column1, NULL::integer
(4 rows)

--Testcase 563:
insert into grem1 (a) values (1), (2);
--Testcase 564:
explain (verbose, costs off)
update grem1 set a = 22 where a = 2;
                                QUERY PLAN                                
--------------------------------------------------------------------------
 Update on public.grem1
   Remote SQL: UPDATE odbc_fdw_post.gloc1 SET a = ?, b = ? WHERE a = ?
   ->  Foreign Scan on public.grem1
         Output: 22, a, grem1.*
         Remote SQL: SELECT a, b FROM odbc_fdw_post.gloc1 WHERE ((a = 2))
(5 rows)

--Testcase 565:
update grem1 set a = 22 where a = 2;
--Testcase 566:
select * from grem1;
 a  | b  
----+----
  1 |  2
 22 | 44
(2 rows)

--Testcase 567:
delete from grem1;
-- test copy from
copy grem1 from stdin;
psql:sql/14.5/ported_postgres_fdw.sql:2027: ERROR:  COPY and foreign partition routing not supported in odbc_fdw
--Testcase 568:
select * from grem1;
 a | b 
---+---
(0 rows)

--Testcase 569:
delete from grem1;
-- test batch insert
-- odbc_fdw does not support batch insert
-- alter server loopback options (add batch_size '10');
-- explain (verbose, costs off)
-- insert into grem1 (a) values (1), (2);
-- insert into grem1 (a) values (1), (2);
-- select * from gloc1;
-- select * from grem1;
-- delete from grem1;
-- alter server loopback options (drop batch_size);
-- ===================================================================
-- test local triggers
-- ===================================================================
-- Trigger functions "borrowed" from triggers regress test.
--Testcase 570:
CREATE FUNCTION trigger_func() RETURNS trigger LANGUAGE plpgsql AS $$
BEGIN
	RAISE NOTICE 'trigger_func(%) called: action = %, when = %, level = %',
		TG_ARGV[0], TG_OP, TG_WHEN, TG_LEVEL;
	RETURN NULL;
END;$$;
--Testcase 571:
CREATE TRIGGER trig_stmt_before BEFORE DELETE OR INSERT OR UPDATE ON rem1
	FOR EACH STATEMENT EXECUTE PROCEDURE trigger_func();
--Testcase 572:
CREATE TRIGGER trig_stmt_after AFTER DELETE OR INSERT OR UPDATE ON rem1
	FOR EACH STATEMENT EXECUTE PROCEDURE trigger_func();
--Testcase 573:
CREATE OR REPLACE FUNCTION trigger_data()  RETURNS trigger
LANGUAGE plpgsql AS $$

declare
	oldnew text[];
	relid text;
    argstr text;
begin

	relid := TG_relid::regclass;
	argstr := '';
	for i in 0 .. TG_nargs - 1 loop
		if i > 0 then
			argstr := argstr || ', ';
		end if;
		argstr := argstr || TG_argv[i];
	end loop;

    RAISE NOTICE '%(%) % % % ON %',
		tg_name, argstr, TG_when, TG_level, TG_OP, relid;
    oldnew := '{}'::text[];
	if TG_OP != 'INSERT' then
		oldnew := array_append(oldnew, format('OLD: %s', OLD));
	end if;

	if TG_OP != 'DELETE' then
		oldnew := array_append(oldnew, format('NEW: %s', NEW));
	end if;

    RAISE NOTICE '%', array_to_string(oldnew, ',');

	if TG_OP = 'DELETE' then
		return OLD;
	else
		return NEW;
	end if;
end;
$$;
-- Test basic functionality
--Testcase 574:
CREATE TRIGGER trig_row_before
BEFORE INSERT OR UPDATE OR DELETE ON rem1
FOR EACH ROW EXECUTE PROCEDURE trigger_data(23,'skidoo');
--Testcase 575:
CREATE TRIGGER trig_row_after
AFTER INSERT OR UPDATE OR DELETE ON rem1
FOR EACH ROW EXECUTE PROCEDURE trigger_data(23,'skidoo');
--Testcase 576:
delete from rem1;
psql:sql/14.5/ported_postgres_fdw.sql:2116: NOTICE:  trigger_func(<NULL>) called: action = DELETE, when = BEFORE, level = STATEMENT
psql:sql/14.5/ported_postgres_fdw.sql:2116: NOTICE:  trig_row_before(23, skidoo) BEFORE ROW DELETE ON rem1
psql:sql/14.5/ported_postgres_fdw.sql:2116: NOTICE:  OLD: (1,hi)
psql:sql/14.5/ported_postgres_fdw.sql:2116: NOTICE:  trig_row_before(23, skidoo) BEFORE ROW DELETE ON rem1
psql:sql/14.5/ported_postgres_fdw.sql:2116: NOTICE:  OLD: (10,"hi remote")
psql:sql/14.5/ported_postgres_fdw.sql:2116: NOTICE:  trig_row_before(23, skidoo) BEFORE ROW DELETE ON rem1
psql:sql/14.5/ported_postgres_fdw.sql:2116: NOTICE:  OLD: (2,bye)
psql:sql/14.5/ported_postgres_fdw.sql:2116: NOTICE:  trig_row_before(23, skidoo) BEFORE ROW DELETE ON rem1
psql:sql/14.5/ported_postgres_fdw.sql:2116: NOTICE:  OLD: (11,"bye remote")
psql:sql/14.5/ported_postgres_fdw.sql:2116: NOTICE:  trig_row_after(23, skidoo) AFTER ROW DELETE ON rem1
psql:sql/14.5/ported_postgres_fdw.sql:2116: NOTICE:  OLD: (1,hi)
psql:sql/14.5/ported_postgres_fdw.sql:2116: NOTICE:  trig_row_after(23, skidoo) AFTER ROW DELETE ON rem1
psql:sql/14.5/ported_postgres_fdw.sql:2116: NOTICE:  OLD: (10,"hi remote")
psql:sql/14.5/ported_postgres_fdw.sql:2116: NOTICE:  trig_row_after(23, skidoo) AFTER ROW DELETE ON rem1
psql:sql/14.5/ported_postgres_fdw.sql:2116: NOTICE:  OLD: (2,bye)
psql:sql/14.5/ported_postgres_fdw.sql:2116: NOTICE:  trig_row_after(23, skidoo) AFTER ROW DELETE ON rem1
psql:sql/14.5/ported_postgres_fdw.sql:2116: NOTICE:  OLD: (11,"bye remote")
psql:sql/14.5/ported_postgres_fdw.sql:2116: NOTICE:  trigger_func(<NULL>) called: action = DELETE, when = AFTER, level = STATEMENT
--Testcase 577:
insert into rem1 values(1,'insert');
psql:sql/14.5/ported_postgres_fdw.sql:2118: NOTICE:  trigger_func(<NULL>) called: action = INSERT, when = BEFORE, level = STATEMENT
psql:sql/14.5/ported_postgres_fdw.sql:2118: NOTICE:  trig_row_before(23, skidoo) BEFORE ROW INSERT ON rem1
psql:sql/14.5/ported_postgres_fdw.sql:2118: NOTICE:  NEW: (1,insert)
psql:sql/14.5/ported_postgres_fdw.sql:2118: NOTICE:  trig_row_after(23, skidoo) AFTER ROW INSERT ON rem1
psql:sql/14.5/ported_postgres_fdw.sql:2118: NOTICE:  NEW: (1,insert)
psql:sql/14.5/ported_postgres_fdw.sql:2118: NOTICE:  trigger_func(<NULL>) called: action = INSERT, when = AFTER, level = STATEMENT
--Testcase 578:
update rem1 set f2  = 'update' where f1 = 1;
psql:sql/14.5/ported_postgres_fdw.sql:2120: NOTICE:  trigger_func(<NULL>) called: action = UPDATE, when = BEFORE, level = STATEMENT
psql:sql/14.5/ported_postgres_fdw.sql:2120: NOTICE:  trig_row_before(23, skidoo) BEFORE ROW UPDATE ON rem1
psql:sql/14.5/ported_postgres_fdw.sql:2120: NOTICE:  OLD: (1,insert),NEW: (1,update)
psql:sql/14.5/ported_postgres_fdw.sql:2120: NOTICE:  trig_row_after(23, skidoo) AFTER ROW UPDATE ON rem1
psql:sql/14.5/ported_postgres_fdw.sql:2120: NOTICE:  OLD: (1,insert),NEW: (1,update)
psql:sql/14.5/ported_postgres_fdw.sql:2120: NOTICE:  trigger_func(<NULL>) called: action = UPDATE, when = AFTER, level = STATEMENT
--Testcase 579:
update rem1 set f2 = f2 || f2;
psql:sql/14.5/ported_postgres_fdw.sql:2122: NOTICE:  trigger_func(<NULL>) called: action = UPDATE, when = BEFORE, level = STATEMENT
psql:sql/14.5/ported_postgres_fdw.sql:2122: NOTICE:  trig_row_before(23, skidoo) BEFORE ROW UPDATE ON rem1
psql:sql/14.5/ported_postgres_fdw.sql:2122: NOTICE:  OLD: (1,update),NEW: (1,updateupdate)
psql:sql/14.5/ported_postgres_fdw.sql:2122: NOTICE:  trig_row_after(23, skidoo) AFTER ROW UPDATE ON rem1
psql:sql/14.5/ported_postgres_fdw.sql:2122: NOTICE:  OLD: (1,update),NEW: (1,updateupdate)
psql:sql/14.5/ported_postgres_fdw.sql:2122: NOTICE:  trigger_func(<NULL>) called: action = UPDATE, when = AFTER, level = STATEMENT
-- cleanup
--Testcase 580:
DROP TRIGGER trig_row_before ON rem1;
--Testcase 581:
DROP TRIGGER trig_row_after ON rem1;
--Testcase 582:
DROP TRIGGER trig_stmt_before ON rem1;
--Testcase 583:
DROP TRIGGER trig_stmt_after ON rem1;
--Testcase 584:
DELETE from rem1;
-- Test multiple AFTER ROW triggers on a foreign table
--Testcase 585:
CREATE TRIGGER trig_row_after1
AFTER INSERT OR UPDATE OR DELETE ON rem1
FOR EACH ROW EXECUTE PROCEDURE trigger_data(23,'skidoo');
--Testcase 586:
CREATE TRIGGER trig_row_after2
AFTER INSERT OR UPDATE OR DELETE ON rem1
FOR EACH ROW EXECUTE PROCEDURE trigger_data(23,'skidoo');
--Testcase 587:
insert into rem1 values(1,'insert');
psql:sql/14.5/ported_postgres_fdw.sql:2150: NOTICE:  trig_row_after1(23, skidoo) AFTER ROW INSERT ON rem1
psql:sql/14.5/ported_postgres_fdw.sql:2150: NOTICE:  NEW: (1,insert)
psql:sql/14.5/ported_postgres_fdw.sql:2150: NOTICE:  trig_row_after2(23, skidoo) AFTER ROW INSERT ON rem1
psql:sql/14.5/ported_postgres_fdw.sql:2150: NOTICE:  NEW: (1,insert)
--Testcase 588:
update rem1 set f2  = 'update' where f1 = 1;
psql:sql/14.5/ported_postgres_fdw.sql:2152: NOTICE:  trig_row_after1(23, skidoo) AFTER ROW UPDATE ON rem1
psql:sql/14.5/ported_postgres_fdw.sql:2152: NOTICE:  OLD: (1,insert),NEW: (1,update)
psql:sql/14.5/ported_postgres_fdw.sql:2152: NOTICE:  trig_row_after2(23, skidoo) AFTER ROW UPDATE ON rem1
psql:sql/14.5/ported_postgres_fdw.sql:2152: NOTICE:  OLD: (1,insert),NEW: (1,update)
--Testcase 589:
update rem1 set f2 = f2 || f2;
psql:sql/14.5/ported_postgres_fdw.sql:2154: NOTICE:  trig_row_after1(23, skidoo) AFTER ROW UPDATE ON rem1
psql:sql/14.5/ported_postgres_fdw.sql:2154: NOTICE:  OLD: (1,update),NEW: (1,updateupdate)
psql:sql/14.5/ported_postgres_fdw.sql:2154: NOTICE:  trig_row_after2(23, skidoo) AFTER ROW UPDATE ON rem1
psql:sql/14.5/ported_postgres_fdw.sql:2154: NOTICE:  OLD: (1,update),NEW: (1,updateupdate)
--Testcase 590:
delete from rem1;
psql:sql/14.5/ported_postgres_fdw.sql:2156: NOTICE:  trig_row_after1(23, skidoo) AFTER ROW DELETE ON rem1
psql:sql/14.5/ported_postgres_fdw.sql:2156: NOTICE:  OLD: (1,updateupdate)
psql:sql/14.5/ported_postgres_fdw.sql:2156: NOTICE:  trig_row_after2(23, skidoo) AFTER ROW DELETE ON rem1
psql:sql/14.5/ported_postgres_fdw.sql:2156: NOTICE:  OLD: (1,updateupdate)
-- cleanup
--Testcase 591:
DROP TRIGGER trig_row_after1 ON rem1;
--Testcase 592:
DROP TRIGGER trig_row_after2 ON rem1;
-- Test WHEN conditions
--Testcase 593:
CREATE TRIGGER trig_row_before_insupd
BEFORE INSERT OR UPDATE ON rem1
FOR EACH ROW
WHEN (NEW.f2 like '%update%')
EXECUTE PROCEDURE trigger_data(23,'skidoo');
--Testcase 594:
CREATE TRIGGER trig_row_after_insupd
AFTER INSERT OR UPDATE ON rem1
FOR EACH ROW
WHEN (NEW.f2 like '%update%')
EXECUTE PROCEDURE trigger_data(23,'skidoo');
-- Insert or update not matching: nothing happens
--Testcase 595:
INSERT INTO rem1 values(1, 'insert');
--Testcase 596:
UPDATE rem1 set f2 = 'test';
-- Insert or update matching: triggers are fired
--Testcase 597:
INSERT INTO rem1 values(2, 'update');
psql:sql/14.5/ported_postgres_fdw.sql:2188: NOTICE:  trig_row_before_insupd(23, skidoo) BEFORE ROW INSERT ON rem1
psql:sql/14.5/ported_postgres_fdw.sql:2188: NOTICE:  NEW: (2,update)
psql:sql/14.5/ported_postgres_fdw.sql:2188: NOTICE:  trig_row_after_insupd(23, skidoo) AFTER ROW INSERT ON rem1
psql:sql/14.5/ported_postgres_fdw.sql:2188: NOTICE:  NEW: (2,update)
--Testcase 598:
UPDATE rem1 set f2 = 'update update' where f1 = '2';
psql:sql/14.5/ported_postgres_fdw.sql:2190: NOTICE:  trig_row_before_insupd(23, skidoo) BEFORE ROW UPDATE ON rem1
psql:sql/14.5/ported_postgres_fdw.sql:2190: NOTICE:  OLD: (2,update),NEW: (2,"update update")
psql:sql/14.5/ported_postgres_fdw.sql:2190: NOTICE:  trig_row_after_insupd(23, skidoo) AFTER ROW UPDATE ON rem1
psql:sql/14.5/ported_postgres_fdw.sql:2190: NOTICE:  OLD: (2,update),NEW: (2,"update update")
--Testcase 599:
CREATE TRIGGER trig_row_before_delete
BEFORE DELETE ON rem1
FOR EACH ROW
WHEN (OLD.f2 like '%update%')
EXECUTE PROCEDURE trigger_data(23,'skidoo');
--Testcase 600:
CREATE TRIGGER trig_row_after_delete
AFTER DELETE ON rem1
FOR EACH ROW
WHEN (OLD.f2 like '%update%')
EXECUTE PROCEDURE trigger_data(23,'skidoo');
-- Trigger is fired for f1=2, not for f1=1
--Testcase 601:
DELETE FROM rem1;
psql:sql/14.5/ported_postgres_fdw.sql:2208: NOTICE:  trig_row_before_delete(23, skidoo) BEFORE ROW DELETE ON rem1
psql:sql/14.5/ported_postgres_fdw.sql:2208: NOTICE:  OLD: (2,"update update")
psql:sql/14.5/ported_postgres_fdw.sql:2208: NOTICE:  trig_row_after_delete(23, skidoo) AFTER ROW DELETE ON rem1
psql:sql/14.5/ported_postgres_fdw.sql:2208: NOTICE:  OLD: (2,"update update")
-- cleanup
--Testcase 602:
DROP TRIGGER trig_row_before_insupd ON rem1;
--Testcase 603:
DROP TRIGGER trig_row_after_insupd ON rem1;
--Testcase 604:
DROP TRIGGER trig_row_before_delete ON rem1;
--Testcase 605:
DROP TRIGGER trig_row_after_delete ON rem1;
-- Test various RETURN statements in BEFORE triggers.
--Testcase 606:
CREATE FUNCTION trig_row_before_insupdate() RETURNS TRIGGER AS $$
  BEGIN
    NEW.f2 := NEW.f2 || ' triggered !';
    RETURN NEW;
  END
$$ language plpgsql;
--Testcase 607:
CREATE TRIGGER trig_row_before_insupd
BEFORE INSERT OR UPDATE ON rem1
FOR EACH ROW EXECUTE PROCEDURE trig_row_before_insupdate();
-- The new values should have 'triggered' appended
--Testcase 608:
INSERT INTO rem1 values(1, 'insert');
--Testcase 609:
SELECT f1, f2 from loc1;
 f1 |         f2         
----+--------------------
  1 | insert triggered !
(1 row)

--Testcase 610:
INSERT INTO rem1 values(2, 'insert');
--Testcase 611:
SELECT f1, f2 from loc1;
 f1 |         f2         
----+--------------------
  1 | insert triggered !
  2 | insert triggered !
(2 rows)

--Testcase 612:
UPDATE rem1 set f2 = '';
--Testcase 613:
SELECT f1, f2 from loc1;
 f1 |      f2      
----+--------------
  1 |  triggered !
  2 |  triggered !
(2 rows)

--Testcase 614:
UPDATE rem1 set f2 = 'skidoo';
--Testcase 615:
SELECT f1, f2 from loc1;
 f1 |         f2         
----+--------------------
  1 | skidoo triggered !
  2 | skidoo triggered !
(2 rows)

--Testcase 616:
EXPLAIN (verbose, costs off)
UPDATE rem1 set f1 = 10;          -- all columns should be transmitted
                               QUERY PLAN                                
-------------------------------------------------------------------------
 Update on public.rem1
   Remote SQL: UPDATE odbc_fdw_post.loc1 SET f1 = ?, f2 = ? WHERE f1 = ?
   ->  Foreign Scan on public.rem1
         Output: 10, f1, rem1.*
         Remote SQL: SELECT f1, f2 FROM odbc_fdw_post.loc1
(5 rows)

--Testcase 617:
UPDATE rem1 set f1 = 10;
--Testcase 618:
SELECT f1, f2 from loc1;
 f1 |               f2               
----+--------------------------------
 10 | skidoo triggered ! triggered !
 10 | skidoo triggered ! triggered !
(2 rows)

--Testcase 619:
DELETE FROM rem1;
-- Add a second trigger, to check that the changes are propagated correctly
-- from trigger to trigger
--Testcase 620:
CREATE TRIGGER trig_row_before_insupd2
BEFORE INSERT OR UPDATE ON rem1
FOR EACH ROW EXECUTE PROCEDURE trig_row_before_insupdate();
--Testcase 621:
INSERT INTO rem1 values(1, 'insert');
--Testcase 622:
SELECT f1, f2 from loc1;
 f1 |               f2               
----+--------------------------------
  1 | insert triggered ! triggered !
(1 row)

--Testcase 623:
INSERT INTO rem1 values(2, 'insert');
--Testcase 624:
SELECT f1, f2 from loc1;
 f1 |               f2               
----+--------------------------------
  1 | insert triggered ! triggered !
  2 | insert triggered ! triggered !
(2 rows)

--Testcase 625:
UPDATE rem1 set f2 = '';
--Testcase 626:
SELECT f1, f2 from loc1;
 f1 |            f2            
----+--------------------------
  1 |  triggered ! triggered !
  2 |  triggered ! triggered !
(2 rows)

--Testcase 627:
UPDATE rem1 set f2 = 'skidoo';
--Testcase 628:
SELECT f1, f2 from loc1;
 f1 |               f2               
----+--------------------------------
  1 | skidoo triggered ! triggered !
  2 | skidoo triggered ! triggered !
(2 rows)

--Testcase 629:
DROP TRIGGER trig_row_before_insupd ON rem1;
--Testcase 630:
DROP TRIGGER trig_row_before_insupd2 ON rem1;
--Testcase 631:
DELETE from rem1;
--Testcase 632:
INSERT INTO rem1 VALUES (1, 'test');
-- Test with a trigger returning NULL
--Testcase 633:
CREATE FUNCTION trig_null() RETURNS TRIGGER AS $$
  BEGIN
    RETURN NULL;
  END
$$ language plpgsql;
--Testcase 634:
CREATE TRIGGER trig_null
BEFORE INSERT OR UPDATE OR DELETE ON rem1
FOR EACH ROW EXECUTE PROCEDURE trig_null();
-- Nothing should have changed.
--Testcase 635:
INSERT INTO rem1 VALUES (2, 'test2');
--Testcase 636:
SELECT f1, f2 from loc1;
 f1 |  f2  
----+------
  1 | test
(1 row)

--Testcase 637:
UPDATE rem1 SET f2 = 'test2';
--Testcase 638:
SELECT f1, f2 from loc1;
 f1 |  f2  
----+------
  1 | test
(1 row)

--Testcase 639:
DELETE from rem1;
--Testcase 640:
SELECT f1, f2 from loc1;
 f1 |  f2  
----+------
  1 | test
(1 row)

--Testcase 641:
DROP TRIGGER trig_null ON rem1;
--Testcase 642:
DELETE from rem1;
-- Test a combination of local and remote triggers
--Testcase 643:
CREATE TRIGGER trig_row_before
BEFORE INSERT OR UPDATE OR DELETE ON rem1
FOR EACH ROW EXECUTE PROCEDURE trigger_data(23,'skidoo');
--Testcase 644:
CREATE TRIGGER trig_row_after
AFTER INSERT OR UPDATE OR DELETE ON rem1
FOR EACH ROW EXECUTE PROCEDURE trigger_data(23,'skidoo');
--Testcase 645:
CREATE TRIGGER trig_local_before BEFORE INSERT OR UPDATE ON loc1
FOR EACH ROW EXECUTE PROCEDURE trig_row_before_insupdate();
--Testcase 646:
INSERT INTO rem1(f2) VALUES ('test');
psql:sql/14.5/ported_postgres_fdw.sql:2353: NOTICE:  trig_row_before(23, skidoo) BEFORE ROW INSERT ON rem1
psql:sql/14.5/ported_postgres_fdw.sql:2353: NOTICE:  NEW: (12,test)
psql:sql/14.5/ported_postgres_fdw.sql:2353: NOTICE:  trig_row_after(23, skidoo) AFTER ROW INSERT ON rem1
psql:sql/14.5/ported_postgres_fdw.sql:2353: NOTICE:  NEW: (12,test)
--Testcase 647:
UPDATE rem1 SET f2 = 'testo';
psql:sql/14.5/ported_postgres_fdw.sql:2355: NOTICE:  trig_row_before(23, skidoo) BEFORE ROW UPDATE ON rem1
psql:sql/14.5/ported_postgres_fdw.sql:2355: NOTICE:  OLD: (12,test),NEW: (12,testo)
psql:sql/14.5/ported_postgres_fdw.sql:2355: NOTICE:  trig_row_after(23, skidoo) AFTER ROW UPDATE ON rem1
psql:sql/14.5/ported_postgres_fdw.sql:2355: NOTICE:  OLD: (12,test),NEW: (12,testo)
-- Test returning a system attribute
--Testcase 648:
INSERT INTO rem1(f2) VALUES ('test');
psql:sql/14.5/ported_postgres_fdw.sql:2359: NOTICE:  trig_row_before(23, skidoo) BEFORE ROW INSERT ON rem1
psql:sql/14.5/ported_postgres_fdw.sql:2359: NOTICE:  NEW: (13,test)
psql:sql/14.5/ported_postgres_fdw.sql:2359: NOTICE:  trig_row_after(23, skidoo) AFTER ROW INSERT ON rem1
psql:sql/14.5/ported_postgres_fdw.sql:2359: NOTICE:  NEW: (13,test)
-- cleanup
--Testcase 649:
DROP TRIGGER trig_row_before ON rem1;
--Testcase 650:
DROP TRIGGER trig_row_after ON rem1;
--Testcase 651:
DROP TRIGGER trig_local_before ON loc1;
-- Test direct foreign table modification functionality
--Testcase 652:
EXPLAIN (verbose, costs off)
DELETE FROM rem1;                 -- can be pushed down
                        QUERY PLAN                         
-----------------------------------------------------------
 Delete on public.rem1
   Remote SQL: DELETE FROM odbc_fdw_post.loc1 WHERE f1 = ?
   ->  Foreign Scan on public.rem1
         Output: f1
         Remote SQL: SELECT f1 FROM odbc_fdw_post.loc1
(5 rows)

--Testcase 653:
EXPLAIN (verbose, costs off)
DELETE FROM rem1 WHERE false;     -- currently can't be pushed down
                        QUERY PLAN                         
-----------------------------------------------------------
 Delete on public.rem1
   Remote SQL: DELETE FROM odbc_fdw_post.loc1 WHERE f1 = ?
   ->  Result
         Output: f1
         One-Time Filter: false
(5 rows)

-- Test with statement-level triggers
--Testcase 654:
CREATE TRIGGER trig_stmt_before
	BEFORE DELETE OR INSERT OR UPDATE ON rem1
	FOR EACH STATEMENT EXECUTE PROCEDURE trigger_func();
--Testcase 655:
EXPLAIN (verbose, costs off)
UPDATE rem1 set f2 = '';          -- can be pushed down
                           QUERY PLAN                            
-----------------------------------------------------------------
 Update on public.rem1
   Remote SQL: UPDATE odbc_fdw_post.loc1 SET f2 = ? WHERE f1 = ?
   ->  Foreign Scan on public.rem1
         Output: ''::text, f1, rem1.*
         Remote SQL: SELECT f1, f2 FROM odbc_fdw_post.loc1
(5 rows)

--Testcase 656:
EXPLAIN (verbose, costs off)
DELETE FROM rem1;                 -- can be pushed down
                        QUERY PLAN                         
-----------------------------------------------------------
 Delete on public.rem1
   Remote SQL: DELETE FROM odbc_fdw_post.loc1 WHERE f1 = ?
   ->  Foreign Scan on public.rem1
         Output: f1
         Remote SQL: SELECT f1 FROM odbc_fdw_post.loc1
(5 rows)

--Testcase 657:
DROP TRIGGER trig_stmt_before ON rem1;
--Testcase 658:
CREATE TRIGGER trig_stmt_after
	AFTER DELETE OR INSERT OR UPDATE ON rem1
	FOR EACH STATEMENT EXECUTE PROCEDURE trigger_func();
--Testcase 659:
EXPLAIN (verbose, costs off)
UPDATE rem1 set f2 = '';          -- can be pushed down
                           QUERY PLAN                            
-----------------------------------------------------------------
 Update on public.rem1
   Remote SQL: UPDATE odbc_fdw_post.loc1 SET f2 = ? WHERE f1 = ?
   ->  Foreign Scan on public.rem1
         Output: ''::text, f1, rem1.*
         Remote SQL: SELECT f1, f2 FROM odbc_fdw_post.loc1
(5 rows)

--Testcase 660:
EXPLAIN (verbose, costs off)
DELETE FROM rem1;                 -- can be pushed down
                        QUERY PLAN                         
-----------------------------------------------------------
 Delete on public.rem1
   Remote SQL: DELETE FROM odbc_fdw_post.loc1 WHERE f1 = ?
   ->  Foreign Scan on public.rem1
         Output: f1
         Remote SQL: SELECT f1 FROM odbc_fdw_post.loc1
(5 rows)

--Testcase 661:
DROP TRIGGER trig_stmt_after ON rem1;
-- Test with row-level ON INSERT triggers
--Testcase 662:
CREATE TRIGGER trig_row_before_insert
BEFORE INSERT ON rem1
FOR EACH ROW EXECUTE PROCEDURE trigger_data(23,'skidoo');
--Testcase 663:
EXPLAIN (verbose, costs off)
UPDATE rem1 set f2 = '';          -- can be pushed down
                           QUERY PLAN                            
-----------------------------------------------------------------
 Update on public.rem1
   Remote SQL: UPDATE odbc_fdw_post.loc1 SET f2 = ? WHERE f1 = ?
   ->  Foreign Scan on public.rem1
         Output: ''::text, f1, rem1.*
         Remote SQL: SELECT f1, f2 FROM odbc_fdw_post.loc1
(5 rows)

--Testcase 664:
EXPLAIN (verbose, costs off)
DELETE FROM rem1;                 -- can be pushed down
                        QUERY PLAN                         
-----------------------------------------------------------
 Delete on public.rem1
   Remote SQL: DELETE FROM odbc_fdw_post.loc1 WHERE f1 = ?
   ->  Foreign Scan on public.rem1
         Output: f1
         Remote SQL: SELECT f1 FROM odbc_fdw_post.loc1
(5 rows)

--Testcase 665:
DROP TRIGGER trig_row_before_insert ON rem1;
--Testcase 666:
CREATE TRIGGER trig_row_after_insert
AFTER INSERT ON rem1
FOR EACH ROW EXECUTE PROCEDURE trigger_data(23,'skidoo');
--Testcase 667:
EXPLAIN (verbose, costs off)
UPDATE rem1 set f2 = '';          -- can be pushed down
                           QUERY PLAN                            
-----------------------------------------------------------------
 Update on public.rem1
   Remote SQL: UPDATE odbc_fdw_post.loc1 SET f2 = ? WHERE f1 = ?
   ->  Foreign Scan on public.rem1
         Output: ''::text, f1, rem1.*
         Remote SQL: SELECT f1, f2 FROM odbc_fdw_post.loc1
(5 rows)

--Testcase 668:
EXPLAIN (verbose, costs off)
DELETE FROM rem1;                 -- can be pushed down
                        QUERY PLAN                         
-----------------------------------------------------------
 Delete on public.rem1
   Remote SQL: DELETE FROM odbc_fdw_post.loc1 WHERE f1 = ?
   ->  Foreign Scan on public.rem1
         Output: f1
         Remote SQL: SELECT f1 FROM odbc_fdw_post.loc1
(5 rows)

--Testcase 669:
DROP TRIGGER trig_row_after_insert ON rem1;
-- Test with row-level ON UPDATE triggers
--Testcase 670:
CREATE TRIGGER trig_row_before_update
BEFORE UPDATE ON rem1
FOR EACH ROW EXECUTE PROCEDURE trigger_data(23,'skidoo');
--Testcase 671:
EXPLAIN (verbose, costs off)
UPDATE rem1 set f2 = '';          -- can't be pushed down
                               QUERY PLAN                                
-------------------------------------------------------------------------
 Update on public.rem1
   Remote SQL: UPDATE odbc_fdw_post.loc1 SET f1 = ?, f2 = ? WHERE f1 = ?
   ->  Foreign Scan on public.rem1
         Output: ''::text, f1, rem1.*
         Remote SQL: SELECT f1, f2 FROM odbc_fdw_post.loc1
(5 rows)

--Testcase 672:
EXPLAIN (verbose, costs off)
DELETE FROM rem1;                 -- can be pushed down
                        QUERY PLAN                         
-----------------------------------------------------------
 Delete on public.rem1
   Remote SQL: DELETE FROM odbc_fdw_post.loc1 WHERE f1 = ?
   ->  Foreign Scan on public.rem1
         Output: f1
         Remote SQL: SELECT f1 FROM odbc_fdw_post.loc1
(5 rows)

--Testcase 673:
DROP TRIGGER trig_row_before_update ON rem1;
--Testcase 674:
CREATE TRIGGER trig_row_after_update
AFTER UPDATE ON rem1
FOR EACH ROW EXECUTE PROCEDURE trigger_data(23,'skidoo');
--Testcase 675:
EXPLAIN (verbose, costs off)
UPDATE rem1 set f2 = '';          -- can't be pushed down
                           QUERY PLAN                            
-----------------------------------------------------------------
 Update on public.rem1
   Remote SQL: UPDATE odbc_fdw_post.loc1 SET f2 = ? WHERE f1 = ?
   ->  Foreign Scan on public.rem1
         Output: ''::text, f1, rem1.*
         Remote SQL: SELECT f1, f2 FROM odbc_fdw_post.loc1
(5 rows)

--Testcase 676:
EXPLAIN (verbose, costs off)
DELETE FROM rem1;                 -- can be pushed down
                        QUERY PLAN                         
-----------------------------------------------------------
 Delete on public.rem1
   Remote SQL: DELETE FROM odbc_fdw_post.loc1 WHERE f1 = ?
   ->  Foreign Scan on public.rem1
         Output: f1
         Remote SQL: SELECT f1 FROM odbc_fdw_post.loc1
(5 rows)

--Testcase 677:
DROP TRIGGER trig_row_after_update ON rem1;
-- Test with row-level ON DELETE triggers
--Testcase 678:
CREATE TRIGGER trig_row_before_delete
BEFORE DELETE ON rem1
FOR EACH ROW EXECUTE PROCEDURE trigger_data(23,'skidoo');
--Testcase 679:
EXPLAIN (verbose, costs off)
UPDATE rem1 set f2 = '';          -- can be pushed down
                           QUERY PLAN                            
-----------------------------------------------------------------
 Update on public.rem1
   Remote SQL: UPDATE odbc_fdw_post.loc1 SET f2 = ? WHERE f1 = ?
   ->  Foreign Scan on public.rem1
         Output: ''::text, f1, rem1.*
         Remote SQL: SELECT f1, f2 FROM odbc_fdw_post.loc1
(5 rows)

--Testcase 680:
EXPLAIN (verbose, costs off)
DELETE FROM rem1;                 -- can't be pushed down
                        QUERY PLAN                         
-----------------------------------------------------------
 Delete on public.rem1
   Remote SQL: DELETE FROM odbc_fdw_post.loc1 WHERE f1 = ?
   ->  Foreign Scan on public.rem1
         Output: f1, rem1.*
         Remote SQL: SELECT f1, f2 FROM odbc_fdw_post.loc1
(5 rows)

--Testcase 681:
DROP TRIGGER trig_row_before_delete ON rem1;
--Testcase 682:
CREATE TRIGGER trig_row_after_delete
AFTER DELETE ON rem1
FOR EACH ROW EXECUTE PROCEDURE trigger_data(23,'skidoo');
--Testcase 683:
EXPLAIN (verbose, costs off)
UPDATE rem1 set f2 = '';          -- can be pushed down
                           QUERY PLAN                            
-----------------------------------------------------------------
 Update on public.rem1
   Remote SQL: UPDATE odbc_fdw_post.loc1 SET f2 = ? WHERE f1 = ?
   ->  Foreign Scan on public.rem1
         Output: ''::text, f1, rem1.*
         Remote SQL: SELECT f1, f2 FROM odbc_fdw_post.loc1
(5 rows)

--Testcase 684:
EXPLAIN (verbose, costs off)
DELETE FROM rem1;                 -- can't be pushed down
                        QUERY PLAN                         
-----------------------------------------------------------
 Delete on public.rem1
   Remote SQL: DELETE FROM odbc_fdw_post.loc1 WHERE f1 = ?
   ->  Foreign Scan on public.rem1
         Output: f1, rem1.*
         Remote SQL: SELECT f1, f2 FROM odbc_fdw_post.loc1
(5 rows)

--Testcase 685:
DROP TRIGGER trig_row_after_delete ON rem1;
-- ===================================================================
-- test inheritance features
-- ===================================================================
--Testcase 686:
CREATE TABLE a (aa TEXT);
--Testcase 687:
ALTER TABLE a SET (autovacuum_enabled = 'false');
--Testcase 688:
CREATE FOREIGN TABLE b (bb TEXT, id serial OPTIONS (key 'true')) INHERITS (a)
  SERVER :DB_SERVERNAME OPTIONS (schema :DB_SCHEMA_PORT_TEST, table 'loct');
--Testcase 689:
INSERT INTO a(aa) VALUES('aaa');
--Testcase 690:
INSERT INTO a(aa) VALUES('aaaa');
--Testcase 691:
INSERT INTO a(aa) VALUES('aaaaa');
--Testcase 692:
INSERT INTO b(aa) VALUES('bbb');
--Testcase 693:
INSERT INTO b(aa) VALUES('bbbb');
--Testcase 694:
INSERT INTO b(aa) VALUES('bbbbb');
--Testcase 695:
SELECT tableoid::regclass, * FROM a;
 tableoid |  aa   
----------+-------
 a        | aaa
 a        | aaaa
 a        | aaaaa
 b        | bbb
 b        | bbbb
 b        | bbbbb
(6 rows)

--Testcase 696:
SELECT tableoid::regclass, aa, bb FROM b;
 tableoid |  aa   | bb 
----------+-------+----
 b        | bbb   | 
 b        | bbbb  | 
 b        | bbbbb | 
(3 rows)

--Testcase 697:
SELECT tableoid::regclass, * FROM ONLY a;
 tableoid |  aa   
----------+-------
 a        | aaa
 a        | aaaa
 a        | aaaaa
(3 rows)

--Testcase 698:
UPDATE a SET aa = 'zzzzzz' WHERE aa LIKE 'aaaa%';
--Testcase 699:
SELECT tableoid::regclass, * FROM a;
 tableoid |   aa   
----------+--------
 a        | aaa
 a        | zzzzzz
 a        | zzzzzz
 b        | bbb
 b        | bbbb
 b        | bbbbb
(6 rows)

--Testcase 700:
SELECT tableoid::regclass, aa, bb FROM b;
 tableoid |  aa   | bb 
----------+-------+----
 b        | bbb   | 
 b        | bbbb  | 
 b        | bbbbb | 
(3 rows)

--Testcase 701:
SELECT tableoid::regclass, * FROM ONLY a;
 tableoid |   aa   
----------+--------
 a        | aaa
 a        | zzzzzz
 a        | zzzzzz
(3 rows)

--Testcase 702:
UPDATE b SET aa = 'new';
--Testcase 703:
SELECT tableoid::regclass, * FROM a;
 tableoid |   aa   
----------+--------
 a        | aaa
 a        | zzzzzz
 a        | zzzzzz
 b        | new
 b        | new
 b        | new
(6 rows)

--Testcase 704:
SELECT tableoid::regclass, aa, bb FROM b;
 tableoid | aa  | bb 
----------+-----+----
 b        | new | 
 b        | new | 
 b        | new | 
(3 rows)

--Testcase 705:
SELECT tableoid::regclass, * FROM ONLY a;
 tableoid |   aa   
----------+--------
 a        | aaa
 a        | zzzzzz
 a        | zzzzzz
(3 rows)

--Testcase 706:
UPDATE a SET aa = 'newtoo';
--Testcase 707:
SELECT tableoid::regclass, * FROM a;
 tableoid |   aa   
----------+--------
 a        | newtoo
 a        | newtoo
 a        | newtoo
 b        | newtoo
 b        | newtoo
 b        | newtoo
(6 rows)

--Testcase 708:
SELECT tableoid::regclass, aa, bb FROM b;
 tableoid |   aa   | bb 
----------+--------+----
 b        | newtoo | 
 b        | newtoo | 
 b        | newtoo | 
(3 rows)

--Testcase 709:
SELECT tableoid::regclass, * FROM ONLY a;
 tableoid |   aa   
----------+--------
 a        | newtoo
 a        | newtoo
 a        | newtoo
(3 rows)

--Testcase 710:
DELETE FROM a;
--Testcase 711:
SELECT tableoid::regclass, * FROM a;
 tableoid | aa 
----------+----
(0 rows)

--Testcase 712:
SELECT tableoid::regclass, aa, bb FROM b;
 tableoid | aa | bb 
----------+----+----
(0 rows)

--Testcase 713:
SELECT tableoid::regclass, * FROM ONLY a;
 tableoid | aa 
----------+----
(0 rows)

--Testcase 714:
DROP TABLE a CASCADE;
psql:sql/14.5/ported_postgres_fdw.sql:2560: NOTICE:  drop cascades to foreign table b
-- DROP TABLE loct;
-- Check SELECT FOR UPDATE/SHARE with an inherited source table
--Testcase 715:
create table foo (f1 int, f2 int);
--Testcase 716:
create foreign table foo2 (f3 int OPTIONS (key 'true')) inherits (foo)
  server :DB_SERVERNAME options (schema :DB_SCHEMA_PORT_TEST, table 'loct1');
--Testcase 717:
create table bar (f1 int, f2 int);
--Testcase 718:
create foreign table bar2 (f3 int OPTIONS (key 'true')) inherits (bar)
  server :DB_SERVERNAME options (schema :DB_SCHEMA_PORT_TEST, table 'loct2');
--Testcase 719:
alter table foo set (autovacuum_enabled = 'false');
--Testcase 720:
alter table bar set (autovacuum_enabled = 'false');
--Testcase 721:
insert into foo values(1,1);
--Testcase 722:
insert into foo values(3,3);
--Testcase 723:
insert into foo2 values(2,2,2);
--Testcase 724:
insert into foo2 values(4,4,4);
--Testcase 725:
insert into bar values(1,11);
--Testcase 726:
insert into bar values(2,22);
--Testcase 727:
insert into bar values(6,66);
--Testcase 728:
insert into bar2 values(3,33,33);
--Testcase 729:
insert into bar2 values(4,44,44);
--Testcase 730:
insert into bar2 values(7,77,77);
--Testcase 731:
explain (verbose, costs off)
select * from bar where f1 in (select f1 from foo) for update;
                                          QUERY PLAN                                          
----------------------------------------------------------------------------------------------
 LockRows
   Output: bar.f1, bar.f2, bar.ctid, foo.ctid, bar.*, bar.tableoid, foo.*, foo.tableoid
   ->  Hash Semi Join
         Output: bar.f1, bar.f2, bar.ctid, foo.ctid, bar.*, bar.tableoid, foo.*, foo.tableoid
         Hash Cond: (bar.f1 = foo.f1)
         ->  Append
               ->  Seq Scan on public.bar bar_1
                     Output: bar_1.f1, bar_1.f2, bar_1.ctid, bar_1.*, bar_1.tableoid
               ->  Foreign Scan on public.bar2 bar_2
                     Output: bar_2.f1, bar_2.f2, bar_2.ctid, bar_2.*, bar_2.tableoid
                     Remote SQL: SELECT f1, f2, f3 FROM odbc_fdw_post.loct2
         ->  Hash
               Output: foo.ctid, foo.f1, foo.*, foo.tableoid
               ->  Append
                     ->  Seq Scan on public.foo foo_1
                           Output: foo_1.ctid, foo_1.f1, foo_1.*, foo_1.tableoid
                     ->  Foreign Scan on public.foo2 foo_2
                           Output: foo_2.ctid, foo_2.f1, foo_2.*, foo_2.tableoid
                           Remote SQL: SELECT f1, f2, f3 FROM odbc_fdw_post.loct1
(19 rows)

--Testcase 732:
select * from bar where f1 in (select f1 from foo) for update;
 f1 | f2 
----+----
  1 | 11
  2 | 22
  3 | 33
  4 | 44
(4 rows)

--Testcase 733:
explain (verbose, costs off)
select * from bar where f1 in (select f1 from foo) for share;
                                          QUERY PLAN                                          
----------------------------------------------------------------------------------------------
 LockRows
   Output: bar.f1, bar.f2, bar.ctid, foo.ctid, bar.*, bar.tableoid, foo.*, foo.tableoid
   ->  Hash Semi Join
         Output: bar.f1, bar.f2, bar.ctid, foo.ctid, bar.*, bar.tableoid, foo.*, foo.tableoid
         Hash Cond: (bar.f1 = foo.f1)
         ->  Append
               ->  Seq Scan on public.bar bar_1
                     Output: bar_1.f1, bar_1.f2, bar_1.ctid, bar_1.*, bar_1.tableoid
               ->  Foreign Scan on public.bar2 bar_2
                     Output: bar_2.f1, bar_2.f2, bar_2.ctid, bar_2.*, bar_2.tableoid
                     Remote SQL: SELECT f1, f2, f3 FROM odbc_fdw_post.loct2
         ->  Hash
               Output: foo.ctid, foo.f1, foo.*, foo.tableoid
               ->  Append
                     ->  Seq Scan on public.foo foo_1
                           Output: foo_1.ctid, foo_1.f1, foo_1.*, foo_1.tableoid
                     ->  Foreign Scan on public.foo2 foo_2
                           Output: foo_2.ctid, foo_2.f1, foo_2.*, foo_2.tableoid
                           Remote SQL: SELECT f1, f2, f3 FROM odbc_fdw_post.loct1
(19 rows)

--Testcase 734:
select * from bar where f1 in (select f1 from foo) for share;
 f1 | f2 
----+----
  1 | 11
  2 | 22
  3 | 33
  4 | 44
(4 rows)

-- Now check SELECT FOR UPDATE/SHARE with an inherited source table,
-- where the parent is itself a foreign table
--Testcase 735:
create foreign table foo2child (f3 int) inherits (foo2)
  server :DB_SERVERNAME options (schema :DB_SCHEMA_PORT_TEST, table 'loct4');
psql:sql/14.5/ported_postgres_fdw.sql:2618: NOTICE:  moving and merging column "f3" with inherited definition
DETAIL:  User-specified column moved to the position of the inherited column.
--Testcase 736:
explain (verbose, costs off)
select * from bar where f1 in (select f1 from foo2) for share;
                                      QUERY PLAN                                      
--------------------------------------------------------------------------------------
 LockRows
   Output: bar.f1, bar.f2, bar.ctid, foo2.*, bar.*, bar.tableoid, foo2.tableoid
   ->  Hash Semi Join
         Output: bar.f1, bar.f2, bar.ctid, foo2.*, bar.*, bar.tableoid, foo2.tableoid
         Hash Cond: (bar.f1 = foo2.f1)
         ->  Append
               ->  Seq Scan on public.bar bar_1
                     Output: bar_1.f1, bar_1.f2, bar_1.ctid, bar_1.*, bar_1.tableoid
               ->  Foreign Scan on public.bar2 bar_2
                     Output: bar_2.f1, bar_2.f2, bar_2.ctid, bar_2.*, bar_2.tableoid
                     Remote SQL: SELECT f1, f2, f3 FROM odbc_fdw_post.loct2
         ->  Hash
               Output: foo2.*, foo2.f1, foo2.tableoid
               ->  Append
                     ->  Foreign Scan on public.foo2 foo2_1
                           Output: foo2_1.*, foo2_1.f1, foo2_1.tableoid
                           Remote SQL: SELECT f1, f2, f3 FROM odbc_fdw_post.loct1
                     ->  Foreign Scan on public.foo2child foo2_2
                           Output: foo2_2.*, foo2_2.f1, foo2_2.tableoid
                           Remote SQL: SELECT f1, f2, f3 FROM odbc_fdw_post.loct4
(20 rows)

--Testcase 737:
select * from bar where f1 in (select f1 from foo2) for share;
 f1 | f2 
----+----
  2 | 22
  4 | 44
(2 rows)

--Testcase 738:
drop foreign table foo2child;
-- And with a local child relation of the foreign table parent
--Testcase 739:
create table foo2child (f3 int) inherits (foo2);
psql:sql/14.5/ported_postgres_fdw.sql:2631: NOTICE:  moving and merging column "f3" with inherited definition
DETAIL:  User-specified column moved to the position of the inherited column.
--Testcase 740:
explain (verbose, costs off)
select * from bar where f1 in (select f1 from foo2) for share;
                                           QUERY PLAN                                            
-------------------------------------------------------------------------------------------------
 LockRows
   Output: bar.f1, bar.f2, bar.ctid, foo2.*, bar.*, bar.tableoid, foo2.ctid, foo2.tableoid
   ->  Hash Join
         Output: bar.f1, bar.f2, bar.ctid, foo2.*, bar.*, bar.tableoid, foo2.ctid, foo2.tableoid
         Inner Unique: true
         Hash Cond: (bar.f1 = foo2.f1)
         ->  Append
               ->  Seq Scan on public.bar bar_1
                     Output: bar_1.f1, bar_1.f2, bar_1.ctid, bar_1.*, bar_1.tableoid
               ->  Foreign Scan on public.bar2 bar_2
                     Output: bar_2.f1, bar_2.f2, bar_2.ctid, bar_2.*, bar_2.tableoid
                     Remote SQL: SELECT f1, f2, f3 FROM odbc_fdw_post.loct2
         ->  Hash
               Output: foo2.*, foo2.f1, foo2.ctid, foo2.tableoid
               ->  HashAggregate
                     Output: foo2.*, foo2.f1, foo2.ctid, foo2.tableoid
                     Group Key: foo2.f1
                     ->  Append
                           ->  Foreign Scan on public.foo2 foo2_1
                                 Output: foo2_1.*, foo2_1.f1, foo2_1.ctid, foo2_1.tableoid
                                 Remote SQL: SELECT f1, f2, f3 FROM odbc_fdw_post.loct1
                           ->  Seq Scan on public.foo2child foo2_2
                                 Output: foo2_2.*, foo2_2.f1, foo2_2.ctid, foo2_2.tableoid
(23 rows)

--Testcase 741:
select * from bar where f1 in (select f1 from foo2) for share;
 f1 | f2 
----+----
  2 | 22
  4 | 44
(2 rows)

--Testcase 742:
drop table foo2child;
-- Check UPDATE with inherited target and an inherited source table
--Testcase 743:
explain (verbose, costs off)
update bar set f2 = f2 + 100 where f1 in (select f1 from foo);
                                                       QUERY PLAN                                                       
------------------------------------------------------------------------------------------------------------------------
 Update on public.bar
   Update on public.bar bar_1
   Foreign Update on public.bar2 bar_2
     Remote SQL: UPDATE odbc_fdw_post.loct2 SET f2 = ? WHERE f3 = ?
   ->  Hash Semi Join
         Output: (bar.f2 + 100), foo.ctid, bar.tableoid, bar.ctid, (NULL::integer), (NULL::record), foo.*, foo.tableoid
         Hash Cond: (bar.f1 = foo.f1)
         ->  Append
               ->  Seq Scan on public.bar bar_1
                     Output: bar_1.f2, bar_1.f1, bar_1.tableoid, bar_1.ctid, NULL::integer, NULL::record
               ->  Foreign Scan on public.bar2 bar_2
                     Output: bar_2.f2, bar_2.f1, bar_2.tableoid, NULL::tid, bar_2.f3, bar_2.*
                     Remote SQL: SELECT f1, f2, f3 FROM odbc_fdw_post.loct2
         ->  Hash
               Output: foo.ctid, foo.f1, foo.*, foo.tableoid
               ->  Append
                     ->  Seq Scan on public.foo foo_1
                           Output: foo_1.ctid, foo_1.f1, foo_1.*, foo_1.tableoid
                     ->  Foreign Scan on public.foo2 foo_2
                           Output: foo_2.ctid, foo_2.f1, foo_2.*, foo_2.tableoid
                           Remote SQL: SELECT f1, f2, f3 FROM odbc_fdw_post.loct1
(21 rows)

--Testcase 744:
update bar set f2 = f2 + 100 where f1 in (select f1 from foo);
--Testcase 745:
select tableoid::regclass, * from bar order by 1,2;
 tableoid | f1 | f2  
----------+----+-----
 bar      |  1 | 111
 bar      |  2 | 122
 bar      |  6 |  66
 bar2     |  3 | 133
 bar2     |  4 | 144
 bar2     |  7 |  77
(6 rows)

-- Check UPDATE with inherited target and an appendrel subquery
--Testcase 746:
explain (verbose, costs off)
update bar set f2 = f2 + 100
from
  ( select f1 from foo union all select f1+3 from foo ) ss
where bar.f1 = ss.f1;
                                                  QUERY PLAN                                                   
---------------------------------------------------------------------------------------------------------------
 Update on public.bar
   Update on public.bar bar_1
   Foreign Update on public.bar2 bar_2
     Remote SQL: UPDATE odbc_fdw_post.loct2 SET f2 = ? WHERE f3 = ?
   ->  Hash Join
         Output: (bar.f2 + 100), (ROW(foo.f1)), bar.tableoid, bar.ctid, (NULL::integer), (NULL::record)
         Hash Cond: (foo.f1 = bar.f1)
         ->  Append
               ->  Seq Scan on public.foo
                     Output: ROW(foo.f1), foo.f1
               ->  Foreign Scan on public.foo2 foo_1
                     Output: ROW(foo_1.f1), foo_1.f1
                     Remote SQL: SELECT f1 FROM odbc_fdw_post.loct1
               ->  Seq Scan on public.foo foo_2
                     Output: ROW((foo_2.f1 + 3)), (foo_2.f1 + 3)
               ->  Foreign Scan on public.foo2 foo_3
                     Output: ROW((foo_3.f1 + 3)), (foo_3.f1 + 3)
                     Remote SQL: SELECT f1 FROM odbc_fdw_post.loct1
         ->  Hash
               Output: bar.f2, bar.f1, bar.tableoid, bar.ctid, (NULL::integer), (NULL::record)
               ->  Append
                     ->  Seq Scan on public.bar bar_1
                           Output: bar_1.f2, bar_1.f1, bar_1.tableoid, bar_1.ctid, NULL::integer, NULL::record
                     ->  Foreign Scan on public.bar2 bar_2
                           Output: bar_2.f2, bar_2.f1, bar_2.tableoid, NULL::tid, bar_2.f3, bar_2.*
                           Remote SQL: SELECT f1, f2, f3 FROM odbc_fdw_post.loct2
(26 rows)

--Testcase 747:
update bar set f2 = f2 + 100
from
  ( select f1 from foo union all select f1+3 from foo ) ss
where bar.f1 = ss.f1;
--Testcase 748:
select tableoid::regclass, * from bar order by 1,2;
 tableoid | f1 | f2  
----------+----+-----
 bar      |  1 | 211
 bar      |  2 | 222
 bar      |  6 | 166
 bar2     |  3 | 233
 bar2     |  4 | 244
 bar2     |  7 | 177
(6 rows)

-- Test forcing the remote server to produce sorted data for a merge join,
-- but the foreign table is an inheritance child.
-- truncate table loct1;
--Testcase 749:
delete from foo2;
truncate table only foo;
\set num_rows_foo 2000
--Testcase 750:
insert into foo2 select generate_series(0, :num_rows_foo, 2), generate_series(0, :num_rows_foo, 2), generate_series(0, :num_rows_foo, 2);
--Testcase 751:
insert into foo select generate_series(1, :num_rows_foo, 2), generate_series(1, :num_rows_foo, 2);
--Testcase 752:
SET enable_hashjoin to false;
--Testcase 753:
SET enable_nestloop to false;
--alter foreign table foo2 options (use_remote_estimate 'true'); -- does not support this option
--create index i_foo2_f1 on foo2(f1);
--Testcase 754:
create index i_foo_f1 on foo(f1);
analyze foo;
-- analyze foo2;
-- inner join; expressions in the clauses appear in the equivalence class list
--Testcase 755:
explain (verbose, costs off)
	select foo.f1, foo2.f1 from foo join foo2 on (foo.f1 = foo2.f1) order by foo.f2 offset 10 limit 10;
                                     QUERY PLAN                                     
------------------------------------------------------------------------------------
 Limit
   Output: foo.f1, foo2.f1, foo.f2
   ->  Sort
         Output: foo.f1, foo2.f1, foo.f2
         Sort Key: foo.f2
         ->  Merge Join
               Output: foo.f1, foo2.f1, foo.f2
               Merge Cond: (foo.f1 = foo2.f1)
               ->  Merge Append
                     Sort Key: foo.f1
                     ->  Index Scan using i_foo_f1 on public.foo foo_1
                           Output: foo_1.f1, foo_1.f2
                     ->  Sort
                           Output: foo_2.f1, foo_2.f2
                           Sort Key: foo_2.f1
                           ->  Foreign Scan on public.foo2 foo_2
                                 Output: foo_2.f1, foo_2.f2
                                 Remote SQL: SELECT f1, f2 FROM odbc_fdw_post.loct1
               ->  Sort
                     Output: foo2.f1
                     Sort Key: foo2.f1
                     ->  Foreign Scan on public.foo2
                           Output: foo2.f1
                           Remote SQL: SELECT f1 FROM odbc_fdw_post.loct1
(24 rows)

--Testcase 756:
select foo.f1, foo2.f1 from foo join foo2 on (foo.f1 = foo2.f1) order by foo.f2 offset 10 limit 10;
 f1 | f1 
----+----
 20 | 20
 22 | 22
 24 | 24
 26 | 26
 28 | 28
 30 | 30
 32 | 32
 34 | 34
 36 | 36
 38 | 38
(10 rows)

-- outer join; expressions in the clauses do not appear in equivalence class
-- list but no output change as compared to the previous query
--Testcase 757:
explain (verbose, costs off)
	select foo.f1, foo2.f1 from foo left join foo2 on (foo.f1 = foo2.f1) order by foo.f2 offset 10 limit 10;
                                     QUERY PLAN                                     
------------------------------------------------------------------------------------
 Limit
   Output: foo.f1, foo2.f1, foo.f2
   ->  Sort
         Output: foo.f1, foo2.f1, foo.f2
         Sort Key: foo.f2
         ->  Merge Left Join
               Output: foo.f1, foo2.f1, foo.f2
               Merge Cond: (foo.f1 = foo2.f1)
               ->  Merge Append
                     Sort Key: foo.f1
                     ->  Index Scan using i_foo_f1 on public.foo foo_1
                           Output: foo_1.f1, foo_1.f2
                     ->  Sort
                           Output: foo_2.f1, foo_2.f2
                           Sort Key: foo_2.f1
                           ->  Foreign Scan on public.foo2 foo_2
                                 Output: foo_2.f1, foo_2.f2
                                 Remote SQL: SELECT f1, f2 FROM odbc_fdw_post.loct1
               ->  Sort
                     Output: foo2.f1
                     Sort Key: foo2.f1
                     ->  Foreign Scan on public.foo2
                           Output: foo2.f1
                           Remote SQL: SELECT f1 FROM odbc_fdw_post.loct1
(24 rows)

--Testcase 758:
select foo.f1, foo2.f1 from foo left join foo2 on (foo.f1 = foo2.f1) order by foo.f2 offset 10 limit 10;
 f1 | f1 
----+----
 10 | 10
 11 |   
 12 | 12
 13 |   
 14 | 14
 15 |   
 16 | 16
 17 |   
 18 | 18
 19 |   
(10 rows)

--Testcase 759:
RESET enable_hashjoin;
--Testcase 760:
RESET enable_nestloop;
-- Test that WHERE CURRENT OF is not supported
-- begin;
-- declare c cursor for select * from bar where f1 = 7;
-- fetch from c;
-- update bar set f2 = null where current of c;
-- rollback;
--Testcase 761:
explain (verbose, costs off)
delete from foo where f1 < 5;
                                  QUERY PLAN                                   
-------------------------------------------------------------------------------
 Delete on public.foo
   Delete on public.foo foo_1
   Foreign Delete on public.foo2 foo_2
     Remote SQL: DELETE FROM odbc_fdw_post.loct1 WHERE f3 = ?
   ->  Append
         ->  Index Scan using i_foo_f1 on public.foo foo_1
               Output: foo_1.tableoid, foo_1.ctid, NULL::integer
               Index Cond: (foo_1.f1 < 5)
         ->  Foreign Scan on public.foo2 foo_2
               Output: foo_2.tableoid, NULL::tid, foo_2.f3
               Remote SQL: SELECT f3 FROM odbc_fdw_post.loct1 WHERE ((f1 < 5))
(11 rows)

--Testcase 762:
delete from foo where f1 < 5;
--Testcase 763:
explain (verbose, costs off)
update bar set f2 = f2 + 100;
                                          QUERY PLAN                                           
-----------------------------------------------------------------------------------------------
 Update on public.bar
   Update on public.bar bar_1
   Foreign Update on public.bar2 bar_2
     Remote SQL: UPDATE odbc_fdw_post.loct2 SET f2 = ? WHERE f3 = ?
   ->  Result
         Output: (bar.f2 + 100), bar.tableoid, bar.ctid, (NULL::integer), (NULL::record)
         ->  Append
               ->  Seq Scan on public.bar bar_1
                     Output: bar_1.f2, bar_1.tableoid, bar_1.ctid, NULL::integer, NULL::record
               ->  Foreign Scan on public.bar2 bar_2
                     Output: bar_2.f2, bar_2.tableoid, NULL::tid, bar_2.f3, bar_2.*
                     Remote SQL: SELECT f1, f2, f3 FROM odbc_fdw_post.loct2
(12 rows)

--Testcase 764:
update bar set f2 = f2 + 100;
-- Test that UPDATE/DELETE with inherited target works with row-level triggers
--Testcase 765:
CREATE TRIGGER trig_row_before
BEFORE UPDATE OR DELETE ON bar2
FOR EACH ROW EXECUTE PROCEDURE trigger_data(23,'skidoo');
--Testcase 766:
CREATE TRIGGER trig_row_after
AFTER UPDATE OR DELETE ON bar2
FOR EACH ROW EXECUTE PROCEDURE trigger_data(23,'skidoo');
--Testcase 767:
explain (verbose, costs off)
update bar set f2 = f2 + 100;
                                          QUERY PLAN                                           
-----------------------------------------------------------------------------------------------
 Update on public.bar
   Update on public.bar bar_1
   Foreign Update on public.bar2 bar_2
     Remote SQL: UPDATE odbc_fdw_post.loct2 SET f1 = ?, f2 = ?, f3 = ? WHERE f3 = ?
   ->  Result
         Output: (bar.f2 + 100), bar.tableoid, bar.ctid, (NULL::integer), (NULL::record)
         ->  Append
               ->  Seq Scan on public.bar bar_1
                     Output: bar_1.f2, bar_1.tableoid, bar_1.ctid, NULL::integer, NULL::record
               ->  Foreign Scan on public.bar2 bar_2
                     Output: bar_2.f2, bar_2.tableoid, NULL::tid, bar_2.f3, bar_2.*
                     Remote SQL: SELECT f1, f2, f3 FROM odbc_fdw_post.loct2
(12 rows)

--Testcase 768:
update bar set f2 = f2 + 100;
psql:sql/14.5/ported_postgres_fdw.sql:2740: NOTICE:  trig_row_before(23, skidoo) BEFORE ROW UPDATE ON bar2
psql:sql/14.5/ported_postgres_fdw.sql:2740: NOTICE:  OLD: (3,333,33),NEW: (3,433,33)
psql:sql/14.5/ported_postgres_fdw.sql:2740: NOTICE:  trig_row_before(23, skidoo) BEFORE ROW UPDATE ON bar2
psql:sql/14.5/ported_postgres_fdw.sql:2740: NOTICE:  OLD: (4,344,44),NEW: (4,444,44)
psql:sql/14.5/ported_postgres_fdw.sql:2740: NOTICE:  trig_row_before(23, skidoo) BEFORE ROW UPDATE ON bar2
psql:sql/14.5/ported_postgres_fdw.sql:2740: NOTICE:  OLD: (7,277,77),NEW: (7,377,77)
psql:sql/14.5/ported_postgres_fdw.sql:2740: NOTICE:  trig_row_after(23, skidoo) AFTER ROW UPDATE ON bar2
psql:sql/14.5/ported_postgres_fdw.sql:2740: NOTICE:  OLD: (3,333,33),NEW: (3,433,33)
psql:sql/14.5/ported_postgres_fdw.sql:2740: NOTICE:  trig_row_after(23, skidoo) AFTER ROW UPDATE ON bar2
psql:sql/14.5/ported_postgres_fdw.sql:2740: NOTICE:  OLD: (4,344,44),NEW: (4,444,44)
psql:sql/14.5/ported_postgres_fdw.sql:2740: NOTICE:  trig_row_after(23, skidoo) AFTER ROW UPDATE ON bar2
psql:sql/14.5/ported_postgres_fdw.sql:2740: NOTICE:  OLD: (7,277,77),NEW: (7,377,77)
--Testcase 769:
explain (verbose, costs off)
delete from bar where f2 < 400;
                                       QUERY PLAN                                        
-----------------------------------------------------------------------------------------
 Delete on public.bar
   Delete on public.bar bar_1
   Foreign Delete on public.bar2 bar_2
     Remote SQL: DELETE FROM odbc_fdw_post.loct2 WHERE f3 = ?
   ->  Append
         ->  Seq Scan on public.bar bar_1
               Output: bar_1.tableoid, bar_1.ctid, NULL::integer, NULL::record
               Filter: (bar_1.f2 < 400)
         ->  Foreign Scan on public.bar2 bar_2
               Output: bar_2.tableoid, NULL::tid, bar_2.f3, bar_2.*
               Remote SQL: SELECT f1, f2, f3 FROM odbc_fdw_post.loct2 WHERE ((f2 < 400))
(11 rows)

--Testcase 770:
delete from bar where f2 < 400;
psql:sql/14.5/ported_postgres_fdw.sql:2746: NOTICE:  trig_row_before(23, skidoo) BEFORE ROW DELETE ON bar2
psql:sql/14.5/ported_postgres_fdw.sql:2746: NOTICE:  OLD: (7,377,77)
psql:sql/14.5/ported_postgres_fdw.sql:2746: NOTICE:  trig_row_after(23, skidoo) AFTER ROW DELETE ON bar2
psql:sql/14.5/ported_postgres_fdw.sql:2746: NOTICE:  OLD: (7,377,77)
-- cleanup
--Testcase 771:
drop table foo cascade;
psql:sql/14.5/ported_postgres_fdw.sql:2750: NOTICE:  drop cascades to foreign table foo2
--Testcase 772:
drop table bar cascade;
psql:sql/14.5/ported_postgres_fdw.sql:2752: NOTICE:  drop cascades to foreign table bar2
-- drop table loct1;
-- drop table loct2;
-- Test pushing down UPDATE/DELETE joins to the remote server
--Testcase 773:
create table parent (a int, b text);
--Testcase 774:
create foreign table loct1_2 (a int, b text)
  server :DB_SERVERNAME options (schema :DB_SCHEMA_PORT_TEST, table 'loct1_2');
--Testcase 775:
create foreign table loct2_2 (a int, b text)
  server :DB_SERVERNAME options (schema :DB_SCHEMA_PORT_TEST, table 'loct2_2');
--Testcase 776:
create foreign table remt1 (a int OPTIONS (key 'true'), b text)
  server :DB_SERVERNAME options (schema :DB_SCHEMA_PORT_TEST, table 'loct1_2');
--Testcase 777:
create foreign table remt2 (a int, b text)
  server :DB_SERVERNAME options (schema :DB_SCHEMA_PORT_TEST, table 'loct2_2');
--Testcase 778:
alter foreign table remt1 inherit parent;
--Testcase 779:
insert into remt1 values (1, 'foo');
--Testcase 780:
insert into remt1 values (2, 'bar');
--Testcase 781:
insert into remt2 values (1, 'foo');
--Testcase 782:
insert into remt2 values (2, 'bar');
--analyze remt1;
--analyze remt2;
--Testcase 783:
explain (verbose, costs off)
update parent set b = parent.b || remt2.b from remt2 where parent.a = remt2.a;
                                                    QUERY PLAN                                                     
-------------------------------------------------------------------------------------------------------------------
 Update on public.parent
   Update on public.parent parent_1
   Foreign Update on public.remt1 parent_2
     Remote SQL: UPDATE odbc_fdw_post.loct1_2 SET b = ? WHERE a = ?
   ->  Nested Loop
         Output: (parent.b || remt2.b), remt2.*, parent.tableoid, parent.ctid, (NULL::integer), (NULL::record)
         Join Filter: (parent.a = remt2.a)
         ->  Append
               ->  Seq Scan on public.parent parent_1
                     Output: parent_1.b, parent_1.a, parent_1.tableoid, parent_1.ctid, NULL::integer, NULL::record
               ->  Foreign Scan on public.remt1 parent_2
                     Output: parent_2.b, parent_2.a, parent_2.tableoid, NULL::tid, parent_2.a, parent_2.*
                     Remote SQL: SELECT a, b FROM odbc_fdw_post.loct1_2
         ->  Materialize
               Output: remt2.b, remt2.*, remt2.a
               ->  Foreign Scan on public.remt2
                     Output: remt2.b, remt2.*, remt2.a
                     Remote SQL: SELECT a, b FROM odbc_fdw_post.loct2_2
(18 rows)

--Testcase 784:
update parent set b = parent.b || remt2.b from remt2 where parent.a = remt2.a;
--Testcase 785:
explain (verbose, costs off)
delete from parent using remt2 where parent.a = remt2.a;
                                       QUERY PLAN                                        
-----------------------------------------------------------------------------------------
 Delete on public.parent
   Delete on public.parent parent_1
   Foreign Delete on public.remt1 parent_2
     Remote SQL: DELETE FROM odbc_fdw_post.loct1_2 WHERE a = ?
   ->  Nested Loop
         Output: remt2.*, parent.tableoid, parent.ctid, (NULL::integer)
         Join Filter: (parent.a = remt2.a)
         ->  Append
               ->  Seq Scan on public.parent parent_1
                     Output: parent_1.a, parent_1.tableoid, parent_1.ctid, NULL::integer
               ->  Foreign Scan on public.remt1 parent_2
                     Output: parent_2.a, parent_2.tableoid, NULL::tid, parent_2.a
                     Remote SQL: SELECT a FROM odbc_fdw_post.loct1_2
         ->  Materialize
               Output: remt2.*, remt2.a
               ->  Foreign Scan on public.remt2
                     Output: remt2.*, remt2.a
                     Remote SQL: SELECT a, b FROM odbc_fdw_post.loct2_2
(18 rows)

--Testcase 786:
delete from parent using remt2 where parent.a = remt2.a;
-- cleanup
--Testcase 787:
drop foreign table remt1;
--Testcase 788:
drop foreign table remt2;
--Testcase 789:
drop table parent;
-- Does not support tuple routing/COPY
-- ===================================================================
-- test tuple routing for foreign-table partitions
-- ===================================================================
-- Test insert tuple routing
--Testcase 790:
create table itrtest (a int, b text, id int) partition by list (a);
--Testcase 791:
create foreign table loct1_3 (a int check (a in (1)), b text, id int OPTIONS (key 'true')) server :DB_SERVERNAME options (schema :DB_SCHEMA_PORT_TEST, table 'loct1_3');
--Testcase 792:
create foreign table remp1 (a int check (a in (1)), b text, id int OPTIONS (key 'true')) server :DB_SERVERNAME options (schema :DB_SCHEMA_PORT_TEST, table 'loct1_3');
--Testcase 793:
create foreign table loct2_3 (b text, a int check (a in (2))) server :DB_SERVERNAME options (schema :DB_SCHEMA_PORT_TEST, table 'loct2_3');
--Testcase 794:
create foreign table remp2 (b text, a int check (a in (2)), id int OPTIONS (key 'true')) server :DB_SERVERNAME options (schema :DB_SCHEMA_PORT_TEST, table 'loct2_3');
--Testcase 795:
alter table itrtest attach partition remp1 for values in (1);
--Testcase 796:
alter table itrtest attach partition remp2 for values in (2);
--Testcase 797:
insert into itrtest(a, b) values (1, 'foo');
psql:sql/14.5/ported_postgres_fdw.sql:2827: ERROR:  COPY and foreign partition routing not supported in odbc_fdw
--Testcase 798:
insert into itrtest values (1, 'bar');
psql:sql/14.5/ported_postgres_fdw.sql:2829: ERROR:  COPY and foreign partition routing not supported in odbc_fdw
--Testcase 799:
insert into itrtest values (2, 'baz');
psql:sql/14.5/ported_postgres_fdw.sql:2831: ERROR:  COPY and foreign partition routing not supported in odbc_fdw
--Testcase 800:
insert into itrtest values (2, 'qux');
psql:sql/14.5/ported_postgres_fdw.sql:2833: ERROR:  COPY and foreign partition routing not supported in odbc_fdw
--Testcase 801:
insert into itrtest values (1, 'test1'), (2, 'test2');
psql:sql/14.5/ported_postgres_fdw.sql:2835: ERROR:  COPY and foreign partition routing not supported in odbc_fdw
--Testcase 802:
select tableoid::regclass, a, b FROM itrtest;
 tableoid | a | b 
----------+---+---
(0 rows)

--Testcase 803:
select tableoid::regclass, a, b FROM remp1;
 tableoid | a | b 
----------+---+---
(0 rows)

--Testcase 804:
select tableoid::regclass, a, b FROM remp2;
 tableoid | a | b 
----------+---+---
(0 rows)

--Testcase 805:
delete from itrtest;
--Testcase 806:
create unique index loct1_idx on loct1_3 (a);
psql:sql/14.5/ported_postgres_fdw.sql:2848: ERROR:  cannot create index on foreign table "loct1_3"
-- DO NOTHING without an inference specification is supported
--Testcase 807:
insert into itrtest values (1, 'foo') on conflict do nothing;
psql:sql/14.5/ported_postgres_fdw.sql:2852: ERROR:  COPY and foreign partition routing not supported in odbc_fdw
--Testcase 808:
insert into itrtest values (1, 'foo') on conflict do nothing;
psql:sql/14.5/ported_postgres_fdw.sql:2854: ERROR:  COPY and foreign partition routing not supported in odbc_fdw
-- But other cases are not supported
--Testcase 809:
insert into itrtest values (1, 'bar') on conflict (a) do nothing;
psql:sql/14.5/ported_postgres_fdw.sql:2858: ERROR:  there is no unique or exclusion constraint matching the ON CONFLICT specification
--Testcase 810:
insert into itrtest values (1, 'bar') on conflict (a) do update set b = excluded.b;
psql:sql/14.5/ported_postgres_fdw.sql:2860: ERROR:  there is no unique or exclusion constraint matching the ON CONFLICT specification
--Testcase 811:
select tableoid::regclass, * FROM itrtest;
 tableoid | a | b | id 
----------+---+---+----
(0 rows)

--Testcase 812:
delete from itrtest;
--Testcase 813:
drop index loct1_idx;
psql:sql/14.5/ported_postgres_fdw.sql:2869: ERROR:  index "loct1_idx" does not exist
-- -- Test that remote triggers work with insert tuple routing
--Testcase 814:
create function br_insert_trigfunc() returns trigger as $$
begin
	new.b := new.b || ' triggered !';
	return new;
end
$$ language plpgsql;
--Testcase 815:
create trigger loct1_br_insert_trigger before insert on loct1_3
	for each row execute procedure br_insert_trigfunc();
--Testcase 816:
create trigger loct2_br_insert_trigger before insert on loct2_3
	for each row execute procedure br_insert_trigfunc();
-- The new values are concatenated with ' triggered !'
--Testcase 817:
insert into itrtest values (1, 'foo');
psql:sql/14.5/ported_postgres_fdw.sql:2888: ERROR:  COPY and foreign partition routing not supported in odbc_fdw
--Testcase 818:
insert into itrtest values (2, 'qux');
psql:sql/14.5/ported_postgres_fdw.sql:2890: ERROR:  COPY and foreign partition routing not supported in odbc_fdw
--Testcase 819:
insert into itrtest values (1, 'test1'), (2, 'test2');
psql:sql/14.5/ported_postgres_fdw.sql:2892: ERROR:  COPY and foreign partition routing not supported in odbc_fdw
--Testcase 820:
with result as (insert into itrtest values (1, 'test1'), (2, 'test2')) select * from result;
psql:sql/14.5/ported_postgres_fdw.sql:2894: ERROR:  WITH query "result" does not have a RETURNING clause
LINE 1: ...est values (1, 'test1'), (2, 'test2')) select * from result;
                                                                ^
--Testcase 821:
drop trigger loct1_br_insert_trigger on loct1_3;
--Testcase 822:
drop trigger loct2_br_insert_trigger on loct2_3;
--Testcase 823:
drop table itrtest;
-- drop table loct1;
-- drop table loct2;
-- Test update tuple routing
--Testcase 824:
create table utrtest (a int, b text, id int) partition by list (a);
--Testcase 825:
create foreign table loct_2 (a int check (a in (1)), b text, id int OPTIONS (key 'true')) server :DB_SERVERNAME options (schema :DB_SCHEMA_PORT_TEST, table 'loct_2');
--Testcase 826:
create foreign table remp (a int check (a in (1)), b text, id int OPTIONS (key 'true')) server :DB_SERVERNAME options (schema :DB_SCHEMA_PORT_TEST, table 'loct_2');
--Testcase 827:
create table locp (a int check (a in (2)), b text, id int);
--Testcase 828:
alter table utrtest attach partition remp for values in (1);
--Testcase 829:
alter table utrtest attach partition locp for values in (2);
--Testcase 830:
insert into utrtest values (1, 'foo');
psql:sql/14.5/ported_postgres_fdw.sql:2921: ERROR:  COPY and foreign partition routing not supported in odbc_fdw
--Testcase 831:
insert into utrtest values (2, 'qux');
--Testcase 832:
select tableoid::regclass, * FROM utrtest;
 tableoid | a |  b  | id 
----------+---+-----+----
 locp     | 2 | qux |   
(1 row)

--Testcase 833:
select tableoid::regclass, * FROM remp;
 tableoid | a | b | id 
----------+---+---+----
(0 rows)

--Testcase 834:
select tableoid::regclass, * FROM locp;
 tableoid | a |  b  | id 
----------+---+-----+----
 locp     | 2 | qux |   
(1 row)

-- It's not allowed to move a row from a partition that is foreign to another
--Testcase 835:
update utrtest set a = 2 where b = 'foo';
-- But the reverse is allowed
--Testcase 836:
update utrtest set a = 1 where b = 'qux';
psql:sql/14.5/ported_postgres_fdw.sql:2938: ERROR:  COPY and foreign partition routing not supported in odbc_fdw
--Testcase 837:
select tableoid::regclass, * FROM utrtest;
 tableoid | a |  b  | id 
----------+---+-----+----
 locp     | 2 | qux |   
(1 row)

--Testcase 838:
select tableoid::regclass, * FROM remp;
 tableoid | a | b | id 
----------+---+---+----
(0 rows)

--Testcase 839:
select tableoid::regclass, * FROM locp;
 tableoid | a |  b  | id 
----------+---+-----+----
 locp     | 2 | qux |   
(1 row)

-- The executor should not let unexercised FDWs shut down
--Testcase 840:
update utrtest set a = 1 where b = 'foo';
-- Test that remote triggers work with update tuple routing
--Testcase 841:
create trigger loct_br_insert_trigger before insert on loct_2
	for each row execute procedure br_insert_trigfunc();
--Testcase 842:
delete from utrtest;
--Testcase 843:
insert into utrtest values (2, 'qux');
-- Check case where the foreign partition is a subplan target rel
--Testcase 844:
explain (verbose, costs off)
update utrtest set a = 1 where a = 1 or a = 2;
                                            QUERY PLAN                                            
--------------------------------------------------------------------------------------------------
 Update on public.utrtest
   Foreign Update on public.remp utrtest_1
     Remote SQL: UPDATE odbc_fdw_post.loct_2 SET a = ? WHERE id = ?
   Update on public.locp utrtest_2
   ->  Append
         ->  Foreign Scan on public.remp utrtest_1
               Output: 1, utrtest_1.tableoid, utrtest_1.id, utrtest_1.*, NULL::tid
               Remote SQL: SELECT a, b, id FROM odbc_fdw_post.loct_2 WHERE (((a = 1) OR (a = 2)))
         ->  Seq Scan on public.locp utrtest_2
               Output: 1, utrtest_2.tableoid, NULL::integer, NULL::record, utrtest_2.ctid
               Filter: ((utrtest_2.a = 1) OR (utrtest_2.a = 2))
(11 rows)

-- The new values are concatenated with ' triggered !'
--Testcase 845:
update utrtest set a = 1 where a = 1 or a = 2;
psql:sql/14.5/ported_postgres_fdw.sql:2967: ERROR:  COPY and foreign partition routing not supported in odbc_fdw
--Testcase 846:
delete from utrtest;
--Testcase 847:
insert into utrtest values (2, 'qux');
-- Check case where the foreign partition isn't a subplan target rel
--Testcase 848:
explain (verbose, costs off)
update utrtest set a = 1 where a = 2;
                      QUERY PLAN                       
-------------------------------------------------------
 Update on public.utrtest
   Update on public.locp utrtest_1
   ->  Seq Scan on public.locp utrtest_1
         Output: 1, utrtest_1.tableoid, utrtest_1.ctid
         Filter: (utrtest_1.a = 2)
(5 rows)

-- The new values are concatenated with ' triggered !'
--Testcase 849:
update utrtest set a = 1 where a = 2;
psql:sql/14.5/ported_postgres_fdw.sql:2980: ERROR:  COPY and foreign partition routing not supported in odbc_fdw
--Testcase 850:
drop trigger loct_br_insert_trigger on loct_2;
-- We can move rows to a foreign partition that has been updated already,
-- but can't move rows to a foreign partition that hasn't been updated yet
--Testcase 851:
delete from utrtest;
--Testcase 852:
insert into utrtest values (1, 'foo');
psql:sql/14.5/ported_postgres_fdw.sql:2991: ERROR:  COPY and foreign partition routing not supported in odbc_fdw
--Testcase 853:
insert into utrtest values (2, 'qux');
-- Test the former case:
-- with a direct modification plan
--Testcase 854:
explain (verbose, costs off)
update utrtest set a = 1;
                                        QUERY PLAN                                        
------------------------------------------------------------------------------------------
 Update on public.utrtest
   Foreign Update on public.remp utrtest_1
     Remote SQL: UPDATE odbc_fdw_post.loct_2 SET a = ? WHERE id = ?
   Update on public.locp utrtest_2
   ->  Append
         ->  Foreign Scan on public.remp utrtest_1
               Output: 1, utrtest_1.tableoid, utrtest_1.id, utrtest_1.*, NULL::tid
               Remote SQL: SELECT a, b, id FROM odbc_fdw_post.loct_2
         ->  Seq Scan on public.locp utrtest_2
               Output: 1, utrtest_2.tableoid, NULL::integer, NULL::record, utrtest_2.ctid
(10 rows)

--Testcase 855:
update utrtest set a = 1;
psql:sql/14.5/ported_postgres_fdw.sql:3001: ERROR:  COPY and foreign partition routing not supported in odbc_fdw
--Testcase 856:
delete from utrtest;
--Testcase 857:
insert into utrtest values (1, 'foo');
psql:sql/14.5/ported_postgres_fdw.sql:3006: ERROR:  COPY and foreign partition routing not supported in odbc_fdw
--Testcase 858:
insert into utrtest values (2, 'qux');
-- with a non-direct modification plan
--Testcase 859:
explain (verbose, costs off)
update utrtest set a = 1 from (values (1), (2)) s(x) where a = s.x;
                                                QUERY PLAN                                                
----------------------------------------------------------------------------------------------------------
 Update on public.utrtest
   Foreign Update on public.remp utrtest_1
     Remote SQL: UPDATE odbc_fdw_post.loct_2 SET a = ? WHERE id = ?
   Update on public.locp utrtest_2
   ->  Hash Join
         Output: 1, "*VALUES*".*, utrtest.tableoid, utrtest.id, utrtest.*, (NULL::tid)
         Hash Cond: (utrtest.a = "*VALUES*".column1)
         ->  Append
               ->  Foreign Scan on public.remp utrtest_1
                     Output: utrtest_1.a, utrtest_1.tableoid, utrtest_1.id, utrtest_1.*, NULL::tid
                     Remote SQL: SELECT a, b, id FROM odbc_fdw_post.loct_2
               ->  Seq Scan on public.locp utrtest_2
                     Output: utrtest_2.a, utrtest_2.tableoid, NULL::integer, NULL::record, utrtest_2.ctid
         ->  Hash
               Output: "*VALUES*".*, "*VALUES*".column1
               ->  Values Scan on "*VALUES*"
                     Output: "*VALUES*".*, "*VALUES*".column1
(17 rows)

--Testcase 860:
update utrtest set a = 1 from (values (1), (2)) s(x) where a = s.x;
psql:sql/14.5/ported_postgres_fdw.sql:3015: ERROR:  COPY and foreign partition routing not supported in odbc_fdw
-- Change the definition of utrtest so that the foreign partition get updated
-- after the local partition
--Testcase 861:
delete from utrtest;
--Testcase 862:
alter table utrtest detach partition remp;
--Testcase 863:
drop foreign table remp;
--Testcase 864:
alter foreign table loct_2 drop constraint loct_2_a_check;
--Testcase 865:
alter foreign table loct_2 add check (a in (3));
--Testcase 866:
create foreign table remp (a int check (a in (3)), b text, id int OPTIONS (key 'true')) server :DB_SERVERNAME options (schema :DB_SCHEMA_PORT_TEST, table 'loct_2');
--Testcase 867:
alter table utrtest attach partition remp for values in (3);
--Testcase 868:
insert into utrtest values (2, 'qux');
--Testcase 869:
insert into utrtest values (3, 'xyzzy');
psql:sql/14.5/ported_postgres_fdw.sql:3036: ERROR:  COPY and foreign partition routing not supported in odbc_fdw
-- Test the latter case:
-- with a direct modification plan
--Testcase 870:
explain (verbose, costs off)
update utrtest set a = 3;
                                        QUERY PLAN                                        
------------------------------------------------------------------------------------------
 Update on public.utrtest
   Update on public.locp utrtest_1
   Foreign Update on public.remp utrtest_2
     Remote SQL: UPDATE odbc_fdw_post.loct_2 SET a = ? WHERE id = ?
   ->  Append
         ->  Seq Scan on public.locp utrtest_1
               Output: 3, utrtest_1.tableoid, utrtest_1.ctid, NULL::integer, NULL::record
         ->  Foreign Scan on public.remp utrtest_2
               Output: 3, utrtest_2.tableoid, NULL::tid, utrtest_2.id, utrtest_2.*
               Remote SQL: SELECT a, b, id FROM odbc_fdw_post.loct_2
(10 rows)

--Testcase 871:
update utrtest set a = 3; -- ERROR
psql:sql/14.5/ported_postgres_fdw.sql:3044: ERROR:  COPY and foreign partition routing not supported in odbc_fdw
-- with a non-direct modification plan
--Testcase 872:
explain (verbose, costs off)
update utrtest set a = 3 from (values (2), (3)) s(x) where a = s.x;
                                                QUERY PLAN                                                
----------------------------------------------------------------------------------------------------------
 Update on public.utrtest
   Update on public.locp utrtest_1
   Foreign Update on public.remp utrtest_2
     Remote SQL: UPDATE odbc_fdw_post.loct_2 SET a = ? WHERE id = ?
   ->  Hash Join
         Output: 3, "*VALUES*".*, utrtest.tableoid, utrtest.ctid, (NULL::integer), (NULL::record)
         Hash Cond: (utrtest.a = "*VALUES*".column1)
         ->  Append
               ->  Seq Scan on public.locp utrtest_1
                     Output: utrtest_1.a, utrtest_1.tableoid, utrtest_1.ctid, NULL::integer, NULL::record
               ->  Foreign Scan on public.remp utrtest_2
                     Output: utrtest_2.a, utrtest_2.tableoid, NULL::tid, utrtest_2.id, utrtest_2.*
                     Remote SQL: SELECT a, b, id FROM odbc_fdw_post.loct_2
         ->  Hash
               Output: "*VALUES*".*, "*VALUES*".column1
               ->  Values Scan on "*VALUES*"
                     Output: "*VALUES*".*, "*VALUES*".column1
(17 rows)

--Testcase 873:
update utrtest set a = 3 from (values (2), (3)) s(x) where a = s.x; -- ERROR
psql:sql/14.5/ported_postgres_fdw.sql:3051: ERROR:  COPY and foreign partition routing not supported in odbc_fdw
--Testcase 874:
drop table utrtest;
-- drop table loct;
-- Test copy tuple routing
--Testcase 875:
create table ctrtest (a int, b text, id int) partition by list (a);
--Testcase 876:
create foreign table loct1_4 (a int check (a in (1)), b text, id int OPTIONS (key 'true')) server :DB_SERVERNAME options (schema :DB_SCHEMA_PORT_TEST, table 'loct1_4');
--Testcase 877:
create foreign table remp1 (a int check (a in (1)), b text, id int OPTIONS (key 'true')) server :DB_SERVERNAME options (schema :DB_SCHEMA_PORT_TEST, table 'loct1_4');
--Testcase 878:
create foreign table loct2_4 (b text, a int check (a in (2)), id int OPTIONS (key 'true')) server :DB_SERVERNAME options (schema :DB_SCHEMA_PORT_TEST, table 'loct2_4');
--Testcase 879:
create foreign table remp2 (b text, a int check (a in (2)), id int OPTIONS (key 'true')) server :DB_SERVERNAME options (schema :DB_SCHEMA_PORT_TEST, table 'loct2_4');
--Testcase 880:
alter table ctrtest attach partition remp1 for values in (1);
--Testcase 881:
alter table ctrtest attach partition remp2 for values in (2);
copy ctrtest from stdin;
psql:sql/14.5/ported_postgres_fdw.sql:3076: ERROR:  COPY and foreign partition routing not supported in odbc_fdw
CONTEXT:  COPY ctrtest, line 1: "1	foo	1"
--Testcase 882:
select tableoid::regclass, * FROM ctrtest;
 tableoid | a | b | id 
----------+---+---+----
(0 rows)

--Testcase 883:
select tableoid::regclass, * FROM remp1;
 tableoid | a | b | id 
----------+---+---+----
(0 rows)

--Testcase 884:
select tableoid::regclass, * FROM remp2;
 tableoid | b | a | id 
----------+---+---+----
(0 rows)

-- Copying into foreign partitions directly should work as well
copy remp1 from stdin;
psql:sql/14.5/ported_postgres_fdw.sql:3088: ERROR:  COPY and foreign partition routing not supported in odbc_fdw
--Testcase 885:
select tableoid::regclass, * FROM remp1;
 tableoid | a | b | id 
----------+---+---+----
(0 rows)

--Testcase 886:
drop table ctrtest;
-- drop table loct1;
-- drop table loct2;
-- ===================================================================
-- test COPY FROM
-- ===================================================================
--Testcase 887:
create foreign table loc2 (f1 int, f2 text, id int OPTIONS (key 'true')) server :DB_SERVERNAME options(schema :DB_SCHEMA_PORT_TEST, table 'loc2');
--Testcase 888:
create foreign table rem2 (f1 int, f2 text, id int OPTIONS (key 'true')) server :DB_SERVERNAME options(schema :DB_SCHEMA_PORT_TEST, table 'loc2');
-- Test basic functionality
copy rem2 from stdin;
psql:sql/14.5/ported_postgres_fdw.sql:3111: ERROR:  COPY and foreign partition routing not supported in odbc_fdw
--Testcase 889:
select * from rem2;
 f1 | f2 | id 
----+----+----
(0 rows)

--Testcase 890:
delete from rem2;
-- Test check constraints
--Testcase 891:
alter foreign table loc2 add constraint loc2_f1positive check (f1 >= 0);
--Testcase 892:
alter foreign table rem2 add constraint rem2_f1positive check (f1 >= 0);
-- check constraint is enforced on the remote side, not locally
copy rem2 from stdin;
psql:sql/14.5/ported_postgres_fdw.sql:3128: ERROR:  COPY and foreign partition routing not supported in odbc_fdw
copy rem2 from stdin; -- ERROR
psql:sql/14.5/ported_postgres_fdw.sql:3131: ERROR:  COPY and foreign partition routing not supported in odbc_fdw
--Testcase 893:
select * from rem2;
 f1 | f2 | id 
----+----+----
(0 rows)

--Testcase 894:
alter foreign table rem2 drop constraint rem2_f1positive;
--Testcase 895:
alter foreign table loc2 drop constraint loc2_f1positive;
--Testcase 896:
delete from rem2;
-- Test local triggers
--Testcase 897:
create trigger trig_stmt_before before insert on rem2
	for each statement execute procedure trigger_func();
--Testcase 898:
create trigger trig_stmt_after after insert on rem2
	for each statement execute procedure trigger_func();
--Testcase 899:
create trigger trig_row_before before insert on rem2
	for each row execute procedure trigger_data(23,'skidoo');
--Testcase 900:
create trigger trig_row_after after insert on rem2
	for each row execute procedure trigger_data(23,'skidoo');
copy rem2 from stdin;
psql:sql/14.5/ported_postgres_fdw.sql:3160: ERROR:  COPY and foreign partition routing not supported in odbc_fdw
--Testcase 901:
select * from rem2;
 f1 | f2 | id 
----+----+----
(0 rows)

--Testcase 902:
drop trigger trig_row_before on rem2;
--Testcase 903:
drop trigger trig_row_after on rem2;
--Testcase 904:
drop trigger trig_stmt_before on rem2;
--Testcase 905:
drop trigger trig_stmt_after on rem2;
--Testcase 906:
delete from rem2;
--Testcase 907:
create trigger trig_row_before_insert before insert on rem2
	for each row execute procedure trig_row_before_insupdate();
-- The new values are concatenated with ' triggered !'
copy rem2 from stdin;
psql:sql/14.5/ported_postgres_fdw.sql:3184: ERROR:  COPY and foreign partition routing not supported in odbc_fdw
--Testcase 908:
select * from rem2;
 f1 | f2 | id 
----+----+----
(0 rows)

--Testcase 909:
drop trigger trig_row_before_insert on rem2;
--Testcase 910:
delete from rem2;
--Testcase 911:
create trigger trig_null before insert on rem2
	for each row execute procedure trig_null();
-- Nothing happens
copy rem2 from stdin;
psql:sql/14.5/ported_postgres_fdw.sql:3202: ERROR:  COPY and foreign partition routing not supported in odbc_fdw
--Testcase 912:
select * from rem2;
 f1 | f2 | id 
----+----+----
(0 rows)

--Testcase 913:
drop trigger trig_null on rem2;
--Testcase 914:
delete from rem2;
-- Test remote triggers
--Testcase 915:
create trigger trig_row_before_insert before insert on loc2
	for each row execute procedure trig_row_before_insupdate();
-- The new values are concatenated with ' triggered !'
copy rem2 from stdin;
psql:sql/14.5/ported_postgres_fdw.sql:3221: ERROR:  COPY and foreign partition routing not supported in odbc_fdw
--Testcase 916:
select * from rem2;
 f1 | f2 | id 
----+----+----
(0 rows)

--Testcase 917:
drop trigger trig_row_before_insert on loc2;
--Testcase 918:
delete from rem2;
--Testcase 919:
create trigger trig_null before insert on loc2
	for each row execute procedure trig_null();
-- Nothing happens
copy rem2 from stdin;
psql:sql/14.5/ported_postgres_fdw.sql:3239: ERROR:  COPY and foreign partition routing not supported in odbc_fdw
--Testcase 920:
select * from rem2;
 f1 | f2 | id 
----+----+----
(0 rows)

--Testcase 921:
drop trigger trig_null on loc2;
--Testcase 922:
delete from rem2;
-- Test a combination of local and remote triggers
--Testcase 923:
create trigger rem2_trig_row_before before insert on rem2
	for each row execute procedure trigger_data(23,'skidoo');
--Testcase 924:
create trigger rem2_trig_row_after after insert on rem2
	for each row execute procedure trigger_data(23,'skidoo');
--Testcase 925:
create trigger loc2_trig_row_before_insert before insert on loc2
	for each row execute procedure trig_row_before_insupdate();
copy rem2 from stdin;
psql:sql/14.5/ported_postgres_fdw.sql:3263: ERROR:  COPY and foreign partition routing not supported in odbc_fdw
--Testcase 926:
select * from rem2;
 f1 | f2 | id 
----+----+----
(0 rows)

--Testcase 927:
drop trigger rem2_trig_row_before on rem2;
--Testcase 928:
drop trigger rem2_trig_row_after on rem2;
--Testcase 929:
drop trigger loc2_trig_row_before_insert on loc2;
--Testcase 930:
delete from rem2;
-- test COPY FROM with foreign table created in the same transaction
-- begin;
--Testcase 931:
create foreign table loc3 (f1 int, f2 text, id int OPTIONS (key 'true'))
	server :DB_SERVERNAME options(schema :DB_SCHEMA_PORT_TEST, table 'loc3');
--Testcase 932:
create foreign table rem3 (f1 int, f2 text, id int OPTIONS (key 'true'))
	server :DB_SERVERNAME options(schema :DB_SCHEMA_PORT_TEST, table 'loc3');
copy rem3 from stdin;
psql:sql/14.5/ported_postgres_fdw.sql:3288: ERROR:  COPY and foreign partition routing not supported in odbc_fdw
-- commit;
--Testcase 933:
select * from rem3;
 f1 | f2 | id 
----+----+----
(0 rows)

--Testcase 934:
drop foreign table rem3;
-- drop table loc3;
-- ===================================================================
-- test for TRUNCATE
-- odbc_fdw does not support truncate command
-- ===================================================================
-- CREATE TABLE tru_rtable0 (id int primary key);
-- CREATE FOREIGN TABLE tru_ftable (id int)
--        SERVER loopback OPTIONS (table_name 'tru_rtable0');
-- INSERT INTO tru_rtable0 (SELECT x FROM generate_series(1,10) x);
-- CREATE TABLE tru_ptable (id int) PARTITION BY HASH(id);
-- CREATE TABLE tru_ptable__p0 PARTITION OF tru_ptable
--                             FOR VALUES WITH (MODULUS 2, REMAINDER 0);
-- CREATE TABLE tru_rtable1 (id int primary key);
-- CREATE FOREIGN TABLE tru_ftable__p1 PARTITION OF tru_ptable
--                                     FOR VALUES WITH (MODULUS 2, REMAINDER 1)
--        SERVER loopback OPTIONS (table_name 'tru_rtable1');
-- INSERT INTO tru_ptable (SELECT x FROM generate_series(11,20) x);
-- CREATE TABLE tru_pk_table(id int primary key);
-- CREATE TABLE tru_fk_table(fkey int references tru_pk_table(id));
-- INSERT INTO tru_pk_table (SELECT x FROM generate_series(1,10) x);
-- INSERT INTO tru_fk_table (SELECT x % 10 + 1 FROM generate_series(5,25) x);
-- CREATE FOREIGN TABLE tru_pk_ftable (id int)
--        SERVER loopback OPTIONS (table_name 'tru_pk_table');
-- CREATE TABLE tru_rtable_parent (id int);
-- CREATE TABLE tru_rtable_child (id int);
-- CREATE FOREIGN TABLE tru_ftable_parent (id int)
--        SERVER loopback OPTIONS (table_name 'tru_rtable_parent');
-- CREATE FOREIGN TABLE tru_ftable_child () INHERITS (tru_ftable_parent)
--        SERVER loopback OPTIONS (table_name 'tru_rtable_child');
-- INSERT INTO tru_rtable_parent (SELECT x FROM generate_series(1,8) x);
-- INSERT INTO tru_rtable_child  (SELECT x FROM generate_series(10, 18) x);
-- -- normal truncate
-- SELECT sum(id) FROM tru_ftable;        -- 55
-- TRUNCATE tru_ftable;
-- SELECT count(*) FROM tru_rtable0;		-- 0
-- SELECT count(*) FROM tru_ftable;		-- 0
-- -- 'truncatable' option
-- ALTER SERVER loopback OPTIONS (ADD truncatable 'false');
-- TRUNCATE tru_ftable;			-- error
-- ALTER FOREIGN TABLE tru_ftable OPTIONS (ADD truncatable 'true');
-- TRUNCATE tru_ftable;			-- accepted
-- ALTER FOREIGN TABLE tru_ftable OPTIONS (SET truncatable 'false');
-- TRUNCATE tru_ftable;			-- error
-- ALTER SERVER loopback OPTIONS (DROP truncatable);
-- ALTER FOREIGN TABLE tru_ftable OPTIONS (SET truncatable 'false');
-- TRUNCATE tru_ftable;			-- error
-- ALTER FOREIGN TABLE tru_ftable OPTIONS (SET truncatable 'true');
-- TRUNCATE tru_ftable;			-- accepted
-- -- partitioned table with both local and foreign tables as partitions
-- SELECT sum(id) FROM tru_ptable;        -- 155
-- TRUNCATE tru_ptable;
-- SELECT count(*) FROM tru_ptable;		-- 0
-- SELECT count(*) FROM tru_ptable__p0;	-- 0
-- SELECT count(*) FROM tru_ftable__p1;	-- 0
-- SELECT count(*) FROM tru_rtable1;		-- 0
-- -- 'CASCADE' option
-- SELECT sum(id) FROM tru_pk_ftable;      -- 55
-- TRUNCATE tru_pk_ftable;	-- failed by FK reference
-- TRUNCATE tru_pk_ftable CASCADE;
-- SELECT count(*) FROM tru_pk_ftable;    -- 0
-- SELECT count(*) FROM tru_fk_table;		-- also truncated,0
-- -- truncate two tables at a command
-- INSERT INTO tru_ftable (SELECT x FROM generate_series(1,8) x);
-- INSERT INTO tru_pk_ftable (SELECT x FROM generate_series(3,10) x);
-- SELECT count(*) from tru_ftable; -- 8
-- SELECT count(*) from tru_pk_ftable; -- 8
-- TRUNCATE tru_ftable, tru_pk_ftable CASCADE;
-- SELECT count(*) from tru_ftable; -- 0
-- SELECT count(*) from tru_pk_ftable; -- 0
-- -- truncate with ONLY clause
-- -- Since ONLY is specified, the table tru_ftable_child that inherits
-- -- tru_ftable_parent locally is not truncated.
-- TRUNCATE ONLY tru_ftable_parent;
-- SELECT sum(id) FROM tru_ftable_parent;  -- 126
-- TRUNCATE tru_ftable_parent;
-- SELECT count(*) FROM tru_ftable_parent; -- 0
-- -- in case when remote table has inherited children
-- CREATE TABLE tru_rtable0_child () INHERITS (tru_rtable0);
-- INSERT INTO tru_rtable0 (SELECT x FROM generate_series(5,9) x);
-- INSERT INTO tru_rtable0_child (SELECT x FROM generate_series(10,14) x);
-- SELECT sum(id) FROM tru_ftable;   -- 95
-- -- Both parent and child tables in the foreign server are truncated
-- -- even though ONLY is specified because ONLY has no effect
-- -- when truncating a foreign table.
-- TRUNCATE ONLY tru_ftable;
-- SELECT count(*) FROM tru_ftable;   -- 0
-- INSERT INTO tru_rtable0 (SELECT x FROM generate_series(21,25) x);
-- INSERT INTO tru_rtable0_child (SELECT x FROM generate_series(26,30) x);
-- SELECT sum(id) FROM tru_ftable;		-- 255
-- TRUNCATE tru_ftable;			-- truncate both of parent and child
-- SELECT count(*) FROM tru_ftable;    -- 0
-- -- cleanup
-- DROP FOREIGN TABLE tru_ftable_parent, tru_ftable_child, tru_pk_ftable,tru_ftable__p1,tru_ftable;
-- DROP TABLE tru_rtable0, tru_rtable1, tru_ptable, tru_ptable__p0, tru_pk_table, tru_fk_table,
-- tru_rtable_parent,tru_rtable_child, tru_rtable0_child;
-- ===================================================================
-- test IMPORT FOREIGN SCHEMA
-- ===================================================================
--Testcase 935:
CREATE SERVER mysql_svr FOREIGN DATA WRAPPER :DB_EXTENSIONNAME
  OPTIONS (odbc_DRIVER :DB_DRIVERNAME,
          odbc_SERVER :DB_SERVER,
          odbc_PORT :DB_PORT,
          odbc_DATABASE 'import_source');
--Testcase 936:
CREATE USER MAPPING FOR public SERVER mysql_svr OPTIONS(odbc_UID :DB_USER, odbc_PWD :DB_PASS);
--Testcase 937:
CREATE SCHEMA import_dest1;
IMPORT FOREIGN SCHEMA import_source FROM SERVER mysql_svr INTO import_dest1; --fail for postgres
IMPORT FOREIGN SCHEMA import_source FROM SERVER :DB_SERVERNAME INTO import_dest1; --fail for mysql
--Testcase 938:
\det+ import_dest1.*
                                  List of foreign tables
    Schema    | Table |  Server   |               FDW options               | Description 
--------------+-------+-----------+-----------------------------------------+-------------
 import_dest1 | t1    | mysql_svr | ("table" 't1', schema 'import_source')  | 
 import_dest1 | t2    | mysql_svr | ("table" 't2', schema 'import_source')  | 
 import_dest1 | t3    | mysql_svr | ("table" 't3', schema 'import_source')  | 
 import_dest1 | x_4   | mysql_svr | ("table" 'x_4', schema 'import_source') | 
(4 rows)

--Testcase 939:
\d import_dest1.*
                        Foreign table "import_dest1.t1"
 Column |         Type          | Collation | Nullable | Default | FDW options 
--------+-----------------------+-----------+----------+---------+-------------
 c1     | integer               |           |          |         | 
 c2     | character varying(10) |           |          |         | 
Server: mysql_svr
FDW options: ("table" 't1', schema 'import_source')

                        Foreign table "import_dest1.t2"
 Column |         Type          | Collation | Nullable | Default | FDW options 
--------+-----------------------+-----------+----------+---------+-------------
 c1     | integer               |           |          |         | 
 c2     | character varying(10) |           |          |         | 
 c3     | text                  |           |          |         | 
Server: mysql_svr
FDW options: ("table" 't2', schema 'import_source')

                           Foreign table "import_dest1.t3"
 Column |            Type             | Collation | Nullable | Default | FDW options 
--------+-----------------------------+-----------+----------+---------+-------------
 c1     | timestamp without time zone |           |          |         | 
 c2     | character varying(10)       |           |          |         | 
Server: mysql_svr
FDW options: ("table" 't3', schema 'import_source')

                       Foreign table "import_dest1.x_4"
 Column |         Type          | Collation | Nullable | Default | FDW options 
--------+-----------------------+-----------+----------+---------+-------------
 c1     | double precision      |           |          |         | 
 C_2    | text                  |           |          |         | 
 c3     | character varying(42) |           |          |         | 
Server: mysql_svr
FDW options: ("table" 'x_4', schema 'import_source')

/*
-- Does not support options
-- Options
CREATE SCHEMA import_dest2;
IMPORT FOREIGN SCHEMA import_source FROM SERVER :DB_SERVERNAME INTO import_dest2
  OPTIONS (import_default 'true');
\det+ import_dest2.*
\d import_dest2.*
CREATE SCHEMA import_dest3;
IMPORT FOREIGN SCHEMA import_source FROM SERVER :DB_SERVERNAME INTO import_dest3
  OPTIONS (import_collate 'false', import_not_null 'false');
\det+ import_dest3.*
\d import_dest3.*

-- Check LIMIT TO and EXCEPT
CREATE SCHEMA import_dest4;
IMPORT FOREIGN SCHEMA import_source LIMIT TO (t1, nonesuch)
  FROM SERVER :DB_SERVERNAME INTO import_dest4;
\det+ import_dest4.*
IMPORT FOREIGN SCHEMA import_source EXCEPT (t1, "x 4", nonesuch)
  FROM SERVER :DB_SERVERNAME INTO import_dest4;
\det+ import_dest4.*

-- Assorted error cases
IMPORT FOREIGN SCHEMA import_source FROM SERVER :DB_SERVERNAME INTO import_dest4;
IMPORT FOREIGN SCHEMA nonesuch FROM SERVER :DB_SERVERNAME INTO import_dest4;
IMPORT FOREIGN SCHEMA nonesuch FROM SERVER :DB_SERVERNAME INTO notthere;
IMPORT FOREIGN SCHEMA nonesuch FROM SERVER nowhere INTO notthere;

-- Check case of a type present only on the remote server.
-- We can fake this by dropping the type locally in our transaction.
CREATE TYPE "Colors" AS ENUM ('red', 'green', 'blue');
CREATE TABLE import_source.t5 (c1 int, c2 text collate "C", "Col" "Colors");

CREATE SCHEMA import_dest5;
-- BEGIN;
DROP TYPE "Colors" CASCADE;
IMPORT FOREIGN SCHEMA import_source LIMIT TO (t5)
  FROM SERVER :DB_SERVERNAME INTO import_dest5;  -- ERROR
-- ROLLBACK;
*/
/*
-- Does not support fetch_size option
-- BEGIN;
CREATE SERVER fetch101 FOREIGN DATA WRAPPER :DB_EXTENSIONNAME OPTIONS( fetch_size '101' );

SELECT count(*)
FROM pg_foreign_server
WHERE srvname = 'fetch101'
AND srvoptions @> array['fetch_size=101'];

ALTER SERVER fetch101 OPTIONS( SET fetch_size '202' );

SELECT count(*)
FROM pg_foreign_server
WHERE srvname = 'fetch101'
AND srvoptions @> array['fetch_size=101'];

SELECT count(*)
FROM pg_foreign_server
WHERE srvname = 'fetch101'
AND srvoptions @> array['fetch_size=202'];

CREATE FOREIGN TABLE table30000 ( x int ) SERVER fetch101 OPTIONS ( fetch_size '30000' );

SELECT COUNT(*)
FROM pg_foreign_table
WHERE ftrelid = 'table30000'::regclass
AND ftoptions @> array['fetch_size=30000'];

ALTER FOREIGN TABLE table30000 OPTIONS ( SET fetch_size '60000');

SELECT COUNT(*)
FROM pg_foreign_table
WHERE ftrelid = 'table30000'::regclass
AND ftoptions @> array['fetch_size=30000'];

SELECT COUNT(*)
FROM pg_foreign_table
WHERE ftrelid = 'table30000'::regclass
AND ftoptions @> array['fetch_size=60000'];

-- ROLLBACK;
*/
/*
-- Does not support partition table
-- ===================================================================
-- test partitionwise joins
-- ===================================================================
SET enable_partitionwise_join=on;

CREATE TABLE fprt1 (a int, b int, c varchar) PARTITION BY RANGE(a);
CREATE FOREIGN TABLE ftprt1_p1 PARTITION OF fprt1 FOR VALUES FROM (0) TO (250)
	SERVER :DB_SERVERNAME OPTIONS (schema :DB_SCHEMA_PORT_TEST, table 'fprt1_p1', use_remote_estimate 'true');
CREATE FOREIGN TABLE ftprt1_p2 PARTITION OF fprt1 FOR VALUES FROM (250) TO (500)
	SERVER :DB_SERVERNAME OPTIONS (schema :DB_SCHEMA_PORT_TEST, table 'fprt1_p2');
-- ANALYZE fprt1;
-- ANALYZE fprt1_p1;
-- ANALYZE fprt1_p2;

CREATE TABLE fprt2 (a int, b int, c varchar) PARTITION BY RANGE(b);
CREATE FOREIGN TABLE ftprt2_p1 (b int, c varchar, a int)
	SERVER :DB_SERVERNAME OPTIONS (schema :DB_SCHEMA_PORT_TEST, table 'fprt2_p1', use_remote_estimate 'true');
ALTER TABLE fprt2 ATTACH PARTITION ftprt2_p1 FOR VALUES FROM (0) TO (250);
CREATE FOREIGN TABLE ftprt2_p2 PARTITION OF fprt2 FOR VALUES FROM (250) TO (500)
	SERVER :DB_SERVERNAME OPTIONS (schema :DB_SCHEMA_PORT_TEST, table 'fprt2_p2', use_remote_estimate 'true');

-- inner join three tables
EXPLAIN (COSTS OFF)
SELECT t1.a,t2.b,t3.c FROM fprt1 t1 INNER JOIN fprt2 t2 ON (t1.a = t2.b) INNER JOIN fprt1 t3 ON (t2.b = t3.a) WHERE t1.a % 25 =0 ORDER BY 1,2,3;
SELECT t1.a,t2.b,t3.c FROM fprt1 t1 INNER JOIN fprt2 t2 ON (t1.a = t2.b) INNER JOIN fprt1 t3 ON (t2.b = t3.a) WHERE t1.a % 25 =0 ORDER BY 1,2,3;

-- left outer join + nullable clause
EXPLAIN (VERBOSE, COSTS OFF)
SELECT t1.a,t2.b,t2.c FROM fprt1 t1 LEFT JOIN (SELECT * FROM fprt2 WHERE a < 10) t2 ON (t1.a = t2.b and t1.b = t2.a) WHERE t1.a < 10 ORDER BY 1,2,3;
SELECT t1.a,t2.b,t2.c FROM fprt1 t1 LEFT JOIN (SELECT * FROM fprt2 WHERE a < 10) t2 ON (t1.a = t2.b and t1.b = t2.a) WHERE t1.a < 10 ORDER BY 1,2,3;

-- with whole-row reference; partitionwise join does not apply
EXPLAIN (COSTS OFF)
SELECT t1.wr, t2.wr FROM (SELECT t1 wr, a FROM fprt1 t1 WHERE t1.a % 25 = 0) t1 FULL JOIN (SELECT t2 wr, b FROM fprt2 t2 WHERE t2.b % 25 = 0) t2 ON (t1.a = t2.b) ORDER BY 1,2;
SELECT t1.wr, t2.wr FROM (SELECT t1 wr, a FROM fprt1 t1 WHERE t1.a % 25 = 0) t1 FULL JOIN (SELECT t2 wr, b FROM fprt2 t2 WHERE t2.b % 25 = 0) t2 ON (t1.a = t2.b) ORDER BY 1,2;

-- join with lateral reference
EXPLAIN (COSTS OFF)
SELECT t1.a,t1.b FROM fprt1 t1, LATERAL (SELECT t2.a, t2.b FROM fprt2 t2 WHERE t1.a = t2.b AND t1.b = t2.a) q WHERE t1.a%25 = 0 ORDER BY 1,2;
SELECT t1.a,t1.b FROM fprt1 t1, LATERAL (SELECT t2.a, t2.b FROM fprt2 t2 WHERE t1.a = t2.b AND t1.b = t2.a) q WHERE t1.a%25 = 0 ORDER BY 1,2;

-- with PHVs, partitionwise join selected but no join pushdown
EXPLAIN (COSTS OFF)
SELECT t1.a, t1.phv, t2.b, t2.phv FROM (SELECT 't1_phv' phv, * FROM fprt1 WHERE a % 25 = 0) t1 FULL JOIN (SELECT 't2_phv' phv, * FROM fprt2 WHERE b % 25 = 0) t2 ON (t1.a = t2.b) ORDER BY t1.a, t2.b;
SELECT t1.a, t1.phv, t2.b, t2.phv FROM (SELECT 't1_phv' phv, * FROM fprt1 WHERE a % 25 = 0) t1 FULL JOIN (SELECT 't2_phv' phv, * FROM fprt2 WHERE b % 25 = 0) t2 ON (t1.a = t2.b) ORDER BY t1.a, t2.b;

-- test FOR UPDATE; partitionwise join does not apply
EXPLAIN (COSTS OFF)
SELECT t1.a, t2.b FROM fprt1 t1 INNER JOIN fprt2 t2 ON (t1.a = t2.b) WHERE t1.a % 25 = 0 ORDER BY 1,2 FOR UPDATE OF t1;
SELECT t1.a, t2.b FROM fprt1 t1 INNER JOIN fprt2 t2 ON (t1.a = t2.b) WHERE t1.a % 25 = 0 ORDER BY 1,2 FOR UPDATE OF t1;

RESET enable_partitionwise_join;


-- ===================================================================
-- test partitionwise aggregates
-- ===================================================================

CREATE TABLE pagg_tab (a int, b int, c text) PARTITION BY RANGE(a);

-- Create foreign partitions
CREATE FOREIGN TABLE fpagg_tab_p1 PARTITION OF pagg_tab FOR VALUES FROM (0) TO (10) SERVER :DB_SERVERNAME OPTIONS (schema :DB_SCHEMA_PORT_TEST, table 'pagg_tab_p1');
CREATE FOREIGN TABLE fpagg_tab_p2 PARTITION OF pagg_tab FOR VALUES FROM (10) TO (20) SERVER :DB_SERVERNAME OPTIONS (schema :DB_SCHEMA_PORT_TEST, table 'pagg_tab_p2');;
CREATE FOREIGN TABLE fpagg_tab_p3 PARTITION OF pagg_tab FOR VALUES FROM (20) TO (30) SERVER :DB_SERVERNAME OPTIONS (schema :DB_SCHEMA_PORT_TEST, table 'pagg_tab_p3');;


-- When GROUP BY clause matches with PARTITION KEY.
-- Plan with partitionwise aggregates is disabled
SET enable_partitionwise_aggregate TO false;
EXPLAIN (COSTS OFF)
SELECT a, sum(b), min(b), count(*) FROM pagg_tab GROUP BY a HAVING avg(b) < 22 ORDER BY 1;

-- Plan with partitionwise aggregates is enabled
SET enable_partitionwise_aggregate TO true;
EXPLAIN (COSTS OFF)
SELECT a, sum(b), min(b), count(*) FROM pagg_tab GROUP BY a HAVING avg(b) < 22 ORDER BY 1;
SELECT a, sum(b), min(b), count(*) FROM pagg_tab GROUP BY a HAVING avg(b) < 22 ORDER BY 1;

-- Check with whole-row reference
-- Should have all the columns in the target list for the given relation
EXPLAIN (VERBOSE, COSTS OFF)
SELECT a, count(t1) FROM pagg_tab t1 GROUP BY a HAVING avg(b) < 22 ORDER BY 1;
SELECT a, count(t1) FROM pagg_tab t1 GROUP BY a HAVING avg(b) < 22 ORDER BY 1;

-- When GROUP BY clause does not match with PARTITION KEY.
EXPLAIN (COSTS OFF)
SELECT b, avg(a), max(a), count(*) FROM pagg_tab GROUP BY b HAVING sum(a) < 700 ORDER BY 1;
*/
-- Does not support rights
-- ===================================================================
-- access rights and superuser
-- ===================================================================
-- -- Non-superuser cannot create a FDW without a password in the connstr
-- CREATE ROLE regress_nosuper NOSUPERUSER;
-- GRANT USAGE ON FOREIGN DATA WRAPPER :DB_EXTENSIONNAME TO regress_nosuper;
-- SET ROLE regress_nosuper;
-- SHOW is_superuser;
-- -- This will be OK, we can create the FDW
-- DO $d$
--     BEGIN
--         EXECUTE $$CREATE SERVER loopback_nopw FOREIGN DATA WRAPPER :DB_EXTENSIONNAME
--             OPTIONS (dbname '$$||current_database()||$$',
--                      port '$$||current_setting('port')||$$'
--             )$$;
--     END;
-- $d$;
-- -- But creation of user mappings for non-superusers should fail
-- CREATE USER MAPPING FOR public SERVER loopback_nopw;
-- CREATE USER MAPPING FOR CURRENT_USER SERVER loopback_nopw;
-- CREATE FOREIGN TABLE ft1_nopw (
-- 	c1 int NOT NULL,
-- 	c2 int NOT NULL,
-- 	c3 text,
-- 	c4 timestamptz,
-- 	c5 timestamp,
-- 	c6 varchar(10),
-- 	c7 char(10) default 'ft1',
-- 	c8 user_enum
-- ) SERVER loopback_nopw OPTIONS (schema_name 'public', table 'ft1');
-- SELECT * FROM ft1_nopw LIMIT 1;
-- -- If we add a password to the connstr it'll fail, because we don't allow passwords
-- -- in connstrs only in user mappings.
-- DO $d$
--     BEGIN
--         EXECUTE $$ALTER SERVER loopback_nopw OPTIONS (ADD password 'dummypw')$$;
--     END;
-- $d$;
-- -- If we add a password for our user mapping instead, we should get a different
-- -- error because the password wasn't actually *used* when we run with trust auth.
-- --
-- -- This won't work with installcheck, but neither will most of the FDW checks.
-- ALTER USER MAPPING FOR CURRENT_USER SERVER loopback_nopw OPTIONS (ADD password 'dummypw');
-- SELECT * FROM ft1_nopw LIMIT 1;
-- -- Unpriv user cannot make the mapping passwordless
-- ALTER USER MAPPING FOR CURRENT_USER SERVER loopback_nopw OPTIONS (ADD password_required 'false');
-- SELECT * FROM ft1_nopw LIMIT 1;
-- RESET ROLE;
-- -- But the superuser can
-- ALTER USER MAPPING FOR regress_nosuper SERVER loopback_nopw OPTIONS (ADD password_required 'false');
-- SET ROLE regress_nosuper;
-- -- Should finally work now
-- SELECT * FROM ft1_nopw LIMIT 1;
-- -- unpriv user also cannot set sslcert / sslkey on the user mapping
-- -- first set password_required so we see the right error messages
-- ALTER USER MAPPING FOR CURRENT_USER SERVER loopback_nopw OPTIONS (SET password_required 'true');
-- ALTER USER MAPPING FOR CURRENT_USER SERVER loopback_nopw OPTIONS (ADD sslcert 'foo.crt');
-- ALTER USER MAPPING FOR CURRENT_USER SERVER loopback_nopw OPTIONS (ADD sslkey 'foo.key');
-- -- We're done with the role named after a specific user and need to check the
-- -- changes to the public mapping.
-- DROP USER MAPPING FOR CURRENT_USER SERVER loopback_nopw;
-- -- This will fail again as it'll resolve the user mapping for public, which
-- -- lacks password_required=false
-- SELECT * FROM ft1_nopw LIMIT 1;
-- RESET ROLE;
-- -- The user mapping for public is passwordless and lacks the password_required=false
-- -- mapping option, but will work because the current user is a superuser.
-- SELECT * FROM ft1_nopw LIMIT 1;
-- -- cleanup
-- DROP USER MAPPING FOR public SERVER loopback_nopw;
-- DROP OWNED BY regress_nosuper;
-- DROP ROLE regress_nosuper;
-- -- Clean-up
-- RESET enable_partitionwise_aggregate;
-- -- Two-phase transactions are not supported.
-- BEGIN;
-- SELECT count(*) FROM ft1;
-- -- error here
-- PREPARE TRANSACTION 'fdw_tpc';
-- ROLLBACK;
-- odbd_fdw does not support new feature from postgres_fdw 14.0
-- -- ===================================================================
-- -- reestablish new connection
-- -- ===================================================================
-- -- Change application_name of remote connection to special one
-- -- so that we can easily terminate the connection later.
-- ALTER SERVER loopback OPTIONS (application_name 'fdw_retry_check');
-- -- If debug_discard_caches is active, it results in
-- -- dropping remote connections after every transaction, making it
-- -- impossible to test termination meaningfully.  So turn that off
-- -- for this test.
-- SET debug_discard_caches = 0;
-- -- Make sure we have a remote connection.
-- SELECT 1 FROM ft1 LIMIT 1;
-- -- Terminate the remote connection and wait for the termination to complete.
-- SELECT pg_terminate_backend(pid, 180000) FROM pg_stat_activity
-- 	WHERE application_name = 'fdw_retry_check';
-- -- This query should detect the broken connection when starting new remote
-- -- transaction, reestablish new connection, and then succeed.
-- BEGIN;
-- SELECT 1 FROM ft1 LIMIT 1;
-- -- If we detect the broken connection when starting a new remote
-- -- subtransaction, we should fail instead of establishing a new connection.
-- -- Terminate the remote connection and wait for the termination to complete.
-- SELECT pg_terminate_backend(pid, 180000) FROM pg_stat_activity
-- 	WHERE application_name = 'fdw_retry_check';
-- SAVEPOINT s;
-- -- The text of the error might vary across platforms, so only show SQLSTATE.
-- \set VERBOSITY sqlstate
-- SELECT 1 FROM ft1 LIMIT 1;    -- should fail
-- \set VERBOSITY default
-- COMMIT;
-- RESET debug_discard_caches;
-- -- =============================================================================
-- -- test connection invalidation cases and postgres_fdw_get_connections function
-- -- =============================================================================
-- -- Let's ensure to close all the existing cached connections.
-- SELECT 1 FROM postgres_fdw_disconnect_all();
-- -- No cached connections, so no records should be output.
-- SELECT server_name FROM postgres_fdw_get_connections() ORDER BY 1;
-- -- This test case is for closing the connection in pgfdw_xact_callback
-- BEGIN;
-- -- Connection xact depth becomes 1 i.e. the connection is in midst of the xact.
-- SELECT 1 FROM ft1 LIMIT 1;
-- SELECT 1 FROM ft7 LIMIT 1;
-- -- List all the existing cached connections. loopback and loopback3 should be
-- -- output.
-- SELECT server_name FROM postgres_fdw_get_connections() ORDER BY 1;
-- -- Connections are not closed at the end of the alter and drop statements.
-- -- That's because the connections are in midst of this xact,
-- -- they are just marked as invalid in pgfdw_inval_callback.
-- ALTER SERVER loopback OPTIONS (ADD use_remote_estimate 'off');
-- DROP SERVER loopback3 CASCADE;
-- -- List all the existing cached connections. loopback and loopback3
-- -- should be output as invalid connections. Also the server name for
-- -- loopback3 should be NULL because the server was dropped.
-- SELECT * FROM postgres_fdw_get_connections() ORDER BY 1;
-- -- The invalid connections get closed in pgfdw_xact_callback during commit.
-- COMMIT;
-- -- All cached connections were closed while committing above xact, so no
-- -- records should be output.
-- SELECT server_name FROM postgres_fdw_get_connections() ORDER BY 1;
-- -- =======================================================================
-- -- test postgres_fdw_disconnect and postgres_fdw_disconnect_all functions
-- -- =======================================================================
-- BEGIN;
-- -- Ensure to cache loopback connection.
-- SELECT 1 FROM ft1 LIMIT 1;
-- -- Ensure to cache loopback2 connection.
-- SELECT 1 FROM ft6 LIMIT 1;
-- -- List all the existing cached connections. loopback and loopback2 should be
-- -- output.
-- SELECT server_name FROM postgres_fdw_get_connections() ORDER BY 1;
-- -- Issue a warning and return false as loopback connection is still in use and
-- -- can not be closed.
-- SELECT postgres_fdw_disconnect('loopback');
-- -- List all the existing cached connections. loopback and loopback2 should be
-- -- output.
-- SELECT server_name FROM postgres_fdw_get_connections() ORDER BY 1;
-- -- Return false as connections are still in use, warnings are issued.
-- -- But disable warnings temporarily because the order of them is not stable.
-- SET client_min_messages = 'ERROR';
-- SELECT postgres_fdw_disconnect_all();
-- RESET client_min_messages;
-- COMMIT;
-- -- Ensure that loopback2 connection is closed.
-- SELECT 1 FROM postgres_fdw_disconnect('loopback2');
-- SELECT server_name FROM postgres_fdw_get_connections() WHERE server_name = 'loopback2';
-- -- Return false as loopback2 connection is closed already.
-- SELECT postgres_fdw_disconnect('loopback2');
-- -- Return an error as there is no foreign server with given name.
-- SELECT postgres_fdw_disconnect('unknownserver');
-- -- Let's ensure to close all the existing cached connections.
-- SELECT 1 FROM postgres_fdw_disconnect_all();
-- -- No cached connections, so no records should be output.
-- SELECT server_name FROM postgres_fdw_get_connections() ORDER BY 1;
-- -- =============================================================================
-- -- test case for having multiple cached connections for a foreign server
-- -- =============================================================================
-- CREATE ROLE regress_multi_conn_user1 SUPERUSER;
-- CREATE ROLE regress_multi_conn_user2 SUPERUSER;
-- CREATE USER MAPPING FOR regress_multi_conn_user1 SERVER loopback;
-- CREATE USER MAPPING FOR regress_multi_conn_user2 SERVER loopback;
-- BEGIN;
-- -- Will cache loopback connection with user mapping for regress_multi_conn_user1
-- SET ROLE regress_multi_conn_user1;
-- SELECT 1 FROM ft1 LIMIT 1;
-- RESET ROLE;
-- -- Will cache loopback connection with user mapping for regress_multi_conn_user2
-- SET ROLE regress_multi_conn_user2;
-- SELECT 1 FROM ft1 LIMIT 1;
-- RESET ROLE;
-- -- Should output two connections for loopback server
-- SELECT server_name FROM postgres_fdw_get_connections() ORDER BY 1;
-- COMMIT;
-- -- Let's ensure to close all the existing cached connections.
-- SELECT 1 FROM postgres_fdw_disconnect_all();
-- -- No cached connections, so no records should be output.
-- SELECT server_name FROM postgres_fdw_get_connections() ORDER BY 1;
-- -- Clean up
-- DROP USER MAPPING FOR regress_multi_conn_user1 SERVER loopback;
-- DROP USER MAPPING FOR regress_multi_conn_user2 SERVER loopback;
-- DROP ROLE regress_multi_conn_user1;
-- DROP ROLE regress_multi_conn_user2;
-- -- ===================================================================
-- -- Test foreign server level option keep_connections
-- -- ===================================================================
-- -- By default, the connections associated with foreign server are cached i.e.
-- -- keep_connections option is on. Set it to off.
-- ALTER SERVER loopback OPTIONS (keep_connections 'off');
-- -- connection to loopback server is closed at the end of xact
-- -- as keep_connections was set to off.
-- SELECT 1 FROM ft1 LIMIT 1;
-- -- No cached connections, so no records should be output.
-- SELECT server_name FROM postgres_fdw_get_connections() ORDER BY 1;
-- ALTER SERVER loopback OPTIONS (SET keep_connections 'on');
-- -- ===================================================================
-- -- batch insert
-- -- ===================================================================
-- BEGIN;
-- CREATE SERVER batch10 FOREIGN DATA WRAPPER postgres_fdw OPTIONS( batch_size '10' );
-- SELECT count(*)
-- FROM pg_foreign_server
-- WHERE srvname = 'batch10'
-- AND srvoptions @> array['batch_size=10'];
-- ALTER SERVER batch10 OPTIONS( SET batch_size '20' );
-- SELECT count(*)
-- FROM pg_foreign_server
-- WHERE srvname = 'batch10'
-- AND srvoptions @> array['batch_size=10'];
-- SELECT count(*)
-- FROM pg_foreign_server
-- WHERE srvname = 'batch10'
-- AND srvoptions @> array['batch_size=20'];
-- CREATE FOREIGN TABLE table30 ( x int ) SERVER batch10 OPTIONS ( batch_size '30' );
-- SELECT COUNT(*)
-- FROM pg_foreign_table
-- WHERE ftrelid = 'table30'::regclass
-- AND ftoptions @> array['batch_size=30'];
-- ALTER FOREIGN TABLE table30 OPTIONS ( SET batch_size '40');
-- SELECT COUNT(*)
-- FROM pg_foreign_table
-- WHERE ftrelid = 'table30'::regclass
-- AND ftoptions @> array['batch_size=30'];
-- SELECT COUNT(*)
-- FROM pg_foreign_table
-- WHERE ftrelid = 'table30'::regclass
-- AND ftoptions @> array['batch_size=40'];
-- ROLLBACK;
-- CREATE TABLE batch_table ( x int );
-- CREATE FOREIGN TABLE ftable ( x int ) SERVER loopback OPTIONS ( table_name 'batch_table', batch_size '10' );
-- EXPLAIN (VERBOSE, COSTS OFF) INSERT INTO ftable SELECT * FROM generate_series(1, 10) i;
-- INSERT INTO ftable SELECT * FROM generate_series(1, 10) i;
-- INSERT INTO ftable SELECT * FROM generate_series(11, 31) i;
-- INSERT INTO ftable VALUES (32);
-- INSERT INTO ftable VALUES (33), (34);
-- SELECT COUNT(*) FROM ftable;
-- TRUNCATE batch_table;
-- DROP FOREIGN TABLE ftable;
-- -- try if large batches exceed max number of bind parameters
-- CREATE FOREIGN TABLE ftable ( x int ) SERVER loopback OPTIONS ( table_name 'batch_table', batch_size '100000' );
-- INSERT INTO ftable SELECT * FROM generate_series(1, 70000) i;
-- SELECT COUNT(*) FROM ftable;
-- TRUNCATE batch_table;
-- DROP FOREIGN TABLE ftable;
-- -- Disable batch insert
-- CREATE FOREIGN TABLE ftable ( x int ) SERVER loopback OPTIONS ( table_name 'batch_table', batch_size '1' );
-- EXPLAIN (VERBOSE, COSTS OFF) INSERT INTO ftable VALUES (1), (2);
-- INSERT INTO ftable VALUES (1), (2);
-- SELECT COUNT(*) FROM ftable;
-- DROP FOREIGN TABLE ftable;
-- DROP TABLE batch_table;
-- -- Use partitioning
-- CREATE TABLE batch_table ( x int ) PARTITION BY HASH (x);
-- CREATE TABLE batch_table_p0 (LIKE batch_table);
-- CREATE FOREIGN TABLE batch_table_p0f
-- 	PARTITION OF batch_table
-- 	FOR VALUES WITH (MODULUS 3, REMAINDER 0)
-- 	SERVER loopback
-- 	OPTIONS (table_name 'batch_table_p0', batch_size '10');
-- CREATE TABLE batch_table_p1 (LIKE batch_table);
-- CREATE FOREIGN TABLE batch_table_p1f
-- 	PARTITION OF batch_table
-- 	FOR VALUES WITH (MODULUS 3, REMAINDER 1)
-- 	SERVER loopback
-- 	OPTIONS (table_name 'batch_table_p1', batch_size '1');
-- CREATE TABLE batch_table_p2
-- 	PARTITION OF batch_table
-- 	FOR VALUES WITH (MODULUS 3, REMAINDER 2);
-- INSERT INTO batch_table SELECT * FROM generate_series(1, 66) i;
-- SELECT COUNT(*) FROM batch_table;
-- -- Check that enabling batched inserts doesn't interfere with cross-partition
-- -- updates
-- CREATE TABLE batch_cp_upd_test (a int) PARTITION BY LIST (a);
-- CREATE TABLE batch_cp_upd_test1 (LIKE batch_cp_upd_test);
-- CREATE FOREIGN TABLE batch_cp_upd_test1_f
-- 	PARTITION OF batch_cp_upd_test
-- 	FOR VALUES IN (1)
-- 	SERVER loopback
-- 	OPTIONS (table_name 'batch_cp_upd_test1', batch_size '10');
-- CREATE TABLE batch_cp_up_test1 PARTITION OF batch_cp_upd_test
-- 	FOR VALUES IN (2);
-- INSERT INTO batch_cp_upd_test VALUES (1), (2);
-- -- The following moves a row from the local partition to the foreign one
-- UPDATE batch_cp_upd_test t SET a = 1 FROM (VALUES (1), (2)) s(a) WHERE t.a = s.a;
-- SELECT tableoid::regclass, * FROM batch_cp_upd_test;
-- -- Clean up
-- DROP TABLE batch_table, batch_cp_upd_test, batch_table_p0, batch_table_p1 CASCADE;
-- -- Use partitioning
-- ALTER SERVER loopback OPTIONS (ADD batch_size '10');
-- CREATE TABLE batch_table ( x int, field1 text, field2 text) PARTITION BY HASH (x);
-- CREATE TABLE batch_table_p0 (LIKE batch_table);
-- ALTER TABLE batch_table_p0 ADD CONSTRAINT p0_pkey PRIMARY KEY (x);
-- CREATE FOREIGN TABLE batch_table_p0f
-- 	PARTITION OF batch_table
-- 	FOR VALUES WITH (MODULUS 2, REMAINDER 0)
-- 	SERVER loopback
-- 	OPTIONS (table_name 'batch_table_p0');
-- CREATE TABLE batch_table_p1 (LIKE batch_table);
-- ALTER TABLE batch_table_p1 ADD CONSTRAINT p1_pkey PRIMARY KEY (x);
-- CREATE FOREIGN TABLE batch_table_p1f
-- 	PARTITION OF batch_table
-- 	FOR VALUES WITH (MODULUS 2, REMAINDER 1)
-- 	SERVER loopback
-- 	OPTIONS (table_name 'batch_table_p1');
-- INSERT INTO batch_table SELECT i, 'test'||i, 'test'|| i FROM generate_series(1, 50) i;
-- SELECT COUNT(*) FROM batch_table;
-- SELECT * FROM batch_table ORDER BY x;
-- ALTER SERVER loopback OPTIONS (DROP batch_size);
-- -- ===================================================================
-- -- test asynchronous execution
-- -- ===================================================================
-- ALTER SERVER loopback OPTIONS (DROP extensions);
-- ALTER SERVER loopback OPTIONS (ADD async_capable 'true');
-- ALTER SERVER loopback2 OPTIONS (ADD async_capable 'true');
-- CREATE TABLE async_pt (a int, b int, c text) PARTITION BY RANGE (a);
-- CREATE TABLE base_tbl1 (a int, b int, c text);
-- CREATE TABLE base_tbl2 (a int, b int, c text);
-- CREATE FOREIGN TABLE async_p1 PARTITION OF async_pt FOR VALUES FROM (1000) TO (2000)
--   SERVER loopback OPTIONS (table_name 'base_tbl1');
-- CREATE FOREIGN TABLE async_p2 PARTITION OF async_pt FOR VALUES FROM (2000) TO (3000)
--   SERVER loopback2 OPTIONS (table_name 'base_tbl2');
-- INSERT INTO async_p1 SELECT 1000 + i, i, to_char(i, 'FM0000') FROM generate_series(0, 999, 5) i;
-- INSERT INTO async_p2 SELECT 2000 + i, i, to_char(i, 'FM0000') FROM generate_series(0, 999, 5) i;
-- ANALYZE async_pt;
-- -- simple queries
-- CREATE TABLE result_tbl (a int, b int, c text);
-- EXPLAIN (VERBOSE, COSTS OFF)
-- INSERT INTO result_tbl SELECT * FROM async_pt WHERE b % 100 = 0;
-- INSERT INTO result_tbl SELECT * FROM async_pt WHERE b % 100 = 0;
-- SELECT * FROM result_tbl ORDER BY a;
-- DELETE FROM result_tbl;
-- EXPLAIN (VERBOSE, COSTS OFF)
-- INSERT INTO result_tbl SELECT * FROM async_pt WHERE b === 505;
-- INSERT INTO result_tbl SELECT * FROM async_pt WHERE b === 505;
-- SELECT * FROM result_tbl ORDER BY a;
-- DELETE FROM result_tbl;
-- -- Check case where multiple partitions use the same connection
-- CREATE TABLE base_tbl3 (a int, b int, c text);
-- CREATE FOREIGN TABLE async_p3 PARTITION OF async_pt FOR VALUES FROM (3000) TO (4000)
--   SERVER loopback2 OPTIONS (table_name 'base_tbl3');
-- INSERT INTO async_p3 SELECT 3000 + i, i, to_char(i, 'FM0000') FROM generate_series(0, 999, 5) i;
-- ANALYZE async_pt;
-- EXPLAIN (VERBOSE, COSTS OFF)
-- INSERT INTO result_tbl SELECT * FROM async_pt WHERE b === 505;
-- INSERT INTO result_tbl SELECT * FROM async_pt WHERE b === 505;
-- SELECT * FROM result_tbl ORDER BY a;
-- DELETE FROM result_tbl;
-- DROP FOREIGN TABLE async_p3;
-- DROP TABLE base_tbl3;
-- -- Check case where the partitioned table has local/remote partitions
-- CREATE TABLE async_p3 PARTITION OF async_pt FOR VALUES FROM (3000) TO (4000);
-- INSERT INTO async_p3 SELECT 3000 + i, i, to_char(i, 'FM0000') FROM generate_series(0, 999, 5) i;
-- ANALYZE async_pt;
-- EXPLAIN (VERBOSE, COSTS OFF)
-- INSERT INTO result_tbl SELECT * FROM async_pt WHERE b === 505;
-- INSERT INTO result_tbl SELECT * FROM async_pt WHERE b === 505;
-- SELECT * FROM result_tbl ORDER BY a;
-- DELETE FROM result_tbl;
-- -- partitionwise joins
-- SET enable_partitionwise_join TO true;
-- CREATE TABLE join_tbl (a1 int, b1 int, c1 text, a2 int, b2 int, c2 text);
-- EXPLAIN (VERBOSE, COSTS OFF)
-- INSERT INTO join_tbl SELECT * FROM async_pt t1, async_pt t2 WHERE t1.a = t2.a AND t1.b = t2.b AND t1.b % 100 = 0;
-- INSERT INTO join_tbl SELECT * FROM async_pt t1, async_pt t2 WHERE t1.a = t2.a AND t1.b = t2.b AND t1.b % 100 = 0;
-- SELECT * FROM join_tbl ORDER BY a1;
-- DELETE FROM join_tbl;
-- RESET enable_partitionwise_join;
-- -- Test rescan of an async Append node with do_exec_prune=false
-- SET enable_hashjoin TO false;
-- EXPLAIN (VERBOSE, COSTS OFF)
-- INSERT INTO join_tbl SELECT * FROM async_p1 t1, async_pt t2 WHERE t1.a = t2.a AND t1.b = t2.b AND t1.b % 100 = 0;
-- INSERT INTO join_tbl SELECT * FROM async_p1 t1, async_pt t2 WHERE t1.a = t2.a AND t1.b = t2.b AND t1.b % 100 = 0;
-- SELECT * FROM join_tbl ORDER BY a1;
-- DELETE FROM join_tbl;
-- RESET enable_hashjoin;
-- -- Test interaction of async execution with plan-time partition pruning
-- EXPLAIN (VERBOSE, COSTS OFF)
-- SELECT * FROM async_pt WHERE a < 3000;
-- EXPLAIN (VERBOSE, COSTS OFF)
-- SELECT * FROM async_pt WHERE a < 2000;
-- -- Test interaction of async execution with run-time partition pruning
-- SET plan_cache_mode TO force_generic_plan;
-- PREPARE async_pt_query (int, int) AS
--   INSERT INTO result_tbl SELECT * FROM async_pt WHERE a < $1 AND b === $2;
-- EXPLAIN (VERBOSE, COSTS OFF)
-- EXECUTE async_pt_query (3000, 505);
-- EXECUTE async_pt_query (3000, 505);
-- SELECT * FROM result_tbl ORDER BY a;
-- DELETE FROM result_tbl;
-- EXPLAIN (VERBOSE, COSTS OFF)
-- EXECUTE async_pt_query (2000, 505);
-- EXECUTE async_pt_query (2000, 505);
-- SELECT * FROM result_tbl ORDER BY a;
-- DELETE FROM result_tbl;
-- RESET plan_cache_mode;
-- CREATE TABLE local_tbl(a int, b int, c text);
-- INSERT INTO local_tbl VALUES (1505, 505, 'foo'), (2505, 505, 'bar');
-- ANALYZE local_tbl;
-- CREATE INDEX base_tbl1_idx ON base_tbl1 (a);
-- CREATE INDEX base_tbl2_idx ON base_tbl2 (a);
-- CREATE INDEX async_p3_idx ON async_p3 (a);
-- ANALYZE base_tbl1;
-- ANALYZE base_tbl2;
-- ANALYZE async_p3;
-- ALTER FOREIGN TABLE async_p1 OPTIONS (use_remote_estimate 'true');
-- ALTER FOREIGN TABLE async_p2 OPTIONS (use_remote_estimate 'true');
-- EXPLAIN (VERBOSE, COSTS OFF)
-- SELECT * FROM local_tbl, async_pt WHERE local_tbl.a = async_pt.a AND local_tbl.c = 'bar';
-- EXPLAIN (ANALYZE, COSTS OFF, SUMMARY OFF, TIMING OFF)
-- SELECT * FROM local_tbl, async_pt WHERE local_tbl.a = async_pt.a AND local_tbl.c = 'bar';
-- SELECT * FROM local_tbl, async_pt WHERE local_tbl.a = async_pt.a AND local_tbl.c = 'bar';
-- ALTER FOREIGN TABLE async_p1 OPTIONS (DROP use_remote_estimate);
-- ALTER FOREIGN TABLE async_p2 OPTIONS (DROP use_remote_estimate);
-- DROP TABLE local_tbl;
-- DROP INDEX base_tbl1_idx;
-- DROP INDEX base_tbl2_idx;
-- DROP INDEX async_p3_idx;
-- -- Test that pending requests are processed properly
-- SET enable_mergejoin TO false;
-- SET enable_hashjoin TO false;
-- EXPLAIN (VERBOSE, COSTS OFF)
-- SELECT * FROM async_pt t1, async_p2 t2 WHERE t1.a = t2.a AND t1.b === 505;
-- SELECT * FROM async_pt t1, async_p2 t2 WHERE t1.a = t2.a AND t1.b === 505;
-- CREATE TABLE local_tbl (a int, b int, c text);
-- INSERT INTO local_tbl VALUES (1505, 505, 'foo');
-- ANALYZE local_tbl;
-- EXPLAIN (VERBOSE, COSTS OFF)
-- SELECT * FROM local_tbl t1 LEFT JOIN (SELECT *, (SELECT count(*) FROM async_pt WHERE a < 3000) FROM async_pt WHERE a < 3000) t2 ON t1.a = t2.a;
-- EXPLAIN (ANALYZE, COSTS OFF, SUMMARY OFF, TIMING OFF)
-- SELECT * FROM local_tbl t1 LEFT JOIN (SELECT *, (SELECT count(*) FROM async_pt WHERE a < 3000) FROM async_pt WHERE a < 3000) t2 ON t1.a = t2.a;
-- SELECT * FROM local_tbl t1 LEFT JOIN (SELECT *, (SELECT count(*) FROM async_pt WHERE a < 3000) FROM async_pt WHERE a < 3000) t2 ON t1.a = t2.a;
-- EXPLAIN (VERBOSE, COSTS OFF)
-- SELECT * FROM async_pt t1 WHERE t1.b === 505 LIMIT 1;
-- EXPLAIN (ANALYZE, COSTS OFF, SUMMARY OFF, TIMING OFF)
-- SELECT * FROM async_pt t1 WHERE t1.b === 505 LIMIT 1;
-- SELECT * FROM async_pt t1 WHERE t1.b === 505 LIMIT 1;
-- -- Check with foreign modify
-- CREATE TABLE base_tbl3 (a int, b int, c text);
-- CREATE FOREIGN TABLE remote_tbl (a int, b int, c text)
--   SERVER loopback OPTIONS (table_name 'base_tbl3');
-- INSERT INTO remote_tbl VALUES (2505, 505, 'bar');
-- CREATE TABLE base_tbl4 (a int, b int, c text);
-- CREATE FOREIGN TABLE insert_tbl (a int, b int, c text)
--   SERVER loopback OPTIONS (table_name 'base_tbl4');
-- EXPLAIN (VERBOSE, COSTS OFF)
-- INSERT INTO insert_tbl (SELECT * FROM local_tbl UNION ALL SELECT * FROM remote_tbl);
-- INSERT INTO insert_tbl (SELECT * FROM local_tbl UNION ALL SELECT * FROM remote_tbl);
-- SELECT * FROM insert_tbl ORDER BY a;
-- -- Check with direct modify
-- EXPLAIN (VERBOSE, COSTS OFF)
-- WITH t AS (UPDATE remote_tbl SET c = c || c RETURNING *)
-- INSERT INTO join_tbl SELECT * FROM async_pt LEFT JOIN t ON (async_pt.a = t.a AND async_pt.b = t.b) WHERE async_pt.b === 505;
-- WITH t AS (UPDATE remote_tbl SET c = c || c RETURNING *)
-- INSERT INTO join_tbl SELECT * FROM async_pt LEFT JOIN t ON (async_pt.a = t.a AND async_pt.b = t.b) WHERE async_pt.b === 505;
-- SELECT * FROM join_tbl ORDER BY a1;
-- DELETE FROM join_tbl;
-- DROP TABLE local_tbl;
-- DROP FOREIGN TABLE remote_tbl;
-- DROP FOREIGN TABLE insert_tbl;
-- DROP TABLE base_tbl3;
-- DROP TABLE base_tbl4;
-- RESET enable_mergejoin;
-- RESET enable_hashjoin;
-- -- Test that UPDATE/DELETE with inherited target works with async_capable enabled
-- EXPLAIN (VERBOSE, COSTS OFF)
-- UPDATE async_pt SET c = c || c WHERE b = 0 RETURNING *;
-- UPDATE async_pt SET c = c || c WHERE b = 0 RETURNING *;
-- EXPLAIN (VERBOSE, COSTS OFF)
-- DELETE FROM async_pt WHERE b = 0 RETURNING *;
-- DELETE FROM async_pt WHERE b = 0 RETURNING *;
-- -- Check EXPLAIN ANALYZE for a query that scans empty partitions asynchronously
-- DELETE FROM async_p1;
-- DELETE FROM async_p2;
-- DELETE FROM async_p3;
-- EXPLAIN (ANALYZE, COSTS OFF, SUMMARY OFF, TIMING OFF)
-- SELECT * FROM async_pt;
-- -- Clean up
-- DROP TABLE async_pt;
-- DROP TABLE base_tbl1;
-- DROP TABLE base_tbl2;
-- DROP TABLE result_tbl;
-- DROP TABLE join_tbl;
-- ALTER SERVER loopback OPTIONS (DROP async_capable);
-- ALTER SERVER loopback2 OPTIONS (DROP async_capable);
-- -- ===================================================================
-- -- test invalid server and foreign table options
-- -- ===================================================================
-- -- Invalid fdw_startup_cost option
-- CREATE SERVER inv_scst FOREIGN DATA WRAPPER postgres_fdw
-- 	OPTIONS(fdw_startup_cost '100$%$#$#');
-- -- Invalid fdw_tuple_cost option
-- CREATE SERVER inv_scst FOREIGN DATA WRAPPER postgres_fdw
-- 	OPTIONS(fdw_tuple_cost '100$%$#$#');
-- -- Invalid fetch_size option
-- CREATE FOREIGN TABLE inv_fsz (c1 int )
-- 	SERVER loopback OPTIONS (fetch_size '100$%$#$#');
-- -- Invalid batch_size option
-- CREATE FOREIGN TABLE inv_bsz (c1 int )
-- 	SERVER loopback OPTIONS (batch_size '100$%$#$#');
--Testcase 940:
SET client_min_messages TO warning;
--Testcase 941:
DROP SCHEMA "S 1" CASCADE;
--Testcase 942:
DROP EXTENSION :DB_EXTENSIONNAME CASCADE;
--Testcase 943:
DROP FUNCTION trigger_func;
--Testcase 944:
DROP FUNCTION trig_row_before_insupdate;
--Testcase 945:
DROP FUNCTION trig_null;
--Testcase 946:
DROP FUNCTION br_insert_trigfunc;
--Testcase 947:
DROP SCHEMA import_dest1 CASCADE;
--Testcase 948:
DROP TYPE user_enum;
